Unfazed by demonetisation  the rich in Kerala continue laundering ...,The New Indian Express,27 Nov 2016,http://www.newindianexpress.com/cities/kochi/2016/nov/28/unfazed-by-demonetisation-the-rich-in-kerala-continue-laundering-black-money-1543325.html,They use overdraft and NRI accounts in a big way to beat the witch-hunt against black money hoarders. “Demonetisation has not affected most businessmen as ...
Black money hoarders to face whopper 90 per cent tax if caught,The New Indian Express,25 Nov 2016,http://www.newindianexpress.com/nation/2016/nov/26/black-money-hoarders-to-face-whopper-90-per-cent-tax-if-caught-1542742.html,NEW DELHI: When the smoke clears after demonetisation  black money hoarders  who are left with no option but to turn in their unaccounted wealth into the ...
Modi plays a Trump card: Twitter reaction to PM's war on black money,Hindustan Times,8 Nov 2016,http://www.hindustantimes.com/india-news/surgical-strike-to-bold-move-twitter-reaction-to-pm-modi-s-war-on-black-money/story-bmmfUcmESNxZ0ggp4dxGzM.html,Modi plays a Trump card: Twitter reaction to PM's war on black money ... Here's a glimpse of what Twitterati is saying about Modi's war on black money. Surgical ...
It's a setback to parallel black money economy: Arun Jaitley on ...,The Indian Express,9 Nov 2016,http://indianexpress.com/article/india/india-news-india/arun-jaitley-black-money-corruption-notes-500-1000-scrapped-economy-rbi-currency/,It's a setback to parallel black money economy: Arun Jaitley on scrapping Rs 500/1000 notes. There is a sense of satisfaction among honest tax payers to what is ...
Black money estimates overshot as 82% of cash deposited in banks,Livemint,5 Dec 2016,http://www.livemint.com/Industry/SmaP4M0Q6lf2nrpjnQTgGO/Black-money-estimates-overshot-as-82-of-cash-deposited-in-b.html,New Delhi: Indians have validated 82 percent of bank notes rendered worthless by Prime Minister Narendra Modi's surprise move last month  according to ...
Just depositing black money doesn't make it white: Hasmukh Adhia,Economic Times,6 Dec 2016,http://economictimes.indiatimes.com/news/economy/policy/just-depositing-black-money-doesnt-make-it-white-hasmukh-adhia/articleshow/55836113.cms,MUMBAI: Revenue Secretary Hasmukh Adhia today said it is wrong to assume that black money that has come into the banking system following the ...
AAP had plans to inject black money in Punjab: Sukhbir Singh Badal,The Indian Express,12 Nov 2016,http://indianexpress.com/article/cities/ludhiana/sukhbir-singh-badal-punjab-aap-black-money-4372513/,On his last visit to release industry and trade manifesto in Ludhiana  Kejriwal had alleged that 'SAD-BJP-Congress has entered grand alliance to defeat AAP'.
Demonetisation: Black money clean-up may erase some growth ...,The Indian Express,14 Nov 2016,http://indianexpress.com/article/business/business-others/demonetisation-black-money-clean-up-may-erase-some-growth-gains-as-well-4375938/,Demonetisation: Black money clean-up may erase some growth gains as well. The government's move to withdraw higher denomination notes may also have ...
War on black money: At least 50 people nabbed  over Rs 90 crores ...,Daily News & Analysis,30 Nov 2016,http://www.dnaindia.com/india/report-war-on-black-money-at-least-50-people-nabbed-more-than-rs-90-crores-cash-seized-after-demonetization-2278470,Some of the people scrambling to deal with piled up black money were ... of demonetization  it has also given sleepless nights to several black money hoarders.
Black money: Rs 6 crore cash seized in Osmanabad  probe launched,The Indian Express,15 Nov 2016,http://indianexpress.com/article/india/india-news-india/black-money-rs-6-crore-cash-seized-in-osmanabad-probe-launched-4377667/,Black money: Rs 6 crore cash seized in Osmanabad  probe launched. The cash was being transported in a Bolero. According to officials  the seized cash ...
Jaitley challenges Congress to name steps taken to curb black ...,The Indian Express,8 Dec 2016,http://indianexpress.com/article/india/demonetisation-arun-jaitley-challenges-congress-to-name-steps-taken-to-curb-black-money-4416831/,“Congress was in power from 2004 to 2014  I challenge them to tell about even one step taken to curb black money in the 10 years ” said Jaitley in Lok Sabha.
Taxmen begin verifying abuse of Jan Dhan accounts to hide black ...,Hindustan Times,17 Nov 2016,http://www.hindustantimes.com/india-news/taxmen-begin-verifying-abuse-of-jan-dhan-accounts-to-hide-black-money/story-8HywRIf4SVNt3DMmoGte5M.html,Taxmen begin verifying abuse of Jan Dhan accounts to hide black money. india Updated: Nov 18  2016 12:33 IST. Manish Chandra Pandey Hindustan Times.
'Mohanlal hoarding black money  Rajagopal is insane',The New Indian Express,23 Nov 2016,http://www.newindianexpress.com/states/kerala/2016/nov/24/mohanlal-hoarding-black-money-rajagopal-is-insane-1541971.html,Mani  known for his vitriolic speeches  termed the superstar as a ' hoarder of black money' and the veteran BJP leader as 'insane'. Mani said Rajagopal became ...
Have black money hoarders found a way out? Bank deposits touch ...,Daily News & Analysis,3 Dec 2016,http://www.dnaindia.com/money/report-have-black-money-hoarders-found-a-way-out-bank-deposits-touch-rs-99-lakh-crore-2279491,... by Prime Minister Narendra Modi on November 8  when he demonetized Rs 500 and Rs 1 000 notes in a bid to curb black money and cut off terror funding.
“You Are Reducing Black Money Without Stopping Its Sources”,Outlook India,11 Nov 2016,http://www.outlookindia.com/magazine/story/you-are-reducing-black-money-without-stopping-its-sources/298132,These are people with black money  as a large part of the black money is actually the liquidity for a very large economy. If these people get scared and shut off to ...
Black money scheme not amnesty: Jaitley on 'Fair and Lovely' jibe,Hindustan Times,8 Mar 2016,http://www.hindustantimes.com/india/look-at-your-track-record-jaitley-hits-back-at-rahul-s-fair-and-lovely-remark/story-0NvUFfRPrQTcJlSui5uhmL.html,Under a four-month compliance window -- announced by finance minister Arun Jaitley during the Union Budget -- people with domestic black money can come ...
Bring back 'black money' from Captain's Swiss accounts: Kejriwal to ...,Hindustan Times,21 Nov 2016,http://www.hindustantimes.com/india-news/kejriwal-attacks-amarinder-cites-swiss-accounts-of-his-kin-as-black-money/story-KHyuzfjX9AD9tg0gYR9AiK.html,After becoming the chief minister  he accumulated black money by looting the people of Punjab and opened accounts in foreign banks in 2005 ” alleged Kejriwal ...
Those Robbed Of Black Money Not Letting Parliament Work: Smriti ...,NDTV,19 Nov 2016,http://www.ndtv.com/india-news/those-robbed-of-black-money-not-letting-parliament-work-smriti-irani-1627518,"Naturally  those who have been robbed of their black money are not letting Parliament work. We should set aside our political differences and work together in ...
Swiss Whistleblower Says Black Money Data He Disclosed Has ...,NDTV,23 Aug 2016,http://www.ndtv.com/india-news/swiss-whistleblower-says-black-money-data-he-disclosed-has-indian-names-1449430,Swiss black money whistleblower Rudolf Elmer has told NDTV that India can ask for fresh information on its citizens from the data he leaked in 2008 from a bank ...
Here's A Simple Idea To Fix India's Black Money Problem Once And ...,Huffington Post India,18 Jul 2016,http://www.huffingtonpost.in/sriram-karri/heres-a-simple-idea-to-fix-indias-black-money-problem-once-and/,The issue of uprooting  finding and bringing back black money has been debated with great intensity  passion and vehemence during the elections of 2014.
Modi warns of further action against black money,The New Indian Express,12 Nov 2016,http://www.newindianexpress.com/nation/2016/nov/13/modi-warns-of-further-action-against-black-money-1537929.html,KOBE: Prime Minister Narendra Modi today warned of further action against those with black money once the December 30 deadline expires for disclosing ...
Deepak Gola ki shaadi: weddings must now factor in 'black money',The Indian Express,26 Nov 2016,http://indianexpress.com/article/india/india-news-india/weddings-must-now-factor-in-black-money-4397129/,Across Chandni Chowk  the one-stop shop for all things matrimonial  The Sunday Express joins a 22-year-old as he sets off with a little band  a little baaja and a ...
Muted response to black money disclosure window,Business Standard,11 Sep 2016,http://www.business-standard.com/article/companies/muted-response-to-black-money-disclosure-window-116091100773_1.html,The government's effort to get people to voluntarily disclose their black money  under the Income Declaration Scheme (IDS)  has had a tepid response  with only ...
Blog: On Black Money  The Government Has It All Wrong,NDTV,4 Mar 2016,http://profit.ndtv.com/news/budget/article-on-black-money-the-government-has-it-all-wrong-1283921,Finance Minister Arun Jaitley has stated that the "Income Declaration Scheme" he introduced in the latest Budget to unearth black money is not an amnesty.
How the Modi govt recovered Rs 65250 crore of black money,Daily News & Analysis,1 Oct 2016,http://www.dnaindia.com/money/report-how-the-modi-govt-recovered-rs-65250-crore-of-black-money-2260520,Over 5 500 public meetings  social media campaign on Talkathons and Nukkad Nataks along with threat of prosecution prompted over 64 000 black money ...
Youth participating in Swachh Bharat  black money drive makes me ...,The Indian Express,19 Nov 2016,http://indianexpress.com/article/india/india-news-india/global-citizen-festival-youth-participating-in-swachh-bharat-black-money-drive-makes-me-happy-pm-narendra-modi-4384645/,Youth participating in Swachh Bharat  black money drive makes me happy: PM Modi at Global Citizen fest. The Global Citizen Festival India is being held at ...
Debashis Basu: Black money: The elephant in the room,Business Standard,27 Nov 2016,http://www.business-standard.com/article/opinion/debashis-basu-black-money-the-elephant-in-the-room-116112700731_1.html,Debashis Basu Cashless economy  black money  political gain  economic pain  too few data points and too many anecdotes have all combined to create ...
Black money hoarders find escape route in farm income,The New Indian Express,12 Nov 2016,http://www.newindianexpress.com/states/andhra-pradesh/2016/nov/13/black-money-hoarders-find-escape-route-in-farm-income-1538023.html,VIJAYAWADA: CUROIUSLY  agriculture now doesn't just let farmers make ends meet  but has turned out to be boon for the black money hoarders as well.
How 'black money' keeps an economy from flourishing,YourStory.com,26 Apr 2016,https://yourstory.com/2016/04/black-money-rbi/,At a recent Bi-monthly Monetary Policy press conference  Governor Raghuram Rajan talked about the RBI's strategies to narrow down the liquidity corridor in the ...
Black money crackdown: Here's what Narendra Modi might do next,Forbes India,25 Nov 2016,http://www.forbesindia.com/article/the-demonetisation-debate/black-money-crackdown-heres-what-narendra-modi-might-do-next/44921/1,The Prime Minister has announced that many more measures will be introduced in the coming days to prevent future generation of black money. Check out ...
Show me the (black) money: Has Modi underestimated India's ...,Business Standard,1 Dec 2016,http://www.business-standard.com/article/economy-policy/show-me-the-black-money-has-modi-underestimated-india-s-laundering-capacity-116120200035_1.html,The main reason given by the government for demonetising high denomination notes was to curb black money. Various estimates have been made of the ...
Black money crackdown could hit jewellery sales,Hindustan Times,8 Nov 2016,http://www.hindustantimes.com/business-news/black-money-crackdown-could-hit-jewellery-sales/story-wsrNtElhhQuF1f6JNt0ViL.html,Long queues were seen outside jewellery stores on Tuesday night as consumers tried to convert their Rs 500  Rs 1 000 currency notes to gold. However  that ...
As black money compliance window deadline nears  IT uses Section ...,The Indian Express,28 Sep 2016,http://indianexpress.com/article/business/economy/as-black-money-compliance-window-deadline-nears-i-t-uses-section-273a-to-ease-disclosures-3055182/,In the last video-conference of tax department held on Saturday before the end of the four-month long black money compliance window on September 30  ...
War on black money: Rs 300000 crore deposited so far  exchange ...,Daily News & Analysis,13 Nov 2016,http://www.dnaindia.com/money/report-war-on-black-money-rs-300000-crore-deposited-so-far-exchange-and-withdrawal-norms-relaxed-2273065,Indian customers queue outside a bank near a shuttered ATM as they wait to try to exchange 500 and 1000 INR notes and deposit money in Siliguri on ...
Black money: Man held with Rs 96 lakh in old currency,The Indian Express,19 Nov 2016,http://indianexpress.com/article/india/india-news-india/black-money-man-held-with-rs-96-lakh-in-old-currency/,Black money: Man held with Rs 96 lakh in old currency. DCP (east district) Rishi Pal said they arrested Nazer-e-Alam  a resident of Gorakhpur in Uttar Pradesh  ...
War on black money: India makes 20 'administrative assistance ...,Daily News & Analysis,27 Nov 2016,http://www.dnaindia.com/money/report-war-on-black-money-india-shots-20-administrative-assistance-requests-to-switzerland-2277508,Stepping up its efforts to trace black money parked abroad  India has shot off at least 20 'administrative assistance' requests to Switzerland in recent months ...
Gold at 3year high on black money crackdown  global cues,The Indian Express,9 Nov 2016,http://indianexpress.com/article/business/market/gold-at-3year-high-on-black-money-crackdown-global-cues-4366631/,Gold at 3year high on black money crackdown  global cues. "The bullion demand has got a boost as people having huge funds in cash  were seen converting ...
SIT set to comb P-Note data for black money,Business Standard,12 Oct 2016,http://www.business-standard.com/article/markets/sit-set-to-comb-p-note-data-for-black-money-116101200812_1.html,The special investigation team (SIT) on black money has asked the Securities and Exchange Board of India (Sebi) to furnish the details of all those investing ...
To increase black money disclosure  govt promises confidentiality,The Indian Express,15 Sep 2016,http://indianexpress.com/article/business/economy/black-money-disclosure-increase-income-tax-government-promise-confidentiality-3033579/,The government stated that declaration filed with jurisdictional principal commissioner/commissioner shall not be shared with any authority within or outside the ...
War on black money: This Chartered Accountant wrote a detailed ...,Daily News & Analysis,16 Nov 2016,http://www.dnaindia.com/india/report-this-surat-ca-s-open-letter-to-arvind-kejriwal-explains-best-how-rs-2000-will-curb-black-money-circulation-2274067,However  to the Income Tax Department  Mr. X has shown that he was having only Rs. 10 000/- as black money initially ( i.e. one bundle of 10 Notes of Rs. 1000 ) ...
Surendran greets 'joint black money protection front',Kaumudi Online,18 Nov 2016,http://www.kaumudi.com/innerpage1.php?newsid=85033,“This is a joint Front comprising protectors of black money holders  supporters of religious fanatism and those who oppose development. This sort of polarisation ...
Tax Law To Facilitate Conversion Of Black Money to White: Arvind ...,NDTV,30 Nov 2016,http://www.ndtv.com/india-news/tax-law-to-facilitate-conversion-of-black-money-to-white-arvind-kejriwal-1632388,New Delhi: The proposed changes in the tax law was a "fraud" on the honest  aimed at "facilitating" the conversion of black money into white  Delhi Chief ...
Amitabh Bachchan  Aishwarya Rai  DLF's KP Singh in Panama ...,Firstpost,4 Apr 2016,http://www.firstpost.com/business/black-money-rot-runs-deeper-amitabh-bachchan-kp-singh-aishwarya-rai-figure-in-panama-papers-list-2710708.html,The taxman had conducted a 'survey' operation in mid- February at the Mumbai head office of HSBC Bank in connection with the black money probe against it ...
Private banks in Odisha found turning black money into white,The New Indian Express,17 Nov 2016,http://www.newindianexpress.com/states/odisha/2016/nov/18/private-banks-in-odisha-found-turning-black-money-into-white-1539905.html,ROURKELA: With a host of private banks in Rourkela city accused of channelising demonitised currencies into life insurance and mutual fund investments  the ...
Demonetization: Politicians  babus and hoarders woo friends to turn ...,Daily News & Analysis,14 Nov 2016,http://www.dnaindia.com/india/report-politicos-look-to-friends-to-convert-black-into-white-2273497,Following the crackdown on black money post Prime Minister Narendra Modi's announcement on demonetization of Rs 500 and Rs 1 000 notes last Tuesday  ...
To check black money flow  RBI to share FDI-related info with IB  RAW,The Hindu,7 Mar 2016,http://www.thehindu.com/business/Economy/to-check-black-money-flow-rbi-to-share-fdirelated-info-with-ib-raw/article8323713.ece,The Reserve Bank of India (RBI) will share FDI-related information with the Intelligence Bureau (IB) and Research and Analysis Wing (RAW) — to check black ...
To fight black money Indo-Swiss agreement on financial info ...,Hindustan Times,15 Jun 2016,http://www.hindustantimes.com/business/to-fight-black-money-indo-swiss-agreement-on-financial-info-exchange-by-2018/story-xRRC01IJP83oYAg1fPVE9I.html,To combat the black money menace  India and Switzerland will expedite the signing of the automatic exchange of financial information between the two nations.
Black money: 300% rise in raids  seizures by income tax department,Firstpost,30 Aug 2016,http://www.firstpost.com/business/black-money-300-rise-in-raids-seizures-by-income-tax-department-2984428.html,New Delhi: The Income Tax department has seized an all-time high value of cash and jewellery  while Rs 3 360 crore unpaid taxes have been surrendered this ...
IT case against Moin Qureshi among the biggest under new Black ...,The Indian Express,15 Oct 2016,http://indianexpress.com/article/india/india-news-india/i-t-case-against-moin-qureshi-among-the-biggest-under-new-black-money-act-3085266/,I-T case against Moin Qureshi among the biggest under new Black Money Act. Officials in the I-T department said that Qureshi has recently been slapped with ...
Kejriwal Decries Currency Ban  Says Black Money Will be Re-routed ...,News18,13 Nov 2016,http://www.news18.com/news/india/arvind-kejriwal-decries-demonetisation-says-black-money-will-be-re-routed-to-bjp-1311585.html,New Delhi: Slamming the Modi government move of demonetisation  Delhi Chief Minister Arvind Kejriwal said  "Not a single rupee of black money will come into ...
Govt's gambit: pay 50% to convert black money,Deccan Herald,28 Nov 2016,http://www.deccanherald.com/content/583726/govts-gambit-pay-50-convert.html,If caught  taxes and penalties to go up to 85%. 'There have been representations and suggestions from experts that instead of allowing people to find.
Black money window: CBDT vows to confront 9 lakh special cases,Firstpost,18 Jul 2016,http://www.firstpost.com/business/black-money-window-cbdt-vows-to-confront-9-lakh-special-cases-2901380.html,Black money window: CBDT vows to confront 9 lakh special cases ... whom it will soon 'confront' during the ongoing one-time black money window scheme.
PM Modi In Switzerland  Focus On Black Money  Nuclear Club: 10 ...,NDTV,5 Jun 2016,http://www.ndtv.com/cheat-sheet/7-agreements-signed-pm-modi-will-meet-expat-indians-in-doha-10-points-1415735,Geneva: Prime Minister Narendra Modi is in Switzerland on a day-long visit  where he is likely to seek support for India's membership to the elite 48-member ...
If Modi Wants More Disclosures Of Black Money  He Must Rattle The ...,Swarajya,11 Sep 2016,http://swarajyamag.com/politics/if-modi-wants-more-disclosures-of-black-money-he-must-rattle-the-realty-market,Unless black money hoarders believe that the government is going to come down like a tonne of bricks  many may still chose to remain silent. Modi needs to ...
Crackdown on black money: Can the system still be beaten?,Hindustan Times,9 Nov 2016,http://www.hindustantimes.com/business-news/crackdown-on-black-money-can-the-system-still-be-beaten/story-OLBExcAG3tfwm79O5Gpc5I.html,“Those with black money will have to now declare the money to the bank to exchange them for new notes of Rs 500 and Rs 1000. This would mean paying tax  ...
Corruption and black money: Changes to anti-graft bill run contrary ...,Firstpost,14 Nov 2016,http://www.firstpost.com/india/corruption-and-black-money-changes-to-anti-graft-bill-run-contrary-to-sc-judgments-un-convention-3104576.html,The long standing tussle on the issue of protection of central government officials from investigating agencies  between the Supreme Court and successive ...
Twitterati lashes out at Rajyavardhan Singh Rathore for 'no black ...,The Indian Express,29 Nov 2016,http://indianexpress.com/article/trending/trending-in-india/rajyavardhan-singh-rathore-no-black-money-in-film-industry-comment-twitterati-lashes-out-4400926/,Twitter doesn't seem as confident as Union minister Rajyavardhan Singh Rathore  when he said the film industry was devoid of any black money transactions ...
War on Black Money: Top 5 sectors affected & how can you take ...,Daily News & Analysis,11 Nov 2016,http://www.dnaindia.com/money/column-top-5-sectors-affected-how-can-you-take-advantage-of-it-2272325,Like real estate sector  Gold is again the most used option for converting black money apart from the fact that this sector depends heavily on cash transactions ...
Post IDS  3000 black money holders on I-T Department radar,Free Press Journal,12 Oct 2016,http://www.freepressjournal.in/indore/post-ids-3000-black-money-holders-on-i-t-department-radar/953571,Indore: Black money holders of the Indore region  who lost the golden opportunity to declare their stashed money under the Income Declaration Scheme ...
Bank manager in MP converts VIPs' black money into white  faces ...,Hindustan Times,21 Nov 2016,http://www.hindustantimes.com/indore/bank-manager-in-mp-converts-vips-black-money-into-white-faces-probe/story-2jnnLZc9z7zLtWsmmxC3fI.html,Prime Minister Narendra Modi had on November 8 evening announced scrapping of Rs 500 and Rs 1 000 notes as legal tender  in order to target black money ...
Bansal's son disclosed black money before ending life,Deccan Herald,28 Sep 2016,http://www.deccanherald.com/content/573027/bansals-son-disclosed-black-money.html,CBI starts probe into charges levelled in suicide note. Yogesh Bansal. File photo. Days before committing suicide  Yogesh Bansal  son of former director general ...
Fighting black money: IT dept to mine PAN data  trace fund flow trail,The Indian Express,21 Feb 2016,http://indianexpress.com/article/business/business-others/fighting-black-money-i-t-dept-to-mine-pan-data-trace-fund-flow-trail/,Kept closely under wraps  a new project being readied by the Income Tax Department ahead of the upcoming Budget could provide fresh ammunition to the ...
Demonetisation Move Has Failed To Unearth 'Real' Black Money ...,NDTV,22 Nov 2016,http://www.ndtv.com/india-news/demonetisation-move-has-failed-to-unearth-real-black-money-shiv-sena-1628697,Mumbai: Keeping up its attack on the Centre's demonetisation move  Shiv Sena today said the exercise has failed to unearth the "real" black money and only ...
Demonetisation: As mad scramble for indelible ink begins  black ...,Firstpost,16 Nov 2016,http://www.firstpost.com/india/demonetisation-as-mad-scramble-for-indelible-ink-begins-black-money-holders-have-the-last-laugh-3109536.html,The shortage of the ink is giving more time for black money holders to whiten their ill-gotten wealth. However  there is only one recognised producer of the ...
Demonetisation: Those with 'black money' resort to last-ditch tricks,Hindustan Times,14 Nov 2016,http://www.hindustantimes.com/punjab/demonetisation-those-with-black-money-resort-to-last-ditch-tricks/story-M9fn3mDjdehU3DpK57KSSP.html,Banknotes out of circulation has left those with unaccounted-for cash looking for desperate ways to convert their money into white. (HT Representative Image).
Bhutan Concerned India's Black Money Might Enter Country ...,NDTV,25 Nov 2016,http://www.ndtv.com/india-news/bhutan-concerned-indias-black-money-might-enter-country-chinese-report-1630180,Bhutan Concerned India's Black Money Might Enter Country: Chinese Report ... 500 and 1 000 notes in India  fears of black money entering Bhutan looms large  ...
Flushing out black money,The Hindu,10 Nov 2016,http://www.thehindu.com/opinion/letters/flushing-out-black-money/article9330345.ece,More importantly  if the Finance Minister is more worried about India's security  why hasn't any action been taken against all the black money flowing to cricket  ...
Black money: Single point of contact for disclosures mandates CBDT,The Indian Express,23 Jun 2016,http://indianexpress.com/article/business/economy/single-point-of-contact-for-black-money-disclosures-cbdt-2871106/,The four-month window under the Income Declaration Scheme 2016  allows domestic black money holders to declare their ill-gotten wealth by paying a tax and ...
Sizable Dip In Indian Black Money Parked Abroad  Says Arun Jaitley,NDTV,10 Jul 2016,http://www.ndtv.com/india-news/sizable-dip-in-indian-black-money-parked-abroad-says-arun-jaitley-1429999,Ahmedabad: Finance Minister Arun Jaitley on Sunday said the Narendra Modi government's "activism" against black money in the last two years has resulted ...
