Z-plus security for Muzaffarnagar riot accused BJP MP Sangeet Som ...,Firstpost,26 Aug 2014,http://www.firstpost.com/politics/z-plus-security-muzaffarnagar-riot-accused-bjp-mp-sangeet-som-stirs-controversy-1683019.html,"Claiming that this move is aimed at curbing corruption and putting an end to black money is election jumla by the prime minister. The decision to demonetise ...
Delhi polls: AAP to fight 'very powerful forces' only with 'clean money ...,Indian Express,8 Dec 2014,http://indianexpress.com/article/cities/delhi/delhi-polls-aap-to-fight-very-powerful-forces-only-with-clean-money-says-kejriwal/,BJP has a lot of money  it has every kind of money ” Kejriwal said  adding  AAP does not want to fight the elections with black money. “AAP is the only party ...
Congress raps Modi on KVP and SBI loan to Adani,Business Standard,20 Nov 2014,http://www.business-standard.com/article/politics/congress-raps-modi-on-kvp-and-sbi-loan-to-adani-114112100045_1.html,He said Modi and the BJP needed to answer queries on living up to their earlier claim of bringing back black money stashed abroad within 100 days of coming ...
There are limited investment options for short-term needs,Livemint,18 Aug 2014,http://www.livemint.com/Money/9n9SQ29pCuKVj39pIvPYaJ/There-are-limited-investment-options-for-shortterm-needs.html,I've just started working and am living with my parents as I have been posted in my home town. This allows me a decent amount as savings. There's no money ...
Parrikar's Sweet Revenge Against Advani,NDTV,6 Nov 2014,http://www.ndtv.com/opinion/parrikars-sweet-revenge-against-advani-689938,... to secure himself as the BJP nominee for the top job of Prime Minister and raise an emotive issue which had held centre stage - corruption and black money.
Huawei smartphone sales boosted copying Xiaomi's online strategy,Firstpost,24 Dec 2014,http://www.firstpost.com/business/huawei-smartphone-sales-boosted-copying-xiaomis-online-strategy-2013765.html,The boast harked back to Modi's election vow to recover black money from abroad that had resonated with voters fed up with the corruption scandals that ...
I choose not to run after money: PK director Rajkumar Hirani,The Indian Express,15 Dec 2014,http://indianexpress.com/article/entertainment/bollywood/i-choose-not-to-run-after-money-pk-director-rajkumar-hirani/,Rajkumar Hirani credits his writing collaborator Abhijat Joshi for not tiring as they struggle to come up with something unique with every film.
ED banks on AAP site to slap FEMA notices,Indian Express,4 May 2014,http://indianexpress.com/article/india/india-others/ed-banks-on-aap-site-to-slap-fema-notices/,The Enforcement Directorate (ED) has finally taken action on the black money trail arising out of the HSBC case  but by using an unconventional source of ...
BJP's decision to boycott NDTV shows its seriousness about social ...,Firstpost,10 Mar 2014,http://www.firstpost.com/politics/bjps-decision-to-boycott-ndtv-shows-its-seriousness-about-social-media-1426865.html,A purported tweet against Narendra Modi attributed to BJP leader Sushma Swaraj has resulted in the party boycotting all panel discussions on NDTV and its ...
A factory of talented theatre geeks,The Hindu,14 Dec 2014,http://www.thehindu.com/news/cities/puducherry/a-factory-of-talented-theatre-geeks/article6693342.ece,When a theatre group that goes by the name Stray Factory rolls out plays called 'Kakka Sutta Vadai' and 'Osama  Cinema and a Whole Lot of Black Money'  ...
Money laundering case: IRS officer Ashutosh Verma gets bail,indiatvnews.com,29 Sep 2014,http://www.indiatvnews.com/news/india/money-laundering-case-irs-officer-ashutosh-verma-gets-bail-42568.html,New Delhi: A Delhi court has granted bail to a senior IRS officer  who was earlier arrested by CBI for allegedly diluting I-T appraisal reports of arms dealer ...
Treasure hunting,Indian Express,16 Nov 2014,http://indianexpress.com/article/opinion/columns/treasure-hunting/,In the choice between spending Rs 100 on either building a more capable and effective tax administration or waging war against black money  we seem to have ...
Q&A: Former Chief Election Commissioner of India,Wall Street Journal (India) (blog),23 Apr 2014,http://blogs.wsj.com/indiarealtime/2014/04/24/qa-former-chief-election-commissioner-of-india/,Big bags of black money are unfortunately a regular part of Indian elections according to S.Y. Quraishi  a former chief election commissioner and the author of ...
NGT issues notices over Sardar Sarovar dam project in Gujarat,Firstpost,24 Jan 2014,http://www.firstpost.com/india/ngt-issues-notices-over-sardar-sarovar-dam-project-in-gujarat-1358251.html,Meanwhile  Singh says that only a fraction of the actual black money is stored in cash form (rest in land  gold  foreign exchange  etc) by the guilty. And these ...
Needed  an antidote to capitation fee menace,The Hindu,24 Aug 2014,http://www.thehindu.com/opinion/op-ed/needed-an-antidote-to-capitation-fee-menace/article6347319.ece,If that is the case  why did the National Institute of Public Finance and Policy give the education sector a shameful number two position in the list of black money ...
Former Janata Dal friends re-unite as Samajwadi Janata Dal to take ...,Indian Express,4 Dec 2014,http://indianexpress.com/article/india/politics/erstwhile-janata-dal-member-re-unite-as-samajwadi-janata-dal-to-take-on-govt/,The new front headed by SP chief Mulayam Singh Yadav will raise several issues  including black money and unemployment.
Navy to set up naval base named after Sardar Vallabhbhai Patel in ...,Firstpost,3 Sep 2014,http://www.firstpost.com/india/navy-to-set-up-naval-base-named-after-sardar-vallabhbhai-patel-in-porbandar-1696397.html,Weeks after the government startled all with the demonetisation move  black money continues to be the biggest talking point in the country. However  much of ...
Income Tax notice to 7187 luxury houses in Malabar,Deccan Chronicle,15 Dec 2014,http://www.deccanchronicle.com/141216/nation-current-affairs/article/income-tax-notice-7187-luxury-houses-malabar,The majority of these houses are constructed using black money and we are scrutinising the papers submitted by the house owners ” Mr P.N. Devadas  Income ...
How India's Narendra Modi Moves Markets,Wall Street Journal (India) (blog),26 Oct 2014,http://blogs.wsj.com/indiarealtime/2014/10/27/how-indias-narendra-modi-moves-markets/,One of Mr. Modi's first steps as prime minister was to create a special investigation team to track India's “black money”  which is basically wealth on which taxes ...
Despite LawMin advice  floor for paid-up capital removed,The Indian Express,17 Dec 2014,http://indianexpress.com/article/business/business-others/despite-lawmin-advice-floor-for-paid-up-capital-removed/,Despite red flag by the law ministry on its possible misuse by shell companies to launder black money  the government has decided to do away with the ...
Modi shares his vision of 'brand India' in 5 Ts,NDTV,20 Jan 2014,http://www.ndtv.com/cheat-sheet/narendra-modi-shares-his-vision-of-brand-india-in-5-ts-548337,Also  party patriarch L K Advani's pet project of bringing back the country's black money stashed abroad. "If need be  we will amend the law and also set up a ...
Two UP ministers sacked after earning Mulayam Singh Yadav's ire,Indian Express,9 Mar 2014,http://indianexpress.com/article/india/politics/two-up-ministers-sacked-after-earning-mulayam-singh-yadavs-ire/,CM Akhilesh Yadav removed Anand Kumar Singh and Manoj Paras their posts after irking party supremo Mulayam. Google +. Lucknow | Published:March 9  ...
Are you serious? Robert Vadra made Rs 44 cr thanks to DLF land ...,Firstpost,2 Nov 2014,http://www.firstpost.com/india/are-you-serious-robert-vadra-made-rs-44-cr-thanks-to-dlf-land-deal-says-cag-1783675.html,There's no end to the controversy surrounding Robert Vadra. Even as he faces flak over pushing away a journalist's microphone  a new report claims that the ...
Full Text: Pranab Mukherjee's speech at Lok Sabha joint session,Firstpost,11 Jun 2014,http://www.firstpost.com/politics/full-text-pranab-mukherjees-speech-at-lok-sabha-joint-session-2-1562443.html,My government is determined to rid the country of the scourge of corruption and the menace of black money. As a first step in this direction  the government has ...
Weak anti-money laundering systems plague brokerages,Business Standard,25 Sep 2014,http://www.business-standard.com/article/markets/weak-anti-money-laundering-systems-plague-brokerages-114092500386_1.html,A number of demat accounts opened in a remote area were found to be linked to the same bank account. The Know Your Client (KYC) documentation for ...
Modi to reunite child he looked after with parents on 'emotional ...,Firstpost,2 Aug 2014,http://www.firstpost.com/india/modi-reunite-child-looked-parents-emotional-nepal-trip-1646683.html,Meanwhile  Singh says that only a fraction of the actual black money is stored in cash form (rest in land  gold  foreign exchange  etc) by the guilty. And these ...
Top Khalistan Tiger Force terrorist arrested,Chandigarh Tribune,6 Nov 2014,http://www.tribuneindia.com/2014/20141106/latest-news.htm,The SIT has recently also announced that it would seek information against black money hoarders from the public and it will soon announce the communication ...
Black river  buried treasure: How river Yamuna provides livelihood ...,Indian Express,18 Oct 2014,http://indianexpress.com/article/lifestyle/black-river-buried-treasure-how-river-yamuna-provides-livelihood-to-people/,To those who brave the dark waters of the Yamuna  the river rewards them with a livelihood. Google +. Written by Nidhi Sinha | Published:October 19  2014 1:00 ...
What ails higher education?,The Hindu,12 Oct 2014,http://www.thehindu.com/features/education/research/what-ails-higher-education/article6491934.ece,The NIPFP study has identified private education as one of the sources of black money. Will the educational institutions that glorify mediocrity and mint money ...
Delhi property prices being artificially propped up; Bangalore is ...,Firstpost,31 Jul 2014,http://www.firstpost.com/business/real-estate/delhi-property-prices-being-artificially-propped-up-bangalore-is-reviving-1981837.html,This could mean black money is being pumped into the sector to keep prices artificially high. "The price-supply situation in NCR clearly implies that home prices ...
DTC woes begin for Co-op Bank depositors,Indian Cooperative,5 Nov 2014,http://www.indiancooperative.com/featured/dtc-woes-begin-for-co-op-bank-depositors/,Income tax officials will soon begin checking all ' transactions including their investments and other schemes in order to unearth black money. Some tax officials ...
No plan to impose tax on agricultural income: Jaitley,Hindu Business Line,5 Dec 2014,http://www.thehindubusinessline.com/economy/no-plan-to-impose-tax-on-agricultural-income-jaitley/article6665643.ece,Shome had noted the move could block an escape route for black money but that such a move would need political consensus across party lines. That  in ...
What Is The Main Issue Of Modi  BJP And NDA During The 2014 Lok ...,CounterCurrents.org,3 May 2014,http://www.countercurrents.org/kocherry030514.htm,He talks about unearthing black money and stopping corruption. If he is honest he has to publish his expenses and income of all the rallies and his travel by ...
19-yr-old Gujarat girl fakes own kidnapping for money,India Today,4 Sep 2014,http://indiatoday.intoday.in/story/gujarat-girl-fakes-own-kidnapping-for-money/1/380961.html,The police said that the girl and her friend Bhawik Soni (21) admitted to have planned her own kidnapping. It was not immediately clear why she needed such a ...
Elections 2014: Election Commission seizes Rs 195 crore in cash ...,Indian Express,7 Apr 2014,http://indianexpress.com/article/india/india-others/elections-2014-ec-seizes-rs-195-crore-in-cash-11000-firs-filed/,Snippet not available
Singham Returns trailer: 3 reasons why you can't miss Ajay Devgn's ...,India.com,11 Jul 2014,http://www.india.com/showbiz/singham-returns-trailer-3-reasons-why-you-cant-miss-ajay-devgns-fight-against-corruption-and-black-money-menace-94353/,Snippet not available
Congress releases list of 'U-turns' made by BJP government,Livemint,1 Dec 2014,http://www.livemint.com/Politics/d3fh99eZOgDLnStZ92pmoI/Congress-releases-list-of-Uturns-made-by-government.html,Snippet not available
PM Modi Announces US $1 Billion Concessional Line of Credit to ...,NDTV,3 Aug 2014,http://www.ndtv.com/india-news/pm-modi-announces-us-1-billion-concessional-line-of-credit-to-nepal-608329,Snippet not available
