Black money: CPI asks government to come out with all names,Daily News & Analysis,27 Oct 2014,http://www.dnaindia.com/india/report-black-money-cpi-asks-government-to-come-out-with-all-names-2029558,Raja said if the government needs more time to come out with the details of black money stashed in foreign banks  then "it should say how long it will take and ...
Black money case: Ponzi scheme  defence  export deals under SIT ...,Firstpost,4 Nov 2014,http://www.firstpost.com/business/economy/black-money-case-ponzi-scheme-defence-export-deals-under-sit-scanner-1995501.html,The Special Investigation Team appointed by the Central Government to look into the menace of black money may currentlyhave its hands full with the over 600 ...
Don't doubt Modi govt's intention on black money: Baba Ramdev,Zee News,29 Oct 2014,http://zeenews.india.com/news/india/dont-doubt-modi-govts-intention-on-black-money-baba-ramdev_1491129.html,Ramdev  who had launched a nationwide campaign against black money  said  “I do not doubt Modi government's intent on bringing back black money but the ...
Another Whistleblower  Stephanie Gibaud  Offers to Help ...,NDTV,5 Dec 2014,http://www.ndtv.com/india-news/another-whistleblower-stephanie-gibaud-offers-to-help-government-with-black-money-probe-709396,... is a former public relations officer of the bank UBS France has told NDTV in an exclusive interview in Paris that she can help India's black money investigation.
Assocham against government disclosing names of black money ...,Daily News & Analysis,26 Oct 2014,http://www.dnaindia.com/india/report-assocham-against-government-disclosing-names-of-black-money-holders-2029452,Amid a growing clamour for naming of alleged black money holders  industry body Assocham on Sunday said the government should not prematurely disclose ...
Modi govt. draws flak for 'U-turn' on black money,The Hindu,17 Oct 2014,http://www.thehindu.com/news/national/modi-govt-draws-flak-for-uturn-on-black-money/article6513393.ece,The government's 'U-turn' on the black money issue on Friday put the BJP on the mat with not just the Congress but the social media also erupting with angry ...
Lottery scam: 72 bought prize-winning tickets to convert black money,Indian Express,4 Feb 2014,http://indianexpress.com/article/india/india-others/lottery-scam-72-bought-prize-winning-tickets-to-convert-black-money/,These claimants had never visited Kerala and had not bought the first prize winning tickets from Kerala after paying the ticket price of Rs 10.
International Convention Does Not Allow for Retrieval of Black ...,NDTV,19 Nov 2014,http://www.ndtv.com/india-news/international-convention-does-not-allow-for-retrieval-of-black-money-says-note-from-pms-office-702646,New Delhi: The Narendra Modi government  which has promised to bring back untaxed or black money stashed abroad to India  has run up against a maze of ...
Real estate business accounts for major chunk of black money ...,Economic Times,5 Dec 2014,http://economictimes.indiatimes.com/wealth/personal-finance-news/real-estate-business-accounts-for-major-chunk-of-black-money-institute-of-chartered-accountants-of-india/articleshow/45387295.cms,MUMBAI: When it comes to flow of black money  real estate business accounts for a major chunk of of such illicit funds  accounting regulator ICAI has told the ...
Black money list fiasco: Have Narendra Modi- Arun Jaitley fooled ...,India.com,31 Oct 2014,http://www.india.com/news/india/black-money-list-fiasco-have-narendra-modi-arun-jaitley-fooled-aam-aadmi-183698/,One thing that could possibly have hit the credibility of Modi government hard  was the issue of bringing back black money. And looking at the current scenario  ...
India Moving Towards Tax-Friendly Regime; Black Money Laws ...,International Business Times  India Edition,27 Nov 2014,http://www.ibtimes.co.in/india-moving-towards-tax-friendly-regime-black-money-laws-need-be-changed-says-arun-jaitley-615407,In an effort to rectify India's reputation which has taken a beating over the years  Finance Minister Arun Jaitley on Thursday said that India was moving towards a ...
ED question Goa-based miner Radha Timblo in black money case,Firstpost,2 Dec 2014,http://www.firstpost.com/india/ed-question-goa-based-miner-radha-timblo-black-money-case-1831293.html,Panaji: Enforcement Directorate (ED) on Tuesday questioned Goa-based miner Radha Timblo  whose name figured in the black money list submitted by the ...
Black money may account for one-third of Rs 30k cr poll expenses,Firstpost,1 Apr 2014,http://www.firstpost.com/politics/black-money-may-account-for-one-third-of-rs-30k-cr-poll-expenses-1460853.html,New Delhi: As general elections draw closer  'unaccounted money' may account for over one-third of total Rs 30 000 crore estimated to be spent on these polls  ...
Hawala traders booking rail wagons for black money transactions,India Today,4 May 2014,http://indiatoday.intoday.in/story/hawala-traders-now-booking-rail-wagons-for-exchange-of-heavy-cash/1/359044.html,Hawala operators have now devised an ingenious route of sending black money through railway consignments to their intended customers in the country.
Black money has pernicious impact on Indian economy  says ...,Daily News & Analysis,17 Nov 2014,http://www.dnaindia.com/india/report-black-money-has-pernicious-impact-on-indian-economy-says-president-pranab-mukherjee-2036199,That is one of the reasons why unaccounted money what is being called as black money  on which nowadays people are talking too much  that is being ...
Issue 'white paper' on black money  demands Shankarsinh Vaghela,Daily News & Analysis,28 Oct 2014,http://www.dnaindia.com/india/report-issue-white-paper-on-black-money-demands-shankarsinh-vaghela-2029946,Gujarat Congress on Tuesday asked the NDA Government to issue a "white paper" on black money and declare names of all those Indians who have parked ...
Shiv Sena doubts if black money can be brought back,Daily News & Analysis,26 Nov 2014,http://www.dnaindia.com/india/report-shiv-sena-doubts-if-black-money-can-be-brought-back-2038780,"Bringing back black money can be an election issue  but nothing will come to us. It is like shooting in the air " Shiv Sena leader Sanjay Raut said while ...
PM Narendra Modi will keep his promise on black money issue ...,Daily News & Analysis,28 Dec 2014,http://www.dnaindia.com/india/report-pm-narendra-modi-will-keep-his-promise-on-black-money-issue-baba-ramdev-2047677,Yoga guru Ramdev on Sunday said Prime Minister Narendra Modi will keep his promise of bringing back black money from abroad  although it may take some ...
Government 'promoting' black money with relaunch of KVP: Congress,Daily News & Analysis,20 Nov 2014,http://www.dnaindia.com/india/report-government-promoting-black-money-with-relaunch-of-kvp-congress-2036864,Upping the ante over black money issue ahead of the Winter Session of Parliament  the Congress on Thursday accused the NDA Government of failing on its ...
Sonia Gandhi may have stashed black money abroad: Ram ...,Daily News & Analysis,28 May 2014,http://www.dnaindia.com/india/report-sonia-gandhi-may-have-stashed-black-money-abroad-ram-jethmalani-1992041,A day after the Modi government notified the constitution of a Special Investigating Team (SIT) to probe black money  noted jurist Ram Jethmalani  a petitioner ...
Black money Investigation: Trade based money laundering by ...,Daily News & Analysis,9 Aug 2014,http://www.dnaindia.com/money/report-black-money-investigation-trade-based-money-laundering-by-submitting-fake-bills-now-under-scanner-2009526,Instances of trade-based money laundering including that through submission of forged import bills is likely to be discussed by the Special Investigation Team ...
All you wanted to know about: Round-tripping,Hindu Business Line,3 Nov 2014,http://www.thehindubusinessline.com/opinion/all-you-wanted-to-know-about-roundtripping/article6561441.ece,The ire against black money is justified as this is money that has evaded tax or was obtained in an illegal manner or is attempting to escape from a legitimate ...
The Big Fight: On the Black Money Trail,NDTV,2 Nov 2014,http://www.ndtv.com/video/news/the-big-fight/the-big-fight-on-the-black-money-trail-343453,In the run up to the election  Prime Minister Narendra Modi had promised to bring back black money and enrich the honest tax payers and use it for public good.
India Has Less Than 1% Info on Black Money  Lots More I Can Offer ...,NDTV,20 Nov 2014,http://www.ndtv.com/video/exclusive/news/india-has-less-than-1-info-on-black-money-lots-more-i-can-offer-whistle-blower-to-ndtv-345454,He is the whistle-blower who  eight years ago  leaked a list of thousands of secret account holders at HSBC in Geneva. On that list were over 600 Indian names.
Curbing generation and outflow of black money are more important ...,Daily News & Analysis,1 May 2014,http://www.dnaindia.com/analysis/column-curbing-generation-and-outflow-of-black-money-are-more-important-than-bringing-it-back-1983869,The election manifestos of most prominent political parties have included a reference to the issues related to black money in the country. The common feature ...
Black money: Special Investigation Team to create database of tax ...,Daily News & Analysis,19 Nov 2014,http://www.dnaindia.com/india/report-black-money-special-investigation-team-to-create-database-of-tax-crimes-2036657,The Special Investigation Team (SIT) on black money has decided to create a rich national database where multiple agencies probing tax and financial crimes ...
All money deposited by Indians in foreign banks cannot be called ...,Daily News & Analysis,17 Oct 2014,http://www.dnaindia.com/india/report-all-money-deposited-by-indians-in-foreign-banks-cannot-be-called-black-money-attorney-general-2026911,With the Modi government facing the arduous task of fulfilling its promise of getting back black money stashed abroad  Attorney General Mukul Rohatgi today ...
Narendra Modi cheated people by following UPA line on black ...,Daily News & Analysis,15 Nov 2014,http://www.dnaindia.com/india/report-narendra-modi-cheated-people-by-following-upa-line-on-black-money-in-supreme-court-claims-congress-2035513,The Congress on Saturday accused Prime Minister Narendra Modi of "cheating" people on the black money issue  and said though he had made tall claims on ...
List of Black Money holders in Swiss Bank accounts leaked by ...,India.com,28 Oct 2014,http://www.india.com/news/india/list-of-black-money-holders-in-swiss-bank-accounts-leaked-by-wikileaks-182160/,Snippet not available
Black money: SC order may impact other tax treaties,Times of India,28 Oct 2014,http://timesofindia.indiatimes.com/india/Black-money-SC-order-may-impact-other-tax-treaties/articleshow/44965158.cms,Snippet not available
Black money: Centre submits 627 names  SC says only SIT can ...,Firstpost,29 Oct 2014,http://www.firstpost.com/india/black-money-centre-submits-627-names-sc-says-only-sit-can-open-envelope-1777801.html,Snippet not available
Trust Your 'Pradhan Sevak'  Every Penny of Black Money Will Be ...,NDTV,2 Nov 2014,http://www.ndtv.com/india-news/trust-your-pradhan-sevak-every-penny-of-black-money-will-be-brought-back-pm-narendra-modi-687743,Snippet not available
I'll bring back every penny of black money: Modi,Hindustan Times,2 Nov 2014,http://www.hindustantimes.com/india/i-ll-bring-back-every-penny-of-black-money-modi/story-6SWFskkAMGMqk1YZHr88BO.html,Snippet not available
Will bring back black money  says Narendra Modi,Livemint,2 Nov 2014,http://www.livemint.com/Politics/3WGOAPPuSUvAYbqUFUbVSJ/Modi-vows-to-bring-back-black-money.html,Snippet not available
Live: Trying my best to retrieve black money stashed abroad ...,Firstpost,2 Nov 2014,http://www.firstpost.com/politics/live-trying-my-best-to-retrieve-black-money-stashed-abroad-assures-pm-modi-1783707.html,Snippet not available
Black money debate in Parliament: As it happened on Wednesday,Zee News,25 Nov 2014,http://zeenews.india.com/news/india/black-money-debate-in-parliament-as-it-happened-on-wednesday_1504925.html,Snippet not available
Black money: 'Swiss drawing up list of Indians',Indian Express,22 Jun 2014,http://indianexpress.com/article/india/india-others/swiss-govt-prepares-list-of-indians-with-suspected-black-money/,Snippet not available
Swiss govt readies list of Indians with black money,Hindustan Times,28 Jun 2014,http://www.hindustantimes.com/india/swiss-govt-readies-list-of-indians-with-black-money/story-gdmF3Ov2m2mMF5ciYW6BiI.html,Snippet not available
NDA govt forms crack team to probe black money,Hindustan Times,30 May 2014,http://www.hindustantimes.com/india/nda-govt-forms-crack-team-to-probe-black-money/story-e8wO3dJEyhOngvE3MTBhPI.html,Snippet not available
Modi Government's First Decision: Special Investigation Team on ...,NDTV,27 May 2014,http://www.ndtv.com/elections-news/modi-governments-first-decision-special-investigation-team-on-black-money-564213,Snippet not available
Indian black money in foreign banks: Timeline,India Today,27 Oct 2014,http://indiatoday.intoday.in/story/indian-black-money-in-foreign-banks-timeline/1/397791.html,Snippet not available
Names of black money account holders will embarrass Congress ...,Daily News & Analysis,21 Oct 2014,http://www.dnaindia.com/india/report-names-of-black-money-account-holders-will-embarrass-congress-says-finance-minister-arun-jaitley-2028186,Snippet not available
Black money: Rs 6 lakh crore illegally taken out of India in 2012,Times of India,16 Dec 2014,http://timesofindia.indiatimes.com/india/Black-money-Rs-6-lakh-crore-illegally-taken-out-of-India-in-2012/articleshow/45542719.cms,Snippet not available
India replaces Malaysia as 4th largest exporter of black money,Hindustan Times,16 Dec 2014,http://www.hindustantimes.com/business/india-replaces-malaysia-as-4th-largest-exporter-of-black-money/story-89pY0Zse7MH1jQkGMmjASM.html,Snippet not available
Black money: Kiran Bedi backs Modi govt`s stand  says Jethmalani ...,Zee News,18 Oct 2014,http://zeenews.india.com/news/india/black-money-kiran-bedi-backs-modi-govts-stand-says-jethmalani-needs-to-be-patient_1486813.html,Snippet not available
Black Money: All You Need to Know about India's Parallel Economy,International Business Times  India Edition,30 Oct 2014,http://www.ibtimes.co.in/black-money-all-you-need-know-about-indias-parallel-economy-612645,Snippet not available
Baba Ramdev ji  what are you hiding by switching off the mike ...,India.com,17 Apr 2014,http://www.india.com/election-2014/baba-ramdev-ji-what-are-you-hiding-black-money-41024/,Snippet not available
SC Gives UPA Government 1 Week to Set up SIT on Black Money ...,International Business Times  India Edition,23 May 2014,http://www.ibtimes.co.in/sc-gives-upa-government-one-week-set-sit-black-money-cases-modis-task-force-ready-600864,Snippet not available
Black money probe: SIT traces Rs 4479cr in Swiss banks  Rs 14958 ...,Times of India,12 Dec 2014,http://timesofindia.indiatimes.com/india/Black-money-probe-SIT-traces-Rs-4479cr-in-Swiss-banks-Rs-14958cr-in-India/articleshow/45497127.cms,Snippet not available
Black Money: Rs 4479 crore traced by SIT in Swiss banks,Daily News & Analysis,12 Dec 2014,http://www.dnaindia.com/india/report-black-money-rs-4479-crore-traced-by-sit-in-swiss-banks-2043545,Snippet not available
SIT on black money to hold first meet tomorrow,Times of India,31 May 2014,http://timesofindia.indiatimes.com/india/SIT-on-black-money-to-hold-first-meet-tomorrow/articleshow/35883969.cms,Snippet not available
Over-valuing power imports easiest source of black money  says SIT,Firstpost,20 Aug 2014,http://www.firstpost.com/business/corporate-business/over-valuing-power-imports-easiest-source-of-black-money-says-sit-1985039.html,Snippet not available
Come with proof: Swiss to India on black money,Livemint,7 Dec 2014,http://www.livemint.com/Politics/xj60ITG7oXDNUqx20mgiQM/Come-with-proof-Swiss-on-black-money.html,Snippet not available
If you have information on black money  share it with SIT,Daily News & Analysis,1 Nov 2014,http://www.dnaindia.com/india/report-if-you-have-information-on-black-money-share-it-with-sit-2031385,Snippet not available
Unauthorised disclosure on black money hampers probe: Arun Jaitley,Indian Express,2 Nov 2014,http://indianexpress.com/article/business/economy/unauthorised-disclosure-on-black-money-hampers-probe/,Snippet not available
Chasing black money: How parties are resisting transparency in ...,Economic Times,1 Nov 2014,http://articles.economictimes.indiatimes.com/2014-11-02/news/55682534_1_black-money-hsbc-list-unaccounted-money,Snippet not available
Black money probe: Swiss banks mull anticipatory meaures,India.com,2 Nov 2014,http://www.india.com/news/india/black-money-probe-swiss-banks-mull-anticipatory-meaures-185319/,Snippet not available
Black money stashed abroad: Can Modi government glean ...,Economic Times,5 Jul 2014,http://articles.economictimes.indiatimes.com/2014-07-06/news/51107968_1_swiss-banks-swiss-authorities-international-financial-matters,Snippet not available
Black money trail: No list of Indians holding money in Swiss banks ...,Financial Express,8 Jul 2014,http://www.financialexpress.com/archive/black-money-trail-no-list-of-indians-holding-money-in-swiss-banks-says-arun-jaitley/1267899/,Snippet not available
Black money trail: No list of Indians holding assets in Swiss banks ...,Livemint,8 Jul 2014,http://www.livemint.com/Politics/fUhfTzJFXcS02AcYuD3VOK/No-list-of-Indians-holding-money-in-Swiss-banks-Arun-Jaitle.html,Snippet not available
Lawyer Ram Jethmalani wants Supreme Court to play more active ...,Daily News & Analysis,27 Oct 2014,http://www.dnaindia.com/india/report-lawyer-ram-jethmalani-wants-supreme-court-to-play-more-active-role-in-black-money-row-2029559,Snippet not available
Black money: Lodhya denies having a Swiss bank account,Indian Express,27 Oct 2014,http://indianexpress.com/article/india/india-others/black-money-lodhya-denies-having-a-swiss-bank-account/,Snippet not available
Black Money trail: Pankaj Lodhiya - Bullion trader from Rajkot,Business Standard,27 Oct 2014,http://www.business-standard.com/article/current-affairs/black-money-trail-pankaj-lodhiya-bullion-trader-from-rajkot-114102700754_1.html,Snippet not available
Syndicate Bank CMD SK Jain bribery case may come up before SIT ...,Economic Times,10 Aug 2014,http://articles.economictimes.indiatimes.com/2014-08-10/news/52648200_1_alleged-bribery-bribery-case-money-trail,Snippet not available
Black Money Stashed Abroad Seen at Rs. 120 Lakh Crore: Assocham,NDTV,20 Jun 2014,http://profit.ndtv.com/news/economy/article-black-money-stashed-abroad-seen-at-rs-120-lakh-crore-assocham-545276,Snippet not available
First batch of containers leave for Switzerland to fetch black money,Firstpost (satire),25 Jun 2014,http://www.fakingnews.firstpost.com/snippets/first-batch-of-containers-leave-for-switzerland-to-fetch-black-money-5692,Snippet not available
Black money SIT decides to solve tax treaties' secrecy puzzle,Financial Express,8 Jun 2014,http://www.financialexpress.com/archive/black-money-sit-decides-to-solve-tax-treaties-secrecy-puzzle/1258357/,Snippet not available
Money laundering: RBI takes action against erring Urban ...,Indian Express,14 Sep 2014,http://indianexpress.com/article/business/banking-and-finance/money-laundering-rbi-takes-action-against-erring-urban-cooperative-banks/,Snippet not available
Notice to be served on 23000 income tax defaulters,The Hindu,8 Dec 2014,http://www.thehindu.com/news/cities/kozhikode/notice-to-be-served-on-23000-income-tax-defaulters/article6675206.ece,Snippet not available
Black money issue: In black and white,Financial Express,23 Oct 2014,http://www.financialexpress.com/archive/black-money-issue-in-black-and-white/1301192/,Snippet not available
SIT pushes for cash curbs to check black money,Chandigarh Tribune,12 Dec 2014,http://www.tribuneindia.com/news/nation/sit-pushes-for-cash-curbs-to-check-black-money/17718.html,Snippet not available
The secret history of Swiss bank accounts,Livemint,29 Oct 2014,http://www.livemint.com/Politics/novevubtiXoiKubIr0U6SM/The-secret-history-of-Swiss-bank-accounts.html,Snippet not available
'Narendra Modi govt must not reveal black money holders names on ...,Financial Express,26 Oct 2014,http://www.financialexpress.com/archive/narendra-modi-govt-must-not-reveal-black-money-holders-names-on-india-list/1302007/,Snippet not available
List of 627 Foreign Account Holders Given to Supreme Court,NDTV,28 Oct 2014,http://www.ndtv.com/india-news/black-money-case-list-of-627-foreign-account-holders-given-to-supreme-court-686100,Snippet not available
Report on black money will be submitted on time: Justice M B Shah,Indian Express,30 Oct 2014,http://indianexpress.com/article/india/india-others/report-on-black-money-will-be-submitted-in-time-sit-chief-justice-m-b-shah/,Snippet not available
I am committed towards bringing back black money  PM Narendra ...,Times of India,2 Nov 2014,http://timesofindia.indiatimes.com/india/I-am-committed-towards-bringing-back-black-money-PM-Narendra-Modi-says/articleshow/45010837.cms,Snippet not available
Bringing back black money in 100 days? We aren't so immature ...,The Hindu,27 Nov 2014,http://www.thehindu.com/news/national/bringing-back-black-money-in-100-days-we-arent-so-immature-says-venkaiah/article6640174.ece,Snippet not available
On black money  a reversal of roles: Congress speaks like BJP  BJP ...,Indian Express,27 Nov 2014,http://indianexpress.com/article/india/politics/on-black-money-a-reversal-of-roles-cong-speaks-like-bjp-bjp-like-cong/,Snippet not available
Pradip Burman among 3 named for holding black money accounts ...,Times of India,27 Oct 2014,http://timesofindia.indiatimes.com/india/Daburs-Pradip-Burman-among-3-named-for-holding-black-money-accounts-abroad/articleshow/44945687.cms,Snippet not available
Won't comment till I study black money affidavit: Goa miner Radha ...,Daily News & Analysis,27 Oct 2014,http://www.dnaindia.com/india/report-won-t-comment-till-i-study-black-money-affidavit-goa-miner-radha-timblo-2029661,Snippet not available
Pankaj Lodhiya to Baba Ramdev: Who said what on black money ...,Firstpost,27 Oct 2014,http://www.firstpost.com/india/pankaj-lodhiya-to-baba-ramdev-who-said-what-on-black-money-names-list-1774935.html,Snippet not available
Black money: Swiss government prepares list of individuals but India ...,Deccan Chronicle,23 Jun 2014,http://www.deccanchronicle.com/140623/nation-current-affairs/article/black-money-swiss-government-prepares-list-individuals-india,Snippet not available
SIT on black money to hold first meeting on June 4,The Hindu,30 May 2014,http://www.thehindu.com/news/national/sit-on-black-money-to-hold-first-meeting-on-june-4/article6062219.ece,Snippet not available
Congress steps up attack on government on black money issue,Daily News & Analysis,29 Oct 2014,http://www.dnaindia.com/india/report-congress-steps-up-attack-on-government-on-black-money-issue-2030189,Snippet not available
'Black money accused donated funds to BJP  Congress',Zee News,27 Oct 2014,http://zeenews.india.com/news/india/black-money-accused-donated-funds-to-bjp-congress_1490515.html,Snippet not available
Black Money Names Will Embarrass Congress: Finance Minister ...,NDTV,21 Oct 2014,http://www.ndtv.com/india-news/black-money-names-will-embarrass-congress-finance-minister-arun-jaitley-to-ndtv-682624,Snippet not available
Black money: Congress won't be blackmailed  says Ajay Maken,Firstpost,23 Oct 2014,http://www.firstpost.com/politics/black-money-congress-wont-be-blackmailed-says-ajay-maken-1768837-1768837.html,Snippet not available
Black money: U-turn by NDA,The Hindu,17 Oct 2014,http://www.thehindu.com/news/national/all-details-on-black-money-cant-be-disclosed-centre-tells-sc/article6510838.ece,Snippet not available
Black money: Modi govt says it can't disclose names,India Today,17 Oct 2014,http://indiatoday.intoday.in/story/black-money-modi-government-says-it-can-not-disclose-names/1/396235.html,Snippet not available
Modi govt misleading public on black money issue: Congress,Indian Express,18 Oct 2014,http://indianexpress.com/article/india/politics/modi-govt-misleading-public-on-black-money-issue-congress/,Snippet not available
Bringing back black money: Why name-and-shame alone won't work ...,Firstpost,18 Oct 2014,http://www.firstpost.com/india/bringing-back-black-money-name-shame-alone-wont-work-india-1762437.html,Snippet not available
NDA government and Narendra Modi's black money response ...,Daily News & Analysis,17 Oct 2014,http://www.dnaindia.com/india/report-nda-government-and-narendra-modi-s-black-money-response-shows-sheer-hypocrisy-congress-2026979,Snippet not available
Black money: Switzerland reminds India of terms for sharing bank ...,Times of India,31 Oct 2014,http://timesofindia.indiatimes.com/india/Black-money-Switzerland-reminds-India-of-terms-for-sharing-bank-information/articleshow/44988848.cms,Snippet not available
Government says its hands tied  defers tax treaty signing,Indian Express,29 Oct 2014,http://indianexpress.com/article/india/india-others/government-says-its-hands-tied-defers-tax-treaty-signing-2/,Snippet not available
Why is Modi silent on black money: Sibal,The Hindu,18 Apr 2014,http://www.thehindu.com/elections/loksabha2014/why-is-modi-silent-on-black-money-sibal/article5926898.ece,Snippet not available
Don't talk of money here: Ramdev to BJP candidate,India Today,18 Apr 2014,http://indiatoday.intoday.in/story/ramdev-mahant-chandnath-dont-talk-of-money-here/1/356353.html,Snippet not available
Supreme Court gives Centre a week to form SIT on black money,India Today,23 May 2014,http://indiatoday.intoday.in/story/supreme-court-gives-centre-a-week-to-form-sit-on-black-money/1/363180.html,Snippet not available
