Demonetisation chaotic  will have no impact on black money ...,Economic Times,8 Nov 2016,http://economictimes.indiatimes.com/news/politics-and-nation/demonetisation-chaotic-will-have-no-impact-on-black-money-economist/articleshow/55321764.cms,"That's because people don't stack black money in cash. Rather  they stash it in undisclosed accounts in Swiss Banks. So demonetisation won't affect the big fish ...
Black money: you can't dodge the taxman now,Daily News & Analysis,16 Nov 2016,http://www.dnaindia.com/money/report-black-money-you-can-t-dodge-the-taxman-now-2274198,There are many messages on social media which seem to indicate that you can deposit unaccounted cash into your bank account and pay tax on it @ 30% and ...
After black money  Narendra Modi govt's next crackdown may be on ...,Zee News,15 Nov 2016,http://zeenews.india.com/news/india/after-black-money-narendra-modi-govts-next-crackdown-may-be-on-benami-transactions-gold_1949836.html,Giving an indication in this regard  PM Modi said in Goa recently that the next step in his war on “black money” and corruption would be a crackdown on benami ...
What War on Black Money? BJP  Congress Unite to Hide Fund ...,The Quint,4 Dec 2016,https://www.thequint.com/india/2016/12/05/demonetisation-bjp-congress-unite-to-hide-fund-sources-political-funding-rti-black-money-corruption-election,National political parties collected more than Rs 1 130 crore in donations in 2014-2015. The government levied no tax on this money and its source remains ...
Indians May Have Hidden More Than Rs 12.02 Lakh Crore Of Black ...,Indiatimes.com,20 Mar 2016,http://timesofindia.indiatimes.com/india/181-billion-Indian-black-money-in-tax-havens/articleshow/51487042.cms,In all probability  Indian share in foreign black money is somewhere between the two estimates computed above. This is supported by estimates of offshore ...
To clamp down on black money  government set to ban cash ...,Times of India,21 Aug 2016,http://timesofindia.indiatimes.com/india/To-clamp-down-on-black-money-government-set-to-ban-cash-transactions-over-Rs-3-lakh/articleshow/53802260.cms,NEW DELHI: The government is set to ban cash transactions over Rs 3 lakh as it seeks to clamp down on black money in the economy following ...
It is not so easy to retrieve black money: Venkaiah Naidu,Economic Times,29 May 2016,http://economictimes.indiatimes.com/news/politics-and-nation/it-is-not-so-easy-to-retrieve-black-money-venkaiah-naidu/articleshow/52490680.cms,Treaties that were entered into during the Congress regime have come in the way of getting back black money. International treaties. They have secret clause.
BJP Targets Congress Chief Sonia Gandhi On Black Money Issue,NDTV,5 Apr 2016,http://www.ndtv.com/india-news/bjp-targets-congress-chief-sonia-gandhi-on-black-money-issue-1339030,New Delhi: Hitting back at Congress over its digs at the government over black money and Panama Papers leak issues  BJP today said it should ask its chief ...
I support and applaud Modi's black money move: Narayana Murthy,Economic Times,8 Nov 2016,http://economictimes.indiatimes.com/markets/expert-view/i-support-and-applaud-modis-black-money-move-narayana-murthy/articleshow/55326678.cms,In a chat with ET Now  Narayana Murthy  Founder  Infosys  says Modi has always been opposed to corruption and black money and the step is a right one.
PM Modi in Switzerland: Meeting of minds on black money  tax ...,The Indian Express,6 Jun 2016,http://indianexpress.com/article/india/india-news-india/pm-narendra-modi-in-switzerland-meeting-of-minds-on-black-money-tax-evasion-2838938/,On June 6  PM Narendra Modi  in his talks with Swiss President Schneider-Amman  raised the issue of black money and tax evasion by Indians to which the ...
Supreme Court asks black money SIT to look into Bank of Baroda case,The Indian Express,26 Apr 2016,http://indianexpress.com/article/business/business-others/supreme-court-asks-black-money-sit-to-look-into-bank-of-baroda-case-2771947/,The Supreme Court Tuesday asked the Special Investigation Team (SIT) on black money to “look into” a plea seeking a probe into an alleged Rs 6 000 crore ...
Benami transaction bill passed in RS; FM Jaitley warns black money ...,Economic Times,2 Aug 2016,http://economictimes.indiatimes.com/news/politics-and-nation/benami-transaction-bill-passed-in-rs-fm-jaitley-warns-black-money-holders-not-to-miss-september-30-deadline/articleshow/53510130.cms,NEW DELHI: Committing to deal strongly with black money  Finance Minister Arun Jaitley today warned those having undisclosed income against missing the ...
War on Black Money: Note ban a bolt from blue in Uttar Pradesh?,Daily News & Analysis,10 Nov 2016,http://www.dnaindia.com/india/report-war-on-black-money-note-ban-a-bolt-from-blue-in-uttar-pradesh-2272180,Though the parties are tight-lipped on the issue  the crackdown against black money has left many high and dry as Assembly elections are barely few months ...
Black money: No proposal to extend Income Disclosure Scheme ...,Zee News,12 Aug 2016,http://zeenews.india.com/business/news/economy/black-money-no-proposal-to-extend-income-disclosure-scheme-deadline-says-govt_1918101.html,New Delhi: The government on Friday said it is not considering any proposal to extend the four-month deadline for disclosing domestic black money under the ...
CBDT to acknowledge black money declarants by August-end,The Hindu,13 Aug 2016,http://www.thehindu.com/news/national/cbdt-to-acknowledge-black-money-declarants-by-augustend/article8988380.ece,Black money holders who have disclosed their ill-gotten assets during July under the ongoing compliance window will receive acknowledgement from the tax ...
Fawad Khan and other Pak artistes' managers exposed in black ...,Deccan Chronicle,16 Nov 2016,http://www.deccanchronicle.com/entertainment/bollywood/161116/fawad-khan-and-other-pak-artistes-managers-exposed-in-black-money-scam.html,Fawad Khan and other Pak artistes' managers exposed in black money scam ... of black money  and seems like the move has finally begun to show results.
India's Move To Curb 'Black Money' Will Break Backbone Of ...,NDTV,9 Nov 2016,http://www.ndtv.com/india-news/indias-move-to-curb-black-money-will-break-backbone-of-traffickers-kailash-satyarthi-1623607,"I commend the boldness of the step taken by Prime Minister Narendra Modi to put an end to black money and corruption " he said in a statement on late on ...
Rs 3 35000 cr currency may be destroyed in demonetisation: Think ...,Business Standard,11 Nov 2016,http://www.business-standard.com/article/news-ians/rs-3-35-000-cr-currency-may-be-destroyed-in-demonetisation-think-tank-116111100774_1.html,It means that India's war on domestic black money will bring in approximately $40 billion (Rs 2 68 400 crore) into the formal banking system of the country by ...
Rs 13000 crore black money unearthed from overseas bank accounts,Times of India,27 Jun 2016,http://timesofindia.indiatimes.com/india/Rs-13000-crore-black-money-unearthed-from-overseas-bank-accounts/articleshow/52930791.cms,The recently enacted Black Money Undisclosed Foreign Income and Assets Act has made the "wilful attempt to evade tax"as a predicate offence under the PMLA ...
Crackdown on black money will help clean up election process,Hindustan Times,9 Nov 2016,http://www.hindustantimes.com/india-news/crackdown-on-black-money-will-help-clean-up-election-process/story-4s7CHwm7cddk6KqWdOTRQK.html,Political parties use black money … Rs 500 and Rs 1 000 notes for the purpose ” said SK Dwivedi  a former professor of political science at Lucknow University.
RJD ticket hasn't tainted black money crusade: Ram Jethmalani,Times of India,22 Jul 2016,http://timesofindia.indiatimes.com/india/RJD-ticket-hasnt-tainted-black-money-crusade-Ram-Jethmalani/articleshow/53347884.cms,New Delhi: Senior advocate Ram Jethmalani says his crusade against corruption and black money has not been tainted by his taking the Rajya Sabha berth  ...
$505 billion black money outflow from India 'heavily exaggerated ...,The Indian Express,11 Jun 2016,http://indianexpress.com/article/business/economy/black-money-outflow-from-india-exaggerated-directorate-of-revenue-intelligence-supreme-court-sit-2848437/,Sources said the actual amount of black money outflow  through trade-based money laundering  could be far less than mentioned in the report.
Income Disclosure Scheme: Taxmen to seek info from suspected ...,Economic Times,18 Jul 2016,http://economictimes.indiatimes.com/news/economy/policy/income-disclosure-scheme-taxmen-to-seek-info-from-suspected-black-money-holders/articleshow/53249569.cms,As part of larger efforts to curb the black money menace  the government has been urging the entities to come forward and make use of the IDS.
Black money is in foreign banks  says bank association,Businessinsider India,8 Nov 2016,http://www.businessinsider.in/Black-money-is-in-foreign-banks-says-bank-association/articleshow/55325590.cms,The withdrawal of 500 and 1 000 rupee notes from circulation will not help in fighting black money as it is stashed away in foreign banks  foreign currency  gold ...
“Inform about steps to check black money”,The Hindu,10 Nov 2016,http://www.thehindu.com/news/cities/Delhi/inform-about-steps-to-check-black-money/article9331608.ece,Senior Congress leader and former Rajasthan Chief Minister Ashok Gehlot on Thursday demanded that the NDA government at the Centre inform the public ...
Widening black money net,Hindu Business Line,18 Nov 2016,http://www.thehindubusinessline.com/opinion/black-money-hawala-and-demonetisation/article9362185.ece,The Modi government made an election promise of eradicating black money. It made a boastful promise to put ₹15 lakh into the pockets of every Indian.
Money changers  entry operators  active in converting black money,The Indian Express,12 Nov 2016,http://indianexpress.com/article/india/india-news-india/money-changers-entry-operators-active-in-converting-black-money-4371888/,Money changers  entry operators  active in converting black money. "I am getting handsomely paid for depositing up to Rs 2.5 lakhs in my 'Jan Dhan' account ...
Only those hoarding black money  evading taxes are against ...,The Indian Express,27 Nov 2016,http://indianexpress.com/article/india/politics/only-those-hoarding-black-money-evading-taxes-against-demonetisation-bjp-4399135/,Only those hoarding black money  evading taxes are against demonetisation: BJP. President of Puducherry unit of BJP said that those who were honestly paying ...
'Flow of black money to foreign lands goes down',Times of India,12 Sep 2016,http://timesofindia.indiatimes.com/city/cuttack/Flow-of-black-money-to-foreign-lands-goes-down/articleshow/54306332.cms,CUTTACK: Stashing of black money by Indians in foreign banks has declined  said Arijit Pasayat  vice-chairman of the Special Investigation Team (SIT) on black ...
Dawood Company Accused Of Converting 'Black Money' To 'White ...,Indiatimes.com,11 Sep 2016,http://www.indiatimes.com/news/india/dawood-company-accused-of-converting-black-money-to-white-money-for-a-top-bollywood-star-261534.html,According to intelligence officials  telephonic intercepts of D-company have reportedly shown the mafia crime lord Dawood Ibrahim is "round-tripping" money for ...
Income Declaration Scheme: The scourge of black money,Free Press Journal,18 Sep 2016,http://www.freepressjournal.in/analysis/income-declaration-scheme-the-scourge-of-black-money-ajit-ranade/930505,The government of India announced the Income Declaration Scheme (IDS) earlier this year. The purpose of IDS is to unearth black money in the country. It is an ...
Black money: SIT to submit fifth interim report in August,Daily News & Analysis,15 Jul 2016,http://www.dnaindia.com/money/report-black-money-sit-to-submit-fifth-interim-report-in-august-2234921,Supreme Court-appointed Special Investigating Team (SIT) on black money said on Friday that around Rs 133 crore cash was recovered from three educational ...
Black money hoarders opposing demonetisation: Rajnath Singh,Economic Times,1 hour ago,http://economictimes.indiatimes.com/news/politics-and-nation/black-money-hoarders-opposing-demonetisation-rajnath-singh/articleshow/55897724.cms,"Those who are saying it as 'nashbandi' are actually hoarders of black money. Those who indulge in corruption  their life blood have been cut " he said here.
Keep the black money deposited in your account: PM to Jan Dhan ...,Economic Times,3 Dec 2016,http://economictimes.indiatimes.com/news/politics-and-nation/keep-the-black-money-deposited-in-your-account-pm-to-jan-dhan-holders/articleshow/55771854.cms,Snippet not available
PM Modi biggest patron of black money: Congress,The Indian Express,2 Dec 2016,http://indianexpress.com/article/india/pm-modi-biggest-patron-of-black-money-congress-4407999/,Snippet not available
4 Lessons In Change Leadership From Modi's 'Surgical Strike' On ...,Huffington Post India,21 Nov 2016,http://www.huffingtonpost.in/debashis-sarkar/4-lessons-in-change-leadership-from-modis-surgical-strike-on/,Snippet not available
Prime Minister Modi's Black Money Magic,Mainstream,21 Nov 2016,http://www.mainstreamweekly.net/article6838.html,Snippet not available
Black Money Tax: Government's New Income Declaration Scheme ...,NDTV,28 Nov 2016,http://www.ndtv.com/india-news/government-moves-bill-in-parlaiment-to-plug-loopholes-in-income-tax-laws-1631187,Snippet not available
Government reveals shocking tax percentage for black money holders,YourStory.com,28 Nov 2016,https://yourstory.com/2016/11/govt-shocking-tax-percentage-black-money-holders/,Snippet not available
Chandrababu Naidu  YSJ Reddy in row over Rs 10000 crore black ...,Scroll.in,13 Oct 2016,http://scroll.in/latest/818972/andhra-pradesh-cm-naidu-ysj-reddy-in-row-over-rs-10000-crore-black-money-declared-from-hyderabad,Snippet not available
Black money in India can be reduced by abolishing big currency ...,International Business Times  India Edition,12 Oct 2016,http://www.ibtimes.co.in/black-money-india-can-be-reduced-by-abolishing-big-currency-notes-says-chandrababu-naidu-699337,Snippet not available
Disclosed Black Money To Be Taxed At 50% Gets Closer To Being ...,NDTV,29 Nov 2016,http://www.ndtv.com/india-news/disclosed-black-money-to-be-taxed-at-50-gets-closer-to-being-law-1631663,Snippet not available
Govt's war on black money no less than surgical strike: Amit Shah,Daily News & Analysis,8 Nov 2016,http://www.dnaindia.com/india/report-govt-s-war-on-black-money-no-less-than-surgical-strike-amit-shah-2271652,Snippet not available
Putting a friend's black money into your account? Govt warns of strict ...,Daily News & Analysis,18 Nov 2016,http://www.dnaindia.com/money/report-putting-a-friend-s-black-money-into-your-account-govt-warns-of-strict-action-under-income-tax-act-2274708,Snippet not available
Converting black money into legal tender: Govt warns against ...,Zee News,18 Nov 2016,http://zeenews.india.com/news/india/converting-black-money-into-legal-tender-govt-warns-against-fraudulent-cash-deposit-withdrawal_1951076.html,Snippet not available
Will jail those stashing black money in Jan Dhan accounts: PM in UP,onmanorama,3 Dec 2016,http://english.manoramaonline.com/news/nation/-will-jail-stashing-black-money-jan-dhan-accounts-modi.html,Snippet not available
'Mammoth Tragedy': Manmohan Singh's Sharp Critique Of PM ...,NDTV,11 hours ago,http://www.ndtv.com/india-news/mammoth-tragedy-manmohan-singhs-sharp-critique-of-pm-modis-notes-ban-1635836,Snippet not available
Black money: Deposits belie expectations of large windfall,Economic Times,1 Dec 2016,http://economictimes.indiatimes.com/news/politics-and-nation/what-black-money-government-may-be-in-for-shock/articleshow/55719794.cms,Snippet not available
Minister's reply in Rajya Sabha suggests there was no black money,Janta Ka Reporter,1 Dec 2016,http://www.jantakareporter.com/business/ministers-reply-rajya-sabha-suggests-no-black-money/80447/,Snippet not available
Black money: Indirect tax evasion of Rs.50000 crore uncovered,Times of India,10 May 2016,http://timesofindia.indiatimes.com/city/delhi/Black-money-Indirect-tax-evasion-of-Rs-50000-crore-uncovered/articleshow/52207425.cms,Snippet not available
Blackmoney: Govt unearths indirect tax evasion of Rs 50000 crore in ...,The Indian Express,10 May 2016,http://indianexpress.com/article/business/economy/blackmoney-govt-unearths-indirect-tax-evasion-of-rs-50000-crore-in-two-years-2793085/,Snippet not available
Money owned by Indians in Swiss banks drops to record low of Rs ...,The Indian Express,30 Jun 2016,http://indianexpress.com/article/business/economy/money-owned-by-indians-in-swiss-banks-drops-to-record-low-of-rs-8392-crore/,Snippet not available
Govt checking if any black money returned to India: Revenue Secy,Economic Times,1 Jul 2016,http://economictimes.indiatimes.com/industry/banking/finance/govt-checking-if-any-black-money-returned-to-india-revenue-secy/articleshow/53009295.cms,Snippet not available
Black money amnesty scheme opens today  should you avail and ...,Financial Express,1 Jun 2016,http://www.financialexpress.com/industry/banking-finance/black-money-amnesty-scheme-opens-june-1-2016-should-you-avail-and-steps-to-take/271020/,Snippet not available
Compliance Window For Domestic Black Money Opens Tomorrow,NDTV,31 May 2016,http://www.ndtv.com/india-news/compliance-window-for-domestic-black-money-opens-tomorrow-1413971,Snippet not available
Black money window: Jaitley to meet industry associations  explain ...,The Indian Express,27 Jun 2016,http://indianexpress.com/article/business/business-others/black-money-arun-jaitley-undeclared-assets-income-declaration-scheme-2880082/,Snippet not available
PMO keeping an eye on black money scheme,Business Standard,27 Jun 2016,http://www.business-standard.com/article/economy-policy/pmo-keeping-an-eye-on-black-money-scheme-116062701346_1.html,Snippet not available
MobiKwik  PayTM 'cash in' on the black money crackdown,Techradar India,10 Nov 2016,http://www.in.techradar.com/news/phone-and-communications/MobiKwik-PayTM-cash-in-on-the-black-money-crackdown/articleshow/55350583.cms,Snippet not available
Jaipur defies black money fight  emerges as top centre for filtering ...,Daily News & Analysis,13 hours ago,http://www.dnaindia.com/india/report-pink-city-defies-black-money-fight-2281145,Snippet not available
Jan Dhan inflows decline after govt alert on converting black money,Zee Business,7 Dec 2016,http://www.zeebiz.com/india/news-jan-dhan-inflows-declines-after-govt-alert-on-converting-black-money-8909,Snippet not available
What are participatory notes? How does it feed black money monster?,Business Today,19 May 2016,http://www.businesstoday.in/markets/stocks/what-are-participatory-notes-how-it-feeds-black-money-monster/story/232824.html,Snippet not available
Sebi tightens P-Note norms for hawk-eye vigil on black money,Daily News & Analysis,19 May 2016,http://www.dnaindia.com/money/report-sebi-tightens-p-note-norms-for-hawk-eye-vigil-on-black-money-2214419,Snippet not available
India makes it more difficult to deal in black money,Governance Now,6 Jun 2016,http://www.governancenow.com/news/regular-story/india-makes-it-more-difficult-deal-in-black-money,Snippet not available
Black money declarations begin June 1,The Hindu,14 May 2016,http://www.thehindu.com/business/black-money-declaration-sbegin-june-1/article8601172.ece,Snippet not available
Panama Papers: Investigation of 500 Indians as per new anti black ...,Firstpost,4 Apr 2016,http://www.firstpost.com/india/panama-papers-investigation-of-500-indians-as-per-new-anti-black-money-law-2712536.html,Snippet not available
Withdrawing Rs 500  Rs 1000 notes surgical strike on black money ...,India.com,8 Nov 2016,http://www.india.com/news/india/withdrawing-rs-500-rs-1000-notes-surgical-strike-on-black-money-arun-jaitly-1636253/,Snippet not available
Black money: Government collects Rs 2428 crore tax from over 600 ...,Economic Times,6 Jan 2016,http://economictimes.indiatimes.com/news/economy/finance/black-money-government-collects-rs-2428-crore-tax-from-over-600-entities/articleshow/50468150.cms,Snippet not available
Are Jan Dhan accounts being used to re-route black money?,Hindu Business Line,15 Nov 2016,http://www.thehindubusinessline.com/money-and-banking/jan-dhan/article9349830.ece,Snippet not available
How will higher denomination note help reduce black money: P ...,Economic Times,9 Nov 2016,http://economictimes.indiatimes.com/news/politics-and-nation/how-will-higher-denomination-note-help-reduce-black-money-p-chidambaram/articleshow/55341165.cms,Snippet not available
Gujarat tops list of searches for 'How to convert black money into ...,International Business Times  India Edition,11 Nov 2016,http://www.ibtimes.co.in/gujarat-tops-list-searches-how-convert-black-money-into-white-money-google-703464,Snippet not available
Modi govt fulfilled promises on corruption  black money: Amit Shah,Times of India,2 Oct 2016,http://timesofindia.indiatimes.com/india/Modi-govt-fulfilled-promises-on-corruption-black-money-Amit-Shah/articleshow/54641440.cms,Snippet not available
Black money: SIT asks DRI to verify if $505 billion flown out of India ...,Zee News,15 Feb 2016,http://zeenews.india.com/business/news/economy/black-money-sit-asks-dri-to-verify-if-505-billion-flown-out-of-india-from-2004-13_1855888.html,Snippet not available
Need clear tax laws to prevent black money creation: Niti Aayog chief,Millennium Post,4 Dec 2016,http://www.millenniumpost.in/NewsContent.aspx?NID=346151,Snippet not available
Black Money: People making money through corruption can't take ...,Daily News & Analysis,20 May 2016,http://www.dnaindia.com/money/report-black-money-people-making-money-through-corruption-can-t-take-advantage-of-4-month-disclosure-window-says-finmin-2214754,Snippet not available
Govt recovers black money worth nearly Rs 44000 crore in last two ...,Daily News & Analysis,19 Jul 2016,http://www.dnaindia.com/money/report-govt-recovers-black-money-worth-nearly-rs-44000-crore-in-last-two-years-2236076,Snippet not available
Demonetisation most potent instrument ever against black money: BJP,The Indian Express,3 Dec 2016,http://indianexpress.com/article/india/demonetisation-most-potent-instrument-ever-against-black-money-bjp-4408710/,Snippet not available
Black Money Window: No Significant Addition To Rs. 65250 Crore ...,NDTV,23 Oct 2016,http://profit.ndtv.com/news/tax/article-income-disclosure-scheme-no-significant-addition-to-rs-65-250-crore-declarations-1478039,Snippet not available
Will prosecute those with black money stashed abroad  says Arun ...,Hindustan Times,28 May 2016,http://www.hindustantimes.com/india/will-prosecute-those-with-black-money-stashed-abroad-says-arun-jaitley/story-WF52QMa3oBNYpyXXtTjsEK.html,Snippet not available
IT dept notifies forms to declare assets in one-time black money ...,Firstpost,2 Jun 2016,http://www.firstpost.com/business/it-dept-notifies-forms-to-declare-assets-in-one-time-black-money-window-2812572.html,Snippet not available
After demonetisation  properties without KYC compliance to be seized,Mid-Day,14 Nov 2016,http://www.mid-day.com/articles/demonetisation-properties-kyc-compliance-real-estate-observers-pm-narendra-modi-goa-black-money-news/17758170,Snippet not available
$181 billion Indian black money stashed in tax havens: Report,Zee News,21 Mar 2016,http://zeenews.india.com/business/news/economy/indian-black-money-stashed-in-tax-havens-amounts-to-181-billion_1867853.html,Snippet not available
Black money: Govt to ban cash transactions of above Rs 3 lakh,Zee News,22 Aug 2016,http://zeenews.india.com/business/news/economy/black-money-govt-to-ban-cash-transactions-of-above-rs-3-lakh_1921285.html,Snippet not available
Fawad Khan  Rahat Fateh Ali Khan's BLACK MONEY SCAM ...,Bollywood Life,15 Nov 2016,http://www.bollywoodlife.com/news-gossip/fawad-khan-rahat-fateh-ali-khans-black-money-scam-exposed-through-a-sting-operation/,Snippet not available
Income tax department uncovers Rs 13000 crore in black money ...,Daily News & Analysis,26 Jun 2016,http://www.dnaindia.com/money/report-income-tax-department-uncovers-rs-13000-crore-in-black-money-from-overseas-disclosures-2228527,Snippet not available
PM: Don't return Jan Dhan black money,Chandigarh Tribune,3 Dec 2016,http://www.tribuneindia.com/news/nation/pm-don-t-return-jan-dhan-black-money/332188.html,Snippet not available
Demonetisation: Primer of corruption  black money  but much more ...,Financial Express,1 Dec 2016,http://www.financialexpress.com/opinion/demonetisation-primer-of-corruption-black-money-but-much-more-has-to-be-done/461906/,Snippet not available
Don't return money deposited illegally in your Jan Dhan account: PM ...,Business Standard,3 Dec 2016,http://www.business-standard.com/article/economy-policy/do-not-return-money-deposited-illegally-in-your-jan-dhan-account-says-modi-116120300523_1.html,Snippet not available
Cover Story: Bye Bye Black Money,Tehelka,22 Nov 2016,http://www.tehelka.com/2016/11/bye-bye-black-money/,Snippet not available
Black money hunt: Taxation Law Second Amendment Bill is last ...,Firstpost,29 Nov 2016,http://www.firstpost.com/business/pm-modis-black-money-hunt-taxation-law-second-amendment-bill-is-last-chance-for-evaders-to-come-clean-3128694.html,Snippet not available
Black money: Political slugfest between Naidu and Jagan reaches ...,The New Indian Express,13 Oct 2016,http://www.newindianexpress.com/states/andhra-pradesh/2016/oct/14/black-money-political-slugfest-between-naidu-and-jagan-reaches-modis-doorstep-1527786.html,Snippet not available
Lok Sabha passes bill to tax black money post-demonetisation,YourStory.com,29 Nov 2016,https://yourstory.com/2016/11/lok-sabha-passes-bill-tax-black-money-post-demonetisation/,Snippet not available
