Cauvery dispute: Karnataka protests as Jaya hails 'great victory',Firstpost,21 Feb 2013,http://www.firstpost.com/india/cauvery-dispute-karnataka-protests-as-jaya-hails-great-victory-633971.html,Meanwhile  Singh says that only a fraction of the actual black money is stored in cash form (rest in land  gold  foreign exchange  etc) by the guilty. And these ...
Another headache for banks: Bad loans to surge as RBI tightens ...,Firstpost,30 May 2013,http://www.firstpost.com/business/829685-829685.html,Weeks after the government startled all with the demonetisation move  black money continues to be the biggest talking point in the country. However  much of ...
CMAT merit list - quality goes down as exam gets tougher,Firstpost,23 Oct 2013,http://www.firstpost.com/business/cmat-merit-list-quality-goes-down-as-exam-gets-tougher-1189697.html,New Delhi: The main reason given by the government for demonetising high denomination notes was to curb black money. Various estimates have been made ...
Anna Hazare leads largest India Day parade in New York,Firstpost,18 Aug 2013,http://www.firstpost.com/india/anna-hazare-leads-largest-india-day-parade-in-new-york-1042891.html,Weeks after the government startled all with the demonetisation move  black money continues to be the biggest talking point in the country. However  much of ...
Uttarakhand floods: Brave  committed ITBP men win accolades,Firstpost,27 Jun 2013,http://www.firstpost.com/india/uttarakhand-floods-brave-committed-itbp-men-win-accolades-910073.html,The fresh disclosure comes close on the heels of an Ahmedabad-based businessman  who had declared black money of over Rs 13 000 crore in September ...
How slush money creeps into banks,Hindu Business Line,19 Mar 2013,http://www.thehindubusinessline.com/opinion/how-slush-money-creeps-into-banks/article4526323.ece,The banks charged with providing conversion routes for black money have gone into damage control mode and acted along expected lines — suspending a few ...
With economy crawling  Indian companies set sights on US ...,Firstpost,8 Jul 2013,http://www.firstpost.com/business/with-economy-at-its-slowest-pace-indian-companies-set-sights-on-us-investments-940495.html,New York: With the Indian economy growing at its slowest pace in a decade  Indian companies in search of growth are considering stepped-up investment in the ...
Zee News Special: Donation in engg college admissions order of ...,Daily News & Analysis,22 Sep 2013,http://www.dnaindia.com/india/report-zee-news-special-donation-in-engg-college-admissions-order-of-the-day-shows-zee-news-sting-operation-1892738,Meanwhile  when informed about black money collected under the pretext of donation  officials from UP government and income tax department assured stricter ...
Real estate vs. stock market: Where to invest?,NDTV,22 May 2013,http://profit.ndtv.com/news/your-money/article-real-estate-vs-stock-market-where-to-invest-322526,In real estate market  the component of black money is higher and also the demand for it  which is why transparency in such transactions is lower. Therefore  it is ...
Indian remedies  private sorrows – Narayan's The Vendor of Sweets,The Hindu,5 Oct 2013,http://www.thehindu.com/books/books-authors/indian-remedies-private-sorrows-narayans-the-vendor-of-sweets/article5204213.ece,In popular parlance: black money. ““Money is an evil ” he added with great feeling” (87). And “he could no more help it than he could the weeds flourishing in his ...
Ajit Jogi to take year-long break from electoral politics,Firstpost,27 Dec 2013,http://www.firstpost.com/politics/ajit-jogi-to-take-year-long-break-from-electoral-politics-1310417.html,"Claiming that this move is aimed at curbing corruption and putting an end to black money is election jumla by the prime minister. The decision to demonetise ...
No MBBS degree  but hoping to teach medicine in Bihar,Firstpost,30 Nov 2013,http://www.firstpost.com/india/no-mbbs-degree-but-hoping-to-teach-medicine-in-bihar-1259239.html,The fresh disclosure comes close on the heels of an Ahmedabad-based businessman  who had declared black money of over Rs 13 000 crore in September ...
India defeat Pakistan to win 4th successive Kabaddi World Cup,Firstpost,15 Dec 2013,http://www.firstpost.com/sports/india-defeat-pakistan-to-win-4th-successive-kabaddi-world-cup-1288773.html,India beat Pakistan 48-39 to emerge champions of the fourth World Cup Kabaddi played at the Guru Nanak Stadium here on Saturday night. Defending ...
Modi effect: NRIs postpone holiday to volunteer for BJP poll campaign,Firstpost,18 Oct 2013,http://www.firstpost.com/politics/modi-effect-nris-postpone-holiday-to-volunteer-for-bjp-poll-campaign-1179967.html,"Claiming that this move is aimed at curbing corruption and putting an end to black money is election jumla by the prime minister. The decision to demonetise ...
Move over Jet-Etihad  Air India to get Star Alliance edge,Firstpost,13 Dec 2013,http://www.firstpost.com/business/move-over-jet-etihad-air-india-to-get-star-alliance-edge-1286251.html,New Delhi: The main reason given by the government for demonetising high denomination notes was to curb black money. Various estimates have been made ...
Indian Army's first woman jawan found dead in railway hospital,Firstpost,15 May 2013,http://www.firstpost.com/india/indian-armys-first-woman-jawan-found-dead-in-railway-hospital-783051.html,Meanwhile  Singh says that only a fraction of the actual black money is stored in cash form (rest in land  gold  foreign exchange  etc) by the guilty. And these ...
Takeaway from Chhattisgarh polls: Raman Singh rules the roost,Firstpost,9 Dec 2013,http://www.firstpost.com/politics/takeaway-from-chhattisgarh-polls-raman-singh-rules-the-roost-1277275.html,According to the report  the details given like even the mobile number could not be verified  raising the suspicion it could be an attempt to launder black money.
ICICI  HDFC Bank  Axis flouted norms but no money laundering,Livemint,14 May 2013,http://www.livemint.com/Industry/FHBjlpFkD9hb0DkY3hTPiO/ICICI-HDFC-Bank-Axis-flouted-norms-but-no-money-laundering.html,It is  however  difficult to say to what extent this represented black money/unaccounted money.” The investigations also revealed that there was no KYC/AML ...
Hirco in deep trouble: Co defaults on 2 major township projects,Firstpost,18 Oct 2013,http://www.firstpost.com/business/hirco-in-deep-trouble-co-defaults-on-2-major-township-projects-1180143.html,Weeks after the government startled all with the demonetisation move  black money continues to be the biggest talking point in the country. However  much of ...
Pak PM Nawaz Sharif is a billionaire,Times of India,26 Dec 2013,http://timesofindia.indiatimes.com/world/pakistan/Pak-PM-Nawaz-Sharif-is-a-billionaire/articleshow/27989350.cms,ISLAMABAD: Pakistani Prime Minister Nawaz Sharif is among the few parliamentarians who are billionaires  revealed statements of assets and liabilities of ...
Fodder scam: SC grants bail to Lalu Prasad Yadav on grounds of ...,Firstpost,12 Dec 2013,http://www.firstpost.com/india/after-two-months-in-jail-sc-grants-bail-to-lalu-prasad-yadav-1285239.html,The Supreme Court today granted Rashtriya Janata Dal chief Lalu Prasad bail in connection with the fodder scam case in which he has been sentenced to five ...
Woman wants a bigger bust  so begs motorists for money to fund her ...,India Today,11 Aug 2013,http://indiatoday.intoday.in/story/woman-begs-for-funds-for-boobs-surgery-florida-christina-andrews/1/299125.html,Christina Andrews of Florida found a unique way of arranging money to enhance her breasts: a flashy pink placard that read 'Not Homeless Need Boobs'.
Sexual harassment and Vishakha guidelines: All you need to know,Firstpost,22 Nov 2013,http://www.firstpost.com/india/sexual-harassment-and-vishakha-guidelines-all-you-need-to-know-1241649.html,The victim of the alleged sexual assault by Tehelka's editor-in-chief Tarun Tejpal - who has now has stepped down from the editorship for a period of six months ...
Sexual assault victims be handled by female police officers: SC,Firstpost,25 Apr 2013,http://www.firstpost.com/india/sexual-assault-victims-be-handled-by-female-police-officers-sc-728691.html,Weeks after the government startled all with the demonetisation move  black money continues to be the biggest talking point in the country. However  much of ...
A festival of artistic melange,Livemint,22 Aug 2013,http://www.livemint.com/Leisure/rqbKyQ2UGLznGeZBOnAKqO/A-festival-of-artistic-melange.html,In the theatrical space  Stray Factory presents Osama  Cinema and a Whole Lot of Black Money  a collection of their award- winning short plays that have been ...
Army paid J&K politicians for events to promote harmony  not bribe ...,NDTV,24 Sep 2013,http://www.ndtv.com/india-news/army-paid-j-k-politicians-for-events-to-promote-harmony-not-bribe-says-general-vk-singh-535600,New Delhi: Former army chief VK Singh today sought to explain his controversial comment that the Army pays money to ministers in Jammu and Kashmir to ...
Himachal Pradesh High Court restrains Sahara Group from ...,Economic Times,26 Mar 2013,http://economictimes.indiatimes.com/news/politics-and-nation/himachal-pradesh-high-court-restrains-sahara-group-from-collecting-money/articleshow/19224908.cms,Snippet not available
Archaeological Survey of India begins excavation for gold treasure ...,Daily News & Analysis,19 Oct 2013,http://www.dnaindia.com/india/report-archaeological-survey-of-india-begins-excavation-for-gold-treasure-narendra-modi-takes-a-dig-1905332,Snippet not available
Film Review | Bullett Raja,Livemint,29 Nov 2013,http://www.livemint.com/Leisure/juLS1NodzoF6mEpP0JiJvN/Film-Review--Bullet-Raja.html,Snippet not available
Congress tom-tom made it easy for rebels,The Hindu,27 May 2013,http://www.thehindu.com/news/national/congress-tomtom-made-it-easy-for-rebels/article4757005.ece,Snippet not available
