Tainted Lilavati trustee gets 30-day relief from charity commissioner,Daily News & Analysis,14 Apr 2013,http://www.dnaindia.com/mumbai/report-tainted-lilavati-trustee-gets-30-day-relief-from-charity-commissioner-1822494,"Prabodh and his brother Rashmi are featured on the 'Liechtenstein Bank' black money trail list handed over by the German government to the Indian authority.
RBI fines 22 banks Rs50 crore in Cobrapost sting probe,Daily News & Analysis,15 Jul 2013,http://www.dnaindia.com/money/report-rbi-fines-22-banks-rs50-crore-in-cobrapost-sting-probe-1861619,The State Bank of India along with 21 state-owned and private banks  including a foreign one  were fined between Rs50 lakh and Rs3 crore (totalling Rs49.5 ...
BJP will nationalise overseas bank accounts of resident indians to ...,The Hindu,21 Sep 2013,http://www.thehindu.com/news/national/bjp-will-nationalise-bank-accounts-of-nris-to-check-hawala-transactions-swamy/article5154691.ece?homepage=true,... would be to issue an ordinance to nationalise all bank accounts of Indian citizens in 70 countries that permit secret banking of hawala-converted black money.
No business  like God business: India's godmen find spirituality to be ...,Daily News & Analysis,15 Sep 2013,http://www.dnaindia.com/lifestyle/report-no-business-like-god-business-india-s-godmen-find-spirituality-to-be-profitable-1888934,Besides crusading against corruption and black money  he runs a 100-bed hospital  an Ayurveda college  a university  a real estate business and a mini ...
Bank money laundering scandal widens as investigative website ...,India Today,5 Apr 2013,http://indiatoday.intoday.in/story/money-laundering-cobrapost-releases-fresh-tapes-leading-commercial-banks-india-today/1/260941.html,The senior bank officials offer detailed methods to customers who wanted to turn their ill-gotten black money into white  non-taxable income. The banks go to the ...
Aircel Ties Up With ICICI Bank & Visa To Launch A Mobile Money ...,MediaNama.com,5 Feb 2013,http://www.medianama.com/2013/02/223-aircel-ties-up-with-icici-bank-visa-to-launch-a-mobile-money-service/,Telecom operator Aircel has partnered with ICICI Bank and the global payments company Visa to launch (pdf) a mobile banking service called Mobile Money  ...
LIC hikes stake in Axis Bank despite Cobrapost sting,Business Line,19 Mar 2013,http://www.thehindubusinessline.com/markets/lic-hikes-stake-in-axis-bankdespite-cobrapost-sting/article4525893.ece,“The bank branches use 'benami' (fictitious names or in relatives/ friends/ associates names) to facilitate the conversion of black money. They also use the ...
Income tax raids on Amrapali group for tax evasion,Times of India,8 Aug 2013,http://timesofindia.indiatimes.com/business/india-business/Income-tax-raids-on-Amrapali-group-for-tax-evasion/articleshow/21719404.cms,Sources said the I-T department was tipped off about the group having allegedly circulated black money through various means and in turn evaded taxes to the ...
India's Aadhaar a step to ensure financial inclusion: FATF,Livemint,27 Feb 2013,http://www.livemint.com/Politics/DIivJs6nw4PYC5gIvzqpMN/Indias-Aadhaar-a-step-to-ensure-financial-inclusion-FATF.html,India became a full-member of the FATF in 2010  at a time when the country was witnessing an increased concern to address the issues of black money and ...
Sting operations  bad loans hit all from SBI to Yes Bank,Business Standard,21 Dec 2013,http://www.business-standard.com/article/finance/sting-operations-bad-loans-hit-all-from-sbi-to-yes-bank-113122200210_1.html,The portal alleged the financial entities offered to open bank accounts and lockers without following Know Your Customer (KYC) norms  convert black money ...
Banks pump back counterfeit notes to skirt trouble,The Hindu,12 Feb 2013,http://www.thehindu.com/news/cities/Kochi/banks-pump-back-counterfeit-notes-to-skirt-trouble/article4408396.ece,More fake currency is flooding into the wallets of common man in Kochi every day. Counterfeiters are targeting people who can carry small sums and spend it in ...
Jewellers meet to discuss effects of money laundering in retail sector,Times of India,14 Mar 2013,http://timesofindia.indiatimes.com/city/surat/Jewellers-meet-to-discuss-effects-of-money-laundering-in-retail-sector/articleshow/18976965.cms,SURAT: Hundreds of jewellers from the south Gujarat region including Surat  Navsari  Bharuch  Kosamba and Valsad participated in a meeting organised by the ...
Reserve money up 10 per cent at Rs. 15.65 lakh crore: RBI,NDTV,17 Oct 2013,http://profit.ndtv.com/news/economy/article-reserve-money-up-10-per-cent-at-rs-15-65-lakh-crore-rbi-369751,Mumbai: The Reserve Bank of India (RBI) said on Thursday the reserve money for the week ended October 11 stood at Rs. 15.65 lakh crore  posting a ...
5 easy steps to check PF balance online in less than 5 minutes,Firstpost,6 Sep 2013,http://www.firstpost.com/investing/5-easy-steps-to-check-pf-balance-online-in-less-than-5-minutes-1090331.html,EPFO today launched a facility to enable its over 5 crore subscribers view their updated accounts online on real time basis without waiting for their annual PF ...
Full text of the complaint against Indian diplomat Devyani Khobragade,The Hindu,19 Dec 2013,http://www.thehindu.com/news/resources/full-text-of-the-complaint-against-indian-diplomat-devyani-khobragade/article5482146.ece,This is a straight case of false affidavits  black money and human trafficking. It has become a casual practice in India where every transaction whether buying a ...
Sub Inspector held  two cops on the run after extorting money from ...,NDTV,7 Nov 2013,http://www.ndtv.com/delhi-news/delhi-sub-inspector-held-two-cops-on-the-run-after-extorting-money-from-trader-540300,New Delhi: A Delhi Police sub-inspector was arrested while a head constable and a constable were on the run after a case of extortion was registered against ...
No place to hide,The Hindu,4 Jun 2013,http://www.thehindu.com/opinion/editorial/no-place-to-hide/article4782031.ece,The BJP  which has threatened to make repatriation of black money an election issue  refused to entertain ADR's RTI application seeking details of its wealth ...
Malabar Gold: From Rs50 lakh to Rs22 000 crore in just 20 years!,Moneylife,29 Nov 2013,http://www.moneylife.in/article/malabar-gold-from-rs50-lakh-to-rs22000-crore-in-just-20-years/35475.html,GOLD SMUGGLING AS WELL AS BLACK MONEY CONTRIBUTED TO ITS GROWTH.CAN THE TERRORIST GROUPS HAVE A HAND INITS GROWTH?
Mastercard Partners Beam Money To Launch Mobile Wallet Prepaid ...,MediaNama.com,28 Feb 2013,http://www.medianama.com/2013/02/223-mastercard-beam-money-prepaid-cards/,Beam logo Mobile payments platform  Beam Money  has partnered with MasterCard Worldwide to launch a prepaid card that will allow Beam's mobile wallet ...
Mauritius says its banking rules don't allow money laundering,NDTV,17 May 2013,http://profit.ndtv.com/news/economy/article-mauritius-says-its-banking-rules-dont-allow-money-laundering-322349,Dismissing the perception of Mauritius being a route for round-tripping and laundering of black money to and from India  the country's banking industry body ...
Will India ever mount an operation to capture Dawood Ibrahim?,Firstpost,29 Jul 2013,http://www.firstpost.com/india/will-india-ever-mount-an-operation-to-capture-dawood-ibrahim-993529.html,Ten years ago on a balmy  sunny day in Karachi  my father asked me to accompany him to a great seth's house. People in Karachi sometimes gather at houses ...
End round-tripping,Business Standard,18 Jul 2013,http://www.business-standard.com/article/opinion/end-round-tripping-113071801058_1.html,However  offshore financial centres  such as Mauritius  argue that India should intercept black money when it exits the country in the first place  since targeting ...
Disproportionate assets case: Enforcement Directorate attaches ...,India Today,7 Jan 2013,http://indiatoday.intoday.in/story/jagan-mohan-reddy-disproportionate-assets-case-enforcement-directorate/1/241278.html,The properties attached are from Ms Ramky Pharma City (India) Limited and Jagati Publications Private Limited  both held by YSR Congress chief Jagan Mohan ...
Why more money always means more happiness,Daily News & Analysis,10 May 2013,http://www.dnaindia.com/analysis/column-why-more-money-always-means-more-happiness-1833125,Papa Hemingway's retort to F Scott Fitzgerald was inadequate. Recent research shows that not only do the rich have more money  they actually have more ...
Sania Mirza and Cara Black win China Open title,Daily News & Analysis,5 Oct 2013,http://www.dnaindia.com/sport/report-sania-mirza-and-cara-black-win-china-open-title-1898970,Sania Mirza and her Zimbabwean partner Cara Black eased past Vera Dushevina and Arantxa Parra Santonja to win the women's doubles title at the China ...
Tax on purchase of immovable property,Livemint,29 May 2013,http://www.livemint.com/Money/Thui7higebdns5nJdM8EKK/Tax-on-purchase-of-immovable-property.html,These provisions seem to have been enacted to curb the menace of black money in property transactions. However  the sweeping manner of the provisions ...
Trailer of Turkish film copied from Bhansali's 'Black'?,Times of India,13 Sep 2013,http://timesofindia.indiatimes.com/entertainment/hindi/bollywood/news/Sanjay-Leela-Bhansali-Black-Amitabh-Bachchan-Rani-Mukerji-Benim-Dunyam/articleshow/22572933.cms,... 10 people most affected by Modi's anti-black money campaignCRITICSUNION ... India · People elected me to eliminate black money: PM ModiTimes of India.
Debt ceiling absurdity: How the US Fed is running a ponzi scheme,Firstpost,18 Oct 2013,http://www.firstpost.com/business/economy/debt-ceiling-absurdity-how-the-us-fed-is-running-a-ponzi-scheme-1177519.html,It was widely expected that the Democrats and the Republicans will finally strike a deal and extend the debt ceiling of the government of the United States(US).
How a black hole is formed,Daily News & Analysis,4 May 2013,http://www.dnaindia.com/scitech/report-how-a-black-hole-is-formed-1830622,TRENDING# · Mamata Banerjee · War on Black Money · demonetization · Indian Army · Narendra Modi · Home · Sci/Tech ...
Inheritance Tax: Time to scrap the thought,Moneycontrol.com,29 Jan 2013,http://www.moneycontrol.com/news/tax-columns/inheritance-tax-time-to-scrapthought_814563.html,Hence  if the Government wants that indulgence of the tax payers in the black money activities and transactions is done away with  then surely no thought ever ...
Here's how banks  insurers help clients launder black money,Moneycontrol.com,5 May 2013,http://www.moneycontrol.com/news/market-edge/heres-how-banks-insurers-help-clients-launder-black-money_865239.html,Snippet not available
23 banks  institutional firms accused of money laundering by ...,Economic Times,6 May 2013,http://articles.economictimes.indiatimes.com/2013-05-06/news/39065370_1_cobrapost-operation-red-spider-secretary-rajiv-takru,Snippet not available
Black money outflow from India at Rs. 21 lakh crore in last decade ...,NDTV,12 Dec 2013,http://profit.ndtv.com/news/economy/article-black-money-outflow-from-india-at-rs-21-lakh-crore-in-last-decade-study-374704,Snippet not available
Everything you need to know about money laundering,Firstpost,14 Mar 2013,http://www.firstpost.com/investing/five-things-you-need-to-know-about-money-laundering-660628.html,Snippet not available
Sting operation 'exposes' three banks,The Hindu,14 Mar 2013,http://www.thehindu.com/news/national/sting-operation-exposes-three-banks/article4509004.ece,Snippet not available
India has addressed shortfalls in its black money fight: FATF,Indian Express,25 Jun 2013,http://archive.indianexpress.com/news/india-has-addressed-shortfalls-in-its-black-money-fight-fatf/1134036/,Snippet not available
India probing 1704 money laundering  terror funding cases,Hindu Business Line,26 Jun 2013,http://www.thehindubusinessline.com/economy/india-probing-1704-money-laundering-terror-funding-cases/article4852444.ece,Snippet not available
CEIB detects Rs 3000 crore of black money in H1 of 2013,indiatvnews.com,26 Nov 2013,http://www.indiatvnews.com/business/india/latest-news-black-money-india-ceib-8992.html,Snippet not available
End of banking secrecy in Switzerland,The Hindu,15 Oct 2013,http://www.thehindu.com/news/international/world/end-of-banking-secrecy-in-switzerland/article5237870.ece,Snippet not available
RBI Governor for corrective steps to prevent money laundering,Economic Times,22 Mar 2013,http://economictimes.indiatimes.com/news/economy/policy/rbi-governor-for-corrective-steps-to-prevent-money-laundering/articleshow/19131716.cms,Snippet not available
Pakistan money in Swiss banks higher than India's: Switzerland data,Times of India,21 Jun 2013,http://timesofindia.indiatimes.com/india/Pakistan-money-in-Swiss-banks-higher-than-Indias-Switzerland-data/articleshow/20699190.cms,Snippet not available
Mumbai's money mountain on wheels,Calcutta Telegraph,2 Jul 2013,http://www.telegraphindia.com/1130703/jsp/nation/story_17075513.jsp,Snippet not available
Swiss Banks not happy with FDI limit in India being raised,Firstpost (satire),17 Jul 2013,http://www.fakingnews.firstpost.com/business/swiss-banks-not-happy-with-fdi-limit-in-india-being-raised-3278,Snippet not available
Cobrapost sting: Only gun was pointed. Nobody got shot,Livemint,7 May 2013,http://www.livemint.com/Money/BzSgx9kQUAOX3wMJiJK6nL/Cobrapost-sting-Only-gun-was-pointed-Nobody-got-shot.html,Snippet not available
Don't need to dig for gold if we get black money back: Narendra Modi,NDTV,18 Oct 2013,http://www.ndtv.com/india-news/dont-need-to-dig-for-gold-if-we-get-black-money-back-narendra-modi-538135,Snippet not available
Sexual assault case: Asaram Bapu to miss deadline for questioning ...,NDTV,29 Aug 2013,http://www.ndtv.com/india-news/sexual-assault-case-asaram-bapu-to-miss-deadline-for-questioning-lawyer-cites-relatives-death-533082,Snippet not available
EC notice to Munde over poll expenses claims,The Hindu,29 Jun 2013,http://www.thehindu.com/news/national/ec-notice-to-munde-over-poll-expenses-claims/article4863807.ece,Snippet not available
Who is a politically exposed Indian?,Livemint,14 Jul 2013,http://www.livemint.com/Opinion/vaMh1PUshuYKxj7GD9kHYO/Who-is-a-politically-exposed-Indian.html,Snippet not available
Govt enforces KYC norms on retail purchase of gold,Moneycontrol.com,13 Mar 2013,http://www.moneycontrol.com/news/cnbc-tv18-comments/govt-enforces-kyc-normsretail-purchasegold_837876.html,Snippet not available
Political parties to come under Right to Information Act,NDTV,3 Jun 2013,http://www.ndtv.com/cheat-sheet/political-parties-to-come-under-right-to-information-act-524176,Snippet not available
