I have no use for money: Bill Gates,NDTV,19 Jan 2013,http://www.ndtv.com/world-news/i-have-no-use-for-money-bill-gates-510820,London: William Henry 'Bill' Gates with an estimated wealth of $65 billion is as rich as two Kenyas  three Trinidads and a dozen Montenegros but is now ...
Black pepper - more health benefits than you know!,Daily News & Analysis,7 Aug 2013,http://www.dnaindia.com/health/report-black-pepper-more-health-benefits-than-you-know-1871235,We use it to spice up our omelette  or add that extra zing to Indian dishes  but did you know that humble black pepper can add a lot more to your food than just ...
Vinod Kambli files FIR against foreign lady for racist 'Black Indian ...,India Today,24 Oct 2013,http://indiatoday.intoday.in/story/kambli-files-fir-against-foreign-lady-for-racist-comment/1/320108.html,Former Indian cricketer Vinod Kambli has filed a complaint against a foreign lady for making a racist comment against him over a car parking dispute in the ...
A railway racket worth many 2G scams! Touts block tatkal and VIP ...,India Today,14 May 2013,http://indiatoday.intoday.in/story/railway-tickets-touts-tatkal-vip-quota-tickets-triple-price/1/271130.html,A Mail Today investigation unearths how touts get confirmed tickets with the help of officials sitting at the counters  of which over half the earnings is pocketed by ...
IT dept conducts raids on Amrapali group for tax evasion,Zee News,9 Aug 2013,http://zeenews.india.com/business/realestate/latest-news/i-t-dept-conducts-raids-on-amrapali-group-for-tax-evasion_81681.html,New Delhi: The income tax department has conducted raids on a leading real estate firm Amrapali Group for suspected tax evasions and black money ...
Sahara: Beginning of the endgame?,Livemint,24 Mar 2013,http://www.livemint.com/Companies/Fnba0gdvT8oUa3kLZzXmnL/Sahara-Beginning-of-the-endgame.html,Is Sahara a vehicle for laundering black money into white? “In 34 years  we have not given any unsecured loan to anybody. Not even to our directors. We give a ...
26/11 attack not our fault  disappointed with UK court: Taj Hotels ...,Firstpost,19 Dec 2013,http://www.firstpost.com/india/2611-attack-not-our-fault-disappointed-with-uk-court-taj-hotels-owner-1297993.html,Meanwhile  Singh says that only a fraction of the actual black money is stored in cash form (rest in land  gold  foreign exchange  etc) by the guilty. And these ...
Tom Daley says it 'shouldn't matter' if he's dating older Dustin Lance ...,Daily News & Analysis,5 Dec 2013,http://www.dnaindia.com/entertainment/report-tom-daley-says-it-shouldn-t-matter-if-he-s-dating-older-dustin-lance-black-1929887,British diver Tom Daley recently took to Twitter to hit back over claims that he's in a relationship with Oscar-winning screenwriter Dustin Lance Black  who is 20 ...
dna exclusive: Key Narendra Modi aide under IT scanner; ED may ...,Daily News & Analysis,1 Nov 2013,http://www.dnaindia.com/india/report-dna-exclusive-key-narendra-modi-aide-under-it-scanner-ed-may-follow-up-on-fema-violation-1912623,After Narendra Modi's right hand man Amit Shah  another close confidante of the BJP prime ministerial candidate has come under the scanner of a central ...
SC clears Rs 140 crore spruce-up near Taj Mahal,Firstpost,15 Jul 2013,http://www.firstpost.com/india/sc-clears-rs-140-crore-spruce-up-near-taj-mahal-958417.html,Meanwhile  Singh says that only a fraction of the actual black money is stored in cash form (rest in land  gold  foreign exchange  etc) by the guilty. And these ...
State funding of parties can help end political corruption,Economic Times,30 Nov 2013,http://timesofindia.indiatimes.com/india/State-funding-of-parties-can-help-end-political-corruption/articleshow/26607718.cms,I have always opposed it because white money is not our problem but black money. How state funding will drive out black money used for illegal activities like ...
Diamond trader buys Cadbury House in Mumbai for Rs 350 crore,Firstpost,19 Nov 2013,http://www.firstpost.com/business/diamond-trader-buys-cadbury-house-in-mumbai-for-rs-350-crore-1239461.html,The boast harked back to Modi's election vow to recover black money from abroad that had resonated with voters fed up with the corruption scandals that ...
Misuse of red beacons and sirens on govt cars a 'menace to society ...,Firstpost,5 Aug 2013,http://www.firstpost.com/india/misuse-of-red-beacons-and-sirens-on-govt-cars-a-menace-to-society-sc-1011771.html,Meanwhile  Singh says that only a fraction of the actual black money is stored in cash form (rest in land  gold  foreign exchange  etc) by the guilty. And these ...
Beam Money Launches Wallet App For iPhone,MediaNama.com,10 Jan 2013,http://www.medianama.com/2013/01/223-beam-money-launches-wallet-app-for-iphone/,Mobile payments platform  Beam Money  has launched a mobile wallet app for the iPhone  called Beam Wallet. The app will allow iPhone users to use the Beam ...
BSP leader shot dead in Azamgarh  UP,Firstpost,19 Jul 2013,http://www.firstpost.com/india/bsp-leader-shot-dead-in-azamgarh-up-969391.html,Meanwhile  Singh says that only a fraction of the actual black money is stored in cash form (rest in land  gold  foreign exchange  etc) by the guilty. And these ...
Gold hunt in UP: Is the money BJP spending on your branding black ...,India Today,20 Oct 2013,http://indiatoday.intoday.in/story/angry-over-his-remarks-swami-shobhan-sarkar-hits-back-modi-in-an-open-letter/1/317129.html,The letter also slammed Modi and NDA for its failure on several issues  ranging from the Bofors scandal  black money and unemployment in the country.
Wipro plans to hire 500 IT professionals in Kolkata,Firstpost,5 Dec 2013,http://www.firstpost.com/business/wipro-plans-to-hire-500-it-professionals-in-kolkata-1270391.html,Weeks after the government startled all with the demonetisation move  black money continues to be the biggest talking point in the country. However  much of ...
Narendra Modi as PM will "drag" Dawood Ibrahim to India  says Shiv ...,Times of India,17 Aug 2013,http://articles.economictimes.indiatimes.com/2013-08-17/news/41420874_1_narendra-modi-l-k-advani-saamana,"He will stuff all the black money in Swiss banks in a cargo plane and bring it back to India. The poor and farmers will be happy and lead a debt-free life " ...
Bihar govt did not alert us about large congregation: Rail minister,Firstpost,20 Aug 2013,http://www.firstpost.com/india/bihar-govt-did-not-alert-us-about-large-congregation-rail-minister-1046577.html,Meanwhile  Singh says that only a fraction of the actual black money is stored in cash form (rest in land  gold  foreign exchange  etc) by the guilty. And these ...
Bharat Bandh: Daily life in Kerala hit as workers stay absent,Firstpost,19 Feb 2013,http://www.firstpost.com/india/bharat-bandh-daily-life-in-kerala-hit-as-workers-stay-absent-632181.html,Weeks after the government startled all with the demonetisation move  black money continues to be the biggest talking point in the country. However  much of ...
Ishrat encounter: Javed Sheikh's wife's statement included in CBI ...,Firstpost,14 Jul 2013,http://www.firstpost.com/india/ishrat-encounter-javed-sheikhs-wifes-statement-included-in-cbi-report-954317.html,Meanwhile  Singh says that only a fraction of the actual black money is stored in cash form (rest in land  gold  foreign exchange  etc) by the guilty. And these ...
EPL wrap: Man City and Liverpool's sharp-shooters hit their straps,Firstpost,16 Dec 2013,http://www.firstpost.com/sports/epl-wrap-man-city-and-liverpools-sharp-shooters-hit-their-straps-1288527.html,“It's a bad day and we lost our discipline completely in the last 20 minutes. Out of the six goals  we gave them five.” Manchester City don't need presents when ...
Victim or villain? 'Gold king' Kothari's rags to riches story turns sour,Firstpost,24 Jul 2013,http://www.firstpost.com/business/victim-or-villain-gold-king-kotharis-rags-to-riches-story-turns-sour-982377.html,Gold has been partly a shady business  at least in India. As is widely known  it has lots of entry points for black money to flow in. But if somebody with sharp ...
8 interesting facts about black holes,Daily News & Analysis,16 Aug 2013,http://www.dnaindia.com/scitech/report-8-interesting-facts-about-black-holes-1875217,We keep hearing about these strange and mysterious objects in space called black holes  but have you ever thought what they actually are? Do they exist in ...
WB govt shuts down MPS office in Kolkata; Another chit fund scam in ...,Firstpost,5 May 2013,http://www.firstpost.com/business/wb-govt-shuts-down-mps-office-in-kolkata-another-saradha-in-making-752875.html,The boast harked back to Modi's election vow to recover black money from abroad that had resonated with voters fed up with the corruption scandals that ...
Agra angry over Azam Khan's Taj Mahal statement,Firstpost,28 Jan 2013,http://www.firstpost.com/india/agra-angry-over-azam-khans-taj-mahal-statement-605818.html,Meanwhile  Singh says that only a fraction of the actual black money is stored in cash form (rest in land  gold  foreign exchange  etc) by the guilty. And these ...
Got a call to donate money? Beware!,Daily News & Analysis,21 Apr 2013,http://www.dnaindia.com/ahmedabad/report-got-a-call-to-donate-money-beware-1825475,Have you ever got a call  asking you to donate money for any renowned non-governmental organisation (NGO). Beware! This could be another cheating attempt ...
Newsmaker: Asha Gupta first Indian to lead Tupperware in Asia-Pac,Firstpost,1 Dec 2013,http://www.firstpost.com/business/newsmaker-asha-gupta-first-indian-to-lead-tupperware-in-asia-pac-1261505.html,Weeks after the government startled all with the demonetisation move  black money continues to be the biggest talking point in the country. However  much of ...
Parle see 10% market share growth with Tom & Jerry biscuits,Firstpost,1 Dec 2013,http://www.firstpost.com/business/parle-see-10-market-share-growth-with-tom-jerry-biscuits-1260213.html,The boast harked back to Modi's election vow to recover black money from abroad that had resonated with voters fed up with the corruption scandals that ...
PFRDA chief Yogesh Agarwal steps down after FinMin orders,Firstpost,13 Nov 2013,http://www.firstpost.com/business/pfrda-chief-yogesh-agarwal-steps-down-after-finmin-orders-1228701.html,Weeks after the government startled all with the demonetisation move  black money continues to be the biggest talking point in the country. However  much of ...
Cobrapost: AP minister caught in sting operation,Business Standard,6 May 2013,http://www.business-standard.com/article/current-affairs/cobrapost-ap-minister-caught-in-sting-operation-113050700012_1.html,According to the conversation transcription that runs along the video posted on the Cobrapost website  the deal is to accept Rs 25 crore black money and ...
India's hockey players need to develop mental toughness: Balbir ...,Firstpost,17 Dec 2013,http://www.firstpost.com/sports/indias-hockey-players-need-to-develop-mental-toughness-balbir-singh-sr-1291675.html,New Delhi: Disappointed with the state of Indian hockey right now  three-time Olympic gold-medallist and former captain Balbir Singh (Sr) feels among the ...
Arindam Chaudhuri is the Subrata Roy of the MBA business,Firstpost,16 Feb 2013,http://www.firstpost.com/business/why-arindam-chaudhuri-is-the-subrata-roy-of-the-mba-business-627789.html,One of my bigger regrets in life is that I spent two years doing a post-graduate diploma in management (or what is better known as an MBA). Around 16-17 ...
Is India under threat of a real estate bubble burst?,Firstpost,28 Nov 2013,http://www.firstpost.com/business/economy/is-india-under-threat-of-real-estate-bubble-burst-1255249.html,Add to this the black money and unofficial lending that happen. The exposure just gets bigger. However  the economy will not collapse because of a deep ...
Indiabulls Real Estate buys back PE investor's stake in 7 projects,Firstpost,18 Aug 2013,http://www.firstpost.com/business/indiabulls-real-estate-buys-back-pe-investors-stake-in-7-projects-1042951.html,Weeks after the government startled all with the demonetisation move  black money continues to be the biggest talking point in the country. However  much of ...
Akhil K. Gupta | For love or for money,Livemint,28 Jun 2013,http://www.livemint.com/Leisure/FrvVtecJym5qrwg0NTi2UM/Akhil-K-Gupta--For-love-or-for-money.html,PM Narendra Modi had on 8 November said the demonetisation move would help curb black money Is government winning the black money fight?
Navy commissions MiG-29 K's Black Panther squadron,India Today,11 May 2013,http://indiatoday.intoday.in/story/navy-commissions-mig-29-ks-black-panther-squadron/1/270533.html,The aircraft is armed with its arsenal of weapons including advanced anti-aircraft and anti-ship missiles  precision bombs and sophisticated system to support ...
ED unearths Rs. 1000-crore hawala racket,The Hindu,24 Sep 2013,http://www.thehindu.com/news/national/ed-unearths-rs-1000crore-hawala-racket/article5164818.ece,... the operators would allegedly receive money in Indian currency from exporters  who raised bogus or inflated invoices  to convert their black money into white.
Tripura CPM leader sleeps on bundles of cash,Times of India,18 Oct 2013,http://timesofindia.indiatimes.com/india/Tripura-CPM-leader-sleeps-on-bundles-of-cash-party-in-a-spot/articleshow/24354274.cms,On the other hand  state PCC working president Asish Kumar Saha alleged that it is a clear case to prove how much black money is in the hands of CPM leaders ...
Country risk rating for money laundering: Key parameters,Moneylife,18 Sep 2013,http://www.moneylife.in/article/country-risk-rating-for-money-laundering-key-parameters/34507.html,A lot of black money gets generated because of corruption prevailing at different level of activities  which gets laundered. While corruption results in generation ...
Swiss bank ATM in parliament compound! No wonder they are happy,Daily News & Analysis,16 May 2013,http://www.dnaindia.com/analysis/column-swiss-bank-atm-in-parliament-compound-no-wonder-they-are-happy-1835816,The idea  Gandhi junior is believed to have told the meeting  was to accomplish the twin goals of boosting FDI and putting idle black money to some good use.
Trinamool controversy after 'vulgar' function  leaders throw money at ...,NDTV,1 Jan 2013,http://www.ndtv.com/india-news/trinamool-controversy-after-vulgar-function-leaders-throw-money-at-dancers-509136,Kolkata: At a function organized near Kolkata to celebrate the 15th anniversary of the Trinamool Congress  dancers performed on stage while a man  reportedly ...
Investing through SIPs? Well  there's a downside to it,Firstpost,30 Apr 2013,http://www.firstpost.com/investing/investing-through-sips-well-theres-a-downside-to-it-741283.html,When in doubt  SIP. This is the advice often given to novice investors who may not be sure when is the right time to buy a share or mutual fund or even an ...
Dawood aide joins NGO to cleanse his image?,Daily News & Analysis,24 Oct 2013,http://www.dnaindia.com/mumbai/report-dawood-aide-joins-ngo-to-cleanse-his-image-1908472,“This not only helps to portray a good image  but also helps in running illegal businesses and to convert black money into white ” a source said. Imran Fazal. Info.
Chhattisgarh naxal attack: Why political corruption is also to blame,Firstpost,26 May 2013,http://www.firstpost.com/india/chhattisgarh-naxal-attack-why-political-corruption-is-also-to-blame-815813.html,In 2010  when I was in Sukma to report on the massacre of 76 security personnel  I asked a senior IPS officer if it is true that the Maoists run a parallel ...
Bhai Thakur throws biggest  fattest Virar wedding,Daily News & Analysis,28 Dec 2013,http://www.dnaindia.com/mumbai/report-bhai-thakur-throws-biggest-fattest-virar-wedding-1942086,We've heard of rolling out the red carpet  but a makeshift helipad to welcome VIPs for a wedding? Vasai-Virar strongman Jaynendra Thakur alias Bhai Thakur ...
For financial inclusion  try black magic,Hindu Business Line,21 Nov 2013,http://www.thehindubusinessline.com/opinion/columns/s-murlidharan/for-financial-inclusion-try-black-magic/article5376265.ece,Important as this is — it cuts out black money deals  saves paper and time  and is relatively foolproof — the RBI has the more difficult task of first getting people ...
Residential may be a mess but Mumbai office space better on low ...,Firstpost,27 Nov 2013,http://www.firstpost.com/business/residential-may-be-a-mess-but-mumbai-office-space-better-on-low-rentals-1251185.html,The boast harked back to Modi's election vow to recover black money from abroad that had resonated with voters fed up with the corruption scandals that ...
There's always a fear that I can lose everything: Amitabh Bachchan,Firstpost,12 Dec 2013,http://www.firstpost.com/business/theres-always-a-fear-that-i-can-lose-everything-amitabh-bachchan-1284987.html,Weeks after the government startled all with the demonetisation move  black money continues to be the biggest talking point in the country. However  much of ...
Govt takes first step to control 'flipping' in real estate market,Firstpost,3 Mar 2013,http://www.firstpost.com/business/economy/govt-takes-first-step-to-control-flipping-in-real-estate-market-646052.html,TDS aims to make property transactions more transparent as it increases property sale records and helps curb the black money component to some extent.
Uttarakhand floods: Locals blame relocation of deity  power project,Firstpost,27 Jun 2013,http://www.firstpost.com/india/uttarakhand-floods-locals-blame-relocation-of-deity-power-project-909819.html,Meanwhile  Singh says that only a fraction of the actual black money is stored in cash form (rest in land  gold  foreign exchange  etc) by the guilty. And these ...
Fishermen rescue whale shark pup off Gujarat coast,Firstpost,7 May 2013,http://www.firstpost.com/india/fishermen-rescue-whale-shark-pup-off-gujarat-coast-757217.html,Weeks after the government startled all with the demonetisation move  black money continues to be the biggest talking point in the country. However  much of ...
Insight: Pakistan's booming market no black and white matter,Reuters India,10 Apr 2013,http://in.reuters.com/article/pakistan-stockmarket-idINDEE9380FL20130410,At least some of that performance came on the back of a government amnesty that allowed people holding undeclared assets or "black money" to invest it freely ...
Forget captaincy  here's why Virat Kohli the batsman is so deadly,Firstpost,7 Jul 2013,http://www.firstpost.com/sports/super-stats-forget-captaincy-heres-why-virat-kohli-the-batsman-is-so-deadly-935225.html,After suffering a humiliating defeat by 161 runs against Sri Lanka in the previous game  India made a strong comeback by registering a huge 102-run win over ...
Rs 2960 cr assets: 2 Rajasthan candidates richer than 400 others ...,Firstpost,16 Nov 2013,http://www.firstpost.com/politics/rs-2960-cr-assets-2-rajasthan-candidates-richer-than-400-others-combined-1231797.html,Jaipur: Can guar gum fetch votes? Maybe not  but the produce has become a political talking point in the northern part of Rajasthan. That's because a ...
Finance Ministry to mail 'polite letters' to service tax defaulters,Economic Times,26 May 2013,http://articles.economictimes.indiatimes.com/2013-05-26/news/39538288_1_financial-transaction-letters-defaulters,... defaulters will get "polite letters" seeking information about their pending liability and any suspicious dealings carried out by them possibly with black money.
Time to bank on money-market funds,Business Standard,12 Dec 2013,http://www.business-standard.com/article/pf/time-to-bank-on-money-market-funds-113121200691_1.html,Liquid funds could prove to be a stable fixed-income asset class if the interest rates are raised again. With inflation still on the higher side — consumer price ...
Airport metro: Reliance Infra wants DMRC to shell out termination ...,Firstpost,30 Jun 2013,http://www.firstpost.com/business/airport-metro-reliance-infra-wants-dmrc-to-shell-out-termination-payment-918181.html,Weeks after the government startled all with the demonetisation move  black money continues to be the biggest talking point in the country. However  much of ...
Why Chautala is in jail: All you need to know about JBT scam,Firstpost,17 Jan 2013,http://www.firstpost.com/politics/why-chautala-is-in-jail-all-you-need-to-know-about-jbt-scam-590338.html,Former Haryana Chief Minister Om Prakash Chautala  his MLA son Ajay  and three other officials were today sentenced to ten years in prison by a special CBI ...
SC asks Centre  J&K for answers on attacks on foreign prisoners,Firstpost,16 Jul 2013,http://www.firstpost.com/india/attacks-on-foreign-prisoners-have-international-ramifications-sc-to-centre-jk-960329.html,The fresh disclosure comes close on the heels of an Ahmedabad-based businessman  who had declared black money of over Rs 13 000 crore in September ...
Forget debit cards  use cash: PIN mandate is not as safe as you think,Firstpost,4 Dec 2013,http://www.firstpost.com/investing/forget-debit-cards-use-cash-pin-mandate-is-not-as-safe-as-you-think-1266363.html,British scientist and writer CP Snow once said  "Technology ....is a queer thing. It brings you great gifts with one hand  and it stabs you in the back with the other.
The Undertaker's former manager Paul Bearer dies,Firstpost,6 Mar 2013,http://www.firstpost.com/sports/the-undertakers-former-manager-paul-bearer-dies-651378.html,The professional wrestling community on Wednesday mourned the death of William Moody  a real-life undertaker who gained fame as a wrestling manager with ...
3 arrested for selling tickets of Sachin Tendulkar's 200th match in ...,Daily News & Analysis,14 Nov 2013,http://www.dnaindia.com/sport/report-3-arrested-for-selling-tickets-of-sachin-tendulkar-s-200th-match-in-black-outside-wankhede-1918767,A day before Sachin Tendulkar's 200th test match in Wankhede  three persons connected with prominent sporting clubs in Mumbai were arrested from outside ...
CAG officer held with bribe money,Times of India,11 Feb 2013,http://timesofindia.indiatimes.com/city/goa/CAG-officer-held-with-bribe-money/articleshow/18458192.cms,PANAJI: Assistant audit officer of the Mumbai office of the Comptroller and Auditor General (CAG) of India  Sandeep Chadha  was arrested by Central Bureau of ...
Rs 3000cr lost as tax rebates to NGOs  trusts: CAG,Times of India,22 Sep 2013,http://timesofindia.indiatimes.com/india/Rs-3000cr-lost-as-tax-rebates-to-NGOs-trusts-CAG/articleshow/22903053.cms,NEW DELHI: The government has given away more than Rs 3 000 crore by way of tax exemptions to some non-deserving big charitable organizations and trusts ...
Decoding the missing link in millionaire mystery,Calcutta Telegraph,17 Mar 2013,http://www.telegraphindia.com/1130318/jsp/business/story_16685634.jsp,The biggest generator and recipient of black money is the realty sector  say taxmen. Most housing projects are sold at at least double the reported price.
Tendulkar will come out a little nervous: Shastri,Firstpost,17 Feb 2013,http://www.firstpost.com/sports/tendulkar-will-come-out-a-little-nervous-shastri-628774.html,Former India cricket skipper Ravi Shastri is backing senior batsman Sachin Tendulkar to come good in the upcoming four-match Test series against Australia  ...
Explainer: RBI paves way for foreign banks but may find few takers,Firstpost,7 Nov 2013,http://www.firstpost.com/business/explainer-rbi-paves-way-for-foreign-banks-but-may-find-few-takers-1218163.html,India's move to encourage foreign banks such as Citigroup and HSBC Holdings to reposition as wholly-owned subsidiaries may find just a handful of takers  ...
Let Arjun live life of a normal 14-year-old: Sachin Tendulkar,Firstpost,9 Sep 2013,http://www.firstpost.com/sports/let-arjun-live-life-of-a-normal-14-year-old-sachin-tendulkar-1095039.html,Playing the role of a protective father  senior India batsman Sachin Tendulkar on asked the media to leave his "cricket mad" son Arjun alone and allow him to ...
Relief for Mayawati's brother  IT dept releases seized money,India Today,7 Nov 2013,http://indiatoday.intoday.in/story/mayawati-mayawati-brother-income-tax-mayawati-brother-income-tax/1/322001.html,The money  Rs 400 crore  was seized by the Income Tax department after it found that two people were acting as fronts for Anand Kumar  Mayawati's brother  ...
Fans of Dhulia  Saif  weep: Bullett Raja is a disaster,Firstpost,29 Nov 2013,http://www.firstpost.com/bollywood/fans-of-dhulia-saif-weep-bullett-raja-is-a-disaster-1257333.html,It highlights the fact that while people are hopeful about the decision as a solution to the black money plague  demonetisation might not be India's cup of tea for ...
EcoSport is biggest test for Ford India MD Joginder Singh,Firstpost,26 Jun 2013,http://www.firstpost.com/business/ecosport-is-biggest-test-for-ford-india-md-joginder-singh-907639.html,Weeks after the government startled all with the demonetisation move  black money continues to be the biggest talking point in the country. However  much of ...
How the ISI helped plan the 26/11 attacks in Mumbai,Firstpost,19 Nov 2013,http://www.firstpost.com/india/how-the-isi-helped-plan-the-2611-attacks-in-mumbai-1238585.html,Meanwhile  Singh says that only a fraction of the actual black money is stored in cash form (rest in land  gold  foreign exchange  etc) by the guilty. And these ...
Onion prices: Will Congress's tears of pain be BJP's tears of joy?,Firstpost,14 Aug 2013,http://www.firstpost.com/politics/deja-vu-why-onion-prices-remind-us-of-bjps-defeat-in-1998-1032943.html,The fresh disclosure comes close on the heels of an Ahmedabad-based businessman  who had declared black money of over Rs 13 000 crore in September ...
