Black money list: 10 developments since Modi govt took charge,Hindustan Times,30 Oct 2014,http://www.hindustantimes.com/business/black-money-list-10-developments-since-modi-govt-took-charge/story-yi2kK0pNzRsz3kQdz1osgJ.html,Signalling his government's resolve to bring back the country's black money stashed abroad  PM Modi's first decision in the maiden meeting of his cabinet was to ...
Efforts to bring black money on right track: Modi,The Hindu,2 Nov 2014,http://www.thehindu.com/news/national/narendra-modi-in-radio-show-efforts-to-bring-back-black-money-on-right-track/article6557419.ece,With grocers and cold storage owners refusing to accept scrapped currency notes  farmers are struggling to get potato seeds while landless labourers are forced ...
Black money debate: Oppn slams govt in House,Hindustan Times,26 Nov 2014,http://www.hindustantimes.com/india/black-money-debate-oppn-slams-govt-in-house/story-WmXgUvSt4JSEYrASddHK3I.html,The government and the opposition indulged in accusing and counter-accusing one another over the issue of black money during a debate in both houses of ...
How much black money do Indians have abroad?,Hindustan Times,28 Oct 2014,http://www.hindustantimes.com/business/how-much-black-money-do-indians-have-abroad/story-oNEf43CZRUf36LjCDU1q6K.html,The central government has disclosed to the Supreme Court the names of three business people who have allegedly stashed black money abroad. Former ...
Black money: Switzerland to amend law to aid foreign govts,Times of India,23 Jun 2014,http://timesofindia.indiatimes.com/india/Black-money-Switzerland-to-amend-law-to-aid-foreign-govts/articleshow/37095961.cms,This comes at a time when a renewed debate is underway in India about efforts to act against those alleged to have stashed black money in Swiss banks.
SIT formed to unearth black money – Narendra Modi Cabinet's first ...,Times of India,27 May 2014,http://timesofindia.indiatimes.com/india/SIT-formed-to-unearth-black-money-Narendra-Modi-Cabinets-first-decision/articleshow/35636667.cms,The black money refers to the money that is earned and transferred illegally abroad in tax havens like Cayman Islands and Mauritius  generally to avoid tax.
False promises? BJP's response on black money is even worse than ...,Firstpost,28 Oct 2014,http://www.firstpost.com/india/false-promises-bjps-response-on-black-money-is-even-worse-than-upas-1776309.html,One party that made the biggest political capital out of the much fabled black money issue in India is the BJP when in 2009  the then PM-aspirant LK Advani ...
Black money: Disclosure of names will embarrass Congress  Arun ...,Times of India,21 Oct 2014,http://timesofindia.indiatimes.com/india/Black-money-Disclosure-of-names-will-embarrass-Congress-Arun-Jaitley-says/articleshow/44899883.cms,NEW DELHI: On the back foot on black-money issue  finance minister Arun Jaitley on Tuesday hit back at Congress saying the party will be embarrassed once ...
India third on black money list: report,The Hindu,15 Dec 2014,http://www.thehindu.com/news/india-third-on-black-money-list-report/article6696491.ece,As India continues its pursuit of suspected black money stashed abroad  an international think-tank has ranked the country third globally with an estimated USD ...
Black money case: Can't disclose names of foreign account holders ...,Times of India,16 Oct 2014,http://timesofindia.indiatimes.com/india/Black-money-case-Cant-disclose-names-of-foreign-account-holders-Modi-govt-tells-SC/articleshow/44846119.cms,Petitioner and senior advocate Ram Jethmalani said this is an attempt by Narendra Modi government to shield those who stashed black money abroad.
Modi govt toes UPA line on black money disclosure  faces ...,Times of India,17 Oct 2014,http://timesofindia.indiatimes.com/india/Modi-govt-toes-UPA-line-on-black-money-disclosure-faces-opposition-fire/articleshow/44860897.cms,NEW DELHI: The Narendra Modi government  which promised to bring back black money stashed by Indians in foreign banks  on Friday toed the line of UPA ...
India's 'Black Money' -- The Short Answer,Wall Street Journal (India) (blog),30 Oct 2014,http://blogs.wsj.com/briefly/2014/10/31/indias-black-money/,Indian media this week has been abuzz with the term “black money”  but what exactly is it? On Wednesday  the Indian government gave the Supreme Court a list ...
Baba 'Black Money' Ramdev caught on tape talking money with BJP ...,Daily News & Analysis,17 Apr 2014,http://www.dnaindia.com/india/report-baba-black-money-ramdev-caught-on-tape-talking-money-with-bjp-candidate-but-what-was-he-hiding-from-media-1979403,Baba Ramdev  an avid supporter of Narendra Modi  has been one of most vocal campaigners against black money in the past two years. He  along with the BJP  ...
Black money case: SC tells Centre to form SIT within a week,Times of India,22 May 2014,http://timesofindia.indiatimes.com/india/Black-money-case-SC-tells-Centre-to-form-SIT-within-a-week/articleshow/35505548.cms,NEW DELHI: The Supreme Court on Friday gave the Centre a week's time to notify a Special Investigation Team to probe black money stashed in foreign banks ...
Rs 4479-cr in Indians' HSBC-list accounts: SIT on black money,The Indian Express,12 Dec 2014,http://indianexpress.com/article/india/india-others/rs-4479-cr-in-indians-hsbc-list-accounts-sit-on-black-money/,In case of suspected black money abroad  the disclosure relates to a list of 628 Indians  who figured on a list of account holders in HSBC's Geneva branch that ...
Black money SIT meets  charts out roadmap,Indian Express,2 Jun 2014,http://indianexpress.com/article/business/banking-and-finance/black-money-sit-meets-charts-out-roadmap/,Black money SIT meets  charts out roadmap. The meeting was attended by former Supreme Court Judge Arijit Pasayat as its vice chairman and top officials of 11 ...
Black money: SIT submits reports to SC,The Hindu,20 Aug 2014,http://www.thehindu.com/news/national/black-money-sit-submits-reports-to-supreme-court/article6335412.ece,The Bench in a brief order said “the first report of the SIT on black money is taken on record. Insofar as the request made by Mr. Jethmalani in the letters written to ...
Black money case: SC asks Centre to complete probe by March,Times of India,3 Dec 2014,http://timesofindia.indiatimes.com/india/Black-money-case-SC-asks-Centre-to-complete-probe-by-March/articleshow/45362752.cms,NEW DELHI: The Supreme Court today asked the Centre to ensure that the ongoing income tax probe for suspected black money concerning 627 Indians who ...
A dark  bustling business: How India's black money racket runs,Hindustan Times,30 Jun 2014,http://www.hindustantimes.com/india/a-dark-bustling-business-how-india-s-black-money-racket-runs/story-wtSBDanUcm7gsXKdTCYhgJ.html,Prime Minister Narendra Modi is moving fast to repatriate hundreds of billions of dollars in slush funds or black money stashed abroad  as part of a wider ...
Black money: Won't entertain your 'fishing expedition'  Switzerland ...,Firstpost,7 Dec 2014,http://www.firstpost.com/india/black-money-wont-entertain-fishing-expedition-switzerland-tells-india-1838133.html,Mumbai: As India continues its pursuit of black money allegedly stashed abroad  Switzerland has said it would not entertain any 'fishing expedition' and ...
Jail term  severe penalties for guilty in black money in the works: SIT,Indian Express,31 Oct 2014,http://indianexpress.com/article/business/economy/jail-term-severe-penalties-for-guilty-in-black-money-in-the-works-sit/,SIT probing foreign accounts of Indians parking black money is considering severe punishments for taxpayers found guilty of stashing illegal money abroad.
Bring back black money… it will bring aam aadmi's tax burden down ...,Indian Express,26 Mar 2014,http://indianexpress.com/article/india/india-others/sc-rejects-centres-plea-opposing-sit-on-black-money/,Bring back black money… it will bring aam aadmi's tax burden down 30%: Angry SC. Supreme Court lashed out at the UPA government for its 'inaction' in ...
Govt goes on front foot over black-money case,Times of India,3 Nov 2014,http://timesofindia.indiatimes.com/india/Govt-goes-on-front-foot-over-black-money-case/articleshow/45016858.cms,NEW DELHI: The government on Sunday went on an offensive on the black-money issue with Prime Minister Narendra Modi stating that the government would ...
Black money probe: Swiss banks mull anticipatory measures,Indian Express,2 Nov 2014,http://indianexpress.com/article/business/economy/black-money-probe-swiss-banks-mull-anticipatory-meaures/,As probe into suspected black money stashed abroad by Indians gathers steam  banks in Switzerland are running from pillar to post to safeguard their interest ...
Two big Swiss banks have two-thirds of all money of Indians,The Hindu,20 Jun 2014,http://www.thehindu.com/business/Economy/two-big-swiss-banks-have-twothirds-of-all-money-of-indians/article6133667.ece,India has also constituted a >Special Investigation Team (SIT) to probe cases of alleged black money of Indians  including funds stashed abroad in places like ...
For Black Money  Look in India  Not Switzerland,NDTV,7 Jul 2014,http://www.ndtv.com/opinion/for-black-money-look-in-india-not-switzerland-584612,The BJP has made a big issue of bringing back black money stashed by Indians abroad. But a comprehensive study on India's parallel economy  running into ...
Kisan Vikas Patras could be a big hit with black money buffs,Firstpost,18 Nov 2014,http://www.firstpost.com/business/money/kisan-vikas-patras-could-be-a-big-hit-with-black-money-buffs-1996679.html,It was precisely this feature of the scheme in its earlier avatar that caused the UPA to wind it up in 2011. It was being used for laundering black money.
Make tax evasion serious crime for black money information: SIT chief,The Indian Express,14 Dec 2014,http://indianexpress.com/article/india/india-others/make-tax-evasion-serious-crime-for-black-money-info-sit-chief/,While adding more teeth to India's pursuit of black money kept abroad  this would also check generation of unaccounted wealth within the country  the SIT ...
Names of people under black money probe to be made public after ...,Indian Express,17 Oct 2014,http://indianexpress.com/article/india/india-others/names-of-people-under-black-money-probe-to-be-made-public-after-chargesheet-arun-jaitley/,After the NDA government on Friday urged the Supreme Court to modify its order in the black money case on absolute disclosure of information pertaining to ...
Not possible to get black money from abroad in our lifetime  BJP MP ...,Times of India,24 Jul 2014,http://timesofindia.indiatimes.com/india/Not-possible-to-get-black-money-from-abroad-in-our-lifetime-BJP-MP-says/articleshow/38984685.cms,Dubey  MP from Godda in Jharkhand  the first member from the Treasury benches to speak on the issue  said  "We will not be able to bring back black money ...
No list  no breakthrough: Black money in Swiss banks not coming ...,Firstpost,6 Jul 2014,http://www.firstpost.com/india/no-list-no-breakthrough-black-money-in-swiss-banks-not-coming-back-yet-1605611.html,"It isn't a list of only black money  it is a list of those persons who are also legally vested. It is a combined list. We are asking for the list of the said persons.
Black money: Jethmalani slams govt stand in Supreme Court,Indian Express,24 Oct 2014,http://indianexpress.com/article/india/india-others/black-money-jethmalani-slams-govt-stand-in-sc/,Black money: Jethmalani slams govt stand in Supreme Court. Jethmalani had strongly objected to the stand taken by the Centre and said the matter be not ...
Effective steps being taken to bring back black money: Ravishankar,The Hindu,3 Nov 2014,http://www.thehindu.com/news/national/effective-steps-being-taken-to-bring-back-black-money-ravishankar-prasad/article6560641.ece,Slamming the Congress for “doing nothing” on the black money issue  Union Law minister Ravishankar Prasad on Monday said effective steps were being taken ...
Construction companies ready to accept illicit black money: Report,Times of India,26 Nov 2014,http://timesofindia.indiatimes.com/city/delhi/Construction-companies-ready-to-accept-illicit-black-money-Report/articleshow/45294178.cms,The 35 real estate companies caught on tape have pan-India presence across nine states willing to do bulk transactions in black money. These companies ...
Black money list: 5 facts on Rajkot-based bullion trader  Pankaj ...,Firstpost,27 Oct 2014,http://www.firstpost.com/business/corporate-business/black-money-list-5-facts-on-rajkot-based-bullion-trader-pankaj-chimanlal-lodhiya-1994743.html,After much dithering  the government has finally named three Swiss bankaccount holdersin the Supreme Court. According to the affidavit submitted by the ...
Eight Names From Black Money List Given To Supreme Court,NDTV,27 Oct 2014,http://www.ndtv.com/india-news/eight-names-from-black-money-list-given-to-supreme-court-684896,New Delhi: Days after Finance Minister Arun Jaitley spoke to NDTV about a revelation that would "embarrass the Congress"  the government named eight ...
Study on the quantum of Black money yet to be completed,The Hindu,19 Jun 2014,http://www.thehindu.com/business/Economy/study-on-the-quantum-of-black-money-yet-to-be-completed/article6126506.ece,Members of Youth of India  taking part in a candlelight march  in protest against the corruption  black money at Jantar Mantar in New Delhi. A file photo: Shiv ...
SIT on black money to study Syndicate Bank case,Times of India,10 Aug 2014,http://timesofindia.indiatimes.com/india/SIT-on-black-money-to-study-Syndicate-Bank-case/articleshow/40026339.cms,NEW DELHI: The alleged bribery case involving Syndicate Bank chief SK Jain may come up for discussion in the meeting of the special investigation team on ...
Black money: CBI wants officers posted in some Indian missions ...,Firstpost,2 Nov 2014,http://www.firstpost.com/india/black-money-cbi-wants-officers-posted-in-some-indian-missions-abroad-1783827.html,In view of the action plan  the SIT had asked various probe agencies to submit their views on expediting cases where allegations of black money having been ...
Black economy now amounts to 75% of GDP,The Hindu,3 Aug 2014,http://www.thehindu.com/news/national/black-economy-now-amounts-to-75-of-gdp/article6278286.ece,Since there were no “reliable” estimates of black money generated in India and held within and outside the country  the UPA government commissioned the ...
NDA govt hits out at Congress for inaction on black money issue,Firstpost,2 Sep 2014,http://www.firstpost.com/politics/nda-govt-hits-congress-inaction-black-money-issue-1694107.html,New Delhi: The ruling NDA today hit out at the previous UPA regime saying it had failed to set up an SIT on black money despite a Supreme Court direction for ...
'Float scheme to get back $2 trillion of black money stashed abroad',Economic Times,20 Jun 2014,http://economictimes.indiatimes.com/news/economy/finance/float-scheme-to-get-back-2-trillion-of-black-money-stashed-abroad/articleshow/36894906.cms,NEW DELHI: Claiming that about $ 2 trillion worth of black money from India is stashed abroad  industry body Assocham today said the government should float ...
Mulayam Singh Yadav attacks Modi government on black money issue,Indian Express,25 Nov 2014,http://indianexpress.com/article/india/india-others/mulayam-singh-yadav-attacks-modi-government-on-black-money-issue/,Yadav said the UPA government had at least given an approximate figure of black money  "but this (NDA) government is not giving that figure also." ...
Return of black money an Indian fairy tale,Livemint,25 Jun 2014,http://www.livemint.com/Opinion/V7haK56c7DiGW6SAxbG38O/Return-of-black-money-an-Indian-fairy-tale.html,Even if one assumes that the government could recover such a large stash of cash from Swiss banks  the proceeds would be considered a national asset and go ...
Black money reports yet to be accepted  says Finance Ministry,Indian Express,19 Oct 2014,http://indianexpress.com/article/india/india-others/black-money-study-reports-yet-to-be-accepted-finance-ministry/,The Finance Ministry is yet to accept two of the three reports submitted to it on the assessment of black money in India and abroad which were commissioned by ...
BJP Committed to Bringing Back Black Money: Rajnath Singh,NDTV,17 Nov 2014,http://www.ndtv.com/india-news/bjp-committed-to-bringing-back-black-money-rajnath-singh-699070,Palamu: Asserting that it was taking forward its promise to bring back black money stashed abroad  ruling BJP on Monday said that Prime Minister Narendra ...
Black money: Preneet Kaur  ex-UPA minister  figures among 627 ...,Times of India,31 Oct 2014,http://timesofindia.indiatimes.com/india/Black-money-Preneet-Kaur-ex-UPA-minister-figures-among-627-names-submitted-to-SC/articleshow/44999956.cms,Details of Kaur's account can escalate Congress's fight with BJP over black money. The run-up to Lok Sabha polls saw BJP attacking the UPA government for ...
SIT on black money decides to solve tax treaties' secrecy puzzle,Indian Express,8 Jun 2014,http://indianexpress.com/article/india/india-others/black-money-sit-decides-to-solve-tax-treaties-secrecy-puzzle/,Tasked with the job of recovering illicit wealth stashed away by Indians  the SIT on black money has decided to look into the contentious issue of secrecy clauses ...
Black money menace: Swiss exchanging 'lawful' information with India,Economic Times,8 Mar 2014,http://economictimes.indiatimes.com/news/economy/finance/black-money-menace-swiss-exchanging-lawful-information-with-india/articleshow/31724545.cms,NEW DELHI: With India stepping up its pursuit of alleged black money in Swiss banks  Switzerland says it is exchanging information with Indian authorities on all ...
Four Congress Names Being Investigated for Black Money in ...,NDTV,27 Oct 2014,http://www.ndtv.com/india-news/four-congress-names-being-investigated-for-black-money-in-switzerland-sources-684682,New Delhi: Among the Indians who are being investigated for allegedly funneling untaxed or black money to illicit bank accounts in Switzerland are four from the ...
Parliament Live: Government prepared for discussion on black ...,Daily News & Analysis,24 Nov 2014,http://www.dnaindia.com/india/report-parliament-live-government-prepared-for-discussion-on-black-money-issue-bjp-2038280,Facing opposition flak on the issue of black money  BJP on Tuesday sought to wriggle out of the situation by saying that it was ready for a discussion on it.
Shutting the black money window,Indian Express,30 Jun 2014,http://indianexpress.com/article/business/economy/shutting-the-black-money-window/,Various reports and assessments made over the years estimate the black money amount at 20% or even at 100% of the GDP.
Rs 9300cr black money changes hands in medical seat sale every ...,Times of India,17 Dec 2014,http://timesofindia.indiatimes.com/india/Rs-9300cr-black-money-changes-hands-in-medical-seat-sale-every-year/articleshow/45556289.cms,NEW DELHI: The White Paper on Black Money in India  published in May 2012  estimated that deposits by Indians in all Swiss banks at the end of 2010 ...
BJP approach over black money reflects 'black mind' of its leaders ...,Indian Express,27 Oct 2014,http://indianexpress.com/article/india/politics/bjp-approach-over-black-money-reflects-black-mind-of-its-leaders-nitish-kumar/,“Kale dhan par BJP ka rukh unke kale maan ko dikhata hai (The approach of BJP on the issue of black money reflects black mind of its leaders) ” senior JD(U) ...
The elusive hunt for black money,The Hindu,10 Aug 2014,http://www.thehindu.com/business/Economy/the-elusive-hunt-for-black-money/article6299336.ece,The debate on black money is probably as old as our civilisation itself. Several working groups and committees have burnt the midnight oil trying to find a ...
Compare NDA and UPA stance on black money: Union Minister ...,Daily News & Analysis,4 Nov 2014,http://www.dnaindia.com/india/report-compare-nda-and-upa-stance-on-black-money-union-minister-radha-mohan-2032055,Union minister Radha Mohan Singh on Tuesday mentioned comparative efforts of Narendra Modi government and UPA rule on black money issue and ...
Can Modi Win The Battle With Black Money?,Wall Street Journal (India) (blog),29 May 2014,http://blogs.wsj.com/indiarealtime/2014/05/29/can-modi-win-the-battle-with-black-money/,“There's no magic wand to dig out the black money overnight ” he said. “Even if it takes years to track and get hold of all the black money  it's a good thing.”.
Black Money: RBI Takes Action Against Erring Urban Cooperative ...,NDTV,14 Sep 2014,http://profit.ndtv.com/news/economy/article-black-money-rbi-takes-action-against-rrring-urban-cooperative-banks-663966,New Delhi: Cracking down on money laundering  the Reserve Bank of India (RBI) has closed down six urban cooperative banks (UCBs) suspected of being ...
Rs 30000 crore stash in cooperative banks in Kerala,Deccan Chronicle,8 Dec 2014,http://www.deccanchronicle.com/141209/nation-current-affairs/article/rupees-30000-crore-stash-cooperative-banks-kerala,Kozhikode: Black money is stashed up not only in Swiss banks  but also in the cooperative banks in Kerala. In a shocking revelation  the Income Tax department ...
Explained: Foreign bank accounts & black money controversy,Indian Express,22 Oct 2014,http://indianexpress.com/article/india/india-others/explained-foreign-bank-accounts-black-money-controversy/,As government  Opposition trade charges over making public the list of people with foreign bank accounts  the black money controversy has returned. ANIL SASI ...
Black money conundrum,The Hindu,14 Dec 2014,http://www.thehindu.com/news/black-money-conundrum/article6691251.ece,This quality seems to be in short supply in India although it is the most needed even to understand any black money retrieval. Both UPA (in 2009) and NDA ...
Change laws  put cash curbs to check black money menace: SIT,The Indian Express,12 Dec 2014,http://indianexpress.com/article/india/india-others/change-laws-put-cash-curbs-to-check-black-money-menace-sit/,Change laws  put cash curbs to check black money menace: SIT. SIT said that making tax evasion of Rs 50 lakh or more a 'predicate offence' would allow ...
What Whistle-Blower Herve Falciani Told Indian Black Money ...,NDTV,18 Dec 2014,http://www.ndtv.com/india-news/what-whistle-blower-herve-falciani-told-indian-black-money-investigators-715092,Mr Falciani told NDTV today that he has proposed what he described as "a larger overhaul" of India's black money investigation. "Looking for names only leads ...
Black  the colour of illegal money,The Hindu,4 Aug 2014,http://www.thehindu.com/in-school/signpost/black-the-colour-of-illegal-money/article6280459.ece,A more popular method of dispensing with black money is to deposit them with banks in countries whose laws with regard to tax evasion aren't as strict as they ...
Black money: Enforcement Directorate summons miner Radha Timblo,Economic Times,5 Nov 2014,http://economictimes.indiatimes.com/news/politics-and-nation/black-money-enforcement-directorate-summons-miner-radha-timblo/articleshow/45049814.cms,PANAJI: The Enforcement Directorate has summoned Radha Timblo  former director of the mining firm Timblo Private Limited  in connection with a money ...
The BJP's Big Black Money Challenge,NDTV,20 Oct 2014,http://www.ndtv.com/opinion/the-bjps-big-black-money-challenge-682137,The eruption of popular outrage over the NDA government's refusal to name those Indian citizens who have stashed black money abroad is understandable: ...
Income Tax department keeps watch on use of black money in ...,Daily News & Analysis,18 Nov 2014,http://www.dnaindia.com/india/report-income-tax-department-keeps-watch-on-use-of-black-money-in-jharkhand-polls-2036270,The Income Tax Department is keeping a close watch on the use of black money in Jharkhand Assemnbly polls to be held from November 25 to December 20 ...
NGO grouping wants India to push for black money information ...,Business Standard,12 Nov 2014,http://www.business-standard.com/article/economy-policy/ngo-grouping-wants-india-to-push-for-black-money-information-sharing-114111300036_1.html,"Prime Minister Narendra Modi has made bringing black money home a national priority. Now  it's time for India to do the same on the global stage " the coalition ...
Prashant Bhushan for law to curb black money,The Hindu,23 Jun 2014,http://www.thehindu.com/news/national/prashant-bhushan-for-law-to-curb-black-money/article6142796.ece,“The primary reason why black money has such a stranglehold on our economy is because our system not only allows  but in fact encourages the siphoning out ...
Black Money: Switzerland Won't Share Information on Accounts ...,NDTV,22 Dec 2014,http://www.ndtv.com/india-news/black-money-switzerland-wont-share-information-on-accounts-before-may-2011-law-ministry-tells-pms-of-716346,The law ministry has advised that a UN Convention against Corruption cannot be invoked to extract information on those who have black money in Swiss bank ...
Black Money List: The Timblo Trail  from Hong Kong to Goa,NDTV,29 Oct 2014,http://www.ndtv.com/india-news/black-money-list-the-timblo-trail-from-hong-kong-to-goa-686447,Mumbai: The Timblo family  named by the government in Supreme Court in connection with untaxed or black money in foreign accounts  parked money illegally ...
6 things you should know before opening a Swiss bank account,Business Standard,28 Oct 2014,http://www.business-standard.com/article/economy-policy/black-money-6-things-you-should-know-before-opening-a-swiss-bank-account-114102900135_1.html,Pradeep Burman of Dabur  whose name appeared in the black money list has ... While black money is by and large only a tax evasion issue if one is able to ...
