Amid disruptions & uproar  Bill to tax deposits passed in Lok Sabha,The Hindu,29 Nov 2016,http://www.thehindu.com/news/national/Amid-disruptions-uproar-Bill-to-tax-deposits-passed-in-Lok-Sabha/article16720245.ece,Snippet not available
PM Narendra Modi Hits Multiple Targets With Strike Against Black ...,NDTV,9 Nov 2016,http://www.ndtv.com/india-news/pm-narendra-modi-hits-multiple-targets-with-strike-against-black-money-foreign-media-1623618,Snippet not available
Narendra Modi's second strike against black money,Livemint,10 Nov 2016,http://www.livemint.com/Opinion/cASC1ZDBZDnYZCOCr2MLaM/Narendra-Modis-second-strike-against-black-money.html,Snippet not available
8 steps of PM Modi's surgical strike against black money,India Today,8 Nov 2016,http://indiatoday.intoday.in/story/prime-minister-modi-surgical-strike-on-black-money-government-currency-revamp/1/805904.html,Snippet not available
Demonetisation has rattled those with black money & fake currency ...,Deccan Herald,11 Nov 2016,http://www.deccanherald.com/content/580517/demonetisation-has-rattled-black-money.html,Snippet not available
Move has rattled those having black money: Shah,The Hindu,11 Nov 2016,http://www.thehindu.com/news/national/demonetisation-move-bjp-presidents-press-conference-in-new-delhi/article9333751.ece?css=print,Snippet not available
Tax on black money: How the cookie will crumble,Hindu Business Line,19 Nov 2016,http://www.thehindubusinessline.com/portfolio/net-worth/tax-on-black-money/article9365564.ece,Snippet not available
Demonetisation a mammoth tragedy: Manmohan Singh,India Today,7 hours ago,http://indiatoday.intoday.in/story/manmohan-singh-demonetisation-congress-modi-government-black-money/1/830667.html,Snippet not available
Demonetisation a mammoth tragedy  brace for a tough period ...,Business Standard,6 hours ago,http://www.business-standard.com/article/economy-policy/demonetisation-a-mammoth-tragedy-brace-for-a-tough-period-manmohan-singh-116120900480_1.html,Snippet not available
Black money and political alienation,The Hindu,11 Nov 2016,http://www.thehindu.com/thread/politics-and-policy/article9333942.ece,Snippet not available
Why govt's demonetisation move may fail to win the war against ...,Hindustan Times,11 Nov 2016,http://www.hindustantimes.com/india-news/cash-has-only-6-share-in-black-money-seizures-reveals-income-tax-data/story-JfFuTiJYtxKwJQhz2ApxlL.html,Snippet not available
Black money recovery claim seems jumla for now: Congress,The Indian Express,12 Nov 2016,http://indianexpress.com/article/india/india-news-india/black-money-recovery-claim-seems-jumla-for-now-congress-4372318/,Snippet not available
Ban cash transactions of above Rs 3 lakh to curb black money: SIT,Times of India,14 Jul 2016,http://timesofindia.indiatimes.com/business/india-business/Ban-cash-transactions-of-above-Rs-3-lakh-to-curb-black-money-SIT/articleshow/53211002.cms,Snippet not available
Ban cash transactions above Rs3 lakh  says SIT on black money,Livemint,14 Jul 2016,http://www.livemint.com/Politics/nzCB1puCO2oVYNIfxdJ5bI/Ban-cash-transaction-above-Rs3-lakh-SIT-on-black-money.html,Snippet not available
Black money SIT for ban on cash deals over Rs 3 lakh  limiting cash ...,Firstpost,14 Jul 2016,http://www.firstpost.com/business/black-money-sit-for-ban-on-cash-transactions-over-rs-3-lakh-2894044.html,Snippet not available
Those trying to convert black money won't be spared: Shaktikanta Das,The New Indian Express,1 Dec 2016,http://www.newindianexpress.com/nation/2016/dec/02/those-trying-to-convert-black-money-wont-be-spared-shaktikanta-das-1544845.html,Snippet not available
Saamana criticises Modi's promise to reclaim black money,India Today,27 Jun 2016,http://indiatoday.intoday.in/story/shiv-sena-criticized-modis-promise-of-reclaiming-black-money/1/702418.html,Snippet not available
Questions in Parliament: No official estimate of black money  says ...,The Hindu,3 May 2016,http://www.thehindu.com/news/national/questions-in-parliament-may-3-2016/article8551727.ece,Snippet not available
ED pan-India searches to check black money,The New Indian Express,30 Nov 2016,http://www.newindianexpress.com/nation/2016/dec/01/ed-pan-india-searches-to-check-black-money-1544336.html,Snippet not available
Battling black money,Hindu Business Line,20 Nov 2016,http://www.thehindubusinessline.com/opinion/editorial/demonetisation-and-what-centre-must-do/article9367571.ece,Snippet not available
BJP hits back at Opposition  says black money supporters observing ...,Financial Express,7 Dec 2016,http://www.financialexpress.com/india-news/bjp-hits-back-at-opposition-says-black-money-supporters-observing-black-day/468230/,Snippet not available
Bold  solution in one stroke: Black money probe judge,The Indian Express,8 Nov 2016,http://indianexpress.com/article/business/economy/currency-ban-500-1000-notes-black-money-narendra-modi-solution-4365164/,Snippet not available
Black money: DRI probes illicit outflow of USD 505 billion,Business Standard,13 Mar 2016,http://www.business-standard.com/article/pti-stories/black-money-dri-probes-illicit-outflow-of-usd-505-billion-116031300244_1.html,Snippet not available
In search for black money  IT Dept raid Chandni Chowk  Pahar Ganj ...,Business Standard,17 Nov 2016,http://www.business-standard.com/article/economy-policy/in-search-for-black-money-it-dept-raid-chandni-chowk-pahar-ganj-cp-hauz-khas-116111701643_1.html,Snippet not available
Congress hails govt's decision to abolish Rs 500  1000 notes; 'Will ...,The Indian Express,8 Nov 2016,http://indianexpress.com/article/india/india-news-india/rs-500-1000-notes-demonetised-congress-black-money-modi-rbi/,Snippet not available
Maoists force elderly to convert black money in Jharkhand,Hindustan Times,15 Nov 2016,http://www.hindustantimes.com/india-news/maoists-force-elderly-to-convert-black-money-in-jharkhand/story-qmUfhWMAHyeRiDijV0gWJJ.html,Snippet not available
Demonetisation: IT department notices to charitable  religious ...,Times of India,16 Nov 2016,http://timesofindia.indiatimes.com/india/Demonetisation-I-T-department-notices-to-charitable-religious-organisations/articleshow/55463330.cms,Snippet not available
Black money: SC asks SIT to look into Bank of Baroda scam,Daily News & Analysis,26 Apr 2016,http://www.dnaindia.com/money/report-black-money-sc-asks-sit-to-look-into-bank-of-baroda-scam-2206458,Snippet not available
Don't miss black money deadline  warns Jaitley,Times of India,2 Aug 2016,http://timesofindia.indiatimes.com/india/Dont-miss-black-money-deadline-warns-Jaitley/articleshow/53514883.cms,Snippet not available
Gehlot: Curb system that generates black money,Times of India,10 Nov 2016,http://timesofindia.indiatimes.com/city/jaipur/Gehlot-Curb-system-that-generates-black-money/articleshow/55360933.cms,Snippet not available
Black money battle: Modi government is closing out all loopholes,Times of India (blog),19 Nov 2016,http://blogs.economictimes.indiatimes.com/taxable-talk/black-money-battle-modi-government-is-closing-out-all-loopholes/,Snippet not available
Focus should be on checking black money generation in Odisha,India Today,12 Sep 2016,http://indiatoday.intoday.in/story/focus-should-be-on-checking-black-money-generation-in-odisha/1/762983.html,Snippet not available
