Black money: Centre gets one more week to notify SIT,indiatvnews.com,23 May 2014,http://www.indiatvnews.com/news/india/black-money-centre-gets-one-more-week-to-notify-sit-37164.html,Snippet not available
Indians in HSBC list hold Rs. 4479 crore black money: Centre,The Hindu,12 Dec 2014,http://www.thehindu.com/news/national/black-money-probe-indians-in-hsbc-list-hold-rs-4479-crore-says-centre/article6686536.ece,Snippet not available
SIT on black money charts road map,The Hindu,2 Jun 2014,http://www.thehindu.com/news/national/sit-on-black-money-charts-road-map/article6075829.ece,Snippet not available
Black money: Will SIT be able to do what the ED could not?,Firstpost,2 Jun 2014,http://www.firstpost.com/politics/black-money-will-sit-be-able-to-do-what-the-ed-could-not-1553537.html,Snippet not available
Modi Government Catches a Break on Black Money Case,NDTV,20 Aug 2014,http://www.ndtv.com/india-news/modi-government-catches-a-break-on-black-money-case-650902,Snippet not available
Power equipment imports huge source of black money: SIT,Times of India,20 Aug 2014,http://timesofindia.indiatimes.com/india/Power-equipment-imports-huge-source-of-black-money-SIT/articleshow/40553402.cms,Snippet not available
Black money: Row over Solicitor General representing SIT in ...,India Today,3 Dec 2014,http://indiatoday.intoday.in/story/black-money-row-over-solicitor-general-ranjit-kumar-representing-sc-appointed-sit-in-supreme-court/1/405025.html,Snippet not available
Black money case: What petitioners want,Moneycontrol.com,3 Dec 2014,http://www.moneycontrol.com/news/cnbc-tv18-comments/black-money-case-what-petitioners-want_1244027.html,Snippet not available
Prosecute account holders by March 31: SC,The Hindu,3 Dec 2014,http://www.thehindu.com/news/national/black-money-supreme-court-tells-centre-to-ensure-it-probe-by-march/article6658655.ece,Snippet not available
Black Money: Swiss flag 'organized crime' link in India laundering trail,Deccan Chronicle,30 Jun 2014,http://www.deccanchronicle.com/140630/nation-current-affairs/article/black-money-swiss-flag-organized-crime-link-india-laundering,Snippet not available
Swiss money trail: From gold and diamond to stocks and bitcoins,Indian Express,29 Jun 2014,http://indianexpress.com/article/india/india-others/swiss-money-trail-from-gold-and-diamond-to-stocks-and-bitcoins/,Snippet not available
Black money menace: India makes fresh request to Swiss govt,India Today,29 Jun 2014,http://indiatoday.intoday.in/story/black-money-india-writes-to-switzerland-seeks-details-on-secret-accounts/1/369138.html,Snippet not available
Secrecy in the name of privacy,The Hindu,31 Oct 2014,http://www.thehindu.com/opinion/lead/lead-article-secrecy-in-the-name-of-privacy/article6553153.ece,Snippet not available
Black money: BJP singing same old lyrics of previous governments ...,Zee News,2 Nov 2014,http://zeenews.india.com/news/india/black-money-bjp-singing-same-old-lyrics-of-previous-governments-says-tmc_1492998.html,Snippet not available
Black money row: Issue of unauthorized disclosure of names in ...,Daily News & Analysis,2 Nov 2014,http://www.dnaindia.com/india/report-black-money-row-issue-of-unauthorized-disclosure-of-names-in-violation-of-tax-treaties-says-arun-jaitley-2031488,Snippet not available
Make tax evasion serious crime: SIT chief,The Hindu,14 Dec 2014,http://www.thehindu.com/news/national/black-money-probe-sit-wants-tax-evasion-made-a-criminal-offence/article6690879.ece,Snippet not available
NDA's approach on black money is doggedly persistent — not ...,Hindu Business Line,18 Oct 2014,http://www.thehindubusinessline.com/economy/ndas-approach-on-black-money-is-doggedly-persistent-not-adventurist-jaitley/article6514731.ece,Snippet not available
Black money can never be brought back  says BJP MP,India Today,24 Jul 2014,http://indiatoday.intoday.in/story/black-money-can-never-be-brought-back-bjp-mp-nishikant-dubey/1/373929.html,Snippet not available
We cannot bring back black money: BJP lawmaker,Deccan Chronicle,24 Jul 2014,http://www.deccanchronicle.com/140724/nation-current-affairs/article/we-cannot-bring-back-black-money-bjp-lawmaker,Snippet not available
Ram Jethmalani writes scathing letter to Arun Jaitley on black money,India Today,24 Oct 2014,http://indiatoday.intoday.in/story/ram-jethmalani-writes-scathing-letter-to-arun-jaitley-on-black-money-row/1/397396.html,Snippet not available
Black money: Ram Jethmalani tears into Modi govt; ex-Congress ...,Times of India,27 Oct 2014,http://timesofindia.indiatimes.com/india/Black-money-Ram-Jethmalani-tears-into-Modi-govt-ex-Congress-minister-denies-having-foreign-account/articleshow/44949905.cms,Snippet not available
Centre to name only those having 'prosecutable evidence': Arun ...,Indian Express,27 Oct 2014,http://indianexpress.com/article/india/india-others/centre-to-name-only-those-having-prosecutable-case-arun-jaitley-on-black-money/,Snippet not available
Black money study incomplete even after three years,Livemint,18 Jun 2014,http://www.livemint.com/Politics/LMqV4FrL6STOYc1YhzrWOI/Black-money-study-incomplete-even-after-three-years.html,Snippet not available
Mulayam Singh Yadav attacks PM Narendra Modi on black money ...,Daily News & Analysis,25 Nov 2014,http://www.dnaindia.com/india/report-mulayam-singh-yadav-attacks-pm-narendra-modi-on-black-money-issue-2038302,Snippet not available
India must lead in global war against black money: Think Tank,India.com,12 Nov 2014,http://www.india.com/news/india/india-must-lead-in-global-war-against-black-money-think-tank-192152/,Snippet not available
Black money case: SIT probing nine cases referred by CBI; PACL ...,Daily News & Analysis,4 Nov 2014,http://www.dnaindia.com/india/report-black-money-case-sit-probing-nine-cases-referred-by-cbi-pacl-ponzi-schemesbhel-defence-deals-beml-under-scanner-2032129,Snippet not available
Narendra Modi keeping his enemies close to him by alloting them ...,Economic Times,29 May 2014,http://articles.economictimes.indiatimes.com/2014-05-29/news/50182453_1_narendra-modi-day-modi-black-money,Snippet not available
