Seized offshore black money will be spent on welfare of poor  Amit ...,indiatvnews.com,24 Oct 2015,http://www.indiatvnews.com/politics/national/amit-shah-in-aap-ki-adalat-black-money-to-be-spent-on-poor-33305.html,New Delhi: BJP president Amit Shah has said  government would spend the entire proceeds from seizure of offshore black money on welfare programmes for ...
PM Modi's reply to Sonia's jibe: Strong black money laws have ...,Zee News,9 Sep 2015,http://zeenews.india.com/news/india/hawalabaaz-congress-putting-road-blocks-in-indias-growth-pm-narendra-%E2%80%8Bmodi_1759090.html,In a remark aimed at Congress president Sonia Gandhi  PM Modi said due to his government's strict measures on black money  'hawalabaaz' are feeling ...
HSBC Swiss account list: Mukesh  Anil Ambani  Naresh Goyal ...,Financial Express,9 Feb 2015,http://www.financialexpress.com/economy/ambanis-jet-chief-goyal-deny-having-illegal-swiss-bank-ac/40810/,HSBC Swiss account list: Mukesh  Anil Ambani  Naresh Goyal  others react to black money accusations. Top industrialists the Ambani brothers and Jet Airways ...
Bhopal: Sri Sri hopes Modi will fulfill his promise on black money,Hindustan Times,22 Nov 2015,http://www.hindustantimes.com/bhopal/bhopal-sri-sri-hopes-modi-will-fulfill-his-promise-on-black-money/story-3FvdLfKhDRkxvIsnO4NpuO.html,Art of Living founder Sri Sri Ravishankar hopes Prime Minister Narendra Modi will take steps to bring black money to India to fulfill his promise he had made ...
Indians seeking Dubai residency visa to avoid black money law,Business Standard,26 Jul 2015,http://www.business-standard.com/article/news-ani/indians-seeking-dubai-residency-visa-to-avoid-black-money-law-115072600361_1.html,Thousands of wealthy Indians are seeking Dubai residency visa to avoid the black money law. Economic and commercial cooperation with the UAE is a key ...
India's Black Money Exceeds Govt's Expenditure on Education and ...,International Business Times  India Edition,4 Jun 2015,http://www.ibtimes.co.in/indias-black-money-exceeds-govts-expenditure-education-health-634782,The average of such illegal money  commonly known as black money  flowing out of the country annually was 120% more than the government's annual ...
Black money: Tighter noose to curb laundering by banks  financial ...,Business Standard,1 Mar 2015,http://www.business-standard.com/budget/article/real-estate-main-target-of-curbing-black-money-in-domestic-economy-business-standard-news-union-budget-2015-115022800943_1.html,With unaccounted 'black' money taking centre-stage in political discussion  the Budget on Saturday announced two laws to prosecute those having money ...
Black money chase: 350 Swiss bank accounts assessed  60 cases ...,Firstpost,9 Feb 2015,http://www.firstpost.com/business/black-money-chase-350-swiss-bank-accounts-assessed-60-cases-filed-says-fm-2088279.html,The government had submitted the a list of about 628 such account holders to the Special Investigation Team appointed for the recovery of black money by the ...
Dawood Ibrahim's stamp on 60 sacks of black money,Business Today,24 Sep 2015,http://www.businesstoday.in/current/corporate/rs-1000-crore-money-laundering-syndicate-with-dawood-ibrahim-stamp-busted/story/224117.html,Based on the Intelligence Bureau (IB) inputs that Rs 100 crore was being routed to UAE  the Central Board of Direct Taxes (CBDT ) seized 60 sacks of Indian ...
Crime proceeds not eligible for black money compliance scheme,Financial Express,4 Aug 2015,http://www.financialexpress.com/economy/crime-proceeds-not-eligible-for-black-money-compliance-scheme/113872/,The compliance opportunity available till September 30 for declaring undisclosed foreign wealth which had escaped taxation in India is not applicable to any ...
Black money probe ordered in poll-bound Bihar: India Today impact,India Today,22 Sep 2015,http://indiatoday.intoday.in/story/black-money-probe-ordered-in-poll-bound-bihar-india-today-impact/1/479919.html,The Election Commission has formally taken cognizance of India Today's investigation on black money being routed through hawala into poll-bound Bihar.
Income Tax infighting hits black money chase,India Today,13 Oct 2015,http://indiatoday.intoday.in/story/income-tax-infighting-hits-black-money-chase/1/498100.html,Sanjay Srivastava the Commissioner of Income Tax (OSD) had gone to Chennai from New Delhi and had questioned officials of the investigation department on ...
Remove loopholes in the Bill meant for recovering black money to ...,Merinews,6 May 2015,http://www.merinews.com/article/remove-loopholes-in-the-bill-meant-for-recovering-black-money-to-prevent-harassment-assocham/15906261.shtml,Complimenting efforts of the government to deal firmly with the menace of black money stashed abroad  industry body Assocham has impressed upon the ...
New black-money law will give those with foreign assets six months ...,Hindu Business Line,29 Apr 2015,http://www.thehindubusinessline.com/economy/new-blackmoney-law-will-give-those-with-foreign-assets-six-months-to-come-clean/article7155099.ece,The six-month compliance window will come into effect from the date notified  after the black money Bill is passed by Parliament  a senior Finance Ministry ...
7 held in fake notes scam,The Hindu,1 Apr 2015,http://www.thehindu.com/news/cities/chennai/7-held-in-fake-notes-scam/article7059766.ece,In a classic instance of a black money scam  also known as the 'wash wash scam'  a group of men in the city cheated people of a few lakhs after convincing them ...
Confusion over Modi's I-Day speech: DTAA info behind Rs 6500 cr ...,Business Standard,19 Aug 2015,http://www.business-standard.com/article/finance/modi-s-rs-65k-cr-disclosure-on-i-day-didn-t-mean-black-money-115082000040_1.html,Only Rs 70-80 crore had been disclosed under the compliance window provided under the Black Money (Undisclosed Foreign Income and Assets) and ...
India to join top global league with proposed black money law,Firstpost,1 Mar 2015,http://www.firstpost.com/business/economy/india-join-top-global-league-proposed-black-money-law-2129927.html,New Delhi: India will join the league of countries like Singapore  UK and the US with its proposed law to check black money  under which those hiding income ...
5 Things the New Income Tax Tool Will Do to Check PAN ...,The Better India (blog),13 Oct 2015,http://www.thebetterindia.com/36305/new-income-tax-tool/,Hiding black money will now be difficult as the Indian government is all set to launch new PAN activity monitoring and analysis software. This tool will enable the ...
Mumbai Property Prices Might Crash 50% Due to Curbs On Black ...,Huffington Post India,22 Jul 2015,http://www.huffingtonpost.in/2015/07/22/mumbai-property-prices-might-crash-50-due-to-curbs-on-black-mon/,NEW DELHI — Property prices in Indian cities might crash in the near future  in part because of the government's crackdown on black money in the sector  says ...
Did Chidambaram Own and Make Black Money From Vasan Eye ...,The Quint,17 Sep 2015,https://www.thequint.com/india/2015/09/17/did-chidambaram-own-and-make-black-money-from-vasan-eye-care,In an 'expose' by RSS ideologues and chartered accountant S Gurumurthy in The New Indian Express  it was alleged that Chidambaram received black money ...
7 South Asian nations team up to tackle black money,Hindu Business Line,2 Nov 2015,http://www.thehindubusinessline.com/economy/7-south-asian-nations-team-up-to-tackle-black-money/article7834190.ece,Seven countries in the South-Asian region may come together to set up a regional intelligence and coordination centre — to be called SARICC — to tackle the ...
Every step taken to tackle black money: Modi,India Today,14 Aug 2015,http://indiatoday.intoday.in/story/every-step-taken-to-tackle-black-money-narendra-modi/1/458754.html,Addressing the nation on India's 69th Independence Day  Prime Minister Narendra Modi said that when he took over last year  the Central Bureau of ...
Black money law to allow voluntary disclosure  300% penalty to ...,Financial Express,3 Mar 2015,http://www.financialexpress.com/economy/black-money-law-to-allow-voluntary-disclosure-300-penalty-to-avoid-prosecution/50027/,The proposed new Bill on unaccounted wealth that the finance ministry will table in the current session of Parliament will allow an opportunity for black money ...
To curb black money  legalise lobbying,Hindu Business Line,6 Jan 2015,http://www.thehindubusinessline.com/opinion/to-curb-black-money-legalise-lobbying/article6760702.ece,Black money consists of factor incomes and property incomes which should have been reported to income tax authorities  but are not. Black money is generated ...
Black money: India  Japan sign agreement to amend DTAA,Financial Express,12 Dec 2015,http://www.financialexpress.com/economy/black-money-india-japan-sign-agreement-to-amend-dtaa/177927/,India and Japan today signed an agreement to amend the Double Taxation Avoidance Agreement (DTAA) which will help in reducing tax avoidance and act as ...
Black Money: Jethmalani attacks PM Modi Arun Jaitley  calls himself ...,indiatvnews.com,4 Oct 2015,http://www.indiatvnews.com/news/india/jethmalani-attacks-pm-jaitley-calls-himself-victim-of-fraud-55037.html,Patna: Under fire from the grand secular alliance for his failure to bring back black money stashed abroad  senior Supreme Court lawyer and Rajya Sabha ...
Mr PM you need to speak  Lalit Modi is a symbol of black money ...,The Indian Express,12 Aug 2015,http://indianexpress.com/article/india/india-others/she-asked-me-beta-why-are-you-angry-pm-modi-has-no-guts-rahul-gandhi/,Mr PM you need to speak  Lalit Modi is a symbol of black money: Rahul. Rahul Gandhi also drew flak from Finance Minister Arun Jaitley who spoke in Swaraj's ...
Black money compliance window: Declaration of overseas stash can ...,Financial Express,5 Jul 2015,http://www.financialexpress.com/economy/black-money-compliance-window-declaration-of-overseas-stash-can-be-done-online/95207/,Those wanting to utilise the recently notified one-time black money compliance window can also use the e-filing facility of the tax department to declare their ...
Black money: IT dept to file court case if illegal foreign assets detected,Business Today,8 Sep 2015,http://www.businesstoday.in/current/economy-politics/black-money-i-t-dept-file-court-case-illegal-foreign-assets/story/223574.html,Snippet not available
FATCA to power India's fight against black money: FinMin,Moneycontrol.com,8 Jul 2015,http://www.moneycontrol.com/news/economy/fatca-to-power-indias-fight-against-black-money-finmin_1866621.html,Snippet not available
Businessman Moin Akhtar Qureshi Acccused in Black Money Case ...,International Business Times  India Edition,2 Mar 2015,http://www.ibtimes.co.in/businessman-moin-akhtar-qureshi-acccused-black-money-case-granted-bail-624965,Snippet not available
Budget 2015: RBI Governor Rajan Supports Strong Action Against ...,International Business Times  India Edition,21 Feb 2015,http://www.ibtimes.co.in/budget-2015-rbi-governor-rajan-supports-strong-action-against-black-money-holders-tax-evaders-624156,Snippet not available
Indian money in Swiss banks falls by over 10% amid govt's ...,Hindustan Times,18 Jun 2015,http://www.hindustantimes.com/india/indian-money-in-swiss-banks-falls-by-over-10-amid-govt-s-clampdown-on-black-money/story-uIC0sgNdDs5vFC61cnuhSN.html,Snippet not available
Black money: Global automatic information exchange only way to ...,Financial Express,18 Apr 2015,http://www.financialexpress.com/economy/automatic-info-exchange-only-way-to-tackle-black-money-fm-arun-jaitley/64742/,Snippet not available
Guess how big India's black money market is? It is 120% more than ...,Businessinsider India,5 Jun 2015,http://www.businessinsider.in/Guess-how-big-Indias-black-money-market-is-It-is-120-more-than-governments-annual-expenditure-on-education/articleshow/47555419.cms,Snippet not available
Black money: Govt begins prosecution of 60 people,Hindu Business Line,8 Feb 2015,http://www.thehindubusinessline.com/economy/black-money-govt-to-disclose-60-names/article6874009.ece,Snippet not available
Black money: Government plans software to track PAN transactions,indiatvnews.com,13 Oct 2015,http://www.indiatvnews.com/business/india/government-plans-software-to-track-pan-transactions-20275.html,Snippet not available
Jaitley bats for automatic info exchange to tackle black money,The Hindu,8 Oct 2015,http://www.thehindu.com/business/Economy/jaitley-bats-for-automatic-info-exchange-to-tackle-black-money/article7738361.ece,Snippet not available
Lalu Prasad Yadav attacks BJP  says PM Modi not willing to bring ...,The Indian Express,4 Oct 2015,http://indianexpress.com/article/india/politics/lalu-prasad-yadav-attacks-bjp-says-pm-modi-not-interested-in-bringing-back-black-money/,Snippet not available
PM promises to bring back black money but wears Rs. 10-lakh ...,Hindustan Times,29 Jan 2015,http://www.hindustantimes.com/delhi/pm-promises-to-bring-back-black-money-but-wears-rs-10-lakh-designer-suit-rahul-gandhi/story-OAO2nASzv5yd8ctkin0EaM.html,Snippet not available
President Pranab Mukherjee: Government committed to effectively ...,India.com,23 Feb 2015,http://www.india.com/news/india/president-pranab-mukherjee-government-committed-to-effectively-deal-with-black-money-292948/,Snippet not available
$600-mn trail to RIL in maze of 14 accounts,The Indian Express,9 Feb 2015,http://indianexpress.com/article/india/india-others/600-mn-trail-to-ril-in-maze-of-14-accounts/,Snippet not available
Host of steps taken to tackle black money  says PM Narendra Modi ...,IBNLive,14 Aug 2015,http://www.ibnlive.com/news/india/host-of-steps-taken-to-tackle-black-money-says-pm-narendra-modi-in-his-independence-day-speech-1039923.html,Snippet not available
I became a victim of fraud promoting Modi: Jethmalani,India Today,4 Oct 2015,http://indiatoday.intoday.in/story/i-became-a-victim-of-fraud-promoting-narendra-modi-says-ram-jethmalani/1/490089.html,Snippet not available
