Port trust officials nabbed taking Rs2.5-lakh bribe – in new Rs2 000 ...,domain-B,17 Nov 2016,http://www.domain-b.com/economy/Govt/20161117_port_trust.html,Even as citizens struggled to withdraw money or exchange old currency notes of Rs1 000 and Rs500  the Anti-Corruption Bureau arrested two Kandla Port Trust ...
Two postal department officials held for accepting bribe,Business Standard,28 Aug 2016,http://www.business-standard.com/article/pti-stories/two-postal-department-officials-held-for-accepting-bribe-116082800462_1.html,Two officials of the Head Post Office in Odisha's Jajpur were arrested by the CBI for allegedly accepting bribe from a man to issue a registration certificate for ...
Kalyan BJP corporator caught taking bribe,Daily News & Analysis,4 Oct 2016,http://www.dnaindia.com/mumbai/report-kalyan-bjp-corporator-caught-taking-bribe-2261360,A BJP corporator and his accomplice were caught taking bribe red- handed by the Thane anti corruption bureau (ACB) on October 4. The corporator Ganesh ...
It's all politics: K'taka MLAs caught bribing might get away  as in ...,Hindustan Times,10 Jun 2016,http://www.hindustantimes.com/india-news/it-s-all-politics-mlas-caught-bribing-in-k-taka-might-get-away-to-save-big-fish/story-F5kJ7EplzWUPdfhgtUAHYJ.html,Last year  a legislator in Telangana was caught red-handed attempting to bribe another MLA in the run up to a Legislative Council election. The scandal ...
Ex-Ericsson Executives Tell Of Massive Bribery: Report,NDTV,23 Nov 2016,http://www.ndtv.com/world-news/ex-ericsson-executives-tell-of-massive-bribery-report-1629200,Stockholm  Sweden: Former executives with Swedish telecoms equipment giant Ericsson say the firm shelled out tens of millions of dollars in bribes between ...
মোদীর রাজ্যে ঘুষ গেল ১৪৫টা নতুন ২ হাজারি নোট!,আনন্দবাজার,16 Nov 2016,http://www.anandabazar.com/national/bribe-of-nearly-3-lakhs-in-new-2000-notes-seized-in-gujrat-dgtl-1.515638,নোটের চক্করে মানুষের প্রাণ যেখানে ওষ্ঠাগত হওয়ার জোগাড়  ঘণ্টার পর ঘণ্টা লাইনে দাঁড়িয়েও নতুন নোট হাতে পাচ্ছেন না অনেকেই। এর মধ্যেই ঘুষ কাণ্ডে বাজেয়াপ্ত হল ২ ...
Pregnant GMC medical student denied results  allegedly because ...,Oherald,31 Oct 2016,http://www.heraldgoa.in/Goa/Pregnant-GMC-medical-student-denied-results-allegedly-because-bribe-wasnt-paid/107956.html,According to students  a senior doctor in the skin department has been demanding a bribe of Rs one lakh to declare the result. “The student is seven months ...
ACB gives a hot chase  nabs Nandanvan PSI Raut for accepting Rs ...,Nagpur Today,7 Jan 2016,http://www.nagpurtoday.in/acb-gives-a-hot-chase-nabs-nandanvan-psi-raut-for-accepting-rs-15000-bribe-from-nmc-contractor/01071435,Nandanvan PSI Raut Bribe Nagpur: Jagnade Square and nearby area turned out to be the scenario of amusement and bewilderment as well when sleuths of ...
Suspended Judge's Husband Moves Court For Bail In Graft Case,NDTV,13 Oct 2016,http://www.ndtv.com/india-news/suspended-judges-husband-moves-court-for-bail-in-graft-case-1473680,New Delhi: The husband of a judicial officer  arrested in a graft case in which she was allegedly caught by CBI while accepting bribe  has moved a special court ...
Murder accused helps trap jailor who sought bribe | Rajkot NYOOOZ,NYOOOZ,23 Nov 2016,http://www.nyoooz.com/rajkot/672581/murder-accused-helps-trap-jailor-who-sought-bribe,Summary: "We laid the trap near Rajkot central premises and caught Babariya red-handed while accepting the bribe of Rs 5 000 " said U K Makwa  police ...
TTE taking bribes gets suspended on moving train after passsenger ...,India Today,13 Sep 2016,http://indiatoday.intoday.in/story/passsengers-tweets-tte-taking-bribe-gets-suspended-on-train/1/763091.html,TTE taking bribes gets suspended on moving train after passsenger tweets ... on the Barmer-Kalka Express on Saturday did when he caught a TTE taking bribes.
Govt school clerk held for accepting bribe in Chhattisgarh,The Siasat Daily,10 Aug 2016,http://www.siasat.com/news/govt-school-clerk-held-accepting-bribe-chhattisgarh-999490/,New Delhi: A government school clerk was today arrested by anti-corruption bureau (ACB) for allegedly accepting a bribe of Rs 15 000 in Chhattisgarh's ...
Ajay Devgn  KRK and the 'bribe' controversy finally gets a response ...,India TV,2 Sep 2016,http://www.indiatvnews.com/entertainment/bollywood-ajay-devgn-krk-karan-johar-controversy-reply-shivaay-ae-dil-hai-mushkil-346420,Filmmaker Karan Johar has finally broken his silence on the newest controversy engulfing Bollywood  one at whose centre he sits. Speaking at an event ...
Odisha govt paid Rs 2 cr 'bribe' to Daitapatis!,Odisha Television Ltd.,25 Jul 2016,http://odishatv.in/odisha/body-slider/odisha-govt-paid-rs-2-cr-bribe-to-daitapatis-157187/,Bhubaneswar: The Odisha government  often accused of bending backward to keep servitors of Puri Jagannath temple in good humour  has landed in an ...
Tamil Nadu polls: Rs 92 crore  meant to bribe voters  seized by EC,India Today,10 May 2016,http://indiatoday.intoday.in/story/tamil-nadu-polls-rs-92-crore-meant-to-bribe-voters-seized-by-ec/1/664974.html,But now we feel we shouldn't take bribes. We need to eradicate this practice of taking money from politicians." Two years ago during the Lok Sabha elections  ...
Deadline ticks for bribe 'proof' in courts,Times of India,15 hours ago,http://timesofindia.indiatimes.com/city/hyderabad/Deadline-ticks-for-bribe-proof-in-courts/articleshow/55885163.cms,HYDERABAD: With the December 30 deadline to exchange old currency fast approaching  criminal courts in Andhra and Telangana are pressing the panic ...
'Not paying bribes in India is a competitive disadvantage',The Hindu,30 Jan 2016,http://www.thehindu.com/business/Industry/not-paying-bribes-in-india-is-a-competitive-disadvantage/article8172647.ece,“One out of three companies state that 'not paying bribes' is a competitive disadvantage ” according to the 8th annual Business Climate Survey conducted by the ...
Arvind Kejriwal : Modi as Gujarat CM took Rs 25 Crore Bribe from ...,The Indian Talks,16 Nov 2016,https://www.theindiantalks.com/arvind-kejriwal-modi-as-gujarat-cm-took-rs-25-crore-bribe-from-birlas/33732,This is the allegation made by the Delhi Chief Minister Arvind Kejriwal in the Delhi Assembly that the then Gujarat Chief Minister Narendra Modi had taken a ...
KUDA chief tells citizens not to bribe staff,The Hindu,2 Dec 2016,http://www.thehindu.com/todays-paper/tp-national/tp-telangana/KUDA-chief-tells-citizens-not-to-bribe-staff/article16741197.ece,Officials of the Kakatiya Urban Development Authority (KUDA) urged citizens not to panic over the approvals for the Layout Regularisation Scheme (LRS).
Bengaluru: Former Deputy Director of ESIC convicted in bribery ...,India Today,6 Sep 2016,http://indiatoday.intoday.in/story/esic-bribery-corruption-bengaluru-cbi/1/758038.html,The CBI laid a trap and caught Kumar red-handed accepting a bribe of Rs 25 000 from the complainant. A chargesheet was filed and the trial court found him ...
RI arrested by Vigilance for bribe,HERE. NOW,23 May 2016,http://www.orissapost.com/ri-arrested-by-vigilance-for-bribe/,Baripada: Vigilance officials Monday arrested a woman revenue inspector on the charge of taking bribe from a person for demarcating his land at Pokharia ...
Days Before Trust Vote  Second Sting Video Accuses Harish Rawat ...,NDTV,8 May 2016,http://www.ndtv.com/india-news/days-before-trust-vote-second-sting-video-accuses-harish-rawat-of-bribery-1404119,The sting was aired by the same channel which had come out with the earlier sting video that alleged Mr Rawat had engaged in horse-trading - bribing ...
Former bureaucrat and son commit suicide in wake of bribery charges,Scroll.in,27 Sep 2016,http://scroll.in/latest/817581/corporate-affairs-ministry-official-accused-of-bribery-commits-suicide-with-his-son-in-new-delhi,Bansal was the the director general of corporate affairs before he was arrested for taking a bribe of Rs 9 lakh from a Mumbai-based pharmaceutical firm.
Even PM Modi can't build a balcony without bribing MCD: Kejriwal,Hindustan Times,10 Jun 2016,http://www.hindustantimes.com/delhi/even-pm-modi-can-t-build-a-balcony-without-bribing-mcd-kejriwal/story-NZ6hVS0aVWWR4VMLJrgaqI.html,Delhi chief minister Arvind Kejriwal on Friday said the civic bodies were so corrupt that even Prime Minister Narendra Modi would have to bribe officials if he ...
ACB nets woman police constable for accepting bribe of Rs 3000,Nagpur Today,19 Sep 2016,http://www.nagpurtoday.in/acb-nets-woman-police-constable-for-accepting-bribe-of-rs-3000/09192000,Nagpur: The Anti-Corruption Bureau (ACB) on Monday netted a woman police constable for demanding and accepting bribe of Rs 3000 from a man who had a ...
Odisha Vigilance arrest Forest Ranger while receiving bribe,Odisha Sun Times,17 Aug 2016,http://odishasuntimes.com/2016/08/17/odisha-vigilance-arrest-forest-ranger-receiving-bribe/,Snippet not available
Bellary: Driver's suicide note accuses Janardhan Reddy of ...,PrameyaNews7,7 Dec 2016,http://www.prameyanews7.com/en/dec2016/national/37981/Bellary-Driver's-suicide-note-accuses-Janardhan-Reddy-of-laundering-Rs-100-crore-black-money.htm,Snippet not available
Cash for vote case: Chandrababu Naidu gets Hyderabad HC relief,The Indian Express,4 hours ago,http://indianexpress.com/article/india/cash-for-vote-case-chandrababu-naidu-gets-hyderabad-hc-relief-4418685/,Snippet not available
Another video stings Uttarakhand  Rawat says Cong leaders ...,Hindustan Times,8 May 2016,http://www.hindustantimes.com/india/two-days-before-trust-vote-another-bribe-video-stings-uttarakhand-cong/story-GkGLuNyOskWbYZkWoUtFtJ.html,Snippet not available
