A 'begging' protest against bribe,The Hindu,26 Aug 2016,http://www.thehindu.com/news/cities/puducherry/a-begging-protest-against-bribe/article9036998.ece,Snippet not available
Image for representation,The News Minute,26 Aug 2016,http://www.thenewsminute.com/article/tamil-nadu-teenager-makes-banners-and-publicly-begs-bribe-money-48930,Snippet not available
DG Vanzara's Son Arrested While Allegedly Taking Bribe In Vadodara,NDTV,5 Jul 2016,http://www.ndtv.com/india-news/dg-vanzaras-son-arrested-while-allegedly-taking-bribe-in-vadodara-1428316,Snippet not available
Former Gujarat policeman Vanzara's revenue officer son caught ...,Times of India,5 Jul 2016,http://timesofindia.indiatimes.com/city/ahmedabad/Former-Gujarat-policeman-Vanzaras-revenue-officer-son-caught-taking-bribe/articleshow/53066053.cms?from=mdr,Snippet not available
Maharashtra: Kolhapur zilla parishad official takes bribe in Rs 2000 ...,Daily News & Analysis,12 Nov 2016,http://www.dnaindia.com/india/report-maharashtra-kolhapur-zilla-parishad-official-takes-bribe-in-rs-2000-notes-arrested-2272847,Snippet not available
Kerala High Court Judge KT Shankaran Says He Was Offered Bribe,NDTV,6 Jun 2016,http://www.ndtv.com/kerala-news/kerala-high-court-judge-kt-shankaran-says-he-was-offered-bribe-1416122,Snippet not available
Textile Ministry Officer Caught In Bribery Case  Says CBI,NDTV,2 May 2016,http://www.ndtv.com/india-news/textile-ministry-officer-caught-in-bribery-case-says-cbi-1401943,Snippet not available
Bihar Bureaucrat In His First Posting Is Jailed For Rs. 80000 Bribe,NDTV,14 Jul 2016,http://www.ndtv.com/india-news/bihar-bureaucrat-in-his-first-posting-is-jailed-for-rs-80-000-bribe-1431418,Snippet not available
Corporate affairs DG  three others arrested for accepting bribe of Rs ...,India Today,17 Jul 2016,http://indiatoday.intoday.in/story/corporate-affairs-dg-three-others-arrested-for-accepting-bribe-of-rs-9-lakh/1/717122.html,Snippet not available
SDO arrested while taking bribe of Rs 50 lakh: ACB,Daily News & Analysis,24 Nov 2016,http://www.dnaindia.com/india/report-sdo-arrested-while-taking-bribe-of-rs-50-lakh-acb-2276731,Snippet not available
Soldier's Mother Asked to Pay a Bribe to Get Stolen Medals Back,News18,13 Oct 2016,http://www.news18.com/news/india/soldiers-mother-asked-to-pay-a-bribe-to-get-stolen-medals-back-1301565.html,Snippet not available
Woman PSI trapped while taking Rs20 000 bribe,Times of India,21 Jun 2016,http://timesofindia.indiatimes.com/city/nagpur/Woman-PSI-trapped-while-taking-Rs20000-bribe/articleshow/52859304.cms,Snippet not available
2000 note seized in bribe arrest,Times of India,15 Nov 2016,http://timesofindia.indiatimes.com/city/bhopal/2000-note-seized-in-bribe-arrest/articleshow/55452331.cms,Snippet not available
Chennai Provident Fund Commissioner Arrested In An Alleged ...,NDTV,18 Jan 2016,http://www.ndtv.com/tamil-nadu-news/chennai-provident-fund-commissioner-arrested-in-an-alleged-bribery-case-1267408,Snippet not available
Delhi: Government school principal arrested for accepting bribe,The Indian Express,3 Dec 2016,http://indianexpress.com/article/india/delhi-government-school-principal-arrested-for-accepting-bribe-4409075/,Snippet not available
Assam police nab official for taking bribe,Business Standard,27 Oct 2016,http://www.business-standard.com/article/news-ians/assam-police-nab-official-for-taking-bribe-116102700638_1.html,Snippet not available
Faridabad: CBI arrests Central Excise superintendent for bribery,India Today,10 Oct 2016,http://indiatoday.intoday.in/story/faridabad-cbi-central-excise-bribery/1/784292.html,Snippet not available
Baby Patankar case: Cop held for demanding Rs 5-L bribe,The Indian Express,7 May 2016,http://indianexpress.com/article/cities/mumbai/baby-patankar-case-cop-held-for-demanding-rs-5-l-bribe-2789609/,Snippet not available
CBI arrests NDMC inspector for bribery,Times of India,15 Oct 2016,http://timesofindia.indiatimes.com/city/pune/CBI-arrests-NDMC-inspector-for-bribery/articleshow/54868009.cms,Snippet not available
Bribe plaint against AAP legislator,Times of India,17 Sep 2016,http://timesofindia.indiatimes.com/city/delhi/Bribe-plaint-against-AAP-legislator/articleshow/54384652.cms,Snippet not available
Bring firms  bribe givers under anti-graft law: Parliamentary panel,Livemint,12 Aug 2016,http://www.livemint.com/Politics/0F9lXbqMhyFBYGWOdnDxgP/Bring-firms-bribe-givers-under-antigraft-law-Parliamentar.html,Snippet not available
Indian-American charged with trying to bribe council member,The Indian Express,1 Mar 2016,http://indianexpress.com/article/world/world-news/indian-american-charged-with-trying-to-bribe-council-member/,Snippet not available
Hospital officials held for accepting Rs. 4-lakh bribe,The Hindu,4 Jul 2016,http://www.thehindu.com/news/cities/mumbai/news/hospital-officials-held-for-accepting-rs-4lakh-bribe/article8809832.ece,Snippet not available
Nearly four out of 10 Indians paid bribe  says survey,Financial Express,3 Nov 2016,http://www.financialexpress.com/india-news/nearly-four-out-of-10-indians-paid-bribe-says-survey/437844/,Snippet not available
Bank manager who sought bribe for granting loan held,Deccan Herald,4 Mar 2016,http://www.deccanherald.com/content/532735/bank-manager-sought-bribe-granting.html,Snippet not available
Four Central Excise Intelligence officers arrested for taking bribe ...,The Sen Times Online Newspaper,20 Feb 2016,https://www.tkbsen.in/2016/02/four-central-excise-intelligence-officers-arrested-for-taking-bribe-sent-to-cbi-custody-for-5-days/,Snippet not available
Maharashtra Home dept official in ACB net for taking bribe,Deccan Chronicle,19 May 2016,http://www.deccanchronicle.com/nation/crime/190516/maharashtra-home-dept-official-in-acb-net-for-taking-bribe.html,Snippet not available
Private plaint on attempt to bribe Chief Justice,Deccan Herald,17 Jul 2016,http://www.deccanherald.com/content/558596/private-plaint-attempt-bribe-chief.html,Snippet not available
Exec Engineer lands in Vigilance net while taking bribe,Odisha Sun Times,4 Oct 2016,http://odishasuntimes.com/2016/10/04/exec-engineer-lands-vigilance-net-taking-bribe/,Snippet not available
CJ refuses to elaborate on bid to bribe him,Deccan Herald,6 Jul 2016,http://www.deccanherald.com/content/556467/cj-refuses-elaborate-bid-bribe.html,Snippet not available
Palghar SDM caught accepting Rs. 50 lakh bribe  remanded till ...,The Hindu,25 Nov 2016,http://www.thehindu.com/news/national/other-states/Palghar-SDM-caught-accepting-Rs.-50-lakh-bribe-remanded-till-November-28/article16702442.ece,Snippet not available
Mumbai: Officer caught 'pink'-handed taking Rs 8000 bribe in new ...,Mid-Day,23 Nov 2016,http://www.mid-day.com/articles/mumbai-crime-rationing-officer-caught-taking-bribe-new-notes-corruption-news/17777193,Snippet not available
CBI arrests Kendriya Vidyalaya principal for accepting bribe,The Sen Times Online Newspaper,24 Aug 2016,https://www.tkbsen.in/2016/08/cbi-arrests-kendriya-vidyalaya-principal-for-accepting-bribe/,Snippet not available
Two cops held for taking bribe from businessman in Thane,Mid-Day,18 Oct 2016,http://www.mid-day.com/articles/cops-bribe-businessman-corruption-thane-news-acb-virar-police/17694193,Snippet not available
Three held in bribery case,India Today,10 Nov 2016,http://indiatoday.intoday.in/story/three-held-in-bribery-case/1/807749.html,Snippet not available
Income tax deputy commissioner held for bribery,India.com,7 Feb 2016,http://www.india.com/news/india/income-tax-deputy-commissioner-held-for-bribery-926954/,Snippet not available
CBI arrests IT officer  CA for accepting bribe,Times of India,25 Feb 2016,http://timesofindia.indiatimes.com/city/pune/CBI-arrests-IT-officer-CA-for-accepting-bribe/articleshow/51144041.cms,Snippet not available
Government wants to jail bribe-givers as well  activists say it is cruel,Hindustan Times,22 Aug 2016,http://www.hindustantimes.com/india-news/government-wants-to-jail-bribe-givers-as-well-activists-say-it-is-cruel/story-fKI0H6q79ZNmAf3hV9OBLM.html,Snippet not available
CBI arrests two BSNL officials in separate cases of bribery,Punjab News Express,9 Apr 2016,http://punjabnewsexpress.com/crime-justice/news/cbi-arrests-two-bsnl-officials-in-separate-cases-of-bribery-48485.aspx,Snippet not available
Bribery: student gets professor arrested,The Hindu,17 May 2016,http://www.thehindu.com/news/cities/mumbai/bribery-student-gets-professor-arrested/article8613911.ece,Snippet not available
