Corruption in Palghar: Sub-divisional magistrate had won best govt ...,Hindustan Times,25 Nov 2016,http://www.hindustantimes.com/mumbai-news/palghar-bribery-i-told-magistrate-my-father-has-cancer-but-he-demanded-rs50l/story-mF05sgf9IkA8JKBYPhhFXP.html,Shivaji Davbhat  the 46-year-old sub-divisional magistrate in Palghar was arrested on Thursday for demanding and accepting a bribe of Rs50 lakh had been ...
Corporation official seeks bribe in new currency  caught,Times of India,23 Nov 2016,http://timesofindia.indiatimes.com/city/ajmer/Corporation-official-seeks-bribe-in-new-currency-caught/articleshow/55593405.cms,AJMER: The Anti-Corruption Bureau (ACB) on Wednesday arrested an inspector of the municipal corporation while taking Rs 3 000 as bribe  which he ...
KV principal held for demanding Rs 1-lakh bribe in Kanpur,The Indian Express,24 Aug 2016,http://indianexpress.com/article/education/kv-principal-held-for-demanding-rs-1-lakh-bribe-in-kanpur/,The CBI on Wednesday arrested the principal of Kendriya Vidyalaya in Chakeri  Kanpur  for allegedly demanding a bribe worth Rs 1 lakh to award the canteen ...
ACB arrests 2 engineers for taking bribe in Kota dvn of WCR,Times of India,14 Jun 2016,http://timesofindia.indiatimes.com/city/jaipur/ACB-arrests-2-engineers-for-taking-bribe-in-Kota-dvn-of-WCR/articleshow/52752689.cms,"After getting the complainant a team of officers verified it and laid trap in which both the officers were caught red handed for accepting bribe. Manvendra was ...
Bribery charges: Maharashtra ACB report gives 'clean chit' to ...,The Indian Express,22 May 2016,http://indianexpress.com/article/india/india-news-india/bribery-charges-maharashtra-acb-report-gives-clean-chit-to-khadse-aides-2814380/,The ACB on May 13 arrested Gajanan Patil  Khadse's close associate for allegedly demanding a Rs 30-crore bribe from Mumbai-based entrepreneur Ramesh ...
Corp official demands bribe in new notes  caught,Times of India,24 Nov 2016,http://timesofindia.indiatimes.com/city/jaipur/Corp-official-demands-bribe-in-new-notes-caught/articleshow/55589710.cms,Ajmer: The Anti-Corruption Bureau (ACB) on Wednesday arrested an inspector of the municipal corporation while taking Rs 3 000 as bribe  which he demanded ...
Virar police inspector and constable caught taking bribe to allow ...,Times of India,17 Oct 2016,http://timesofindia.indiatimes.com/city/mumbai/Virar-police-inspector-and-constable-caught-taking-bribe-to-allow-movement-of-illegal-sand/articleshow/54911565.cms,MUMBAI: A sub inspector and constable attached to the Virar police station were caught red handed taking cash bribe for allowing illegal transportation of sand.
Government employee caught receiving Rs 30000 bribe,Times of India,20 Oct 2016,http://timesofindia.indiatimes.com/city/madurai/Government-employee-caught-receiving-Rs-30000-bribe/articleshow/54968109.cms,MADURAI: Sleuths attached with the directorate of vigilance and anti-corruption (DVAC) caught a government employee working in the revenue department ...
ACB set to intensify vigil on bribe in 'kind',Times of India,17 Nov 2016,http://timesofindia.indiatimes.com/city/pune/ACB-set-to-intensify-vigil-on-bribe-in-kind/articleshow/55484025.cms,PUNE: The anti-corruption bureau's Pune division has intensified its vigil at government offices to check bribery in kind because of cash crunch following the ...
ACB nabs three government servants for old notes in bribe,Hindustan Times,10 Nov 2016,http://www.hindustantimes.com/mumbai-news/acb-nabs-three-government-servants-for-old-notes-in-bribe/story-K7UnAknpyrq3EU0kDJZHyO.html,The anti-corruption bureau (ACB) on Thursday caught three government servants for accepting a bribe of Rs12 000 — all notes were of the scrapped Rs500 ...
CBI traps ONGC official for accepting Rs 50000 bribe,Daily News & Analysis,7 Jun 2016,http://www.dnaindia.com/india/report-cbi-traps-ongc-official-for-accepting-rs-50000-bribe-2221010,The complainant had filed the complaint against alleged demand of bribe for release of security deposits that was refundable after completion of work  Gogoi ...
BSNL officer held for taking Rs 50000 bribe,Times of India,8 Jan 2016,http://timesofindia.indiatimes.com/city/delhi/BSNL-officer-held-for-taking-Rs-50000-bribe/articleshow/50505863.cms,BSNL officer held for taking Rs 50 000 bribe ... officer working for BSNL Jaipur  and he was caught red-handed while accepting the bribe from the complainant.
Sirsa IT deputy commissioner held for taking Rs 2L bribe,Times of India,7 Feb 2016,http://timesofindia.indiatimes.com/city/chandigarh/Sirsa-I-T-deputy-commissioner-held-for-taking-Rs-2L-bribe/articleshow/50896208.cms,Bathinda: The CBI on Sunday arrested Sirsa income tax deputy commissioner Nitin Garg and his associate Prince for allegedly accepting Rs 2 lakh bribe from a ...
ACB arrests Thane MC's water department peon while accepting bribe,The Indian Express,18 May 2016,http://indianexpress.com/article/cities/mumbai/acb-arrests-thane-mcs-water-department-peon-while-accepting-bribe-2807842/,The complainant approached the ACB officials  on whose instructions he told Jadhav that he was willing to pay Rs 5 000.
Wedding plan scuttled as Bihar engineer caught taking Rs 10000 ...,Hindustan Times,3 Dec 2016,http://www.hindustantimes.com/india-news/arrest-spooks-engineer-s-wedding-plans-in-bihar/story-Q9uSsnARmv4i0pbkw56ydJ.html,Bihar's vigilance investigation bureau (VIB) spooked the marriage plans of an engineer of the energy department  arresting him for accepting a bribe of Rs ...
CBI arrests Income Tax officer for receiving bribe,India.com,25 Feb 2016,http://www.india.com/news/india/cbi-arrests-income-tax-officer-for-receiving-bribe-981499/,Following the complaint  a trap was laid and the CA arrested while accepting the bribe on behalf of the officer.When questioned  the chartered accountant said ...
Sub-engineer held for accepting bribe in Madhya Pradesh,The Indian Express,4 Jul 2016,http://indianexpress.com/article/india/india-news-india/sub-engineer-held-for-accepting-bribe-in-madhya-pradesh-2894193/,“Pradeep Kumar Kole was caught when he was taking bribe of Rs 50 000 bribe from the contractor at the former's rented house in Sitamau town in the district ” ...
Head constable arrested for accepting bribe,Times of India,24 Aug 2016,http://timesofindia.indiatimes.com/city/ghaziabad/Head-constable-arrested-for-accepting-bribe/articleshow/53847917.cms,GHAZIABAD: A head constable posted in Shahibabad police station has been arrested while accepting a bribe of Rs 12 000 from a transporter. The accused ...
Bribe-givers may get 7 days to come clean,Economic Times,22 Aug 2016,http://economictimes.indiatimes.com/news/politics-and-nation/bribe-givers-may-get-7-days-to-come-clean/articleshow/53817770.cms,NEW DELHI: If a bribe-giver informs the police or a law enforcement agency within seven days of his action  he may receive immunity from criminal prosecution.
CBI arrests two BSNL officials in bribe case,Daily News & Analysis,8 Apr 2016,http://www.dnaindia.com/money/report-cbi-arrests-two-bsnl-officials-in-bribe-case-2199832,CBI has arrested an two BSNL officials in Unnao  Uttar Pradesh for allegedly receiving bribe from a contractor for clearing his bills. CBI said an Accounts Officer ...
Sr Customs officials from Chennai Zone booked for bribery: CBI,Business Standard,29 Nov 2016,http://www.business-standard.com/article/pti-stories/sr-customs-officials-from-chennai-zone-booked-for-bribery-cbi-116112901462_1.html,It is alleged that the officials entered in a criminal conspiracy in November 2016 and demanded bribe for favourable transfer-posting in Central Excise ...
Doctor caught taking Rs 10 thousand bribe,Times of India,30 Sep 2016,http://timesofindia.indiatimes.com/city/bhubaneswar/Doctor-caught-taking-Rs-10-thousand-bribe/articleshow/54619394.cms,"The accused  Arun Kumar Das  was caught red-handed while he was taking the bribe money from SK Chouhan of Soura Sahi  Nabarangapur  in his office ...
Old notes can't be used  hence cannot be called bribe: Corrupt ...,Bangalore Mirror,17 hours ago,http://bangaloremirror.indiatimes.com/bangalore/others/Old-notes-cant-be-used-hence-cannot-be-called-bribe-Corrupt-babus-to-court/articleshow/55882122.cms,What do government officials do when they are caught red-handed accepting a bribe but the notes are old  demonetized ones? Correct; they plead not guilty as ...
Garhwal Regimental Centre clerk held for accepting bribe,Times of India,7 Oct 2016,http://timesofindia.indiatimes.com/city/dehradun/Garhwal-Regimental-Centre-clerk-held-for-accepting-bribe/articleshow/54741934.cms,The complainant  an employee of the Garhwal Regimental Centre  alleged that civil clerk Pratap Singh Rawat had demanded a bribe of Rs 8 lakh from him in ...
Chhattisgarh: ACB arrests government official for allegedly ...,The Indian Express,6 Sep 2016,http://indianexpress.com/article/india/india-news-india/chhatisgarh-acb-arrests-government-official-for-allegedly-accepting-rs-1-4-lakh-bribe-3017372/,"Assistant Food Officer Sanjay Dubey  posted at Rajnandgaon  was caught red-handed while accepting bribe of Rs 1.40 lakh " a senior ACB official said.
ACB trap: Kalyan college professor 'caught accepting bribe' from BA ...,The Indian Express,17 May 2016,http://indianexpress.com/article/cities/mumbai/acb-trap-kalyan-college-professor-caught-accepting-bribe-from-ba-student-2805983/,ACB trap: Kalyan college professor 'caught accepting bribe' from BA student. “The professor demanded a total of Rs 4 000 — Rs 2 000 per paper — to clear the ...
Want to file FIR? Bribe on-duty officer first,Times of India,24 Jan 2016,http://timesofindia.indiatimes.com/city/mumbai/Want-to-file-FIR-Bribe-on-duty-officer-first/articleshow/50710471.cms,A police sub-inspector's arrest  while accepting a bribe of Rs 2 000 for registering an FIR  has confirmed the general belief that in most city police stations  ...
Air India scandal: Officials  ex-minister Praful Patel were paid bribes,Daily News & Analysis,9 May 2016,http://www.dnaindia.com/india/report-air-india-scandal-officials-and-aviation-minister-were-paid-bribe-2210899,Even as the scandal of AugustaWestland VVIP chopper involving bribery and corruption by high-level officials for purchasing a new fleet of helicopters continues ...
Clerk arrested while taking bribe at Arwal,Times of India,20 Sep 2016,http://timesofindia.indiatimes.com/city/patna/Clerk-arrested-while-taking-bribe-at-Arwal/articleshow/54432683.cms,Patna: A government clerk Premchand Tiwary was caught red-handed while accepting a bribe of Rs 1lakh by a team of vigilance officials at Arwal on Tuesday.
ACB nabs ITI instructor for accepting Rs 1500 bribe,Times of India,5 Aug 2016,http://timesofindia.indiatimes.com/city/goa/ACB-nabs-ITI-instructor-for-accepting-Rs-1500-bribe/articleshow/53564856.cms,Panaji: The Anti-Corruption Branch (ACB) of Goa police apprehended an ITI (Industrial Training Institute) teacher for allegedly demanding a bribe of 1 500 from ...
South Africa denies paying bribes to host FIFA World Cup 2010,The Indian Express,17 Mar 2016,http://indianexpress.com/article/sports/football/south-africa-denies-paying-bribes-to-host-fifa-world-cup-2010/,Snippet not available
FIFA admits votes were bought in World Cup hosting contests,The Hindu,16 Mar 2016,http://www.thehindu.com/sport/football/fifa-admits-to-world-cup-hosting-bribes/article8360918.ece,Snippet not available
Fifa scandal: South Africa denies paying bribes to host 2010 World ...,Hindustan Times,17 Mar 2016,http://www.hindustantimes.com/football/fifa-corruption-scandal-south-africa-denies-paying-bribes-to-host-2010-world-cup/story-6gbDuKqPVmAaCTCA8Id1WI.html,Snippet not available
Row over Kapil Sharma's bribe allegation,Deccan Herald,8 Sep 2016,http://www.deccanherald.com/content/569379/row-over-kapil-sharmas-bribe.html,Snippet not available
Kapil Sharma asked for bribe  tweets to PM Narendra Modi: 'Ye hain ...,Firstpost,9 Sep 2016,http://www.firstpost.com/bollywood/kapil-sharma-asked-for-bribe-tweets-to-pm-narendra-modi-ye-hain-aapke-acche-din-2997042.html,Snippet not available
Russia detains economy minister for $2 million bribe over Rosneft,The Indian Express,14 Nov 2016,http://indianexpress.com/article/world/world-news/russia-detains-economy-minister-for-2-million-bribe-over-rosneft-4376221/,Snippet not available
Russian economy minister Ulyukayev detained on suspicion of bribery,WION,14 Nov 2016,https://www.wionews.com/world/russian-economy-minister-ulyukayev-detained-on-suspicion-of-bribery-8812,Snippet not available
Bribe row: Kapil Sharma may be called for questioning soon,Zee News,13 Sep 2016,http://zeenews.india.com/entertainment/celebrity/bribe-row-kapil-sharma-may-be-called-for-questioning-soon_1928964.html,Snippet not available
CBI arrests senior judge of Delhi's Tis Hazari court  husband in ...,India Today,29 Sep 2016,http://indiatoday.intoday.in/story/cbi-arrests-senior-judge-of-delhis-tis-hazari-court-in-bribery-case/1/776467.html,Snippet not available
Congress releases sting video  says AAP minister Imran Hussain's ...,Firstpost,9 Feb 2016,http://www.firstpost.com/politics/congress-releases-sting-video-says-aap-minister-imran-hussains-staffer-asked-for-rs-30-lakh-bribe-2618976.html,Snippet not available
Wife and daughter of DG Corporate Affairs BK Bansal  arrested by ...,Zee News,19 Jul 2016,http://zeenews.india.com/news/delhi/wife-and-daughter-of-dg-corporate-affairs-bk-bansal-arrested-by-cbi-in-bribery-case-found-dead_1909096.html,Snippet not available
Uttar Pradesh: Toddler dies as hospital staff demands bribe for ...,The Indian Express,11 Aug 2016,http://indianexpress.com/article/india/india-news-india/uttar-pradesh-toddler-dies-as-hospital-staff-demands-bribe-for-medical-aid-2967719/,Snippet not available
Kid dies in govt hospital as staff haggle over bribe,The Hindu,11 Aug 2016,http://www.thehindu.com/news/national/other-states/kid-dies-in-govt-hospital-as-staff-haggle-over-bribe/article8976626.ece,Snippet not available
First case of bribe with new notes  Gujarat ACB nabs 3,The Hindu,16 Nov 2016,http://www.thehindu.com/todays-paper/first-case-of-bribe-with-new-notes-gujarat-acb-nabs-3/article9355480.ece,Snippet not available
Two Kolkata policemen suspended for trying to bribe BJP leader ...,Scroll.in,28 Mar 2016,http://scroll.in/latest/805835/two-kolkata-policemen-suspended-for-trying-to-bribe-bjp-leader-rahul-sinha-in-cow-smuggling-case,Snippet not available
Denied Bribe  UP Police Allegedly Beat Up 2 Men  Drown Them In ...,NDTV,6 Aug 2016,http://www.ndtv.com/india-news/denied-bribe-up-police-allegedly-beat-up-2-men-drown-them-in-pond-1440973,Snippet not available
Watch: Policemen in Lucknow scuffle on road over sharing bribe ...,India.com,26 Jun 2016,http://www.india.com/buzz/watch-policemen-in-lucknow-scuffle-on-road-over-sharing-bribe-video-1289832/,Snippet not available
University officials examined by CBI for offering bribe to Central ...,Economic Times,24 Oct 2016,http://economictimes.indiatimes.com/news/politics-and-nation/university-officials-examined-by-cbi-for-offering-bribe-to-central-council-of-homeopathy/articleshow/55035973.cms,Snippet not available
Eknath Khadse to file defamation suit in Rs 30 crore bribery case,Free Press Journal,16 May 2016,http://www.freepressjournal.in/mumbai/khadse-to-file-defamation-suit-in-30-crore-bribery-case/850277,Snippet not available
CBI arrests SDM in bribery case,Chandigarh Tribune,3 Jun 2016,http://www.tribuneindia.com/news/delhi/cbi-arrests-sdm-in-bribery-case/246654.html,Snippet not available
To bribe official  TN teen forced to beg,Times of India,27 Aug 2016,http://timesofindia.indiatimes.com/city/chennai/To-bribe-official-TN-teen-forced-to-beg/articleshow/53893142.cms,Snippet not available
DG Vanzaras son arrested for allegedly accepting a bribe,Catch News,5 Jul 2016,http://www.catchnews.com/national-news/dg-vanzara-s-son-arrested-for-allegedly-accepting-a-bribe-1467728775.html,Snippet not available
Assam: Forest officer arrested for taking bribe; tiger skin  cash ...,International Business Times  India Edition,15 Jun 2016,http://www.ibtimes.co.in/assam-forest-officer-arrested-taking-bribe-tiger-skin-cash-jewellery-also-recovered-682896,Snippet not available
DFO caught accepting bribe in Assam,The Siasat Daily,15 Jun 2016,http://www.siasat.com/news/dfo-caught-accepting-bribe-assam-973044/,Snippet not available
Goa IGP accused of taking Rs 5.5 lakh bribe for registering FIR,India Today,11 Aug 2016,http://indiatoday.intoday.in/story/goa-igp-accused-of-taking-rs-5-5-lakh-bribe-for-registering-fir/1/738565.html,Snippet not available
Mumbai: Food and Drug Administration official 'caught accepting bribe',The Indian Express,14 Sep 2016,http://indianexpress.com/article/cities/mumbai/mumbai-food-and-drug-administration-official-caught-accepting-bribe-3031621/,Snippet not available
CBI arrests BSNL General Manager in bribery case,Daily News & Analysis,25 Mar 2016,http://www.dnaindia.com/money/report-cbi-arrests-bsnl-general-manager-in-bribery-case-2193911,Snippet not available
18-year-old dies after father fails to give Rs 300 bribe at Madurai ...,India.com,11 Jun 2016,http://www.india.com/news/india/18-year-old-dies-after-father-fails-to-give-rs-300-bribe-at-madurai-hospital-for-treatment-1253461/,Snippet not available
Delhi HC tells AAP to respond in bribery case against Imran Hussain,Catch News,22 Apr 2016,http://www.catchnews.com/delhi-news/delhi-hc-tells-aap-to-respond-in-bribery-case-against-imran-hussain-1461324303.html,Snippet not available
Corporator arrested for taking Rs 1 lakh bribe,The Sen Times Online Newspaper,4 Oct 2016,https://www.tkbsen.in/2016/10/corporator-arrested-for-taking-rs-1-lakh-bribe/,Snippet not available
Bribes take ewallet route  keep cops on tenterhooks | Kolkata ...,NYOOOZ,25 Nov 2016,http://www.nyoooz.com/kolkata/675752/bribes-take-ewallet-route-keep-cops-on-tenterhooks,Snippet not available
Customs superintendent suspended after bribe video goes viral,The Sen Times Online Newspaper,14 May 2016,https://www.tkbsen.in/2016/05/customs-superintendent-suspended-after-bribe-video-goes-viral/,Snippet not available
Village officer held on bribery charge,Kaumudi Online,19 Oct 2016,http://www.kaumudi.com/innerpage1.php?newsid=83949,Snippet not available
Two railway engineers arrested by ACB while accepting bribe,India Today,14 Jun 2016,http://indiatoday.intoday.in/story/two-railway-engineers-arrested-by-acb-while-accepting-bribe/1/692082.html,Snippet not available
Doctor held for taking bribe to conduct operation,HERE. NOW,30 Sep 2016,http://www.orissapost.com/doctor-held-for-taking-bribe-to-conduct-operation/,Snippet not available
Garhwal Regimental Centre clerk arrested for taking bribe,Business Standard,7 Oct 2016,http://www.business-standard.com/article/pti-stories/garhwal-regimental-centre-clerk-arrested-for-taking-bribe-116100701057_1.html,Snippet not available
Bribe given to Air India officials to grab tender: Report,Oneindia,9 May 2016,http://www.oneindia.com/india/bribe-given-air-india-officials-grab-tender-report-2094450.html,Snippet not available
ACB nabs Altinho ITI instructor for taking bribe for admission,The Navhind Times,5 Aug 2016,http://www.navhindtimes.in/acb-nabs-altinho-iti-instructor-for-taking-bribe-for-admission/,Snippet not available
Kapil Sharma tweets BMC officer demanded Rs5 lakh bribe  CM ...,Hindustan Times,8 Sep 2016,http://www.hindustantimes.com/mumbai-news/kapil-sharma-tweets-bmc-officer-demanded-rs5-lakh-bribe-cm-assures-action/story-bJpkL9RIXWQfhNIhdoeOtI.html,Snippet not available
Kapil Sharma's bribe charge backfires  BMC points at more violations,Times of India,10 Sep 2016,http://timesofindia.indiatimes.com/city/mumbai/Kapil-Sharmas-bribe-charge-backfires-BMC-points-at-more-violations/articleshow/54266094.cms,Snippet not available
Kapil Sharma Bribe Row: BJP MLA Asks Comic To Reveal Names ...,NDTV,10 Sep 2016,http://www.ndtv.com/mumbai-news/kapil-sharma-bribe-row-bjp-mla-asks-comic-to-reveal-names-or-face-protest-1457054,Snippet not available
Russian Economy Minister charged with extorting $2 million bribe ...,Firstpost,15 Nov 2016,http://www.firstpost.com/world/russian-economy-minister-charged-with-extorting-2-million-bribe-reuters-3107232.html,Snippet not available
BMC to probe bribe charge if Kapil Sharma names official,The Indian Express,12 Sep 2016,http://indianexpress.com/article/india/india-news-india/bmc-to-probe-bribe-charge-if-kapil-sharma-names-official-3028125/,Snippet not available
Kapil Sharma seeks meeting with Maharashtra CM Devendra ...,India Today,11 Sep 2016,http://indiatoday.intoday.in/story/kapil-sharma-bribery-devendra-fadnavis-bmc/1/762213.html,Snippet not available
CBI arrests senior civil judge of Tis Hazari court in bribery case,The Indian Express,29 Sep 2016,http://indianexpress.com/article/india/india-news-india/cbi-arrests-senior-civil-judge-of-tis-hazari-court-in-bribery-case-3057075/,Snippet not available
CBI arrests senior judge of Delhi's Tis Hazari court in bribery case,Hindustan Times,29 Sep 2016,http://www.hindustantimes.com/india-news/cbi-arrests-senior-judge-of-delhi-s-tis-hazari-court-in-bribery-case/story-m8QaM6Zw4kOWykoMkveSMK.html,Snippet not available
WATCH: 'Sting videos of Kejriwal govt's minister Imran Hussain's ...,Zee News,9 Feb 2016,http://zeenews.india.com/news/india/watch-sting-videos-of-kejriwal-govts-minister-imran-hussains-staffer-demanding-bribe-of-rs-25-lakh-for-his-boss_1853907.html,Snippet not available
Delhi minister Imran Hussain sought Rs 30 lakh bribe from builders ...,indiatvnews.com,9 Feb 2016,http://www.indiatvnews.com/politics/national/cong-levels-corruption-charges-against-aap-minister-35035.html,Snippet not available
Wife  daughter of bureaucrat who was caught taking bribe found ...,India Today,19 Jul 2016,http://indiatoday.intoday.in/story/ias-officer-wife-daughter-arrested-corruption-found-hanging-delhi/1/718497.html,Snippet not available
Official held by CBI for graft  his wife  daughter commit suicide,The Indian Express,19 Jul 2016,http://indianexpress.com/article/india/india-news-india/dg-corporate-affairs-bribery-wife-daughter-commit-suicide-2924756/,Snippet not available
Baby dies after hospital staff demand Rs. 20 bribe,Gulte,11 Aug 2016,http://www.gulte.com/movienews/51101/Baby-dies-after-hospital-staff-demand-Rs-20-bribe,Snippet not available
Demonetisation: Three held for accepting bribe in new currency,The Indian Express,17 Nov 2016,http://indianexpress.com/article/india/india-news-india/demonetisation-three-held-for-accepting-bribe-in-new-currency-4380715/,Snippet not available
Gujarat officials caught with Rs 3 lakh worth bribe in new currency,Deccan Chronicle,17 Nov 2016,http://www.deccanchronicle.com/nation/current-affairs/171116/gujarat-officials-caught-with-rs-3-lakh-worth-bribe-in-new-currency.html,Snippet not available
Two detained for trying to bribe BJP's Rahul Sinha,Hindustan Times,28 Mar 2016,http://www.hindustantimes.com/india/two-detained-for-trying-to-bribe-bjp-s-rahul-sinha/story-eYwL1V0wfZMZND79PRYdfL.html,Snippet not available
Kolkata: Two policemen offer bribe to BJP leader Rahul Sinha ...,Daily News & Analysis,28 Mar 2016,http://www.dnaindia.com/india/report-kolkata-two-policemen-offer-bribe-to-bjp-leader-rahul-sinha-suspended-2195252,Snippet not available
Denied Rs 100 bribe  UP cops face charges for beating labourers to ...,Hindustan Times,6 Aug 2016,http://www.hindustantimes.com/india-news/up-beaten-by-cops-seeking-bribe-two-labourers-jump-into-pond-drown/story-jvdYCiRcjmBLuIaADRX0zM.html,Snippet not available
Mainpuri: Two labourers refuse to give bribe of Rs 100  UP police ...,Firstpost,5 Aug 2016,http://www.firstpost.com/india/mainpuri-two-labourers-refuse-to-give-bribe-of-rs-100-up-police-beat-them-to-death-2938634.html,Snippet not available
Caught on Camera: Lucknow Policemen Brawl In Public  Allegedly ...,NDTV,26 Jun 2016,http://www.ndtv.com/lucknow-news/policeman-suspended-for-brawl-with-homeguard-in-lucknow-1423690,Snippet not available
Watch: Uttar Pradesh cops fight over share of bribe  suspended,Deccan Chronicle,26 Jun 2016,http://www.deccanchronicle.com/nation/crime/270616/watch-uttar-pradesh-cops-fight-over-share-of-bribe-suspended.html,Snippet not available
Kerala bar bribery case: Biju Ramesh makes fresh allegations ...,Firstpost,2 Feb 2016,http://www.firstpost.com/politics/kerala-bar-bribery-case-biju-ramesh-makes-fresh-allegations-against-two-leaders-2607424.html,Snippet not available
Central Council of Homeopathy president arrested for accepting ...,The New Indian Express,22 Oct 2016,http://www.newindianexpress.com/nation/2016/oct/22/central-council-of-homeopathy-president-arrested-for-accepting-bribe-of-rs-20-lakh-1530749.html,Snippet not available
CBI arrests Homeopathy edu regulator head in bribery case,Financial Express,22 Oct 2016,http://www.financialexpress.com/india-news/cbi-arrests-homeopathy-edu-regulator-head-in-bribery-case/426889/,Snippet not available
Maharashtra minister's 'PA' held for seeking Rs 30 crore bribe,Deccan Chronicle,14 May 2016,http://www.deccanchronicle.com/nation/current-affairs/140516/maharashtra-minister-s-pa-held-by-acb-for-seeking-rs-30-cr-bribe.html,Snippet not available
Eknath Khadse's 'aide' demanded Rs 30 crore bribe for 'fun',Mid-Day,17 May 2016,http://www.mid-day.com/articles/eknath-khadses-aide-demanded-rs-30-crore-bribe-for-fun/17244196,Snippet not available
CBI arrests SDM for taking Rs 50000 bribe,Hindustan Times,3 Jun 2016,http://www.hindustantimes.com/delhi/cbi-arrests-sdm-for-taking-rs-50-000-bribe/story-R6PkwD7orHvHDNZWmvOYQN.html,Snippet not available
CBI arrests SDM in Delhi government on bribery charges,Janta Ka Reporter,3 Jun 2016,http://www.jantakareporter.com/india/cbi-arrests-sdm-delhi-government-bribery-charges/47421/,Snippet not available
