Demonetisation to weed out black money: Nitin Gadkari,Moneycontrol.com,9 Nov 2016,http://www.moneycontrol.com/news/economy/demonetisation-to-weed-out-black-money-nitin-gadkari_7938361.html,The Minister said the poor will not suffer from it but it was going to spell doom for corrupt people  including politicians who had stacked blackmoney in their ...
भ्रष्टाचार की देवी मायावती कैसे कर सकती हैं ...,Patrika,5 Sep 2016,http://www.patrika.com/news/noida/bjp-leader-srikant-sharma-said-mayawati-is-a-corrupt-1391684/,नई दिल्ली/नोएडा। इलाहाबाद की रैली में मायावती के अच्छे दिन के वायदे पर भाजपा ने पलटवार किया है। पार्टी ने कहा है कि ...
MBBS: ट्युइशन फीस बढ़ने से भ्रष्ट लोगों पर आफत,नवभारत टाइम्स,10 Oct 2016,http://navbharattimes.indiatimes.com/education/education-news/high-medical-tuition-fee-bad-news-for-corrupt/articleshow/54778693.cms,प्राइवेट मेडिकल कॉलेजों के कैपिटेशन फीस के साथ ट्युइशन और अन्य फीस बढ़ाने के फैसले से बहुत लोग खुश नहीं है। वहीं ...
With shortage of cash  Govt employees to organize a brainstorming ...,Firstpost (satire),17 Nov 2016,http://www.fakingnews.firstpost.com/india/shortage-cash-govt-employees-organize-brainstorming-session-come-new-ways-take-bribe-18265,New Delhi: Shortage of cash after the demonetization of old 500 and 1000 notes has hurt many people  and it hasn't hurt anyone more than the corrupt ...
How Socialist Policies Encourage Corruption,Swarajya,30 Apr 2016,http://swarajyamag.com/politics/how-socialist-policies-encourage-corruption,There is a whole class of politicians and officials in Delhi who pocket the profits of a corrupt socialist system. Corruption in social life has many causes. A certain ...
Warangal Rural will be corrupt free district,The Hans India,21 Oct 2016,http://www.thehansindia.com/posts/index/Nizamabad-Tab/2016-10-22/Warangal-Rural-will-be-corrupt-free-district/260358,The Warangal Rural district would be a corrupt-free district with transparent administration. Anyway a change of mindset among people is desirable.
How demonetisation will change the many faces of corruption in India,Sify News,22 Nov 2016,http://www.sify.com/finance/how-demonetisation-will-change-the-many-faces-of-corruption-in-india-news-columns-qlwq14edceecb.html,Many consider Dr Manmohan Singh to be the most corrupt Prime Minister of India. ... By sharing a part of the corrupt earnings with gods  divine shield is sought ...
Weighing the burden of proof,The Hindu,26 Aug 2016,http://www.thehindu.com/opinion/lead/weighing-the-burden-of-proof/article9036968.ece,Not for him the technicalities of what he is accused of. In his own eyes  he has done nothing wrong  and cannot be placed in the company of the corrupt and wily.
Chandrababu Naidu's two-year rule is corrupt: Raghuveera,The Hans India,3 Jul 2016,http://www.thehansindia.com/posts/index/Andhra-Pradesh/2016-07-04/Chandrababu-Naidus-two-year-rule-is-corrupt-Raghuveera/239611,Madakasira (Anantapur): APCC president N Raghuveera Reddy lashed out at Chief Minister Nara Chandrababu Naidu describing his two-year rule as highly ...
Economic Survey 2016: Need to balance probity with bonafide ...,Economic Times,26 Feb 2016,http://economictimes.indiatimes.com/news/economy/policy/economic-survey-2016-need-to-balance-probity-with-bonafide-decisions/articleshow/51155348.cms,NEW DELHI: Some provisions of anti-corruption law seem to scare the honest without deterring the corrupt  the Economic Survey today said while calling for an ...
Woman Sub-Inspector falls sick after judge calls her corrupt; files plaint,Millennium Post,26 Sep 2016,http://www.millenniumpost.in/NewsContent.aspx?NID=326447,Sources said that the woman Sub-Inspector on being called corrupt allegedly got so sick that she started vomiting and within a few minutes fainted in the court ...
अरविंद केजरीवाल ने सरकार पर निशाना साधते हुए ...,Jansatta,13 Nov 2016,http://www.jansatta.com/trending-news/arvind-kejriwal-attacks-on-bjp-and-corrupt-people/183995/,अरविंद केजरीवाल ने प्रधानमंत्री नरेंद्र मोदी और उनके 500-1000 के नोट बैन करने को लेकर ट्वीट किया। Author जनसत्ता ऑनलाइन ...
Four suspended from civil supplies department on charges of ...,The New Indian Express,4 Nov 2016,http://www.newindianexpress.com/cities/hyderabad/2016/nov/05/four-suspended-from-civil-supplies-department-on-charges-of-corruption-1535201.html,HYDERABAD: Cracking down on corrupt staff members  Civil Supplies Department Commissioner CV Anand suspended four temporary employees on charges ...
Tamil Nadu polls: Amid clamour for prohibition  issues like ...,Firstpost,14 May 2016,http://www.firstpost.com/politics/tamil-nadu-polls-corruption-what-corruption-real-issues-take-a-backseat-2779218.html,Tamil Nadu has been listed as one of the most corrupt states in India by the National Council of Applied Economic Research (NCAER) survey. Voters in the state ...
87 corrupt officials caught in three years | Kolhapur NYOOOZ,NYOOOZ,7 Nov 2016,http://www.nyoooz.com/kolhapur/655392/87-corrupt-officials-caught-in-three-years,This year  the ACB has conducted 24 traps. "We will register the complaint and take appropriate action against the corrupt government official " Aphale added.
BJP demands strong action against 'corrupt' AAP MLA Mohaniya,The Sen Times Online Newspaper,23 Jun 2016,https://www.tkbsen.in/2016/06/bjp-demands-strong-action-against-corrupt-aap-mla-mohaniya/,New Delhi: Taking strong exception to Dinesh Mohaniya for his alleged misbehaviour with women who went to his office to lodge complain about irregular water ...
Et tu  tennis? Grand slam winners  top 50 players involved in alleged ...,Firstpost,17 Jan 2016,http://www.firstpost.com/sports/match-fixing-in-tennis-grand-slam-winners-top-players-involved-in-widespread-corruption-says-report-2588136.html,Buzzfeed said that players were targeted in hotel rooms at major tournaments and offered $50 000 or more per fix by corrupt gamblers. But tennis authorities ...
Defamation cases cannot be slapped if someone calls govt unfit or ...,Oneindia,28 Jul 2016,http://www.oneindia.com/new-delhi/defamation-cases-cannot-be-slapped-if-someone-calls-govt-unfit-sc-2165719.html,It also said that if someone terms the government unfit or corrupt  it does not automatically make a case for defamation. SC raps TN govt over defamation cases.
Spectrum auction  corruption index and IMF reforms,Livemint,30 Jan 2016,http://www.livemint.com/Sundayapp/qJBC2FuOWKIgx69cv2d31J/Spectrum-auction-corruption-index-and-IMF-reforms.html,Denmark remained at the top of the index for the second consecutive year as the country perceived to be the least corrupt. Brazil slid to 76th place  sharing its ...
149 banks officials under CVC scanner for corruption,Times of India,16 Jun 2016,http://timesofindia.indiatimes.com/business/india-business/149-banks-officials-under-CVC-scanner-for-corruption/articleshow/52780405.cms,Not only banks but other government departments are also delaying permission to punish the corrupt officials. As many as six cases involving at least eight ...
Appeal to PM to recast tainted MCI,Calcutta Telegraph,14 Apr 2016,http://www.telegraphindia.com/1160415/jsp/nation/story_80219.jsp,New Delhi  April 14: Five former health secretaries and as many doctors have requested Prime Minister Narendra Modi to revamp the "corrupt and shameful" ...
Corrupt officer leaked TP info to builders for partnerships: ACB,Ahmedabad Mirror,3 Jun 2016,http://www.ahmedabadmirror.com/ahmedabad/civic/Corrupt-officer-leaked-TP-info-to-builders-for-partnerships-ACB/articleshow/52576797.cms,A day after Anti-Corruption Bureau carried out statewide raids in connection with disproportionate assets (DA)  it has emerged that Dahyalal Modi  a class ...
भ्रष्ट फैसलांे और गलती मंे भेद करने की जरूरत : जेटली,नवभारत टाइम्स,21 Oct 2016,http://navbharattimes.indiatimes.com/business/business-news/faslane-in-corrupt-and-needs-to-distinguish-mistake-jaitley/articleshow/54981757.cms,नयी दिल्ली  21 अक्तूबर :भाषा: भ्रष्टाचार रोधक कानून में संशोधन की वकालत करते हुए वित्त मंत्री अरण जेटली ने आज कहा कि ...
Punjab's Rs 12000cr food grain scam is a kick on India's stomach,DailyO,22 Apr 2016,http://www.dailyo.in/politics/punjab-foodgrains-parkash-singh-badal-captain-amarinder-singh-sad-farmers-suicide-paic-irrigation/story/1/10229.html,The corrupt employees either make the wheat wet or replace the stock with rotten stock. In the dock for siphoning off over Rs 12 000 crore - the money meant to ...
AAP Government Facing Obstacles Because It Said No To 'Setting ...,NDTV,2 Jul 2016,http://www.ndtv.com/delhi-news/aap-government-facing-obstacles-because-it-said-no-to-setting-arvind-kejriwal-1427352,Arvind Kejriwal took on BJP and Congress  alleging both the parties have "similar characters" in terms of being "corrupt and exploitative". (File Photo). New Delhi ...
Siddaramaiah's Karnataka Is Slipping Badly on Law & Order And ...,Swarajya,20 Jul 2016,http://swarajyamag.com/politics/siddaramaiahs-karnataka-is-slipping-badly-on-law-and-order-and-governance,I can't figure out the SAD - are they really as corrupt and inefficient as they're made out to be ... One thing is for sure SAD is dynastic corrupt party like Shiv sena.
Clinton Foundation most corrupt enterprise  shut it down:Trump,Press Trust of India,21 Aug 2016,http://www.ptinews.com/news/7787949_India-at-70-is-greatest-experiment-in-history-of-world-Sarna-.html,Washington  Aug 22 (PTI) Declaring the Clinton Foundation "the most corrupt enterprise in ... "Hillary Clinton is the defender of the corrupt and rigged status quo.
BK Bansal suicide and scourge of corruption: Are we serious about ...,Firstpost,30 Sep 2016,http://www.firstpost.com/india/bk-bansal-suicide-and-the-scourge-of-corruption-are-we-serious-about-addressing-real-issues-3027818.html,In spite of the fact that India is rated as one of the most corrupt countries in the world  the number of prosecutions and more so the number of convictions are ...
ஜெயலலிதாவின் லட்சியம் இதுதான் ...,Oneindia Tamil,29 May 2016,http://tamil.oneindia.com/news/tamilnadu/ramadoss-slams-jayalalitha-govt-corrupt-admin-254800.html,சென்னை: முதல்வர் ஜெயலலிதாவின் லட்சியமே  ஊழலை 1000 மடங்கு அளவுக்கு உயர்த்துவது ...
Congress veteran Chidambaram slams demonetisation move  asks ...,Zee News,15 Nov 2016,http://zeenews.india.com/news/india/congress-veteran-chidambaram-slams-demonetisation-move-asks-have-achhe-din-arrived_1949907.html,Thousands of "rich" and "corrupt" persons standing in queue. The poor are .... Corrupt Finance Minister did nothing to curb corruption during his term. His family ...
MADAARI (Review) | Common Man Vs Corrupt system,Justbollywood,21 Jul 2016,http://www.justbollywood.in/madaari-review-common-man-vs-corrupt-system/,Snippet not available
BSP  Samajwadi Party Have Plundered UP's Ecology: Amit Shah,News18,8 Nov 2016,http://www.news18.com/news/politics/bsp-samajwadi-party-have-plundered-ups-ecology-amit-shah-1309674.html,Snippet not available
भ्रष्ट और गलत फैसलों में अंतर करने की जरूरत : जेटली,दैनिक जागरण,21 Oct 2016,http://www.jagran.com/news/national-corrupt-and-wrong-decisions-need-to-differentiate-14907184.html,Snippet not available
Killing corruption or killing the Ayukta?,Deccan Chronicle,24 Mar 2016,http://www.deccanchronicle.com/nation/current-affairs/250316/killing-corruption-or-killing-the-ayukta.html,Snippet not available
Siddaramaiah writes to Sonia  Rahul Gandhi defending his move to ...,Daily News & Analysis,22 Mar 2016,http://www.dnaindia.com/india/report-siddaramaiah-writes-to-sonia-rahul-gandhi-defending-his-move-to-form-separate-acb-2192994,Snippet not available
AAP targeting my family  alleges AAP MLA Asim Ahmed Khan,Hindustan Times,3 Aug 2016,http://www.hindustantimes.com/delhi/aap-targeting-my-family-alleges-aap-mla-asim-ahmed-khan/story-hISaBUnBNTenFG1dToDpPN.html,Snippet not available
Fortunes declining  BJP turns corruption buster,The Indian Express,15 Mar 2016,http://indianexpress.com/article/cities/mumbai/fortunes-declining-bjp-turns-corruption-buster/,Snippet not available
BJP attacks 'save democracy' march  says Cong shielding Gandhis,Hindustan Times,6 May 2016,http://www.hindustantimes.com/india/bjp-attacks-save-democracy-march-says-cong-shielding-gandhis/story-sgwzDGw0Hf4znE7i348URK.html,Snippet not available
Ishrat Affidavits: Chidu Did It All  But He Is Still Being Economical ...,Swarajya,18 Apr 2016,http://swarajyamag.com/politics/ishrat-affidavits-chidu-did-it-all-but-he-is-still-being-economical-with-the-truth,Snippet not available
I am not for sale  thunders PM Modi; talks of cheap loans,Hindustan Times,20 Nov 2016,http://www.hindustantimes.com/india-news/i-am-not-for-sale-thunders-pm-modi-talks-of-cheap-loans/story-rPRdAE0Ve58DYcifex7FzN.html,Snippet not available
CBI books 9 I-T officials for corrupt practices,Daily News & Analysis,22 Jun 2016,http://www.dnaindia.com/india/report-cbi-books-9-i-t-officials-for-corrupt-practices-2226657,Snippet not available
Poor India can't afford luxury of corruption  says Modi,Business Standard,7 Nov 2016,http://www.business-standard.com/article/news-ians/poor-india-can-t-afford-luxury-of-corruption-says-modi-116110701695_1.html,Snippet not available
Sack erring government officials who don't mend ways  PM tells ...,Times of India,27 Jan 2016,http://timesofindia.indiatimes.com/india/Sack-erring-government-officials-who-dont-mend-ways-PM-tells-secretaries/articleshow/50748442.cms,Snippet not available
Fighting corruption? Right,Mumbai Mirror,9 hours ago,http://mumbaimirror.indiatimes.com/columns/columnists/pritish-nandy/Fighting-corruption-Right/articleshow/55572823.cms,Snippet not available
Defamation cases can't be used as political weapon: Supreme Court,Daily News & Analysis,28 Jul 2016,http://www.dnaindia.com/india/report-defamation-cases-can-t-be-used-as-political-weapon-supreme-court-2238989,Snippet not available
Had we done nothing  our stint would have been smooth: Kejriwal ...,Daily News & Analysis,2 Jul 2016,http://www.dnaindia.com/india/report-had-we-done-nothing-our-stint-would-have-been-smooth-kejriwal-taunts-congress-bjp-2230544,Snippet not available
