Cut price  India-made Audi Q3 maybe called Audi Q3 S,Indian Autos Blog (blog),13 Jul 2013,http://indianautosblog.com/2013/07/audi-q3-s-india-87201,The Audi Q3 which was launched in India last year is currently imported through the CBU route. Audi India has confirmed to Indian Autos Blog that local ...
Remembering Laxmi Orang: The Predicament of the Gender ...,NewsClick,14 Jan 2013,http://newsclick.in/india/remembering-laxmi-orang-predicament-gender-question-assam,As is in the case of all corrupt capitals of North East India  a region where 'plastic-democracy' is the norm of the day  where the Establishment pays attention to ...
Number of bank fraud cases down but amount involved zooms 324%,Moneylife,1 Aug 2013,http://www.moneylife.in/article/number-of-bank-fraud-cases-down-but-amount-involved-zooms-324-percentage/33899.html,Invariably it is the top guns beginning with the CMD who are corrupt enough to sanction the loans that have turned NPAs. The RBI needs to put in the public ...
Virat Kohli feels India squad for tour for Zimbabwe is strong,Cricket Country,19 Jul 2013,http://www.cricketcountry.com/news/virat-kohli-feels-india-squad-for-tour-for-zimbabwe-is-strong-29113,Kohli also slammed players alleged to have indulged in corrupt practices like spot-fixing in the Indian Premier League that rocked Indian cricket recently as ...
Right to Forest Land: Who Benefits?,Mainstream,1 Dec 2013,https://www.mainstreamweekly.net/article4611.html,The power of the communities to protect and manage their forests and prevent land mafias and corrupt officials from damaging the forest is not recognised.
B-schools to move SC against University Grants Commission,Business Standard,28 Dec 2013,http://www.business-standard.com/article/management/b-schools-to-move-sc-against-university-grants-commission-113122800580_1.html,“Public universities are corrupt and inefficient. AICTE has brought in some transparency and reform in technical education through e-governance. We don't want ...
RTI Judgement Series: Plots for poor in Delhi's Palam village ...,Moneylife,5 Jul 2013,http://www.moneylife.in/article/rti-judgement-series-plots-for-poor-in-delhis-palam-village-usurped-by-criminals/33482.html,Copy of the FIR lodged against this corrupt pradhan. 4. Copy of the FIR lodged against BDO(S-W) concerned. In his reply the PIO mentioned that the required ...
Campaign on auto mode,Business Standard (blog),24 Aug 2013,http://www.business-standard.com/article/politics/campaign-on-auto-mode-113082400631_1.html,(Who will you choose? One who is corrupt or one who is honest?) along with pictures of Dikshit and Kejriwal have not gone down well with the Delhi government ...
State of political trauma,Indian Express,15 Jun 2013,http://indianexpress.com/article/opinion/columns/state-of-political-trauma/,They trained masses to take to streets against businessmen who in Bengali eyes were corrupt. So strikes and lock-outs plagued industrial houses in Bengal ...
PMS Performance: The Good  the Average and the Ugly,Moneylife,6 Sep 2013,http://www.moneylife.in/article/pms-performance-the-good-the-average-and-the-ugly/34343.html,All this goes to show that India is represented by generally corrupt politicians who have deep rooted vested interests. Read below Nayak's compilation on the 40 ...
HC rejects IT officer's plea against sanction to prosecute,Business Standard,16 Nov 2013,http://www.business-standard.com/article/pti-stories/hc-rejects-i-t-officer-s-plea-against-sanction-to-prosecute-113111600746_1.html,It was alleged that he indulged in corrupt practices and thereby accumulated assets exceeding Rs 1.27 crore disproportionate to his known sources of income  ...
Op-Ed: What's Wrong With the Congress,NDTV,13 Dec 2013,http://www.ndtv.com/opinion/op-ed-whats-wrong-with-the-congress-654425,... other dissidents would break away Raman Singh's government while in MP  they tried to project the chief minister and his wife as being 'greedy' and 'corrupt'.
IAS: guardians or palace guards?,Business Standard,16 Aug 2013,http://www.business-standard.com/article/opinion/ias-guardians-or-palace-guards-113081601228_1.html,... Delhi  helped in reducing civil servants to servile courtiers and corrupt conspirators. Mrs Gandhi was known to shrug off corruption as a "global phenomenon".
UP Minister suspends Fatehpur CMO on charges of corruption,Business Standard,27 May 2013,http://www.business-standard.com/article/pti-stories/up-minister-suspends-fatehpur-cmo-on-charges-of-corruption-113052800266_1.html,Chief Medical Officer of Fatehpur has been suspended by Uttar Pradesh Family Welfare minister for dereliction of duty and alleged involvement in corrupt ...
IPL Spot-fixing: India should legalise betting to stop corruption  says ...,NDTVSports.com,23 May 2013,http://sports.ndtv.com/indian-premier-league-2013/news/208228-ipl-spot-fixing-india-should-legalise-betting-to-stop-corruption-says-geoffrey-boycott,If somebody robs a bank in Yorkshire  it doesn't mean Yorkshiremen are corrupt  does it? It's the same here " he said. "It doesn't mean because you've caught ...
Ram Singh was kept in police custody illegally  claims his wife,Chandigarh Tribune,4 Apr 2013,http://www.tribuneindia.com/2013/20130405/punjab.htm,Dismissed head constable Ram Singh was remanded in police custody by a district court till April 7 after the police said it needed to question him on his links ...
It Isn't This  It Isn't This,Outlook,6 Jul 2013,http://www.outlookindia.com/magazine/story/it-isnt-this-it-isnt-this/286679,... essentially either feudal .. or fundamentalist or both and corrupt for sure ...** ... came from lower-middle classes - which isn't to say that they aren't corrupt - or ...
Arvind Subramanian: India's troubling trilemma,Business Standard,13 Dec 2013,http://www.business-standard.com/article/opinion/arvind-subramanian-india-s-troubling-trilemma-113121300990_1.html,And the middle class can invoke a corrupt  inefficient and redistributing state as reason or excuse to exit from the state and minimise its own tax contributions.
BBMP's new building byelaws gathering dust,Deccan Herald,23 Feb 2013,http://www.deccanherald.com/content/314494/bbmps-building-byelaws-gathering-dust.html,Seven months ago  the High Court had ruled that the Bruhat Bangalore Mahanagara Palike (BBMP) cannot continue to approve building plans under the BBMP ...
Latecomer RTO staff get earful from Transport minister,Deccan Herald,3 Jul 2013,http://www.deccanherald.com/content/342602/latecomer-rto-staff-get-earful.html,these corrupt government staff of our beloved country will never improve  they are ... What about the highly corrupt system prevailing at RTOs you cannot get any ...
Is UID-linked cash transfer a good idea?,Business Standard,9 Jan 2013,http://www.business-standard.com/article/opinion/is-uid-linked-cash-transfer-a-good-idea-113011000086_1.html,Ghost and duplicate beneficiaries exist in schemes such as pension and PDS — benefits are either used by their families or by corrupt dealers. The Andhra ...
Egypt to put ex-leader Hosni Mubarak under house arrest,NDTV,21 Aug 2013,http://www.ndtv.com/world-news/egypt-to-put-ex-leader-hosni-mubarak-under-house-arrest-532361,"This is an absurd charade by the judiciary  the army  and the police in order to reinstate Mubarak and his corrupt regime and to rob the people of their revolution ...
Bihu  Bollywood & ULFA,Times of Assam,7 May 2013,https://www.timesofassam.com/social/bihu-bollywood-ulfa/,Just on the eve of Bohag Bihu i.e. on 10th April ULFA had issued a statement requesting the Bihu Organizing Committees and the artists of Assam not to stage or ...
Crime and corruption,Chandigarh Tribune,14 Nov 2013,http://www.tribuneindia.com/2013/20131115/edit.htm,He had closely observed the Akali Dal's movement for freeing the gurdwaras from the corrupt and degenerated control of the mahants. Between 1921-25  over ...
The gallows,Chandigarh Tribune,13 Sep 2013,http://www.tribuneindia.com/2013/20130914/edit.htm,THE award of capital punishment to all four accused in the Nirbhaya case does not come as a surprise. The fifth accused  a juvenile  has already been ...
A year since Delhi rape  women see key changes,NDTV,15 Dec 2013,http://www.ndtv.com/india-news/a-year-since-delhi-rape-women-see-key-changes-544696,"The system is corrupt and many succeed in bribing their way out." For all the attention given to Nirbhaya's case  daily indignities and abuse continue unabated ...
The Wolverine movie review,NDTV,25 Jul 2013,http://movies.ndtv.com/movie-reviews/the-wolverine-movie-review-849,There he finds himself embroiled in a complicated family crisis involving yakuza  samurai  corporate bosses and corrupt politicians. To ensure that no Japanese ...
Bribe and blood ties,Frontline,15 May 2013,http://www.frontline.in/cover-story/bribe-and-blood-ties/article4711078.ece,The UPA government  which has become a byword for nepotistic and corrupt governance  is rocked by one more case involving a nephew pulling the strings for ...
India's missing daughters,Reuters India (blog),9 May 2013,http://blogs.reuters.com/photographers-blog/2013/05/09/indias-missing-daughters/,Living on a construction site where they work  they earn around $4 a day and have to rely on the police  who have a reputation for being inactive and corrupt ...
Global chains hit the slow lane as cash & carry format turns 10 in India,Business Standard,2 Dec 2013,http://www.business-standard.com/article/companies/global-chains-hit-the-slow-lane-as-cash-carry-format-turns-10-in-india-113120300031_1.html,While Walmart has frozen expansion over internal investigations linked to the US' Foreign Corrupt Practices Act (FCPA)  the lone Indian player  Reliance Market  ...
Empowering babus,Chandigarh Tribune,1 Nov 2013,http://www.tribuneindia.com/2013/20131102/edit.htm,In a belated response to the killing of five Indian soldiers on the Line of Control (LoC) near Poonch  Defence Minister AK Antony says he has given the Army a ...
Aamir Khan  David Cameron meet to discuss gender inequality,NDTV,19 Feb 2013,http://movies.ndtv.com/bollywood/aamir-khan-david-cameron-meet-to-discuss-gender-inequality-631882,Aamir Khan  who has been at the forefront of a debate on gender equality  on Tuesday blamed the "patriarchal mindset" of people for the lesser status of women ...
Sachin Tendulkar's IPL retirement shocked Mumbai Indians  says ...,Cricket Country,27 May 2013,http://www.cricketcountry.com/news/sachin-tendulkar-s-ipl-retirement-shocked-mumbai-indians-says-rohit-sharma-27096,Mumbai Indians' skipper Rohit Sharma said on Tuesday that Sachin Tendulkar's decision to retire from the Indian Premier League (IPL) came as a shock to the ...
Jet-Etihad deal: Chronicle of coincidental collusions,Moneylife,5 Jul 2013,http://www.moneylife.in/article/jet-etihad-deal-chronicle-of-coincidental-collusions/33487.html,The deal was finalised only after receiving appropriate ministerial push. Here is the chronology of how Jet pulled it off. Incidentally  well before the FDI limit in ...
(B)looming disasters,Citizen Matters,11 Apr 2013,http://bangalore.citizenmatters.in/articles/5100-blooming-disasters,The BBMP is so corrupt it cannot be correct.It is better to handover to a foreign to run.The present BBMP officials they corrupt and they anti social elements.
GROUND ZERO,Chandigarh Tribune,23 Feb 2013,http://www.tribuneindia.com/2013/20130224/ground.htm,Months later  Fonseka did make a run for the Presidency  but was jailed by the government after being found guilty of corrupt deals during his tenure as army ...
India to Ask Investment Banks to Sign Integrity Pacts,Wall Street Journal (India),10 Apr 2013,http://www.wsj.com/articles/SB10001424127887323741004578415864136759762,Meanwhile  bidders commit to "take all measures necessary to prevent corrupt practices  unfair means and illegal activities" for bidding or while executing the ...
Karnataka's north: The wretched of the earth,Business Standard,30 Apr 2013,http://www.business-standard.com/article/economy-policy/karnataka-s-north-the-wretched-of-the-earth-113050100049_1.html,"There have of course been other corrupt governments in Karnataka. But the ones that got re-elected typically had a major rural initiative like land reforms or ...
BPAC launches leadership training to clip the wings of ...,Citizen Matters  Bangalore,7 Dec 2013,http://bangalore.citizenmatters.in/articles/bpac-launches-leadership-training-to-clip-the-wings-of-misgovernance,In such situations  "why will they not become corrupt?" he asked. He also criticised the way mainline political parties choose their candidates. In a nutshell  it was ...
Zila Ghaziabad Movie Review,Filmi Tadka,23 Feb 2013,http://www.filmitadka.in/201302233108/movie-reviews/zila-ghaziabad-movie-review.html,Lately  it is the cop sagas with the men in khaki being shown tad corrupt  tad righteous a la Dabangg style. But they forget that what worked for Dabangg won't ...
Venomous and lyrical,Calcutta Telegraph,16 Aug 2013,http://www.telegraphindia.com/1130817/jsp/opinion/story_17236632.jsp,He implicates all political parties for this situation  from the Congress who first recruited them to fight  to the Communists whose ideals gave way to corrupt ...
Portuguese march against austerity  demand government step down,Reuters India,2 Mar 2013,http://in.reuters.com/article/portugal-protests-austerity-idINDEE92105O20130302,"This government has left the people on bread and water  selling off state assets for peanuts to pay back debts that were contracted by corrupt politicians to ...
'Speed money' puts brakes on India's retail growth,NDTV,4 May 2013,http://www.ndtv.com/india-news/speed-money-puts-brakes-on-indias-retail-growth-521209,"The nexus runs far deeper than just a few corrupt officials at the local level " said Jiwani  noting that if a retailer approaches an official directly he will not be told ...
Mangalore: 'Hidden government' controlling the system - Dinesh ...,Daijiworld.com,15 Dec 2013,http://www.daijiworld.com/news/news_disp.asp?n_id=207268,Mangalore  Dec 15: The valedictory ceremony of the two-day 'Jana Nudi' organized by Abhimatha was held at Kalaangann  Shaktinagar here on Sunday  ...
India to host World T20 in 2016,Wisden India,29 Jun 2013,http://www.wisdenindia.com/cricket-news/india-host-worldt20-2016/67902,But there continues to be a very small minority whose involvement with corrupt practices discredits themselves and their colleagues  and tarnishes the reputation ...
1336 rape cases in Kashmir in 7 years  conviction rate woefully low,Milli Gazette,4 Jun 2013,http://www.milligazette.com/news/7188-1336-rape-cases-in-kashmir-in-seven-years-conviction-rate-woefully-low,We alone can't blame government for probes and other investigations as the whole system is corrupt and instead of punishing the guilty  they are given awards ...
Akshay offers three film deal to Shiv Pandit,Jagran Post,8 Jul 2013,http://post.jagran.com/impressed-by-performance-akshay-offers-three-film-deal-to-shiv-pandit-1373286361,Shiv  who was popular for his role as Hanuman Prasad  a corrupt cop in comedy TV show "F.I.R."  before he took to the big screen  will be seen sharing screen ...
Manmohan most honest politician  but people don't want him to ...,India Today,16 Aug 2013,http://indiatoday.intoday.in/story/manmohan-singh-honest-politician-upa-india-today-cvoter-mood-of-the-nation-opinion-poll/1/299854.html,About 27 per cent people said he doesn't communicate  21 per cent felt that he presides over a corrupt government  20 per cent thought he lacks authority and ...
Tesco to enter Indian retail space through joint venture with Tatas,Business Standard,17 Dec 2013,http://www.business-standard.com/article/companies/tesco-to-enter-indian-retail-space-through-joint-venture-with-tatas-113121700663_1.html,Apart from internal investigations into Walmart's compliance with the US' Foreign Corrupt Practices Act  the chain had to face political opposition in India for its ...
Delhi exit polls: Congress biggest loser  BJP has slight edge over AAP,Zee News,4 Dec 2013,http://zeenews.india.com/Assembly-Elections-2013/Delhi-Polls/delhi-exit-polls-congress-biggest-loser-bjp-has-slight-edge-over-aap_894372.html,... daily basis....it must be easy to complain against corrupt officials and he must be ... Its the same BJP which is also full of corrupt and incumbent creatures.
'I saw a different Jagan on other side of the coin',The New Indian Express,4 May 2013,http://www.newindianexpress.com/states/andhra_pradesh/I-saw-a-different-Jagan-on-other-side-of-the-coin/2013/05/05/article1575611.ece,Dadi was always in the forefront to attack Jagan over his alleged corrupt practices. But  on Saturday  he gave an explanation that he had to attack Jagan as it ...
Bridging the skill gap in Naxal heartland,Business Standard,4 Aug 2013,http://www.business-standard.com/article/companies/bridging-the-skill-gap-in-naxal-heartland-113080500019_1.html,Bullets  more than ballots  ruled this belt. And  children had ambitions of joining the revolution against a "corrupt system" that neglected their area.
To India My Native Land,SpeakingTree (blog),22 Sep 2013,http://www.speakingtree.in/blog/to-india-my-native-land,In this poem  Derozio personifies India and talks to her in a monologue. Derozio talks about the glorious past of India. He tells her (while Derozio does not hint at ...
AAP protests renaming of club after Sachin Tendulkar,Jagran Post,11 Nov 2013,http://post.jagran.com/aap-protests-renaming-of-club-after-sachin-tendulkar-1384222739,... went to Tendulkar's Bandra residence on Monday morning urging him "not to give his name or associate himself in any manner with a corrupt body like MCA".
Congress' Game-plan in Andhra Pradesh,Mainstream,20 Oct 2013,http://www.mainstreamweekly.net/article4525.html,For  until those elections it was confident that it would write-off what has been called 'Jagan phenomenon' in AP politics by exposing the corrupt practices ...
Kejriwal to be Delhi Chief Minister  swearing-in ceremony at Ramlila ...,Jagran Post,23 Dec 2013,http://post.jagran.com/kejriwal-to-be-delhi-chief-minister-swearingin-ceremony-at-ramlila-maidan-1387779357,Lokpal Bill aimed at battling corruption and covering all employees will be passed within 15 days of coming to power. Around 3 000 'Mohalla Sabhas' to be set ...
Right To Education: A Successful Failure Of India,Cjnews India (blog),12 Feb 2013,http://cjnewsind.blogspot.com/2013/02/right-to-education-successful-failure.html,Further  by introducing the age slab of 6 to 14  all Inconsistencies  Violations and Corrupt Practices happening at the Pre School/Nursery Admission stage have ...
Meet Miss Malini,Reuters India (blog),12 Feb 2013,http://blogs.reuters.com/photographers-blog/2013/02/12/meet-miss-malini/,I'll be the first one to complain about crumbling roads  horrid traffic  corrupt politicians  impossible bureaucracy and the gulf between rich and poor. But you'd ...
Asian Youth Games 'overage' fiasco tells sorry tale of Indian athletics,Sportskeeda (blog),21 Aug 2013,http://www.sportskeeda.com/athletics/asian-youth-games-overage-fiasco-tells-sorry-tale-of-indian-athletics,Having been suspended by the IOC for accommodating the corrupt lot that masterminded the 2010 Commonwealth Games scam  the Indian Olympic ...
As protest looms  Cambodia's strongman Hun Sen faces restive ...,Reuters India,5 Sep 2013,http://in.reuters.com/article/cambodia-youth-idINDEE98503520130906,About 70 percent of Cambodia's 14 million people are under 30  a demographic whose growing political clout is challenging the country's aging and corrupt ...
Lampooned  petrol curfew hastily buried,Calcutta Telegraph,2 Sep 2013,http://www.telegraphindia.com/1130903/jsp/nation/story_17305398.jsp,Why don't they instead shut down government offices for half the day  they would be saving billions of rupees because this is such a corrupt government ” he told ...
Charities say graft  tax evasion hold back poor countries' development,Reuters India,10 Apr 2013,http://in.reuters.com/article/india-tax-haven-graft-idINDEE93908B20130410,... lower its tax bill - as well as money laundering and legal loopholes that allow corrupt  criminal and commercially tax-evading money to move across borders.
16 Indians among World's '500 Powerful People',Siliconindia.com,7 May 2013,http://www.siliconindia.com/news/general/16-Indians-among-Worlds-500-Powerful-People-nid-146567-cid-1.html,Bangalore: With responsibilities come great power and Foreign Policy Magazine listed the 500 most powerful people on the planet. In the present world that ...
Parties return to grassroots in Andhra ahead of panchayat polls,India Today,5 Jul 2013,http://indiatoday.intoday.in/story/political-parties-panchayat-elections-in-andhra-pradesh/1/287073.html,Auctioning of posts was a corrupt practice under Section 211(1) of the Andhra Pradesh Panchayat Raj Act 1994 and this is also an electoral malpractice under ...
Film Review | Runner Runner,Livemint,3 Oct 2013,http://www.livemint.com/Leisure/lxaBxFB0I8vwWAXGHqw2GN/Film-Review--Runner-Runner.html,Usual complications take over in the form of corrupt policemen  the assistant lady who walks around seductively but whose loyalty is as weak as the script  pet ...
Afghan  Myanmar women win Magsaysay awards for work amid ...,Livemint,24 Jul 2013,http://www.livemint.com/Politics/V4773pzOJC0c8x33SiAAdN/Afghan-Myanmar-women-win-Magsaysay-awards-for-work-amid-con.html,... Indonesia's independent anti-corruption government body  the Komisi Pemberantasan Korupsi (KPK)  which has a 100% rate of conviction of corrupt officials ...
Homosexuality a `bad addiction`: Baba Ramdev,Zee News,11 Dec 2013,http://zeenews.india.com/news/nation/homosexuality-a-bad-addiction-baba-ramdev_895992.html,It is a corrupt format of mind plane to be homo. the natural phenomenon is to be ... offcourse he can explain......corrupt congress govt wants to book him and other ...
The grip of a self-fulfilling prophecy,Livemint,22 Aug 2013,http://www.livemint.com/Opinion/PaYNkKzgngFiYoLqHqjIQK/The-grip-of-a-selffulfilling-prophecy.html,... through a creaking and corrupt delivery system  and recklessly force banks to raise agricultural credit sevenfold (government statistics from the start of the UPA ...
Students allege ragging  boycott classes,Chandigarh Tribune,30 Sep 2013,http://www.tribuneindia.com/2013/20131001/delhi.htm,A 45-year-old man allegedly committed suicide by hanging himself from the railings of the stairs at the MP club in North Avenue. The man has been identified by ...
Shortcut Romeo movie review,NDTV,20 Jun 2013,http://movies.ndtv.com/movie-reviews/shortcut-romeo-movie-review-828,The film's most vivid interludes go back to Neil's childhood to show how he learned to be corrupt  acquisitive  and inquisitive  at a tender age. Some of the action ...
After 3-year shock  mom says hang him,Calcutta Telegraph,31 Aug 2013,http://www.telegraphindia.com/1130901/jsp/frontpage/story_17298121.jsp,“Since he is no longer a minor  he will not be allowed to stay with juvenile offenders lest he corrupt their minds. Now the focus will be mainly on his reformation ...
8 Useful Tips To Safeguard Your Online Privacy And Activities !,Dazeinfo,30 Aug 2013,https://dazeinfo.com/2013/08/31/8-useful-tips-to-safeguard-your-online-privacy-and-activities/,There is plenty of corrupt  virus and malware loaded software online. These can easily infect your computer or Smartphone while you are surfing the Internet  ...
Santa act to pull in votes,Calcutta Telegraph,13 Aug 2013,http://www.telegraphindia.com/1130814/jsp/frontpage/story_17229646.jsp,He has been punishing the corrupt and also working for the welfare of the poor. The cheap rice scheme has been a success despite criticism ” said a senior BJD ...
Pakistan brings back death penalty   to anger of rights groups,Reuters India,5 Jul 2013,http://in.reuters.com/article/pakistan-death-penalty-idINDEE96404T20130705,Members of Pakistan's air force salute as they raise the national flag during Defense Day  or Pakistan's Memorial Day  ceremonies at the mausoleum of ...
Kareena Kapoor open to doing intimate scenes  if the script demands,NDTV,9 Sep 2013,http://movies.ndtv.com/bollywood/kareena-kapoor-open-to-doing-intimate-scenes-if-the-script-demands-613796,Satyagraha reflects the uprising of the middle class against a corrupt and unjust system and how a turn of events leads to a movement to challenge the status ...
BJP seeks public views on 'chargesheet' on govt's failures to corner ...,Indian Express,14 Aug 2013,http://archive.indianexpress.com/news/bjp-seeks-public-views-on-chargesheet-on-govts-failures-to-corner-upa/1155448/,The series of corruption making the Congress-led UPA as the most corrupt government in independent India will be highlighted " the statement said. The two ...
Mumbai Mirror's Gihana Khan's sex video leaked,indiatvnews.com,18 Jan 2013,http://www.indiatvnews.com/entertainment/masala/mumbai-mirrors-gihana-khans-sex-video-leaked-1079.html,The movie exposing the nexus between powerful  corrupt dance bar owners and the Mumbai police is released today i.e  18 January. Well time will tell for its box ...
Kerala opposition demands CM's resignation after minister quits,Livemint,2 Apr 2013,http://www.livemint.com/Politics/ZDirrLrQ7EzUIEnDbJhkPK/Kerala-minister-KB-Ganesh-Kumar-quits-on-domestic-violence.html,... was “victim of a conspiracy” which was the result of his firm stand against encroachment of forest land and corrupt dealings. He said he was “trapped in a false ...
Pakistan's Nawaz Sharif calls for warmer ties with India,Livemint,7 May 2013,http://www.livemint.com/Politics/RviVkyzsZjqzO9tOTapVVO/Pakistans-Nawaz-Sharif-calls-for-warmer-ties-with-India.html,The liberal  secular-leaning PPP has a long history of challenging the military's influence in politics while the military sees the party as corrupt and ineffective.
