No holds barred  cynical campaign ends in TN,NetIndian,11 Apr 2011,http://netindian.in/news/2011/04/11/00012441/no-holds-barred-cynical-campaign-ends-tn,The AIADMK  after taking up the 2G spectrum scam involving former Communications Minister A Raja  turned its attention to the alleged corrupt and family rule of ...
Lee Chong Wei now wants to go for ultimate glory,Firstpost (blog),1 Jul 2011,http://www.firstpost.com/blogs/lee-chong-wei-now-wants-to-go-for-ultimate-glory-34748.html,Datuk Lee Chong Wei is like a dancer on the court — nimble  graceful and supremely athletic. In the normal course of events  just watching him would bring ...
China ex-official warns crackdown risks instability,Reuters India,8 Jul 2011,http://in.reuters.com/article/idINIndia-58149620110708,Bao Tong (R)  the most senior Chinese official jailed after the 1989 student protests for democracy is seen in this undated photo beside his former mentor  Zhao ...
Supreme Court sets up probe into black money,Reuters India,4 Jul 2011,http://in.reuters.com/article/idINIndia-58071920110704,India is the world's ninth most corrupt country  with 54 percent of the population paying a bribe in the last 12 months  according to a report by Transparency ...
Gorbachev says Russia heading towards turmoil,Reuters India,21 Sep 2011,http://in.reuters.com/article/idINIndia-59468920110921,... Soviet Union in 1991 following reforms he instigated  Gorbachev portrayed Russia as having a brittle and corrupt political system that could soon face turmoil.
Ramlila remarks: Kiran Bedi  Om Puri could face 15 days in jail,Times of India,29 Aug 2011,http://timesofindia.indiatimes.com/india/Ramlila-remarks-Kiran-Bedi-Om-Puri-could-face-15-days-in-jail/articleshow/9789982.cms,NEW DELHI: Bollywood actor Om Puri and Team Hazare member Kiran Bedi face privilege proceedings in Parliament for their "derogatory and defamatory" ...
'Investors' are realty's mafia; that's why prices can't come down,Firstpost,23 Dec 2011,http://www.firstpost.com/business/investors-are-realtys-mafia-thats-why-prices-cant-come-down-163089.html,The real estate market in India is an ideal example of the subversion of demand-supply economics. Everyone knows the real demand for both residential and ...
Mangalore Sub-jail's Endless Tale of Woes,Daijiworld.com,14 Jun 2011,http://www.daijiworld.com/news/news_disp.asp?n_id=105477,Mangalore  Jun 15: Mangalore sub-jail has been making news for quite some time now for one reason or the other. While conducting raids and seizing drugs ...
The 15 paise knot,Tehelka,9 Jul 2011,http://archive.tehelka.com/story_main50.asp?filename=Ne160711The.asp,In Rajasthan's Bamnor  villagers have to bribe to get their due. Will the proposed Lokpal reach out to them  asks Anumeha Yadav ...
Namma Metro as the metaphor of 'Avara' Avarice,Churumuri,20 Sep 2011,https://churumuri.wordpress.com/2011/09/20/namma-metro-as-the-metaphor-of-avara-avarice/,For a State that makes much of its nela (land) and jala (water)  it is no surprise that all the rapacious rats who have been caught with their half-pants down—B.S. ...
At the core: Glimpses of Surat's glory,Times of India,9 Mar 2011,http://timesofindia.indiatimes.com/city/ahmedabad/At-the-core-Glimpses-of-Surats-glory/articleshow/7668228.cms,Surat is one of the fastest growing cities in the world. A town by the river Tapi  it holds its place in history with illuminating memories of a glorious past. This was ...
Harvard removes Swamy-taught courses  citing his piece,Firstpost,7 Dec 2011,http://www.firstpost.com/world/harvard-removes-swamy-taught-courses-citing-his-piece-150531.html,New York: Harvard University has decided to remove courses taught by Janata Party president Subramanian Swamy at its annual summer school session  ...
Bangladesh removes Nobel winner Yunus as Grameen Bank MD,Reuters India,2 Mar 2011,http://in.reuters.com/article/idINIndia-55262720110302,Nobel Peace Prize winner Muhammad Yunus speaks at a Granmeen America open house at St. John's University in New York April 18  2009. Bangladesh's ...
Hundreds protest in south China over land grab,Reuters India,23 Sep 2011,http://in.reuters.com/article/idINIndia-59501220110923,"The officials here are corrupt and are colluding with the developers " he said. Four people were detained for organising the protests on Wednesday  Shanwei's ...
Toll relief in Adityapur-Kandra road revamp,Calcutta Telegraph,7 Jan 2011,http://www.telegraphindia.com/1110108/jsp/frontpage/story_13408367.jsp,It also demanded action against the construction company and engineers of the road construction department as per Bihar Specified Corrupt Practices Act-1983.
NDRI confers degrees on 132,Chandigarh Tribune,19 Feb 2011,http://www.tribuneindia.com/2011/20110220/haryana.htm,This shows how double-faced they are ” asserted Sharma. For a change  Hooda  too  termed Chautala as “the most corrupt Chief Minister the state had ever ...
Conviction rates for murder abysmal,Times of India,3 Jun 2011,http://timesofindia.indiatimes.com/india/Conviction-rates-for-murder-abysmal/articleshow/8720229.cms,NEW DELHI: There have been nearly 1.27 lakh murders between 2005 and 2009 in the country. Yet  just 44 601 people have been convicted for them in the last ...
Beware  the BDA fuels land grabbing,Citizen Matters,4 Sep 2011,http://bangalore.citizenmatters.in/articles/3340-beware-bda-fuels-land-grabbing,Much of the flak in Balasubramanian's report goes to BDA's Legal Wing  which it says  has been both ineffective and corrupt. Headed by a retired senior judicial ...
Times of India maintains its all-India dominance,Times of India,22 Dec 2011,http://timesofindia.indiatimes.com/india/Times-of-India-maintains-its-all-India-dominance/articleshow/11215000.cms,Across India  TOI continued to be the overwhelming numero uno with an average issue readership of 74.7 lakh  almost double that of the second placed ...
Stock markets take a beating: time to buy?,Equitymaster.com,9 Feb 2011,https://www.equitymaster.com/ht/detail.asp?date=02/09/2011&story=8,The signs of weakness in the markets were there in December  2010. Foreign flows  as I have often said  set the price of India assets but what happens in the ...
Filipinos re-enact Jesus's crucifixion in Easter ritual,Reuters India,22 Apr 2011,http://in.reuters.com/article/idINIndia-56515320110422,Children play on the wooden crosses that will be used by penitents as part of an annual ritual to re-enact the crucifixion of Jesus Christ on Good Friday in Cutud  ...
In the market for votes  the best deal will triumph,Tehelka,13 May 2011,http://archive.tehelka.com/story_main49.asp?filename=Ne210511TAMIL_NADU.asp,Snippet not available
On Parallel Bars,Outlook,26 Mar 2011,http://www.outlookindia.com/magazine/story/on-parallel-bars/271049,Snippet not available
Dalits  youth may tilt the scales in tight electoral race,Livemint,11 Apr 2011,http://www.livemint.com/Politics/NXnv90oY0G27JXfCol2zUM/Dalits-youth-may-tilt-the-scales-in-tight-electoral-race.html,Snippet not available
