CREDAI urges MPs to consider real estate reforms,Hindu Business Line,10 Dec 2012,http://www.thehindubusinessline.com/news/real-estate/credai-urges-mps-to-consider-real-estate-reforms/article4184674.ece,“The bills appear to be one-sided as they seek to punish errant developers while ignoring defaulting buyers and corrupt officials. (While provisions) in the Land ...
Udupi: School Children Create Mini-India on Republic Day,Daijiworld.com,26 Jan 2012,http://www.daijiworld.com/news/news_disp.asp?n_id=128363,It is due to corrupt Mir Jaffer that the patriotic army of Sirajuddaula faced defeat against the army of Robert Clive  which set the foundation for Imperial rule in ...
9 Gorgeous and Stunning Looking Games of 2013,Gamepur,18 Oct 2012,http://www.gamepur.com/feature/9522-9-gorgeous-and-stunning-looking-games-2013.html%20%20,... city has been encased in a Nanodome created by the corrupt Cell Corporation. ... players must use any means at their disposal to take down a corrupt system.
Akhilesh Yadav's Kranti Rath Enters Lucknow,Daijiworld.com,8 Jan 2012,http://www.daijiworld.com/news/news_disp.asp?n_id=126831,... Akhilesh remarked: "There is depression and despair everywhere in this regime but the confidence of youths is signalling that the end of this corrupt rule is ...
India keen on having nuclear waste repository,Deccan Herald,14 Feb 2012,http://www.deccanherald.com/content/227293/india-keen-having-nuclear-waste.html,It is the hall mark of the corrupt modern civilization. Kudiyan Sasi • 2 years ago ... Corrupt modern civilization's devilish proponents. Given enough time Modern ...
The new mafia Raj,Deccan Herald,17 Mar 2012,http://www.deccanherald.com/content/235260/mafia-raj.html,... Golden Quadrilateral  was shot dead after he wrote to the then Prime Minister about the unholy nexus among corrupt officials  politicians and contractors.
Mangalore: SFI Demands Apology from Gadkari over Vivekananda ...,Daijiworld.com,6 Nov 2012,http://www.daijiworld.com/news/news_disp.asp?n_id=154824,Addressing the protesters  Jeevan Raj Kuthar  said that Nithin Gadkari's mind is filled with corruption and hence  he feels that others minds are also corrupt.
Growth or Equality: Two Competing Visions For America's Future,CounterCurrents.org,13 Sep 2012,http://www.countercurrents.org/korten130912.htm,When  however  the differences become extreme and the winners distinguish themselves primarily by their willingness to engage in morally corrupt behavior for ...
Is this why DMK supported Pranab Mukherjee?,Rediff,4 Jul 2012,http://www.rediff.com/business/column/column-is-this-why-dmk-supported-pranab-mukherjee/20120704.htm,Terrorists  drug peddlers and corrupt politicians all launder money - the money from their crime has to be cleansed  passed of as clean lily white money and put ...
Wal-Mart's many bribes in Mexico made the illegal legal,Livemint,18 Dec 2012,http://www.livemint.com/Companies/DmHiZykh3eKzNKwezhkswK/Report-details-extensive-WalMart-bribery-in-Mexico.html,The Times' examination reveals that Wal-Mart de Mexico was not the reluctant victim of a corrupt culture that insisted on bribes as the cost of doing business.
Corruption cannot be eradicated  says Parekh,Times of India,4 Nov 2012,http://timesofindia.indiatimes.com/business/india-business/Corruption-cannot-be-eradicated-says-Parekh/articleshow/17094055.cms,Parekh said  "I know many crony capitalists  but I know many more corrupt politicians (as well) " but declined to name anyone. Recommended By Colombia.
Mangalore: 'Zephyr 12'  National Level PG Management Fest ...,Daijiworld.com,27 Mar 2012,http://www.daijiworld.com/news/news_disp.asp?n_id=132370,Fr Henry Mascarenhas  in his address stressed that our nation should be corrupt free and the task to achieve the same should be borne by the youth. Fr Valerian ...
Lokayukta Under a Cloud Over Extension,Tehelka,29 Mar 2012,http://archive.tehelka.com/story_main52.asp?filename=Ws290312Lokayukta.asp,According to him  this move will “benefit the corrupt ministers of the previous BSP government”  who will now seek judicial intervention alleging that the inquiry ...
CAMERAMAN GANGA THO RAMBABU movie review: Ensures ...,Bollywood Life,19 Oct 2012,http://www.bollywoodlife.com/south-gossip/cameraman-ganga-tho-rambabu-movie-review-ensures-unadulterated-entertainment/,When a righteous journalist is killed by a corrupt politician named Rana Babu  a socially responsible mechanic Rambabu  played by Pawan Kalyan  turns to ...
Sleepless in Shanghai,Livemint,26 Oct 2012,http://www.livemint.com/Leisure/v4xO82oWDwwxNqT9xCieVM/Sleepless-in-Shanghai.html,Reeking with gangster nostalgia  it provides an in-depth  and exciting  narrative of early 20th century Shanghai with its colonies of corrupt foreigners  opium dens ...
EPPADI MANASUKKUL VANDHAI,BehindWoods,10 Aug 2012,http://www.behindwoods.com/tamil-movie-reviews/reviews-2/aug-12-02/eppadi-manasukkul-vandhai-review.html,Another character worth mentioning is Ravi Kalai  who plays the corrupt cop. His character is strongly fleshed out in the beginning but it gradually falls into the ...
Expired litchi drink seized in Bongaigaon,Assam Tribune,1 Apr 2012,http://www.assamtribune.com/scripts/detailsnew.asp?id=apr0212/state07,The locals blamed the Food Inspector for encouraging the corrupt traders to sell products which are unfit for human consumption openly in the market. It is to be ...
Social Responsibility for SMEs,Hindu Business Line,22 Jan 2012,http://www.thehindubusinessline.com/news/education/social-responsibility-for-smes/article2823118.ece,... adhering to basic social security regulations such as minimum wages  ESI  PF  etc  shunning cash-based transactions  and avoiding corrupt practices to solicit ...
5 Sebi rules that limit risks in MF schemes,Livemint,18 Mar 2012,http://www.livemint.com/Money/rq5t04qFsrjPLKdpRa5YSK/5-Sebi-rules-that-limit-risks-in-MF-schemes.html,In June 2010  Sebi accused HDFC Asset Management Co. Ltd  one of India's largest fund houses  of front-running. This is a corrupt practice that is frowned upon ...
The arrogant Indian (woman),Livemint,5 Oct 2012,http://www.livemint.com/Leisure/BzoR8NiAEam1p3g2HnQBLO/The-arrogant-Indian-woman.html,In India it's probably the second most commonly used word to describe a politician or a political party after the word corrupt. The BJP thinks the Congress is ...
Akhilesh's Wife to Contest Kannauj By-poll,Daijiworld.com,5 Jun 2012,http://www.daijiworld.com/news/news_disp.asp?n_id=139576,Attacking the BSP government  Dimple said due to its “corrupt” practices the previous government had put the State on backward track and made the people of ...
Indian Premier League is business  entertainment: Pak paceman ...,India Today,5 Oct 2012,http://indiatoday.intoday.in/story/pakistan-paceman-shoaib-akhtar-ipl-cricket-ipl/1/223632.html,Snippet not available
Review: 'Jaane Bhi Do Yaaro 'is the best film of the year,Daily News & Analysis,3 Nov 2012,http://www.dnaindia.com/entertainment/review-review-jaane-bhi-do-yaaro-is-the-best-film-of-the-year-1759825,Snippet not available
Team Anna gets new people. But will their gameplan be a game ...,India Today,15 Nov 2012,http://indiatoday.intoday.in/story/team-anna-gets-new-people.-but-will-their-gameplan-be-a-game-changer/1/229234.html,Snippet not available
