Sanjay Dutt should face sentence gracefully: Shaheed Bhagat ...,Indian Express,31 Mar 2013,http://archive.indianexpress.com/news/sanjay-dutt-should-face-sentence-gracefully-shaheed-bhagat-singhs-kin/1095644/,Sandhu said that the government "shrewdly divided" social activists Anna Hazare  Arvind Kejriwal and Baba Ramdev who wanted to change the "corrupt system" ...
A for apple? Not if Modi teaches the alphabets,Calcutta Telegraph,10 Sep 2013,http://www.telegraphindia.com/1130911/jsp/nation/story_17336368.jsp,“The more corrupt a Congressman  the more prosperous he becomes.” He went on to cite “an example that would be appropriate to Rajasthan”. “If there are two ...
Irrigation scam comments may soil Prithviraj Chavan's image,Livemint,7 Oct 2013,http://www.livemint.com/Opinion/FjB2u5uewH6T9WrUDZ0AdM/Irrigation-scam-comments-may-soil-Chavans-image.html,To be sure  Chavan's statement will be clearly perceived as an attempt to protect corrupt politicians in his government and save the party's alliance with the ...
What is North East to India,Times of Assam,9 Sep 2013,http://www.timesofassam.com/exclusive/what-is-north-east-to-india/,India is aiming to become a developed nation by the year of 2020. But my questions are – will she become a developed nation if armed conflicts in Jammu and ...
LPG price hiked by Rs 220,Deccan Herald,1 Jan 2014,http://www.deccanherald.com/content/378038/lpg-price-hiked-rs-220.html,For the third time in a month  oil marketing companies on Wednesday increased by Rs 220 per cylinder the price of non-subsidised cooking gas (LPG) cylinder  ...
BJP smacks lips at onion tears,Calcutta Telegraph,24 Oct 2013,http://www.telegraphindia.com/1131025/jsp/nation/story_17492690.jsp,Now our target is to rid Delhi of the corrupt Congress ” Goel said  Gadkari and Harsh Vardhan by his side. The BJP had yesterday named Harsh Vardhan its ...
Big 2 cautious  others not so,Calcutta Telegraph,11 Jul 2013,http://www.telegraphindia.com/1130712/jsp/nation/story_17109004.jsp,The BJP also preferred to hold its horses  fearing any outright opposition may lead to the party being seen as backing corrupt politicians. “We have taken a ...
EXCLUSIVE - Former Syria defence minister defects in break with ...,Reuters India,4 Sep 2013,http://in.reuters.com/article/syria-crisis-defection-idINDEE9830BA20130904,Syria's President Bashar al-Assad (L) receives a gift from Syrian Defense Minister General Ali Habib during a dinner in honor of army officers on the 65th Army ...
FIR after paper runs anti-Kejriwal piece that Shanti Bhushan says he ...,Indian Express,13 Dec 2013,http://archive.indianexpress.com/news/fir-after-paper-runs-antikejriwal-piece-that-shanti-bhushan-says-he-didnt-write/1207275/,... mischievously raised the bogey of Gadkari's corruption and bracketed him with the Congress party's known corrupt politicians to show his 'secular' credentials.
India's wealthy must open gates and fight chaos,Livemint,2 Oct 2013,http://www.livemint.com/Opinion/fMtHXZd6CuqRul11HULH8I/Indias-wealthy-must-open-gates-and-fight-chaos.html,The culprits for this mess seem obvious: greedy politicians  corrupt bureaucrats and the greasy oligarchs who flatter and fund them. Many middle-class Indians ...
China Targets Big Pharma,Wall Street Journal (India),16 Jul 2013,http://www.wsj.com/articles/SB10001424127887323664204578607502156860618,... and Exchange Commission have been investigating whether a number of pharmaceutical makers  including Glaxo  violated the Foreign Corrupt Practices Act  ...
Somali Pirates Shift Course to Other Criminal Pursuits,Wall Street Journal (India),1 Nov 2013,http://www.wsj.com/articles/SB10001424052702304470504579165421385623670,The aggressive military response changed the risk-reward ratio for Somali piracy financiers  who must pay upward of 80% of their earnings to corrupt Somali ...
I complained about Moscow fixing episode  no one took it seriously ...,NDTVSports.com,23 Aug 2013,http://sports.ndtv.com/wrestling/news/212813-i-complained-about-moscow-fixing-episode-no-one-took-it-seriously-sushil-kumar,Advocating the "strictest punishment" for the match fixers  Sushil said wrestling should get rid of corrupt officials. Wrestling is struggling to make the Rio Olympics ...
Sen vs Bhagwati: Turn right or left? Or is there a middle way?,Livemint,25 Jul 2013,http://www.livemint.com/Opinion/zJK8mOiaXPORi4POmLCCJN/Turn-right-or-left-Or-is-there-a-middle-way.html,(d) Entitlement programmes such as MNREGA and PDS are wasteful and corrupt. The impending food security Bill has the potential to increase the scope of ...
New ways to distribute insurance policies,Reuters India (blog),27 Jul 2013,http://blogs.reuters.com/india-expertzone/2013/07/26/new-ways-to-distribute-insurance-policies/,On a rainy day in Mumbai  I was chatting with the taxi driver. It was a prolonged journey  made worse by a never-ending traffic jam. We talked about insurance ...
ED closes in on Koda aides,Calcutta Telegraph,21 Feb 2013,http://www.telegraphindia.com/1130222/jsp/frontpage/story_16591065.jsp,The money  acquired by Koda and his aides through corrupt means  was transferred to a number of close associates and companies in India and foreign ...
Aung San Suu Kyi reappointed as Myanmar opposition leader,Livemint,10 Mar 2013,http://www.livemint.com/Politics/htnCAyviLKqU19lucPodaI/Aung-San-Suu-Kyi-reappointed-as-Myanmar-opposition-leader.html,Experts question whether the party is ready to run an impoverished nation whose economy  education and health systems were left in tatters by the corrupt ...
Film Review | Jolly LLB,Livemint,14 Mar 2013,http://www.livemint.com/Leisure/11qEGjEj5z1JSFjv2LiEzM/Film-Review--Jolly-LLB.html,... the young man's system-bending family members  and the corrupt police officers who thwart the investigation. The best-written and most memorable character ...
If Busybee returned to Pedder Road,Livemint,17 Dec 2013,http://www.livemint.com/Opinion/x7KEF6SMCy8YSZTK95jv2N/If-Busybee-returned-to-Pedder-Road.html,Like after the Emergency Cho Ramaswamy was once asked if Indian journalists were so corrupt that they could be bought for two bottles of imported whiskey.
Sachin Tendulkar my superhero for life  says Virat Kohli,NDTV,19 Jul 2013,http://sports.ndtv.com/cricket/news/211069-sachin-tendulkar-my-superhero-for-life-says-virat-kohli,"In the game of cricket  hero is a person who respects the game and does not corrupt the game. The one who doesn't or corrupts the game  they are the villain.
Cardinals count down to papal conclave with final talks,Livemint,11 Mar 2013,http://www.livemint.com/Politics/5zQkY9cDljLMpW74SeSrvI/Cardinals-count-down-to-conclave-with-final-talks.html,That makes him attractive perhaps to those seeking reform of the nerve center of the Catholic Church  which was exposed as corrupt and full of petty turf battles ...
