The rot in the Devendra Fadnavis govt: 16 ministers facing ...,Daily News & Analysis,26 Jul 2016,http://www.dnaindia.com/india/column-the-rot-in-fadnavis-government-16-ministers-2238315,“Clean Chief Minister but a corrupt team” is how political pundits had been summing up Prithviraj Chavan-led Maharashtra government until the BJP overthrew ...
ACB rule can help corrupt officers escape prosecution,Times of India,25 Mar 2016,http://timesofindia.indiatimes.com/city/bengaluru/ACB-rule-can-help-corrupt-officers-escape-prosecution/articleshow/51557795.cms,Hence  the fear this might shield corrupt officials and undercut the autonomy of the institution. Most "suspect" cases are handled by the head of the department ...
Rs 8 lakh in exchange of Rs 10 lakh in old currency: Corrupt ...,India TV,21 Nov 2016,http://www.indiatvnews.com/business/india-rs-8-lakh-for-rs-10-lakh-in-old-notes-corrupt-bankers-turn-cash-crunch-into-opportunity-357661,According to a Times of India report  enforcement authorities have found that corrupt bank managers are allowing backdoor note exchanges and are charging a ...
Chhagan Bhujbal arrest: NCP takes tough stand  says BJP shielding ...,Daily News & Analysis,16 Mar 2016,http://www.dnaindia.com/mumbai/report-ncp-takes-tough-stand-says-bjp-shielding-its-own-corrupt-ministers-2190264,... party (NCP) has decided to take an aggressive stand against the BJP-led government  by exposing its "double standards to protect its own corrupt ministers".
Four Years of Akhilesh Yadav: Success  Catastrophe Or Somewhere ...,Swarajya,5 May 2016,http://swarajyamag.com/politics/four-years-of-akhilesh-yadav-success-catastrophe-or-somewhere-in-between,The UP Public Service Commission Chairman Anil Kumar Yadav had to be removed after a deluge of complaints about his nepotism and corrupt practices that ...
CJI's Outburst  And The 3 Elephants In The Room He Failed To ...,Swarajya,25 Apr 2016,http://swarajyamag.com/ideas/cjis-outburst-and-the-3-elephants-in-the-room-he-failed-to-recognise,The procedure for getting rid of corrupt judges is simply too elaborate to be a deterrent. Only parliament can impeach bad judges  and this almost never happens ...
Alok Ranjan: Cases against 'corrupt' officials to be disposed timely,The Indian Express,20 Apr 2016,http://indianexpress.com/article/cities/lucknow/uttar-pradesh-ranjan-cases-against-corrupt-officials-to-be-disposed-timely/,Ranjan has said that unnecessary delay in prosecution of corrupt public servants after completion of inquiry resulted in hostile witnesses and dilution of ...
Aam Aadmi Party Alleges Vendetta Politics By BJP In Goa,NDTV,20 Jun 2016,http://www.ndtv.com/india-news/aam-aadmi-party-alleges-vendetta-politics-by-bjp-in-goa-1421357,AAP also reiterates its seven-day deadline to Goa Chief Minister Laxmikant Parsekar to either take immediate action on his corrupt brother-in-law or resign as ...
RTI activist trying to expose corrupt builders shot at in Delhi's Mayur ...,India Today,25 Sep 2016,http://indiatoday.intoday.in/story/rti-activist-shot-at-in-delhi-mayur-vihar-phase-2/1/773249.html,RTI activist Surjit Singh was trying to unearth corrupt dealings of many builders in the Pandav Nagar area. Arvind Ojha | Edited by Nivedita Dash.
Fresh crisis for Arvind Kejriwal with AAP MLA Kartar Singh Tanwar ...,Firstpost,9 Aug 2016,http://www.firstpost.com/politics/i-t-dept-recovers-rs-130-cr-from-aap-mla-kartar-singh-tanwar-how-will-arvind-kejriwal-put-out-this-fire-2946026.html,Aam Aadmi Party (AAP) MLA from Chhatarpur  Kartar Singh Tanwar was an honest man when he had contested 2015 Delhi Assembly election  because it was ...
ये हैं दुनिया के वो 9 देश  जहां चरम पर है करप्शन,दैनिक भास्कर,3 Jun 2016,http://www.bhaskar.com/news/INT-most-corrupt-countries-in-the-world-5340302-PHO.html,इंटरनेशनल डेस्क।ब्राजील में करप्शन के आरोपों में फंसी एक्स प्रेसिडेंट डिल्मा रोसुफ का ट्रायल शुरू हो गया है। पनामा ...
Uproot corrupt  anti-people state government – BS Yeddyurappa,Daijiworld.com,12 Feb 2016,http://www.daijiworld.com/news/news_disp.asp?n_id=380441,The cabinet has incompetent and corrupt ministers and Congress leaders themselves criticize the government over lack of development. Corruption is rampant ...
Selectors Furious at Lodha Panel Secretary's Accusations of Taking ...,News18,24 Aug 2016,http://www.news18.com/cricketnext/news/lodha-panel-secretary-says-indian-selectors-sought-sexual-favours-report-1285060.html,The email points to allegations made by Sankarnarayanan that the BCCI were turning a blind eye to the corrupt practices of the selectors. The email also claims ...
MM Khan's murder should force AAP govt to fix corruption-infested ...,Firstpost,19 May 2016,http://www.firstpost.com/india/mm-khan-corruption-ndmc-aap-arvind-kejriwal-ramesh-kakkar-ravinder-gupta-delhi-murder-2789372.html,“There are many reasons why the NDMC is known as a corrupt body  I do not wish to go into details ” Bharti said in a telephonic interview  adding: “Every time a ...
How many anti-corruption watchdogs will it take  Karnataka CM?,DailyO,23 Mar 2016,http://www.dailyo.in/politics/bangalore-corruption-karnataka-siddaramaiah-yeddyurappa-mining-scam-bjp-congress-justice-bhaskar-rao/story/1/9685.html,Master Hirannaiah had come up with a unique solution to end corruption in the public sphere — if any government body is corrupt  take out its head!
Chinese reality TV series shows lives of corrupt officials,Daijiworld.com,21 Oct 2016,http://www.daijiworld.com/news/news_disp.asp?n_id=419779,Beijing  Oct 21 (IANS): For the first time in China  a reality TV series that provides a peek into the lives of allegedly corrupt senior party officials and attempts to ...
Husband is entitled to seek divorce from a wife who calls him ...,Live Law,10 Jan 2016,http://www.livelaw.in/husband-is-entitled-to-seek-divorce-from-a-wife-who-calls-him-womanizer-in-her-pleadings-without-leading-any-cogent-evidence-delhi-hc-2/,To be called a womanizer and corrupt by his own spouse  would have caused such pain and suffering to the respondent as would lead him to entertain the ...
Government Employees In Tamil Nadu Get A Shield Against ...,NDTV,4 Feb 2016,http://www.ndtv.com/tamil-nadu-news/government-employees-in-tamil-nadu-get-a-shield-against-corruption-probe-1273848,This will force people to pay a bribe and move on  as it makes taking action against corrupt officials even more difficult " said Chandru  an anti-corruption activist.
Iraq Prime Minister Bans Travel By Officials Accused Of Corruption,NDTV,2 Aug 2016,http://www.ndtv.com/world-news/iraq-prime-minister-bans-travel-by-officials-accused-of-corruption-1439360,Defence Minister Khalid al-Obeidi on Monday told parliament that speaker Salim al-Juburi and several lawmakers were corrupt and had sought to blackmail him.
India In Top Three Regions for Corruption-Linked Fraud: Report,The Quint,26 Jun 2016,https://www.thequint.com/hot-wire/2016/06/27/india-in-top-3-most-corrupt-regions-80-percent-companies-in-the-poll-accepted-being-victims-to-fraud,India is one of the most corrupt regions in the world  according to the Global Fraud Report  as reported by The Hindu. Eighty percent of companies who ...
Modi warns of further action against corrupt  Jaitley shares currency ...,Local Press Co,12 Nov 2016,http://localpress.co.in/2016/11/modi-warns-action-corrupt-jaitley-shares-currency-exchange-stats/,Prime Minister Narendra Modi hinted at further actions against those hoarding black money while Finance Minister Arun Jaitley shared statistics about the ...
BCCI vs Lodha Committee: A corrupt cabal takes on the Apex Court,Hardnews Media,16 Oct 2016,http://www.hardnewsmedia.com/2016/10/bcci-vs-lodha-committee-corrupt-cabal-takes-apex-court,As Team India  fans and social media celebrate the historic feat of winning the #500 and #501 Tests  at the same time it appears that the status of the entire ...
Will act against 'corrupt Akali leaders'  says Amarinder,Hindustan Times,5 Nov 2016,http://www.hindustantimes.com/punjab/will-act-against-corrupt-akali-leaders-says-amarinder/story-bYar8gWhXN4OljHIBqBUPL.html,Promising action against “corrupt Akali leaders” if his party is voted back to power  Punjab Congress chief Capt Amarinder Singh on Saturday challenged Aam ...
Anti-Corruption Bureau will shield corrupt: Justice Hegde,India Today,6 Apr 2016,http://indiatoday.intoday.in/story/anti-corruption-bureau-will-shield-corrupt-justice-hegde/1/637360.html,Justice Hegde said the government should withdraw the order creating the ACB and strengthen the Lokayukta  which enjoyed autonomy and could probe any ...
'People's apathy invited corrupt leaders & corruption in Nagaland',Eastern Mirror,2 Aug 2016,http://www.easternmirrornagaland.com/peoples-apathy-invited-corrupt-leaders-corruption-in-nagaland/,KOHIMA  AUGUST 2: The complacence of the people of Nagaland is inviting corrupt leaders and corruption in the government as much as they complacence is ...
Corrupt officals reduce ACB raids to eyewash government agencies,Deccan Chronicle,26 May 2016,http://www.deccanchronicle.com/nation/crime/270516/corrupt-officals-reduce-acb-raids-to-eyewash-government-agencies.html,Whenever a corrupt officer is trapped  a detailed report is submitted to the department concerned for permission to prosecute the official. The department either ...
Arvind Kejriwal to announce AAP's plans to contest Gujarat polls,Firstpost,5 Aug 2016,http://www.firstpost.com/politics/arvind-kejriwal-to-announce-aaps-plans-to-contest-gujarat-polls-2937882.html,New Delhi: AAP leader Arvind Kejriwal will announce the party's plans to contest the Gujarat assembly election at a rally in Surat on 16 October  party sources ...
ACB Nashik traps maximum corrupt officials,Times of India,9 Mar 2016,http://timesofindia.indiatimes.com/city/nashik/ACB-Nashik-traps-maximum-corrupt-officials/articleshow/51339063.cms,Pradhan said it was important to increase the number of entrapments to nab maximum number of corrupt officials. "Besides the issue of corruption  it is gross ...
The fall and fall of Chhagan Bhujbal: The seven people who brought ...,Firstpost,15 Mar 2016,http://www.firstpost.com/politics/the-fall-and-fall-of-chhagan-bhujbal-the-seven-people-who-brought-him-down-2676306.html,Arrested on 1 February this year by the ED for money laundering and corrupt practices  it is believed that the agency succeeded in cracking Sameer and made ...
India Is On Its Way To Establishing An Unaccountable Higher Judiciary,Swarajya,31 Jul 2016,http://swarajyamag.com/politics/india-is-on-its-way-to-establishing-an-unaccountable-higher-judiciary,It is not clear if this determination of the government to have some leverage against corrupt judges will pass judicial muster  for the Supreme Court simply has to ...
भ्रष्टाचार के खिलाफ बोलने पर भाजपा ने निलंबित ...,India.com हिंदी,11 Nov 2016,http://www.india.com/hindi-news/sports-hindi/want-to-expose-the-corrupt-kirti-azad/,भारतीय जनता पार्टी (भाजपा) से निलंबित सांसद और पूर्व क्रिकेट खिलाड़ी कीर्ति आजाद ने कहा है कि वरिष्ठ भाजपा नेता ...
The governor had rejected Siddaramaiah's previous choice-V ...,The News Minute,9 Aug 2016,http://www.thenewsminute.com/article/despite-corruption-allegations-karnataka-guv-clears-sham-bhats-appointment-kpsc-47899,Former BDA Commissioner T Sham Bhat was appointed as the chairman of the Karnataka Public Service Commission (KPSC) on Monday by the Siddaramaiah ...
Movie Review: Madaari…oh oh  back to the good  bad and the corrupt,SpotboyE,21 Jul 2016,http://www.spotboye.com/bollywood/reviews/movie-review-madaari-oh-oh-back-to-the-good-bad-and-the-corrupt/5791c2aa661f941e1723e33c,His tears are for real. When his seven-year-old son dies following a bridge collapse  the father's breakdown is not only inevitable but so heart-rending that the ...
Corrupt officials now demand full bribe in other denomination notes,The New Indian Express,13 Nov 2016,http://www.newindianexpress.com/states/tamil-nadu/2016/nov/14/corrupt-officials-now-demand-full-bribe-in-other-denomination-notes-1538333.html,Those corrupt officials are not at all bothered about the travails of the common man who stand in long queues for hours in front of banks and ATM kiosks.
AFSPA benefits only the corrupt: AHRC,Morung Express,15 Jan 2016,http://morungexpress.com/afspa-benefits-only-the-corrupt-ahrc/,“Only corrupt state officers  politicians and the omnipresent and armed militant groups of Manipur will benefit from the impunity provided by the AFSPA ” said a ...
Corrupt PCBs ruin environment in Hyderabad and Vizag: Nordea ...,pharmabiz.com,22 Apr 2016,http://www.pharmabiz.com/NewsDetails.aspx?aid=94765&sid=1,With corrupt officials at helm in the pollution control boards of both Hyderabad and Vishakhapatnam  the poisonous pollutants in soil  water and air released by ...
Cricket  sports can never be rid of corruption: Malik,The Hindu,20 Jan 2016,http://www.thehindu.com/sport/cricket/cricket-sports-can-never-be-rid-of-corruption-says-former-pakistan-cricket-captain-saleem-malik/article8130545.ece,Malik said he didn't feel there was any noticeable decline in fixing attempts by corrupt gamblers and bookmakers in the last decade or so and referred to the ...
Demolition of 55-year-old public library stayed,The Hindu,16 Nov 2016,http://www.thehindu.com/news/cities/Delhi/demolition-of-55yearold-public-library-stayed/article9355011.ece,“The North Delhi Municipal Corporation has been manipulated using corrupt practices  to declare the premises as dangerous now  while in 2011  the same civic ...
Cover Story: The buck stops here  in officers' pockets,Tehelka,1 Aug 2016,http://www.tehelka.com/2016/08/the-buck-stops-here-in-officers-pockets/,Of the total 5 000 plus IAS officers across the country  many are so corrupt that they would laugh if reminded of their oath to serve the nation. Kanhaiya Bhelari ...
Billionaires can be both good and bad. Ruchir Sharma shows how ...,Scroll.in,13 Jun 2016,http://scroll.in/article/809880/billionaires-can-be-both-good-and-bad-ruchir-sharma-shows-how-to-tell-them-apart,Bad billionaires are the sour cream rising to the top of corrupt societies. It is possible to sound out which societies are most corrupt using the annual surveys ...
Gandhis  Fighting Graft Charges  Hold Rally. A Role For Robert ...,NDTV,5 May 2016,http://www.ndtv.com/india-news/at-sonia-and-rahul-gandhi-rally-robert-vadra-appears-on-posters-1403375,... Haryana have forced the party headed by his mother-in-law  Sonia Gandhi  to repeatedly assert that he is not corrupt  and did not benefit from Congress state ...
Corrupt employees suspension cant continue beyond 90 days,India Today,23 Aug 2016,http://indiatoday.intoday.in/story/corrupt-employees-suspension-cant-continue-beyond-90-days/1/747042.html,New Delhi  Aug 23 (PTI) The suspension of government employees accused of corruption cannot continue beyond 90 days  the Centre said today. It has asked ...
BJP slams Akhilesh for reinducting Gayatri Prajapati,The Indian Express,26 Sep 2016,http://indianexpress.com/article/india/india-news-india/bjp-slams-akhilesh-for-reinducting-gayatri-prajapati/,It is clear that samajwad has been converted into corruption and Yadav is the chief of tainted and corrupt ministers. “For four-and-a-half years the Samajwadi ...
Sonia Gandhi 'supressed' information given by NIA and FBI in Ishrat ...,Firstpost,19 Apr 2016,http://www.firstpost.com/india/sonia-gandhi-supressed-information-given-by-nia-and-fbi-in-ishrat-jahan-case-bjp-2737596.html,New Delhi: Firing a fresh salvo at Sonia Gandhi over the Ishrat Jahan issue  BJP on Tuesday suggested that the Congress chief had asked the then Home ...
Demand to arrest 'corrupt' BDO of Boginadi block,The Sentinel,22 Oct 2016,http://www.sentinelassam.com/state1/story.php?sec=2&subsec=2&id=285353&dtP=2016-10-23&ppr=1,The corrupt official is a leech in the society  feeding on the money of the public. Fund of the Chief Minister's Special Package for the Backward Areas  Indira ...
Congress leader alleges fee hike  other corrupt practices at SGRD ...,Chandigarh Tribune,3 Jun 2016,http://www.tribuneindia.com/news/amritsar/congress-leader-alleges-fee-hike-other-corrupt-practices-at-sgrd-hospital/246523.html,Congress leader alleges fee hike  other corrupt practices at SGRD Hospital ... corrupt practices and harassment of cancer patients admitted to the hospital.
AntiCorruption Bureau to carry out a week long awareness drive ...,NYOOOZ,30 Oct 2016,http://www.nyoooz.com/pune/649125/anticorruption-bureau-to-carry-out-a-week-long-awareness-drive,During the awareness drive  ACB will inform work of the ACB  laws of anti-corruption and what power does the common man wields to book the corrupt ...
Yet again  RTI  a thorn in the flesh of corrupt politicians,The News Minute,11 May 2016,http://www.thenewsminute.com/article/yet-again-rti-thorn-flesh-corrupt-politicians-43054,Ever since the RTI Act was implemented in 2005  the political fraternity has time and again sought amendments (unsuccessfully)  cried foul over its misuse  with ...
Donald Trump shreds 'corrupt' Marco Rubio in new TV ad,Businessinsider India,7 Mar 2016,http://www.businessinsider.in/Donald-Trump-shreds-corrupt-Marco-Rubio-in-new-TV-ad/articleshow/51300428.cms,Trump's campaign labeled the Florida senator a "corrupt  all-talk  no-action politician " noting years-old revelations that Rubio put thousands of personal charges ...
Clarify stand on triple talaq  Amit Shah tells rival parties in Uttar ...,The Hindu,8 Nov 2016,http://www.thehindu.com/news/national/clarify-stand-on-triple-talaq-amit-shah-tells-rival-parties-in-uttar-pradesh/article9320857.ece,Mr. Shah also flayed CM Akhilesh Yadav for not acting against the corrupt elements of the BSP  wondering why he had not “filed a single case against Behenji's ...
ICC bans Hong Kong player Irfan Ahmed for anti-corruption code ...,The Indian Express,20 Apr 2016,http://indianexpress.com/article/sports/cricket/icc-bans-hong-kong-player-irfan-ahmed-for-icc-anti-corruption-code-breach/,... of approaches or invitations to engage in corrupt conduct that had been made to him between January 2012 and January 2014 ” the ICC said in a statement.
Demonetisation disastrous to poor  beneficial to corrupt rich: World ...,News Nation,18 Nov 2016,http://www.newsnation.in/article/151464-world-media-explains-demonetisation-as-disastrous-to-poor-beneficial-to-corrupt-rich.html,Now  the world media is explaining the decision of demonetisation as disastrous  a costly political move  disastrous to poor  bad economics  beneficial to corrupt ...
K Chandrasekhar Rao sounds bugle against corruption in civic wings,Deccan Chronicle,20 Feb 2016,http://www.deccanchronicle.com/nation/current-affairs/210216/k-chandrasekhar-rao-sounds-bugle-against-corruption-in-civic-wings.html,Take stringent action against the corrupt. An indicator of good administration is when people get necessary permissions from municipalities without having to ...
Supreme Court defers hearing of election petition against Sonia ...,Economic Times,27 Oct 2016,http://economictimes.indiatimes.com/news/politics-and-nation/supreme-court-defers-hearing-of-election-petition-against-sonia-gandhi/articleshow/55089536.cms,On the plea that Gandhi has committed "corrupt practice" by allegedly seeking Muslim votes  the high court had said it should be shown that the act was done ...
CBI books 9 top IT officials  CA for corruption,Times of India,22 Jun 2016,http://timesofindia.indiatimes.com/india/CBI-books-9-top-I-T-officials-CA-for-corruption/articleshow/52876778.cms,... in several cities for alleged corrupt practices. The accused income tax officials were reportedly taking favours from private persons including travel  hotel stays  ...
India's war on cash seems misguided: Will the economy go Nigeria's ...,Economic Times,21 Nov 2016,http://economictimes.indiatimes.com/markets/stocks/news/indias-war-on-cash-seems-misguided-will-the-economy-go-nigerias-way/articleshow/55554914.cms,Criminals and corrupt officials often conduct business in cash  because it's hard to trace. So in a sense it's logical to assume that abolishing cash will help reduce ...
G20 Summit: PM Modi Takes On Economic Offenders,The Indian Express,6 Sep 2016,http://indianexpress.com/videos/news-video/g20-summit-pm-modi-takes-on-economic-offenders/,... act against the corrupt and elimination of “safe havens” for economic offenders ... international regulations and excessive banking secrecy that hide the corrupt ...
'Akira' trailer: Sonakshi Sinha is all kinds of badass; Anurag Kashyap ...,Daily News & Analysis,4 Jul 2016,http://www.dnaindia.com/entertainment/report-watch-trailer-of-ar-murugadoss-akira-starring-sonakshi-sinha-anurag-kashyap-and-konkona-sensharma-is-out-now-2231154,Anurag Kashyap can be seen in the character of a corrupt police officer who has issues with Akira  while Konkona Sensharma portrays a lady police constable.
Allegations that demonetisation decision leaked totally absurd ...,The Indian Express,15 Nov 2016,http://indianexpress.com/article/india/india-news-india/allegations-that-demonetisation-decision-leaked-totally-absurd-mischievous-venkaiah-naidu-4377209/,... Tuesday asked the parties to make it clear whether they are with the common man who is going to benefit from the move or corrupt and black money holders.
Gujarat  Delhi  Tamil Nadu top states for fresh investments,Livemint,8 Mar 2016,http://www.livemint.com/Politics/1ZhjuSqBOnCcdx4JZwiw6N/NCAER-ranks-Gujarat-Delhi-Tamil-Nadu-as-top-states-for-mak.html,Industries ranked Uttarakhand (32.5%) as the least corrupt state and Tamil Nadu as the most corrupt with 100% of the survey participants voting against it.
Vigilance Commission Plans First-Ever Public Perception Index On ...,NDTV,31 Oct 2016,http://www.ndtv.com/india-news/vigilance-commission-plans-first-ever-public-perception-index-on-graft-1587040,How corrupt is a government office? The Central Vigilance Commission will come up with first-ever index in the country measuring public perception about 25 ...
Telangana: Graft cases on excise staff to go,Deccan Chronicle,4 Jan 2016,http://www.deccanchronicle.com/160105/nation-current-affairs/article/telangana-graft-cases-excise-staff-go,“The Excise department earned a bad name for being the most corrupt. But this was because of the inefficient governments in undivided AP. After Telangana ...
Top bankers had no clue of government's demonetisation plan; were ...,Zee News,18 Nov 2016,http://zeenews.india.com/economy/top-bankers-had-no-clue-of-governments-demonetisation-plan-were-left-with-few-hours-to-act_1951294.html,Prevent these corrupt scoundrels like Kejriwal from diverting and using for Election ... So the corruption goes on and corrupt system remains untouched. This is a ...
Vivek Agnihotri slams spineless morally corrupt filmmakers,Bollywood Hungama,23 Oct 2016,http://www.bollywoodhungama.com/news/features/vivek-agnihotri-slams-spineless-morally-corrupt-filmmakers/,The morally weak and ethically corrupt people who have no moral standing to resist and fight them. These are the people who make audience question every ...
Corrupt people are very creative: PM Modi,The Asian Age,7 Nov 2016,http://www.asianage.com/india/corrupt-people-are-very-creative-modi-368,“Politicians are considered as the most corrupt people in the world; this mindset deters common man from believing in us. The state has to be policy driven.
Demonetisation: Will make changes when needed  says PM Modi,The Indian Express,20 Nov 2016,http://indianexpress.com/article/india/india-news-india/demonetisation-pm-modi-says-no-strict-rules-reviewing-every-day/,Demonetisation was done to save the country from black-marketing  black money and the corrupt  and not to trouble the common man at all  Modi said.
Hema Malini got prime land worth crores for just Rs 70000,Deccan Herald,28 Jan 2016,http://www.deccanherald.com/content/525792/hema-malini-got-prime-land.html,If you vote for BJP next General Elections  you will see in front of your eyes they will be ten times more corrupt than the previous congress government. BJP got ...
PM Modi upset over complaints regarding customs  excise sector,Daily News & Analysis,27 Jan 2016,http://www.dnaindia.com/india/report-pm-modi-upset-over-complaints-regarding-customs-excise-sector-directs-strict-action-against-officials-responsible-2171042,New Delhi: Prime Minister Narendra Modi chairing 9th interaction through PRAGATI – an ICT-based platform for Pro-Active Governance and Timely ...
Weed out corrupt squads: BMTC staff,Bangalore Mirror,27 Jul 2016,http://www.bangaloremirror.com/bangalore/others/Weed-out-corrupt-squads-BMTC-staff/articleshow/53423326.cms,"I can understand that some conductors are corrupt. But how can every single of them have up to 100 cases filed against them? I have about 150 against me " ...
Hackers target Bank of Greece,The Hindu,4 May 2016,http://www.thehindu.com/news/international/hackers-attack-greek-central-bank/article8556980.ece,Hackers attacked the central Bank of Greece to protest the corrupt international financial system  warning that there will be more cyber attacks across the globe  ...
