Why was the year 2012 eventful for retail,Rediff,24 Dec 2012,http://www.rediff.com/business/slide-show/slide-show-1-why-was-the-year-2012-eventful-for-retail/20121224.htm,The retail sector  where the government permitted foreign direct investment in multi-brand  courted controversies during the year with several opposition parties ...
Medical representatives on nation-wide strike demanding action ...,pharmabiz.com,22 Aug 2012,http://pharmabiz.com/NewsDetails.aspx?aid=70770&sid=1,The resolution says that in the absence of proper enforcement of the regulatory measures  the drug manufacturing companies are continuing their corrupt ...
Congress plotting to defame me  will give tit for tat: BJP chief Nitin ...,Economic Times,31 Oct 2012,http://articles.economictimes.indiatimes.com/2012-10-31/news/34837153_1_nitin-gadkari-bjp-president-ajay-sancheti,Dubbing Congress as a "corrupt" party  Gadkari said  "When you cannot convince  you make efforts to confuse. This is what the Congress is doing to confuse our ...
Ferrari ki sawaari,Calcutta Telegraph,15 Jun 2012,http://www.telegraphindia.com/1120616/jsp/entertainment/story_15616827.jsp,In fact  by the time this Ferrari crosses the chequered flag and eachand every character  including the corrupt politician and his gundason  starts cheering for our ...
Sanjeev Aga: How To Grow A Spine - A Guide For Indian Managers,Forbes India,21 May 2012,http://www.forbesindia.com/article/third-anniversary-special/sanjeev-aga-how-to-grow-a-spine-a-guide-for-indian-managers/32946/1,If business lacks scruples  the Indian business manager laments it is because of our witless regulations  our corrupt system  our promoters  we are but cogs in ...
Imran Khan takes guard for Pakistan,Rediff,1 Jan 2012,http://www.rediff.com/news/slide-show/slide-show-1-can-imran-khan-moderate-the-pak-army/20120102.htm,Former cricketer Imran Khan's December 25  2011 rally at Bagh-e-Qaid  Karachi which was attended by some 1 00 000 people  a bigger crowd than any political ...
We OBJECT  Mr Chetan Bhagat!,Rediff,21 Aug 2012,http://www.rediff.com/getahead/slide-show/slide-show-1-specials-we-object-mr-chetan-bhagat/20120822.htm,Rediff reader and Senior Researcher  Centre for Investment  Indian School of Business  Hyderabad Nupur Pavan Bang lists out her objections about Chetan ...
'Rs 2-lakh cr' land scam rocks Wakf Board,Deccan Herald,26 Mar 2012,http://www.deccanherald.com/content/237393/rs-2-lakh-cr-land.html,Good! we started getting awareness  sooo much property  sooo much illegality  minority exploiting the same minority with the help of corrupt c people  Dalits ...
Gali Gali Chor Hai Movie Review,GlamSham,2 Feb 2012,http://www.glamsham.com/movies/reviews/03-gali-gali-chor-hai-movie-review-021202.asp,True  there have been movies on politics and politicians and the corrupt system; but the way the 'system' is looked into in a holistic way  through the life of just ...
Review: Maximum never quite gets going,Rediff,29 Jun 2012,http://www.rediff.com/movies/review/review-maximum-never-quite-gets-going/20120629.htm,The idea of corrupt cops facing off against each other can be a fine one  but mired here in the midst of people saying things really really slowly  it loses its steam.
Why Dalits Have Slammed Mayawati's Sarvjan Rule?,CounterCurrents.org,25 Mar 2012,http://www.countercurrents.org/darapuri250312.htm,Mayawati's opportunist and corrupt politics has resulted in blurring the vision of Dalits who are now unable to make a difference between their friends and foes.
Economy laid low by governance,Hindu Business Line,3 Jul 2012,http://www.thehindubusinessline.com/opinion/economy-laid-low-by-governance/article3598697.ece,... income in financial assets such as bank deposits  equities  mutual funds  etc.; and live in a society that is secure  transparent  less corrupt and better governed.
Delhi CM Sheila Dikshit sues Arvind Kejriwal over derogatory remarks,India Today,22 Oct 2012,http://indiatoday.intoday.in/story/sheila-dikshit-sues-arvind-kejriwal-defamation/1/225744.html,We will continue doing so against your government and your party till you indulge in corrupt activities. We are not scared. The common man is now on the streets ...
A fatal investigation by the highest investigating agency of India 'CBI',HotnHitNews,20 Mar 2012,http://hotnhitnews.com/Fatal-investigation-by-CBI-the-highest-investigating-agency-of-India-Kerala-India-Hotnhitnews-01521032012.htm,"The so-called 'ultimate criminal investigation agency' in the country  the CBI  itself is not immune to political and otherwise corrupt pressure is not a new concern ...
Rediff.com » Cricket » 'Danger to cricket' Kaneria banned for life by ...,Rediff,22 Jun 2012,http://www.rediff.com/cricket/report/danish-kaneria-spot-fixing-ecb-icc-pcb-guilty-county-match/20120622.htm,"We regard Danish Kaneria as a grave danger to the game of cricket and we must take every appropriate step to protect our game from his corrupt activities " ...
"Respect India” Campaign Launched,CounterCurrents.org,8 May 2012,http://www.countercurrents.org/pmane080512.htm,Just as the freedom fighters asked the colonial rulers to 'Quit India ' we  the People's Movement Against Nuclear Energy fighters  request the corrupt and ...
Importance Of Kanshiram And His Politics,CounterCurrents.org,10 Oct 2012,http://www.countercurrents.org/rawat101012.htm,The anti-corruption agenda is being fixed by the corrupt corporate and their cohorts in the media and hence we need a complete scrutiny of it in a separate ...
Team Anna  Baba Ramdev deny Arvind Kejriwal's walkout,NDTV,3 Jun 2012,http://www.ndtv.com/india-news/team-anna-baba-ramdev-deny-arvind-kejriwals-walkout-from-protest-venue-486395,"If netas are not corrupt  why are they shying away from making a strong Lokpal Bill " he added. (Watch) The token fast comes against the backdrop of reports a ...
New Dishonored Screenshots arrived,Gamepur,2 Aug 2012,http://www.gamepur.com/news/8771-new-dishonored-screenshots-arrived.html,In a time of uncertainty  when the city is besieged by plague and ruled by a corrupt government armed with industrial technologies  dark forces conspire to ...
Petty corruption thrives  and how,Hindu Business Line,8 May 2012,http://www.thehindubusinessline.com/opinion/petty-corruption-thrives-and-how/article3397806.ece,The services made available were often the easiest to acquire  and least corrupt  in the pre-existing  non-computerised system  or were targeted to a specific ...
Full Transcript: Your Call with Imran Khan,NDTV,11 Nov 2012,http://www.ndtv.com/india-news/full-transcript-your-call-with-imran-khan-504320,If you look at Transparency International  this NGO  which publishes every year the table for the most corrupt government and the cleanest government  and if ...
Kingmaker's Sceptre,Outlook,26 Oct 2012,http://www.outlookindia.com/magazine/story/kingmakers-sceptre/282686,And VP  the finance minister in Rajiv Gandhi's government  wanted to teach corrupt businessmen a lesson they'd never forget. The late Goenka  owner of Indian ...
Keep going son  don't give up: Mani Shankar Aiyar to Arvind Kejriwal,India Today,6 Dec 2012,http://indiatoday.intoday.in/story/no-one-cares-for-common-man-says-aam-aadmi-party-leader-arvind-kejriwal-at-agenda-aaj-tak/1/236439.html,Snippet not available
KAS officer dies of injuries,Deccan Herald,20 May 2012,http://www.deccanherald.com/content/250855/kas-officer-dies-injuries.html,Snippet not available
Target the rot in Indian healthcare  NOT Aamir Khan,Rediff,7 Jun 2012,http://www.rediff.com/news/column/target-the-rot-in-indian-healthcare-not-aamir-khan/20120607.htm,Snippet not available
Kiran Bedi disassociates herself from Arvind Kejriwal's political line,India Today,27 Aug 2012,http://indiatoday.intoday.in/story/kiran-bedi-disassociates-herself-from-kejriwal-political-line/1/214943.html,Snippet not available
Arvind Kejriwal unveils political party,Livemint,2 Oct 2012,http://www.livemint.com/Politics/J1XNmjHBolG9JknTdVuh5H/Arvind-Kejriwal-unveils-political-party.html,Snippet not available
Aniruddha Guha reviews: 'Ferrari Ki Sawaari' – manipulative but ...,Daily News & Analysis,15 Jun 2012,http://www.dnaindia.com/entertainment/review-aniruddha-guha-reviews-ferrari-ki-sawaari-manipulative-but-fairly-enjoyable-1702679,Snippet not available
Anna dissolves his team  new committee formed to plan political foray,India Today,6 Aug 2012,http://indiatoday.intoday.in/story/anna-hazare-disbands-team-anna/1/211993.html,Snippet not available
