CM Devendra Fadnavis's maiden move is anti-graft,Indian Express,31 Oct 2014,http://indianexpress.com/article/india/politics/cm-devendra-fadnaviss-maiden-move-is-anti-graft/,In a significant anti-graft move soon after taking over as the Chief Minister on Friday evening  Devendra Fadnavis directed the authorities to submit a proposal ...
Ex Alstom India MD to appear in UK court in graft case,Hindu Business Line,31 Oct 2014,http://www.thehindubusinessline.com/companies/ex-alstom-india-md-to-appear-in-uk-court-in-graft-case/article6552987.ece,Robert Hallet  the former managing director of Alstom Transport India  is set to appear at a London court on Monday charged with two counts of corruption.
300 doctors under Medical Council of India lens over graft charge,Times of India,17 Nov 2014,http://timesofindia.indiatimes.com/india/300-doctors-under-Medical-Council-of-India-lens-over-graft-charge/articleshow/45183105.cms,The Medical Council of India has summoned about 300 doctors from across the country to Delhi to answer questions on an anonymous complaint that they had ...
Sailor put in psychiatry ward for exposing graft in Navy: Wife,Times of India,25 Oct 2014,http://timesofindia.indiatimes.com/india/Sailor-put-in-psychiatry-ward-for-exposing-graft-in-Navy-Wife/articleshow/44936461.cms,MADURAI/KOCHI: A Navy sailor's wife has alleged that that her husband was wrongly diagnosed with psychiatric problems and forcefully admitted in the ...
Held for graft  KDMC engineer is worth crores,Times of India,18 Apr 2014,http://timesofindia.indiatimes.com/city/mumbai/Held-for-graft-KDMC-engineer-is-worth-crores/articleshow/33922491.cms,KALYAN: The Thane Anti-Corruption Bureau (ACB) has found that KDMC deputy engineer Dattatray Mastud who  along with Shiv Sena corporator Vidyadhar ...
Bombay High Court dismisses 5-time Shiv Sena MLA plea for ...,Daily News & Analysis,5 Sep 2014,http://www.dnaindia.com/mumbai/report-bombay-high-court-dismisses-5-time-shiv-sena-mla-plea-for-suspension-of-graft-conviction-2016488,Bombay High Court dismisses 5-time Shiv Sena MLA plea for suspension of graft conviction. Shares5. Urvi Mahajani | Sun  7 Sep 2014-07:30am   DNA.
Graft charges stuck  but Antulay was known as Mr Efficient,Times of India,2 Dec 2014,http://timesofindia.indiatimes.com/city/mumbai/Graft-charges-stuck-but-Antulay-was-known-as-Mr-Efficient/articleshow/45355089.cms,MUMBAI/NEW DELHI: From an ordinary social worker in the 1940s  Congress leader Abdul Rehman Antulay  popularly known as Barrister Antulay  rose to ...
Fraud scales up in ACB's list of graft charges for 2013,Daily News & Analysis,19 Feb 2014,http://www.dnaindia.com/ahmedabad/report-fraud-scales-up-in-acb-s-list-of-graft-charges-for-2013-1963463,The Anti-Corruption Bureau's (ACB) data of graft is a mirror of self contradictions. For  while it managed to notch up the highest number of graft cases in the past ...
CBI arrests Registrar of Companies,The Hindu,26 Aug 2014,http://www.thehindu.com/news/national/cbi-arrests-chennai-registrar-of-companies-manuneethi-cholan-on-graft-charges/article6353480.ece,With grocers and cold storage owners refusing to accept scrapped currency notes  farmers are struggling to get potato seeds while landless labourers are forced ...
Graft case against ex-DGP may trigger faceoff between BJD and ...,India Today,26 Sep 2014,http://indiatoday.intoday.in/story/corruption-charges-prakash-mishra-odisha-government-home-ministry-nda-government/1/392775.html,Senior IPS officer Prakash Mishra allegedly misused his official position and manipulated records to give Rs 59 crore as an advance to cement and steel ...
Mira-Bhayander corporator held for graft released on bail,Times of India,15 Mar 2014,http://timesofindia.indiatimes.com/city/thane/Mira-Bhayander-corporator-held-for-graft-released-on-bail/articleshow/32075226.cms,THANE: A Mira-Bhayander corporator  Vandana Chakre  who was arrested for accepting bribe of Rs 2 lakh last week was granted conditional bail by the Thane ...
Removed as Puducherry's Lieutenant Governor as I 'Exposed' Graft ...,NDTV,25 Jul 2014,http://www.ndtv.com/india-news/removed-as-puducherrys-lieutenant-governor-as-i-exposed-graft-virendra-kataria-594054,New Delhi: Days after he was sacked by the Narendra Modi government as Puducherry's Lieutenant Governor  Virendra Kataria today claimed he was removed ...
Two Directorate of Higher Education officials held for graft,Business Standard,24 Dec 2014,http://www.business-standard.com/article/pti-stories/two-directorate-of-higher-education-officials-held-for-graft-114122400650_1.html,Two senior officers of the Directorate of Higher Education who allegedly demanded and accepted a bribe of Rs 20 000 from a professor were arrested by the ...
MP Governor promises new mechanism to tackle graft,The Hindu,9 Jan 2014,http://www.thehindu.com/news/national/other-states/mp-governor-promises-new-mechanism-to-tackle-graft/article5558750.ece,In his address to the newly elected Madhya Pradesh Vidhan Sabha on Thursday  Governor Ram Naresh Yadav focussed on the development goals of the ...
CBI searches army's Jabalpur-based vehicle factory over graft case,Economic Times,11 Oct 2014,http://articles.economictimes.indiatimes.com/2014-10-11/news/54899674_1_graft-case-searches-factory,JABALPUR: CBI today conducted searches at a vehicle factory  a military motor vehicle manufacturing company here  as well as the residence of its official  ...
For Arvind Kejriwal's anti-graft Jan Lokpal Bill  a new legal knot,NDTV,6 Feb 2014,http://www.ndtv.com/delhi-news/for-arvind-kejriwals-anti-graft-jan-lokpal-bill-a-new-legal-knot-549983,New Delhi: Delhi Chief Minister Arvind Kejriwal has said that starting February 13  his pet proposal - the anti-corruption Jan Lokpal bill - will be reviewed and ...
Drug dealers allege graft in state pharmacy council,Times of India,11 Oct 2014,http://timesofindia.indiatimes.com/city/guwahati/Drug-dealers-allege-graft-in-state-pharmacy-council/articleshow/44786565.cms,Guwahati: The Assam Drug Dealers' Association on Saturday accused the Assam pharmacy council of harassment and indulging in malpractices while ...
Former PM of Bangladesh Khaleda Zia goes on trial on charges of ...,Firstpost,22 Sep 2014,http://www.firstpost.com/world/former-pm-of-bangladesh-khaleda-zia-goes-on-trial-on-charges-of-graft-1724539.html,Former PM of Bangladesh Khaleda Zia goes on trial on charges of graft. Sep 22  2014 15:16 IST. #Bangladesh #Bangladesh Nationalist Party #BNP #corruption ...
Anti-graft law not applicable to highrise panel member: HC,Times of India,16 Sep 2014,http://timesofindia.indiatimes.com/city/mumbai/Anti-graft-law-not-applicable-to-highrise-panel-member-HC/articleshow/42648661.cms,MUMBAI: Four years after Shailesh Mahimtura (57)  one of the city's top structural engineers and a member of the highrise committee  was arrested over bribery ...
Positive fallout of graft probe,Business Standard,14 Dec 2014,http://www.business-standard.com/article/economy-policy/positive-fallout-of-graft-probe-114121500050_1.html,After the coal block allocation scam  which contributed to the defeat of the United Progressive Alliance government  was handed over to the Central Bureau of ...
Court to hear graft case against Anbumani Ramadoss on December 2,Times of India,16 Oct 2014,http://timesofindia.indiatimes.com/india/Court-to-hear-graft-case-against-Anbumani-Ramadoss-on-December-2/articleshow/44844501.cms,NEW DELHI: A trial court on Thursday fixed December 2 for hearing arguments on charges in a case in which former Union health minister Anbumani ...
Vigilance court orders probe against Chandy  2 ministers in graft case,Indian Express,28 Aug 2014,http://indianexpress.com/article/india/india-others/vigilance-court-orders-probe-against-chandy-2-ministers-in-graft-case/,Vigilance court orders probe against Chandy  2 ministers in graft case. Rejecting the VACB probe report that stated Chandy and others had no role in the ...
Kuldeep Bishnoi flays Parkash Singh Badal  asks him to spell out his ...,Daily News & Analysis,21 Apr 2014,http://www.dnaindia.com/india/report-kuldeep-bishnoi-flays-parkash-singh-badal-asks-him-to-spell-out-his-stand-on-graft-1980627,Accusing Badal of having two faces on corruption  Bishnoi asked Badal to come clean on his stand on the graft. The HJC chief also downplayed attempts by ...
Congress to push for anti-graft bills  Jat reservation during ...,Economic Times,10 Jan 2014,http://articles.economictimes.indiatimes.com/2014-01-10/news/46066581_1_congress-core-group-congress-president-sonia-gandhi-jat-reservation,NEW DELHI: Congress top brass today discussed the strategy to pass a slew of anti-corruption bills pushed by Rahul Gandhi to create a 'framework' to fight graft ...
Jayalalithaa found guilty  says local TV channel,Deccan Herald,27 Sep 2014,http://www.deccanherald.com/content/432996/jayalalithaa-found-guilty-says-local.html,Tamil Nadu Chief Minister Jayalalithaa was today convicted in an 18-year-old disproportionate assets case by a special court  a verdict that raises questions ...
Narendra Modi eases graft-linked curbs to boost arms deals in India,Livemint,16 Sep 2014,http://www.livemint.com/Politics/n2OmRgtt6TQnwT5jlHBNQN/Narendra-Modi-eases-graftlinked-curbs-to-boost-arms-deals-i.html,Modi has prioritized military modernization. He dedicated the largest indigenously built guided-missile destroyer in August  and vowed to boost defences so 'no ...
AAP  Lok Satta fighting graft and each other,Times of India,10 Mar 2014,http://timesofindia.indiatimes.com/india/AAP-Lok-Satta-fighting-graft-and-each-other/articleshow/31816818.cms,CHENNAI: Anti-corruption crusaders and RTI activists are disappointed that Aam Aadmi Party (AAP) and Lok Satta Party have not joined hands to fight the Lok ...
China's Anti-Graft Watchdog Finds $19.6M  37kg Gold and 68 ...,International Business Times  India Edition,14 Nov 2014,http://www.ibtimes.co.in/shocking-chinas-anti-graft-watchdog-finds-37kg-gold-19-6m-68-houses-officials-name-613966,In an incident that has shocked many  China's anti-corruption watchdog has discovered 37kgs (82lbs) of gold  documents for 68 houses  and 120 million Yuan ...
Home dept okays graft probe against former cooperatives minister,Mumbai Mirror,30 Dec 2014,http://www.mumbaimirror.com/mumbai/others/Home-dept-okays-graft-probe-against-former-cooperatives-minister/articleshow/45698418.cms,Snippet not available
CVC recommends penalty against 97 bank officials for corruption,Firstpost,10 Jan 2014,http://www.firstpost.com/fwire/cvc-recommends-penalty-against-97-bank-officials-for-corruption-1333473.html,Snippet not available
IAS officers Arvind and Tinoo Joshi sacked in disproportionate ...,India Today,21 Jul 2014,http://indiatoday.intoday.in/story/ias-officers-arvind-and-tinoo-joshi-sacked-over-disproportionate-assets-case/1/373541.html,Snippet not available
Shyamal Acharya back at SBI as management audit head,Hindu Business Line,6 Mar 2014,http://www.thehindubusinessline.com/companies/shyamal-acharya-back-at-sbi-as-management-audit-head/article5756827.ece,Snippet not available
Lenders want to oversee Bhushan Steel operations,Business Standard,8 Aug 2014,http://www.business-standard.com/article/finance/lenders-want-to-oversee-bhushan-steel-operations-114080900036_1.html,Snippet not available
South Asia is World's Most Corrupt Region: Transparency International,NDTV,21 May 2014,http://www.ndtv.com/india-news/south-asia-is-worlds-most-corrupt-region-transparency-international-563198,Snippet not available
Maharashtra government gives nod for ACB probe against Patil,Economic Times,31 Dec 2014,http://articles.economictimes.indiatimes.com/2014-12-31/news/57558290_1_chief-minister-devendra-fadnavis-acb-probe-open-inquiry,Snippet not available
Maharashtra: Fadnavis Govt orders probe against another ex-NCP ...,Oneindia,1 Jan 2015,http://www.oneindia.com/india/maharashtra-fadnavis-govt-orders-probe-against-another-ex-ncp-minister-1609043.html,Snippet not available
Pending: 15 graft cases in high offices for which CBI wants sanction,Indian Express,6 May 2014,http://indianexpress.com/article/india/india-others/pending-15-graft-cases-in-high-offices-for-which-cbi-wants-sanction/,Snippet not available
Currently reading: Jayalalithaa denied bail by Karnataka HC in graft ...,indiatvnews.com,7 Oct 2014,http://www.indiatvnews.com/politics/national/jayalalithaa-bail-plea-rejected-by-the-karnataka-hc-20656.html,Snippet not available
Senior Railway Board official arrested by CBI on graft charges,The Hindu,22 Oct 2014,http://www.thehindu.com/news/national/senior-railway-board-official-arrested-by-cbi-on-graft-charges/article6526779.ece,Snippet not available
Chopper scam: Finmeccanica ex-heads cleared of graft charge  get ...,Indian Express,9 Oct 2014,http://indianexpress.com/article/india/india-others/chopper-scam-two-ex-bosses-of-finmeccanica-cleared-of-graft/,Snippet not available
New Delhi voters difficult to woo,Chandigarh Tribune,3 Apr 2014,http://www.tribuneindia.com/2014/20140404/delhi.htm,Snippet not available
AIIMS Vigilance Officer Shunted Out By Modi Government Seeks ...,NDTV,21 Aug 2014,http://www.ndtv.com/india-news/aiims-vigilance-officer-shunted-out-by-modi-government-seeks-cbi-probe-651843,Snippet not available
Give proof of graft against Sheila Dikshit: Arvind Kejriwal,Times of India,5 Jan 2014,http://timesofindia.indiatimes.com/city/delhi/Give-proof-of-graft-against-Sheila-Dikshit-Arvind-Kejriwal/articleshow/28448653.cms,Snippet not available
CBI registers graft case against agency DSP  MCA member,Business Standard,17 Oct 2014,http://www.business-standard.com/article/pti-stories/cbi-registers-graft-case-against-agency-dsp-mca-member-114101701243_1.html,Snippet not available
Jayalalitha is the first CM to lose post in a graft case,Daily News & Analysis,27 Sep 2014,http://www.dnaindia.com/india/report-jayalalitha-is-the-first-cm-to-lose-post-in-a-graft-case-2021997,Snippet not available
Snoopgate fame IAS officer arrested over corruption,Hindustan Times,30 Sep 2014,http://www.hindustantimes.com/india/snoopgate-fame-ias-officer-arrested-over-corruption/story-CcPSftJWEKshFyXlbRY9TM.html,Snippet not available
Concerned About Corruption in Medical Council of India: Harsh ...,NDTV,7 Nov 2014,http://www.ndtv.com/india-news/concerned-about-corruption-in-medical-council-of-india-harsh-vardhan-to-ndtv-690243,Snippet not available
Jan Lokpal: Kiran Bedi attacks Arvind Kejriwal on threat to resign,Economic Times,9 Feb 2014,http://articles.economictimes.indiatimes.com/2014-02-10/news/47200758_1_jan-lokpal-bill-kiran-bedi-team-anna,Snippet not available
