'MMRDA is a trust  not liable to pay tax',Times of India,17 Jul 2012,http://timesofindia.indiatimes.com/city/mumbai/MMRDA-is-a-trust-not-liable-to-pay-tax/articleshow/15023093.cms,Mumbai: The income tax appellate tribunal has agreed with the Mumbai Metropolitan Region Development Authority's (MMRDA) claim that it is a public trust and ...
Toll collection is a scam worth several hundred crores: MNS,Times of India,20 Jun 2012,http://timesofindia.indiatimes.com/city/mumbai/Toll-collection-is-a-scam-worth-several-hundred-crores-MNS/articleshow/14308629.cms,MUMBAI: Figures on daily vehicular movement and toll collected at six toll nakas (five entry points of Mumbai and one on Ghodbunder Road) could possibly be ...
Renovated 1100-year-old Varadharaja Perumal temple in ...,Times of India,5 Jul 2012,http://timesofindia.indiatimes.com/city/chennai/Renovated-1100-year-old-Varadharaja-Perumal-temple-in-Kancheepuram-consecrated/articleshow/14687014.cms,KANCHEEPURAM: Thousands of residents in the temple town of Kancheepuram were a proud lot on Thursday as their restoration efforts along with the ...
Kalyan Singh owns responsibility for Babri Masjid demolition,Times of India,27 Oct 2012,http://timesofindia.indiatimes.com/india/Kalyan-Singh-owns-responsibility-for-Babri-Masjid-demolition/articleshow/16982785.cms,LUCKNOW: Ahead of his re-induction into Bhartiya Janta Party (BJP)  former Uttar Pradesh (UP) chief minister and Jan Kranti Party (JKP) patron Kalyan Singh ...
Mexico swears in President amid violent protests,The Hindu,1 Dec 2012,http://www.thehindu.com/news/international/mexico-swears-in-president-amid-violent-protests/article4156103.ece,... the oath of office  his opponents called his inauguration an “imposition” of a party that ruled for 71 years using a mix of handouts  graft and rigged elections.
Gilani now reaches out to the Army,The Hindu,14 Jan 2012,http://www.thehindu.com/news/international/gilani-now-reaches-out-to-the-army/article2801322.ece,... Reconciliation Ordinance promulgated during the former President  Pervez Musharraf's tenure that gave amnesty to Mr. Zardari and others in graft cases.
Sun fuels hearth at Akshardham,Times of India,18 Nov 2012,http://timesofindia.indiatimes.com/city/delhi/Sun-fuels-hearth-at-Akshardham/articleshow/17273109.cms,NEW DELHI: The Akshardham temple in the capital has switched from piped natural gas to solar technology for cooking its daily quota of close to 4 000 meals ...
Increase in fuel prices unavoidable: Reddy,Livemint,11 Sep 2012,http://www.livemint.com/Politics/DqfB7uCuAYIyFNq09pNiJJ/Fuel-price-rise-unavoidable-in-short-term-Reddy.html,The government  struggling with graft charges over allocation of coal blocks  has delayed the hike in fuel prices  fearing a strong backlash from its allies and ...
Woman's body found in northeast Delhi,Times of India,28 Apr 2012,http://timesofindia.indiatimes.com/city/delhi/Womans-body-found-in-northeast-Delhi-third-in-5-days/articleshow/12916617.cms,NEW DELHI: The police on Saturday morning found the body of a woman that had been dumped in Sonia Vihar in northeast Delhi  the third such recovery in five ...
Pension scheme for KTDC staff,Times of India,19 Dec 2012,http://timesofindia.indiatimes.com/city/thiruvananthapuram/Pension-scheme-for-KTDC-staff/articleshow/17687039.cms,THIRUVANANTHAPURAM: The employees of KTDC Hotels and Resorts will get a contributory pension scheme soon. Unlike government employees who have ...
Nigerian poverty rising despite economic growth,Reuters India,13 Feb 2012,http://in.reuters.com/article/nigeria-poverty-idINDEE81C09W20120213,... over government corruption and poor governance and pressure has been building on President Goodluck Jonathan to tackle graft  particularly in the oil sector.
India  Russia sign defence deals worth Rs 25000 crore,Times of India,24 Dec 2012,http://timesofindia.indiatimes.com/india/India-Russia-sign-defence-deals-worth-Rs-25000-crore/articleshow/17749163.cms,NEW DELHI: India on Monday inked mega defence deals worth almost Rs 25 000 crore with Russia  including ones for 42 more Sukhoi-30MKI fighters and 71 ...
Visa norms eased for US visitors,Times of India,17 Jul 2012,http://timesofindia.indiatimes.com/city/mumbai/Visa-norms-eased-for-US-visitors/articleshow/15023000.cms,MUMBAI: The US embassy has eased visa application norms for Indians wishing to visit the US.In a move aimed to provide relief to Indians wishing to travel to ...
Housing society shows dog owners the door,Times of India,23 May 2012,http://timesofindia.indiatimes.com/city/mumbai/Housing-society-shows-dog-owners-the-door/articleshow/13418847.cms,NAVI MUMBAI: Two pet dogs  Untidy and Beetle—a mixed breed of Chihuahua and Shidzu miniatures—have become the bone of contention at the posh Radhe ...
Akhilesh Yadav does a U-turn  withdraws car bonanza for MLAs,Times of India,4 Jul 2012,http://timesofindia.indiatimes.com/india/Akhilesh-Yadav-does-a-U-turn-withdraws-car-bonanza-for-MLAs/articleshow/14669730.cms,LUCKNOW: Under attack from the Opposition  UP chief minister Akhilesh Yadav on Wednesday made a U-turn on his decision to allow MLAs to purchase ...
Zee chairman  son questioned,The Hindu,8 Dec 2012,http://www.thehindu.com/news/national/zee-chairman-son-questioned/article4178312.ece,Zee Group chairman Subhash Chandra and his son Punit Goenka  managing director of the company  on Saturday presented themselves for questioning before ...
Omar Abdullah meets deceased youth's family,The Hindu,3 Jan 2012,http://www.thehindu.com/news/national/omar-abdullah-meets-deceased-youths-family/article2771470.ece,Visiting the family of the youth killed in CISF firing in Boniyar  Jammu and Kashmir Chief Minister Omar Abdullah on Tuesday termed the action as “excessive” ...
Yingluck Shinawatra survives no-confidence vote,Livemint,28 Nov 2012,http://www.livemint.com/Politics/DcmmMBN2p5uBtgjVvlgEcK/Yingluck-Shinawatra-survives-noconfidence-vote.html,She added that the government will introduce an information technology system and install closed-circuit cameras to prevent graft. Among other issues brought ...
Haryana rapes: Chautala takes U-turn  says he was talking about ...,Times of India,11 Oct 2012,http://timesofindia.indiatimes.com/india/Haryana-rapes-Chautala-takes-U-turn-says-he-was-talking-about-Mughal-era/articleshow/16770109.cms,CHANDIGARH: After supporting the idea of khap panchayats to reduce the marriageable age of boys and girls to 16 years to curb incidents of sexual assault  ...
Eve-teasing: HC says women's dignity at stake,Times of India,10 Dec 2012,http://timesofindia.indiatimes.com/city/mumbai/Eve-teasing-HC-says-womens-dignity-at-stake/articleshow/17565599.cms,MUMBAI: Exactly a week after a 19-year-old youth was killed in Dombivli by a group of boys after he took them on for passing lewd comments on a girl  the ...
UP Minister gives 'sanction to steal',The Hindu,10 Aug 2012,http://www.thehindu.com/news/national/other-states/up-minister-gives-sanction-to-steal/article3749971.ece,The Minister said he had suspended 125 PWD  Cooperation and Irrigation officials on graft charges in the past four months. Leader of the Opposition in the ...
What would have Jinnah thought of Ajmal Kasab and gang  wonders ...,Times of India,30 Aug 2012,http://timesofindia.indiatimes.com/india/What-would-have-Jinnah-thought-of-Ajmal-Kasab-and-gang-wonders-SC/articleshow/16029576.cms,NEW DELHI: In the wanton spilling of blood and mindless destruction during the 26/11 Mumbai attacks  Pakistani terrorists had scant regard to places  including ...
Flower show ticket fee revised again,Times of India,7 Aug 2012,http://timesofindia.indiatimes.com/city/bengaluru/Flower-show-ticket-fee-revised-again/articleshow/15397081.cms,BANGALORE: A visit to Lalbagh for the upcoming flower show is not going to burn a hole in your pockets. After receiving a number of complaints from the public  ...
Porter booked for assaulting official,Jagran Post,20 Sep 2012,http://post.jagran.com/porter-booked-for-assaulting-railway-official-1348199650,Indore:A railway porter at Indore railway station was on Thursday booked for allegedly attacking a senior official on duty  police said. The pointsman  identified ...
Soaring vegetable prices: New band of middlemen playing havoc,Times of India,5 Jul 2012,http://timesofindia.indiatimes.com/city/kolkata/Soaring-vegetable-prices-New-band-of-middlemen-playing-havoc/articleshow/14698684.cms,KOLKATA: The government pressure and the lure of making a kill have prompted traders from Kolkata to shorten the trade chain. New faces from Kolkata who ...
Police claim leads in the Woodlands DGM murder case of Ghaziabad,Times of India,27 Jul 2012,http://timesofindia.indiatimes.com/city/delhi/Police-claim-leads-in-the-Woodlands-DGM-murder-case-of-Ghaziabad/articleshow/15226751.cms,NEW DELHI/GHAZIABAD: UP police might finally get some clue into the murder of Woodlands DGM Ankit Sharma's murder. Top cops from both the Delhi police ...
Pak girl critical  airlifted to Rawalpindi,Rediff (blog),11 Oct 2012,http://www.rediff.com/news/report/pak-teenage-blogger-shot-by-taliban-not-out-of-danger/20121011.htm,Snippet not available
Pak SC settles bitter battle over humble samosa,India Today,26 Jul 2012,http://indiatoday.intoday.in/story/samosa-pakistan-supreme-court-verdict/1/210289.html,Snippet not available
Zardari and Kayani meet for first time since memo scandal,Firstpost,14 Jan 2012,http://www.firstpost.com/world/zardari-and-kayani-meet-for-first-time-since-memo-scandal-182272.html,Snippet not available
'Leakage of letter an anti-national act',The Hindu,29 Mar 2012,http://www.thehindu.com/news/national/leakage-of-letter-an-antinational-act/article3257312.ece,Snippet not available
Congress taunts Modi over Sanjay Joshi row,Jagran Post,11 Jun 2012,http://post.jagran.com/congress-taunts-narendra-modi-over-sanjay-joshi-row-1339423356,Snippet not available
100 Anna supporters detained outside PM's residence,Chandigarh Tribune,28 Jul 2012,http://www.tribuneindia.com/2012/20120729/delhi.htm,Snippet not available
