Upasi's research foundation releases new high-yielding tea clone,Business Standard,29 Sep 2012,http://www.business-standard.com/article/markets/upasi-s-research-foundation-releases-new-high-yielding-tea-clone-112092900082_1.html,Till now  it has developed and released 33 varieties of tea. It has identified six compatible graft partners to develop new bushes from the TRF-5 clones  he said.
Parliamentarians hit out at Team Anna; attacking MPs now a trend ...,NDTV,27 Mar 2012,http://www.ndtv.com/india-news/parliamentarians-hit-out-at-team-anna-attacking-mps-now-a-trend-says-sharad-yadav-473596,Its nine members will be empowered to investigate complaints of graft against public servants. It was because of Anna's hunger strikes last year and the massive ...
S&P downgrades SBI  UBI's credit ratings,Times of India,10 Oct 2012,http://timesofindia.indiatimes.com/business/india-business/SP-downgrades-SBI-UBIs-credit-ratings/articleshow/16762583.cms,MUMBAI: Rating agency Standard & Poor's on Wednesday downgraded State Bank of India and Union Bank of India's stand-alone credit profile — rating without ...
Intolerant behaviour by politicians has no place in a democracy: Katju,Hindu Business Line,24 Oct 2012,http://www.thehindubusinessline.com/news/intolerant-behaviour-by-politicians-has-no-place-in-a-democracy-katju/article4027735.ece,Politicians must realise that in a democracy people have a right to criticise them  and the media has a right to enquire about the activities of politicians and inform ...
Rs. 14-crore bribe offered to Army chief VK Singh recorded on tape ...,NDTV,27 Mar 2012,http://www.ndtv.com/india-news/rs-14-crore-bribe-offered-to-army-chief-vk-singh-recorded-on-tape-sources-473600,... adding that he follows up even on anonymous letters that allege graft. He said he is ready to cancel any contract tainted by corruption. The BJP's Arun Jaitley ...
Pakistani Taliban plans to target media for Malala coverage,Times of India,13 Oct 2012,http://timesofindia.indiatimes.com/world/pakistan/Pakistani-Taliban-plans-to-target-media-for-Malala-coverage/articleshow/16795683.cms,ISLAMABAD: Angered by the coverage of its attempt to assassinate teenage rights activist Malala Yousufzai  the banned Tehrik-e-Taliban Pakistan has drawn ...
Must know facts about Tehelka sting case,Daily Bhaskar,28 Apr 2012,http://daily.bhaskar.com/news/NAT-TOP-must-know-facts-about-tehelka-sting-case-3183540.html,Enter at the lowest level of the food chain - the section officer in defence procurement - and work your way up the ladder of graft. Eight months into the ...
No compromise with Mamata Banerjee; Congress counts on ...,NDTV,19 Sep 2012,http://www.ndtv.com/india-news/no-compromise-with-mamata-banerjee-congress-counts-on-mulayam-singh-yadav-mayawati-499738,Her party was delivered a humiliating defeat in the recent elections in Uttar Pradesh because of allegations of deeply-entrenched graft. Mr Yadav's son  Akhilesh ...
Critical illness covers from non-life insurers are better,Business Standard,19 Sep 2012,http://www.business-standard.com/article/pf/critical-illness-covers-from-non-life-insurers-are-better-112092000032_1.html,... major organ transplant  heart valve replacement  coronary artery bypass graft  stroke  paralysis  myocardial infarction  major burns  total blindness  end stage ...
Meenakshi Sundareswarar Temple flag mast to be replaced with ...,The Hindu,22 Jun 2012,http://www.thehindu.com/news/national/tamil-nadu/meenakshi-sundareswarar-temple-flag-mast-to-be-replaced-with-new-one/article4013930.ece,The Chief Minister  Jayalalithaa  has ordered the replacement of the flag mast of the Meenakshi Sundareswarar Temple here with a new one. The new mast will ...
The general who kicked the hornets' nest,Livemint,30 May 2012,http://www.livemint.com/Home-Page/zq3Jai321zMyT4aqJwRN4L/The-general-who-kicked-the-hornets8217-nest.html,New Delhi: It was sometime in the early 1990s. A close boxing match degenerated into an ugly brawl between soldiers from two units of the Indian Army at a ...
Malala shooter's sister apologises,Times of India,5 Nov 2012,http://timesofindia.indiatimes.com/world/pakistan/Malala-shooters-sister-apologises-for-attack/articleshow/17111964.cms,ISLAMABAD: The sister of a man suspected in the shooting of Malala Yousufzai has apologised to the teenage Pakistani rights activist  saying that her brother ...
Sanjay Joshi quits BJP: 10 big facts,NDTV,8 Jun 2012,http://www.ndtv.com/cheat-sheet/sanjay-joshi-quits-bjp-10-big-facts-487448,The party's handling of Karnataka and Jharkhand has undermined its anti-graft stand." There has been some strong criticism of Mr Modi over the Sanjay Joshi ...
Clutch of cases against ex-DMK ministers in SC today,Times of India,18 Mar 2012,http://timesofindia.indiatimes.com/india/Clutch-of-cases-against-ex-DMK-ministers-in-SC-today/articleshow/12322550.cms,NEW DELHI: A bunch of cases challenging dismissal of graft charges against former DMK ministers is slated to come up before the Supreme Court on Monday ...
'Once Nirbhaya stabilizes  intestinal transplant is the only surgical ...,Times of India,25 Dec 2012,http://timesofindia.indiatimes.com/city/pune/Once-Nirbhaya-stabilizes-intestinal-transplant-is-the-only-surgical-option/articleshow/17762955.cms,Besides  rejection is more common in the intestinal graft. Rejection breaks down the intestinal barrier leading to bacterial translocation from within the lumen ...
No let-up in firing from Pak side in Poonch,Chandigarh Tribune,14 Jun 2012,http://www.tribuneindia.com/2012/20120615/nation.htm,While a soldier who had been critically injured in Pak firing on Indian forward posts along the Line of Control (LoC) in KG sector of Poonch district yesterday  was ...
70000-crore scam: Gadkari justifies letter lobbying for controversial ...,NDTV,4 Oct 2012,http://www.ndtv.com/india-news/70-000-crore-scam-gadkari-justifies-letter-lobbying-for-controversial-dam-contractors-500930,The Maharashtra unit of the BJP has said that dams like this one epitomize the crony capitalism and graft that guided those who conspired to loot the state.
Ram Jethmalani suspended from BJP for indiscipline; his remarks ...,NDTV,25 Nov 2012,http://www.ndtv.com/india-news/ram-jethmalani-suspended-from-bjp-for-indiscipline-his-remarks-meant-to-help-congress-says-party-505545,... recently by the issue of Nitin Gadkari's continuation as the party president for an unprecedented second term in the midst of charges of graft that he is facing.
Funds crunch deprives them of right to education,Times of India,1 Dec 2012,http://timesofindia.indiatimes.com/city/lucknow/Funds-crunch-deprives-them-of-right-to-education/articleshow/17447807.cms,LUCKNOW: Though enrolled at Drishti Samajik Sansthan (also know as Drishti)  five-year old Sapna  a child with multiple-disabilities living in interiors of Bakshi ...
I don't know why my children died  cries mother of Versova siblings,Times of India,7 Jul 2012,http://timesofindia.indiatimes.com/city/mumbai/I-dont-know-why-my-children-died-cries-mother-of-Versova-siblings/articleshow/14740657.cms,I don't know how my children died " said Farzana Chougle  mother of 26-year-old Rameez Chougle and 27-year-old Rehab Chougle  both of whom died ...
Councillor bribe charge nixes Rs 6 crore contracts,Times of India,18 May 2012,http://timesofindia.indiatimes.com/city/chennai/Councillor-bribe-charge-nixes-Rs-6-crore-contracts/articleshow/13280582.cms,CHENNAI: Graft in public projects may be a dirty open secret  but brazen interference by a ward councillor's husband in the bidding for projects has led to the ...
Pak grapples with fallout of violent protests,Chandigarh Tribune,22 Sep 2012,http://www.tribuneindia.com/2012/20120923/world.htm,Pakistanis today grappled with the fallout of the violence that engulfed the country during protests against an anti-Islam film  resulting in the death of at least 23 ...
The business called “modern medicine”,Moneylife Personal Finance site and magazine,2 Jul 2012,http://www.moneylife.in/article/the-business-called-ldquomodern-medicinerdquo/26706.html,"The business of healthcare delivery in the US has the same potential for graft and corruption as casino gambling and construction rackets" wrote Lisa Van ...
Pak Taliban threaten to attack Myanmar over Rohingya Muslims,Times of India,26 Jul 2012,http://timesofindia.indiatimes.com/world/pakistan/Pak-Taliban-threaten-to-attack-Myanmar-over-Rohingya-Muslims/articleshow/15166653.cms,ISLAMABAD: The Pakistani Taliban today threatened that they would attack Myanmar to avenge the targeting of Rohingya Muslims if Islamabad does not cut off ...
Nepal court allows lesbian live-in relationship,Times of India,6 Nov 2012,http://timesofindia.indiatimes.com/world/south-asia/Nepal-court-allows-lesbian-live-in-relationship/articleshow/17116724.cms,KATHMANDU: Continuing its tradition of passing liberal judgements regarding the rights of sexual minorities  Nepal's Supreme Court has recognised a live-in ...
Fisheries minister Parshottam Solanki faces heat from his own Koli ...,Times of India,27 Jun 2012,http://timesofindia.indiatimes.com/city/rajkot/Fisheries-minister-Parshottam-Solanki-faces-heat-from-his-own-Koli-community/articleshow/14439775.cms,Bhavnagar: It's not going to be a cakewalk for Gujarat's fisheries minister Parshottam Solanki  who is facing graft charges in a fishing scam  in the forthcoming ...
Pakistani rights activist Marvi Sirmed attacked by gunmen in Lahore,Times of India,2 Nov 2012,http://timesofindia.indiatimes.com/world/pakistan/Pakistani-rights-activist-Marvi-Sirmed-attacked-by-gunmen-in-Lahore/articleshow/17067713.cms,ISLAMABAD: Unidentified gunmen attacked prominent rights activist Marvi Sirmed on Friday  who has received threats from extremist groups several times in the ...
Bypass surgery breakthrough assures long-term survival,Times of India,30 Aug 2012,http://timesofindia.indiatimes.com/city/hyderabad/Bypass-surgery-breakthrough-assures-long-term-survival/articleshow/16025147.cms,The standard technique for a bypass surgery is to use one (left) mammary artery and leg veins' graft. But there is a high possibility that this procedure  after 15-20 ...
House: Row over law and order,Chandigarh Tribune,5 Jun 2012,http://www.tribuneindia.com/2012/20120606/delhi.htm,As the country observes 'World Environment Day' today  many parts of the national Capital reel from the shortage of water after the supply of raw water from ...
Now  Pakistan SC settles dispute over samosa price,Times of India,26 Jul 2012,http://timesofindia.indiatimes.com/world/pakistan/Now-Pakistan-SC-settles-dispute-over-samosa-price/articleshow/15180050.cms,ISLAMABAD: Alas! The days of cheap samosas in Pakistan is over. Ending a legal wrangle over the price of the humble samosa  the supreme court has set ...
No fast  andolan for a month: doctor tells Anna,The Hindu,1 Jan 2012,http://www.thehindu.com/news/national/no-fast-andolan-for-a-month-doctor-tells-anna/article2765889.ece,After abruptly ending the three-day fast in Mumbai within two days owing to failing health  anti-corruption crusader Anna Hazare might not even be able to ...
2 firemen among 5 hurt in Nai Sarak fire,Chandigarh Tribune,9 Jun 2012,http://www.tribuneindia.com/2012/20120610/delhi.htm,A major fire broke out today at Nai Sarak where five people  including two Delhi Fire Service officials  suffered injuries after a liquefied petroleum gas (LPG) ...
India pitches for Fitch upgrade after S&P blow,Reuters India,17 May 2012,http://in.reuters.com/article/fitch-india-ratings-idINDEE84G07220120517,... despite investor anger about changes to tax rules and slow progress on much vaunted economic liberalization under a government hit by graft scandals and ...
Honda Civic bids adieu to the Indian market,On Cars India,2 Aug 2012,http://www.oncars.in/car-news/honda-civic-bids-adieu-to-the-indian-market/2812,The loss of the Civic after over half-a-decade of hard graft will leave a hole in Honda's lineup that  we're afraid; the 2012 model cannot quite fill. Perhaps Honda ...
Govt fails to clear Anti Corruption Bureau's prosecution requests,Times of India,21 Dec 2012,http://timesofindia.indiatimes.com/city/jaipur/Govt-fails-to-clear-Anti-Corruption-Bureaus-prosecution-requests/articleshow/17713981.cms,... development and local bodies departments and the universities  even though the agency had concrete evidence against the officials held on graft charges.
"Karnataka should release 48 tmcft of water",The Hindu,4 Oct 2012,http://www.thehindu.com/news/national/tamil-nadu/karnataka-should-release-48-tmcft-of-water/article3964843.ece,Tamil Nadu on Thursday presented a forceful case to the visiting Central team that it should immediately be provided at least 48 thousand million cubic feet (tmc ...
Sr cop Sivanandi's suspension revoked after six months,Times of India,4 Jul 2012,http://timesofindia.indiatimes.com/city/chennai/Sr-cop-Sivanandis-suspension-revoked-after-six-months/articleshow/14683117.cms,CHENNAI: The state government has revoked the suspension of inspector-general of police P Sivanandi  who was kept under suspension since December 12  ...
Stem cell science is already saving lives,The Hindu,19 Mar 2012,http://www.thehindu.com/opinion/op-ed/stem-cell-science-is-already-saving-lives/article3013306.ece,He spent months in isolation until the graft had taken  but is now  says his mother Kerry Tuffin  living a normal life. “He recently started at nursery and he's doing ...
Illegal colonies: CM hails Kamal Nath,Chandigarh Tribune,10 Jun 2012,http://www.tribuneindia.com/2012/20120611/delhi.htm,Here is a group of newly emerged activists under the "Aam Aadmi" banner who call for attention to the irregularities in the social sector. According to them  much ...
Bettiah: Charas worth Rs 10.5 cr seized,Jagran Post,30 Apr 2012,http://post.jagran.com/charas-of-worth-rs-105-cr-was-seized-by-police-on-monday-1335774206,Bettiah (Bihar): Contraband charas worth Rs 10.5 crore in the international market was seized from a man and his two sons who were arrested from Sarkia Tola ...
Grab-o-cracy and the 15 other forms of Democracy in India,Firstpost,27 Aug 2012,http://www.firstpost.com/politics/grab-o-cracy-and-the-15-other-forms-of-democracy-in-india-432941.html,... said “game-changer” during an otherwise scintillating debate on anti-graft  or other such poppycock; and that my dear  was the proverbial smoochie-woochie).
Putin postpones Delhi visit by 8 weeks,Chandigarh Tribune,22 Oct 2012,http://www.tribuneindia.com/2012/20121023/nation.htm,Aggressive posturing by Beijing in the South China Sea  progress in negotiations over a bilateral civil nuclear deal and the agenda for Prime Minister ...
Anita Advani not Rajesh Khanna 's lover: Family,Times of India,8 Aug 2012,http://timesofindia.indiatimes.com/city/mumbai/Anita-Advani-not-Rajesh-Khanna-s-lover-Family/articleshow/15411349.cms,MUMBAI: Three weeks after superstar Rajesh Khanna died  his family has denied Anita Advani's claims that she was his long-time live-in partner and lover.
LJP to support UPA candidate in Presidential elections,Jagran Post,20 May 2012,http://post.jagran.com/ljp-to-support-upa-candidate-in-presidential-elections-1337529099,In response to a question on the Lokpal bill  Paswan alleged anti-graft crusader Anna Hazare was trying to bypass Parliament "which is not acceptable to us."
Ashok Chavan charged in Adarsh housing scam,Times of India,4 Jul 2012,http://timesofindia.indiatimes.com/india/Ashok-Chavan-charged-in-Adarsh-housing-scam/articleshow/14669803.cms,MUMBAI: Former Maharashtra chief minister Ashok Chavan was among 13 people charged by CBI today in the multi-crore Adarsh Housing scam.
Narendra Modi tells US daily: Gujarat's malnutrition due to figure ...,Times of India,29 Aug 2012,http://timesofindia.indiatimes.com/india/Narendra-Modi-tells-US-daily-Gujarats-malnutrition-due-to-figure-conscious-girls/articleshow/15948509.cms,NEW DELHI: Gujarat chief minister Narendra Modi has attributed his state's high rates of malnutrition to vegetarianism and figure-conscious Gujarati girls.
'Conspiracy behind power cut in Delhi',Jagran Post,30 Jul 2012,http://post.jagran.com/power-snapping-in-delhi-team-anna-alleged-conspiracy-angle-1343644848,He said that Delhi government has hatched a conspiracy in order to disrupt the Anna team's ongoing agitation against graft. Singh said that people will not be ...
JVM comes down heavily on Balmuchu,Jagran Post,6 May 2012,http://post.jagran.com/jvm-comes-down-heavily-on-congress-balmuchu-1336325938,The Congress has neither showed its sincerity to fight corruption nor felt any discomfort with leaders mired in graft  he claimed. Admitting that the distance ...
Pre-launch offer lands Gurgaon builder in trouble,Times of India,29 Jun 2012,http://timesofindia.indiatimes.com/city/gurgaon/Pre-launch-offer-lands-Gurgaon-builder-in-trouble/articleshow/14515717.cms,CHANDIGARH/ GURGAON: Advertising the pre-launch offer of residential flats before building plans were approved has landed a New Delhi-based Gurgaon ...
Delhi HC clears fast-track courts for rape cases,Times of India,19 Dec 2012,http://timesofindia.indiatimes.com/city/delhi/Delhi-HC-clears-fast-track-courts-for-rape-cases/articleshow/17685412.cms,NEW DELHI: The Delhi high court on Wednesday cleared the state government's proposal to set up five fast-track trial courts for speedy trial in rape cases  even ...
Pakistan's judiciary faces criticism for 'overreach',The Hindu,10 Feb 2012,http://www.thehindu.com/opinion/op-ed/pakistans-judiciary-faces-criticism-for-overreach/article2880066.ece,One photograph that many a Pakistani newspaper had on Thursday morning was of lawyer Aitzaz Ahsan driving the Chief Justice of Pakistan Iftikhar ...
Delhi lawyers strike work,Jagran Post,17 Sep 2012,http://post.jagran.com/delhi-lawyers-strike-work-on-monday-1347888683,The functioning of the courts were partially affected as the hearing of corruption cases related to 2G scam and Commonwealth Games (CWG) graft remain ...
Raising slogans will not end corruption: Katju,The Hindu,24 Mar 2012,http://www.thehindu.com/news/national/raising-slogans-will-not-end-corruption-katju/article3220872.ece,... Council of India (PCI) Chairman Justice Markandey Katju on Saturday said anti-corruption activist Anna Hazare lacked scientific ideas needed to tackle graft.
Shrapnel prevents Delhi blast victim's return home,Times of India,2 Feb 2012,http://timesofindia.indiatimes.com/city/delhi/Shrapnel-prevents-Delhi-blast-victims-return-home/articleshow/11721968.cms,NEW DELHI: Canada-based software consultant Nitin Mandlaus survived the Delhi high court blast of September 7  2011 despite 822 pieces of shrapnel ...
IIT abuzz over couple 's sperm call,Times of India,18 Jan 2012,http://timesofindia.indiatimes.com/city/mumbai/IIT-abuzz-over-couples-sperm-call/articleshow/11531699.cms,MUMBAI: A Chennai couple is looking for an "IITian's sperm"  something that has left the institute's students amused as well as annoyed across the country  ...
29-yr-old wages a war against criminalization of destitutes,Times of India,31 Dec 2012,http://timesofindia.indiatimes.com/city/mumbai/29-yr-old-wages-a-war-against-criminalization-of-destitutes/articleshow/17838988.cms,MUMBAI: Twenty nine-year-old  Tarique Mohammad Qureshi  wears his heart on his sleeves as he leads a crusade against criminalization of destitution.
Ghaziabad tops list of missing kids in district,Times of India,27 Jul 2012,http://timesofindia.indiatimes.com/city/delhi/Ghaziabad-tops-list-of-missing-kids-in-district/articleshow/15215276.cms,NOIDA: According to police reports  the posh area of Indirapuram in Ghaziabad is the epicentre for cases of missing children in the district. In the period ...
Eleven bank lockers of Ponty Chadha sealed,Times of India,3 Feb 2012,http://timesofindia.indiatimes.com/india/Eleven-bank-lockers-of-Ponty-Chadha-sealed/articleshow/11743889.cms,NEW DELHI/LUCKNOW: Eleven bank lockers of liquor baron Ponty Chadha were sealed today by the Income Tax department which claimed to have seized ...
Censor board firm on display of film categories,Times of India,19 Dec 2012,http://timesofindia.indiatimes.com/city/thiruvananthapuram/Censor-board-firm-on-display-of-film-categories/articleshow/17687060.cms,THIRUVANANTHAPURAM: Opting to watch a movie with family could turn out to be an embarrassing experience  especially if the entire flick turns out to be ...
The 281 era,Wisden India,31 Dec 2012,http://www.wisdenindia.com/?p=42810,The hard graft and hard knocks of Test cricket were like nightmarish 5 a.m. cold showers haunting the silk-robed on Jacuzzi evenings.The generation of 281 had ...
53 women sterilized in Bihar in 2 hours,Times of India,2 Apr 2012,http://timesofindia.indiatimes.com/india/53-women-sterilized-in-Bihar-in-2-hours/articleshow/12511547.cms,NEW DELHI: The Guinness Book of world record would have been happy to include this feat by a surgeon on January 7 in Bihar's Araria district - 53 sterilization ...
One gets life for ex-JNU students' union president murder,Times of India,9 Nov 2012,http://timesofindia.indiatimes.com/city/patna/One-gets-life-for-ex-JNU-students-union-president-murder/articleshow/17165164.cms,PATNA: The Additional District and Sessions Judge XIV  Patna  Choudhary Brijendra Kumar Roy  on Friday  sentenced to life imprisonment one of the accused ...
Rabid dog bites 7 children  7 adults,Times of India,25 Jul 2012,http://timesofindia.indiatimes.com/city/bengaluru/Rabid-dog-bites-7-children-7-adults/articleshow/15152483.cms,BANGALORE: Hours after chief minster Jagadish Shettar asserted in the state legislative assembly that his government will do everything to address the stray ...
Attack on Modi continues  RSS mouthpiece slams him,Chandigarh Tribune,2 Jun 2012,http://www.tribuneindia.com/2012/20120603/nation.htm,There appears to be no let-up in the internal attack on controversial Gujarat Chief Minister Narendra Modi. In fact  it has picked up speed since he forced BJP ...
First bone marrow transplant in Nashik on thalassemia patient,Times of India,8 Nov 2012,http://timesofindia.indiatimes.com/city/nashik/First-bone-marrow-transplant-in-Nashik-on-thalassemia-patient/articleshow/17151447.cms,NASHIK: The first bone marrow transplant on a thalassemia patient was performed in Nashik on a patient from Iraq. It is the first such surgery in north ...
Bharti Airtel in money laundering probe,Reuters India,15 May 2012,http://in.reuters.com/article/india-bharti-airtel-idINDEE84E05H20120515,... second term have rocked the government and businesses  sparking street protests by anti-graft activists and spurring a flurry of investigations of companies.
After crackdown  17 doctors shut abortion clinics in Thane,Times of India,21 Aug 2012,http://timesofindia.indiatimes.com/city/thane/After-crackdown-17-doctors-shut-abortion-clinics-in-Thane/articleshow/15592960.cms,THANE: A showdown between district health officials and gynaecologists conducting abortions within a legally-approved time-frame here has resulted in the ...
Four killed in fresh Assam violence; curfew continues in Kokrajhar,Times of India,16 Nov 2012,http://timesofindia.indiatimes.com/india/Four-killed-in-fresh-Assam-violence-curfew-continues-in-Kokrajhar/articleshow/17251768.cms,GUWAHATI: Bodoland area in lower Assam witnessed fresh trouble with the killing of four persons by armed assailants in Jiaguri even as police arrested a ...
Mega block on Central Railway today,Times of India,8 Dec 2012,http://timesofindia.indiatimes.com/city/mumbai/Mega-block-on-Central-Railway-today/articleshow/17539622.cms,MUMBAI: Central Railway services will not be available at Thakurli  Kopar  Diva  Mumbra and Kalva due to a mega block between Kalyan and Thane from 11am ...
Once powerful Sureedu now a humble man,Times of India,27 Dec 2012,http://timesofindia.indiatimes.com/city/hyderabad/Once-powerful-Sureedu-now-a-humble-man/articleshow/17789080.cms,HYDERABAD: E Surya Narayana Reddy alias Sureedu  the personal assistant of former chief minister YS Rajasekhara Reddy who enjoyed clout almost on a ...
Class XI admission policy: Parents  students to protest on Monday,Times of India,12 Jul 2012,http://timesofindia.indiatimes.com/city/delhi/Class-XI-admission-policy-Parents-students-to-protest-on-Monday/articleshow/14857365.cms,NEW DELHI: Parents and students will protest in front of directorate of education on Monday against the new admission policy for class XI in science and ...
French jet Rafale bags $20bn IAF fighter order; India 'briefs' losing ...,Times of India,1 Feb 2012,http://timesofindia.indiatimes.com/india/French-jet-Rafale-bags-20bn-IAF-fighter-order-India-briefs-losing-European-countries/articleshow/11706551.cms,NEW DELHI: First  the Americans  Russians and Swedes were ejected out of the hotly-contested race. And now  the Europeans too have been shot down in the ...
GRP officials refuse to lodge theft complaint,Times of India,29 Jul 2012,http://timesofindia.indiatimes.com/city/kanpur/GRP-officials-refuse-to-lodge-theft-complaint/articleshow/15261627.cms,KANPUR: A suitcase of a woman passenger was stolen in Kalka mail. The incident took place near Asansol railway station when the train was heading towards ...
Parasu Dental Centre at Velachery,The Hindu,23 Dec 2012,http://www.thehindu.com/news/cities/chennai/chen-downtown/parasu-dental-centre-at-velachery/article4228843.ece,... restorations dental bonding  paediatric dentistry  enamel shaping  gum treatment  bone graft sealant and fluoride application tooth whitening are available.
