No list  no breakthrough: Black money in Swiss banks not coming ...,Firstpost,6 Jul 2014,http://www.firstpost.com/india/no-list-no-breakthrough-black-money-in-swiss-banks-not-coming-back-yet-1605611.html,The BJP has long declared its determination to bring back 'black money' to the country. The issue was a prominent part of the party's successful Lok Sabha ...
BPPF demands graft probe,Calcutta Telegraph,6 Jul 2014,http://www.telegraphindia.com/1140707/jsp/frontpage/story_18587973.jsp,Kokrajhar  July 6: The Bodoland Peoples Progressive Front (BPPF) has sought governor J.B. Patnaik's intervention to probe alleged corruption in the Bodoland ...
Blog: Arvind Kejriwal must acknowledge  rectify mistakes  writes ...,NDTV (blog),23 Jan 2014,http://www.ndtv.com/blog/blog-arvind-kejriwal-must-acknowledge-rectify-mistakes-writes-justice-santosh-hegde-548677,He was part of the core team that led the India Against Corruption movement  demanding the new anti-graft Lokpal law) The Aam Aadmi Party was created out of ...
CBI files chargesheet against Maran brothers in Aircel-Maxis case,Livemint,29 Aug 2014,http://www.livemint.com/Politics/ZNHtmoFFEWUacnmPj5IpXO/AircelMaxis-case-CBI-files-chargesheet-against-Maran-broth.html,New Delhi: The Central Bureau of Investigation (CBI) on Friday pressed charges of graft and criminal misconduct against former communications minister ...
Narendra Modi may lose $3 billion Nalco plant to Iran on coal,Livemint,11 Aug 2014,http://www.livemint.com/Politics/1XTA2HacOdSwAaoMGXwiBM/Narendra-Modi-may-lose-3-billion-plant-to-Iran-on-coal.html,While Narendra Modi has pledged to fix energy woes over time  graft probes  environmental objections and slow land acquisition are holding back efforts to ...
Ex bank manager gets four years jail for cheating  graft case,Business Standard,23 Apr 2014,http://www.business-standard.com/article/pti-stories/ex-bank-manager-gets-four-years-jail-for-cheating-graft-case-114042300887_1.html,A Delhi court has sent a former State Bank of Bikaner and Jaipur (SBBJ) Chief Manager and another person to four years rigorous imprisonment for cheating the ...
PM Asks for Expediting Criminal Cases Against Parliamentarians ...,NDTV,24 Jul 2014,http://www.ndtv.com/india-news/pm-asks-for-expediting-criminal-cases-against-parliamentarians-within-a-year-593389,In his election campaign  Mr Modi  63  had vowed a zero-tolerance policy on graft if he was selected by voters. This Parliament has a record number of ...
Narendra Modi's rise brings a new grammar to Indian politics,Livemint,1 Jun 2014,http://www.livemint.com/Opinion/nQdP5E6RPzczVCh5tFRuPP/A-new-grammar.html,For a country paralysed for several years by the cholesterol of graft and indecision  much of this is welcome. Language and grammar have an ultimate purpose ...
New posters show Rahul Gandhi as anti-corruption hero,NDTV,14 Jan 2014,http://www.ndtv.com/india-news/new-posters-show-rahul-gandhi-as-anti-corruption-hero-547836,... of the Lokpal Bill in a short winter session last month and his party gives him all the credit for the new law  which sets up a national anti-graft ombudsman.
No Leader of Opposition? Please Explain  Says Supreme Court to ...,NDTV,21 Aug 2014,http://www.ndtv.com/india-news/no-leader-of-opposition-please-explain-says-supreme-court-to-centre-652133,... Party leader Prashant Bhushan's petition asking the government to explain the delay in appointing the nine members of the national anti-graft ombudsman or ...
BlackBerry's claims lack merit  says Ryan Seacrest's Typo,NDTV,6 Jan 2014,http://gadgets.ndtv.com/mobiles/news/blackberrys-claims-lack-merit-says-ryan-seacrests-typo-467759,Struggling smartphone maker BlackBerry says the Typo keyboard is an attempt to graft its distinctive angled miniature keys on to other smartphones. © Thomson ...
Anna Hazare-Mamata Banerjee bonhomie a marriage of ...,Daily News & Analysis,22 Feb 2014,http://www.dnaindia.com/india/report-anna-hazare-mamata-banerjee-bonhomie-a-marriage-of-convenience-1964223,Known as an anti-graft crusader  Anna's association provides her an agenda to be counted nationally " said Jana  observing that the association may yield ...
Former Haryana Chief Minister and INLD chief Om Prakash Chautala,NDTV,11 Oct 2014,http://www.ndtv.com/india-news/former-haryana-chief-minister-om-prakash-chautala-surrenders-at-tihar-jail-678044,He was convicted in January last year for running a graft-laden scheme to recruit teachers for government institutions when he was in office in 1999. Mr Chautala ...
Stormy start to Parliament's last session before election,Livemint,5 Feb 2014,http://www.livemint.com/Politics/lbh6HE17eLDhesM7IWUubN/Parliaments-last-session-set-to-be-preelection-scrap.html,After 10 years in power  the popularity of the United Progressive Alliance (UPA)  led by Congress  has sagged in large part over a series of graft scandals as well ...
Prime Minister Recep Tayyip Erdogan Gains Ground in Turkish ...,Wall Street Journal (India),31 Mar 2014,http://www.wsj.com/articles/SB10001424052702303978304579470752756039522,Mr. Erdogan has denied the allegations and has sought to quash the sprawling graft probe by overhauling the judiciary  purging thousands of police officials he ...
Anti-bribery initiatives: Miles to go for India Inc  shows survey,Business Standard,8 Dec 2014,http://www.business-standard.com/article/companies/anti-bribery-initiatives-mile-to-go-for-india-inc-shows-survey-114120800865_1.html,Corporate India's efforts to sensitise its employees on anti-bribery and corruption compliance efforts do not seem to resonate with most employees  show the ...
India seeks to recover $367 million from AgustaWestland,Reuters India,10 Jan 2014,http://in.reuters.com/article/india-finmeccanica-augustawestland-idINDEEA0905M20140110,The Congress-led government is keen to be seen as tough on graft in the lead up to parliamentary elections due by May 2014. Congress performed poorly in ...
E-Retailers Growth Ensnared in India's Logistics Jungle,NDTV,9 Jun 2014,http://www.ndtv.com/india-news/e-retailers-growth-ensnared-in-indias-logistics-jungle-576825,... to several online retailers and logistics companies. Road and rail transport networks remain woefully underdeveloped and entangled in graft and bureaucracy.
Day-to-day trial in CWG scam case as per SC verdict,India Today,26 Apr 2014,http://indiatoday.intoday.in/story/cwg-scam-suresh-kalmadi-sc-verdict-commonwealth-games/1/357804.html,The trial in a CWG related graft scam  in which Congress MP Suresh Kalmadi and nine others are facing prosecution  will be conducted on a day-to-day basis  ...
One month of Arvind Kejriwal's government: Five hits and five misses,NDTV,27 Jan 2014,http://www.ndtv.com/cheat-sheet/one-month-of-arvind-kejriwals-government-five-hits-and-five-misses-549064,(Arvind Kejriwal pulls the plug on FDI in retail stores in Delhi); Hit: The government's anti-graft helpline asks callers to report and conduct sting operations ...
Graft case: Over 80 government files found at agent's house,Economic Times,29 Oct 2014,http://economictimes.indiatimes.com/news/politics-and-nation/graft-case-over-80-government-files-found-at-agents-house/articleshow/44971898.cms,MUMBAI: Anti-Corruption Bureau sleuths  probing a graft case against a Maharashtra revenue official and two agents  has recovered a heap of government files ...
N Srinivasan wants to control ICC's Anti-Corruption and Security Unit,Daily News & Analysis,7 May 2014,http://www.dnaindia.com/sport/report-n-srinivasan-wants-to-control-icc-s-anti-corruption-and-security-unit-1986144,In other words  the ICC wants its anti-graft mechanism to be under the control of a man who has been sidelined by the Supreme Court following serious ...
68 bills lapsed at end of 15th Lok Sabha,Times of India,22 Feb 2014,http://timesofindia.indiatimes.com/india/68-bills-lapsed-at-end-of-15th-Lok-Sabha/articleshow/30862388.cms,The Prevention of Bribery of Foreign Public Officials and Officials of Public International Organisations Bill  2011: One of the anti-graft bills that was on priority list ...
Never seen a party as corrupt as Trinamool  says Bimal Gurung,India Today,18 Mar 2014,http://indiatoday.intoday.in/story/gorkha-janmukti-morcha-bimal-gurung-mamata-banerjee-trinamool-congress/1/350082.html,Calling West Bengal's ruling Trinamool Congress corrupt  Gorkha Janmukti Morcha (GJM) chief Bimal Gurung Tuesday alleged there was graft in distribution of ...
Arvind Kejriwal's resignation dented AAP's chances in national poll ...,NDTV,23 Apr 2014,http://www.ndtv.com/elections-news/arvind-kejriwals-resignation-dented-aaps-chances-in-national-poll-manish-sisodia-558525,Mr Kejriwal and his cabinet quit the government in Delhi after 49 days over the defeat of anti-graft bill by the Congress and the BJP in the assembly.
In Varanasi  Arvind Kejriwal faces a poster war,NDTV,15 Apr 2014,http://www.ndtv.com/elections-news/in-varanasi-arvind-kejriwal-faces-a-poster-war-557470,Mr Kejriwal had resigned in February when the Congress and BJP stalled his effort to push an anti-graft bill in the Delhi assembly. His political rivals accuse him ...
BlackBerry sues Ryan Seacrest's Typo over iPhone keyboard,NDTV,4 Jan 2014,http://gadgets.ndtv.com/mobiles/news/blackberry-sues-ryan-seacrests-typo-over-iphone-keyboard-466829,"We are flattered by the desire to graft our keyboard onto other smartphones  but we will not tolerate such activity without fair compensation for using our ...
Bangladesh's Khaleda Zia loses court battle on corruption charges,Livemint,14 Sep 2014,http://www.livemint.com/Politics/Z7SB3ehVbBqVgU1ANWIUNO/Bangladeshs-Khaleda-Zia-loses-court-battle-on-corruption-ch.html,Snippet not available
Polling begins for fifth phase of assembly elections in Jharkhand ...,India.com,19 Dec 2014,http://www.india.com/news/india/polling-begins-for-fifth-phase-of-assembly-elections-in-jharkhand-jammu-and-kashmir-227372/,Snippet not available
Erdogan declares victory for AKP in key local election,The Hindu,30 Mar 2014,http://www.thehindu.com/news/international/world/erdogan-declares-victory-for-akp-in-key-local-election/article5853481.ece,Snippet not available
Delhi ACB's role restricted,The Hindu,19 Aug 2014,http://www.thehindu.com/news/cities/Delhi/delhi-acbs-role-restricted/article6333687.ece,Snippet not available
Syndicate Bank bribery case: accused in judicial remand,Livemint,24 Sep 2014,http://www.livemint.com/Politics/nkBs7lmOuqZO8KczRckgTM/Syndicate-Bank-bribery-case-accused-in-judicial-remand.html,Snippet not available
AIADMK functionary wants Jayalalithaa to quit as party General ...,Daily News & Analysis,9 Oct 2014,http://www.dnaindia.com/india/report-aiadmk-functionary-wants-jayalalithaa-to-quit-as-party-general-secretary-2024820,Snippet not available
Delhi CM Arvind Kejriwal resigns: Recommends assembly ...,India.com,14 Feb 2014,http://www.india.com/loudspeaker/delhi-cm-arvind-kejriwal-resigns-recommends-assembly-dissolution-fresh-polls-13548/,Snippet not available
Opposition does not respect women: Rahul Gandhi,Deccan Chronicle,16 Feb 2014,http://www.deccanchronicle.com/140216/news-politics/article/opposition-does-not-respect-women-rahul-gandhi,Snippet not available
President's Rule imposed in Delhi after Arvind Kejriwal's resignation,NDTV,16 Feb 2014,http://www.ndtv.com/india-news/presidents-rule-imposed-in-delhi-after-arvind-kejriwals-resignation-551077,Snippet not available
Glad to see Jayalalithaa back: Rajnikanth,The Hindu,19 Oct 2014,http://www.thehindu.com/news/national/tamil-nadu/glad-to-see-aiadmk-chief-jayalalithaa-back-in-her-poes-garden-residence-says-tamil-superstar-rajnikanth/article6516764.ece,Snippet not available
SC suspends Jayalalithaa's sentence  grants interim bail; AIADMK ...,Times of India,17 Oct 2014,http://timesofindia.indiatimes.com/india/SC-suspends-Jayalalithaas-sentence-grants-interim-bail-AIADMK-activists-break-out-into-celebrations/articleshow/44845286.cms,Snippet not available
Will not spare anyone found involved in corruption: Arvind Kejriwal,Daily News & Analysis,3 Jan 2014,http://www.dnaindia.com/india/report-will-not-spare-anyone-found-involved-in-corruption-arvind-kejriwal-1944394,Snippet not available
Top Bollywood producers paid 'bribe' to Censor Board CEO to save ...,Financial Express,19 Aug 2014,http://www.financialexpress.com/archive/top-bollywood-producers-paid-bribe-to-censor-board-ceo-to-save-item-numbers/1280711/,Snippet not available
How Modi Has Moved Into Kejriwal's Space,Wall Street Journal (India) (blog),5 Nov 2014,http://blogs.wsj.com/indiarealtime/2014/11/05/how-narendra-modi-has-moved-into-arvind-kejriwals-space/,Snippet not available
Prez refusal to sign ordinances shows assertiveness,Hindustan Times,5 Mar 2014,http://www.hindustantimes.com/india/prez-refusal-to-sign-ordinances-shows-assertiveness/story-WWP86jwQnZGQeWFpsAAAkJ.html,Snippet not available
President nod for Lokpal Bill,The Hindu,1 Jan 2014,http://www.thehindu.com/news/national/president-nod-for-lokpal-bill/article5526463.ece,Snippet not available
Rahul Gandhi hints at PM role if party wins election,Reuters India,15 Jan 2014,http://in.reuters.com/article/india-rahul-gandhi-congress-pm-idINDEEA0D06H20140114,Snippet not available
15th Parliament: The curious case of ill-mannered Indian MPs,Firstpost,21 Feb 2014,http://www.firstpost.com/politics/15th-parliament-ill-mannered-and-adamant-1403013.html,Snippet not available
