Enrique may perform in Shillong,Times of India,18 Apr 2009,http://timesofindia.indiatimes.com/india/Enrique-may-perform-in-Shillong/articleshow/4419509.cms,SHILLONG: If everything goes right  the music-crazy Shillongites can run  can hide  but can't escape their love for Enrique Iglesias as the Spanish pop sensation ...
Harappan-era cemetery found,Times of India,3 Mar 2009,http://timesofindia.indiatimes.com/india/Harappan-era-cemetery-found/articleshow/4221028.cms,FARMANA(Rohtak): In an extraordinary archaeological finding  a big housing complex that matured during the Harappan era has been discovered in this little ...
Rajini's metallic look!,Times of India,15 Feb 2009,http://timesofindia.indiatimes.com/others/news-interviews/Rajinis-metallic-look/articleshow/4131575.cms,AP transport official arrested for graft  owns assets worth Rs 800 crore. If you are a transport operator and if you need a permit in Andhra Pradesh's Godavari ...
4-month-old dies on plane while being breastfed,Times of India,11 Mar 2009,http://timesofindia.indiatimes.com/india/4-month-old-dies-on-plane-while-being-breastfed/articleshow/4253548.cms,KOCHI: A four-month-old baby died of asphyxiation in an aircraft while being breastfed  shortly before the flight was about to take off from the international airport ...
ID cards not given  students miss NIOS exam,Times of India,6 Apr 2009,http://timesofindia.indiatimes.com/city/delhi/ID-cards-not-given-students-miss-NIOS-exam/articleshow/4367423.cms,NOIDA: Several hundred students of National Institute of Open Schooling (NIOS) from the Delhi region were on Monday reportedly unable to appear for the class ...
Quiet achiever: Shamili,Times of India,4 Jul 2009,http://timesofindia.indiatimes.com/others/news-interviews/Quiet-achiever-Shamili/articleshow/4738174.cms,The soft spoken Shamili (Yes  the younger sister of Shalini Ajith)  who prefers to keep a low profile  has reasons to smile.
