CBI raids HPCL office after graft allegations,Times of India,15 Jul 2014,http://timesofindia.indiatimes.com/city/nagpur/CBI-raids-HPCL-office-after-graft-allegations/articleshow/38444456.cms,NAGPUR: Local anti-corruption wing of Central Bureau of Investigation's (CBI) conducted a surprise check at the regional office of Hindustan Petroleum ...
Will Bellary's Sriramulu hurt BJP's anti-graft plank?,NDTV,26 Mar 2014,http://www.ndtv.com/elections-news/will-bellarys-sriramulu-hurt-bjps-anti-graft-plank-555250,Bellary: Iron rich Bellary in Karnataka was the scene of the famous electoral contest between Sonia Gandhi and Sushma Swaraj in 1999. Mrs Gandhi won that ...
Chinese Ex-Official Admits Bribery in High-Profile Trial,Wall Street Journal (India),24 Sep 2014,http://www.wsj.com/articles/chinese-ex-official-admits-bribery-in-high-profile-trial-1411562471,Since then  some reporters in China who have sought to publicly allege graft by officials have landed in hot water. A number of alleged bribery arrangements ...
Delhi's anti-graft wing stripped of power to probe gas pricing case,Business Standard,19 Aug 2014,http://www.business-standard.com/article/current-affairs/delhi-s-anti-graft-wing-stripped-of-power-to-probe-gas-pricing-case-114081900407_1.html,The Centre has taken away powers of the Delhi government's anti-corruption branch (ACB) to investigate charges filed against Reliance Industries  its chairman ...
Not just training: What RBI  public banks need to do to curb bribery ...,Firstpost,23 Sep 2014,http://www.firstpost.com/business/finance/not-just-training-what-rbi-public-banks-need-to-do-to-curb-bribery-employee-attrition-1991795.html,Jain's arrest and subsequent sacking from the job is just another instance of a public sector banker getting caught for graft. He isn't the first chairman of a PSU ...
CBI files review petition in SNC Lavalin graft case,India Today,31 Jan 2014,http://indiatoday.intoday.in/story/cbi-files-review-petition-in--snc-lavalin-graft-case/1/341113.html,The revision petition also pointed out that loss to the exchequer cannot be dismissed as an administrative flaw as the accused were well aware of the loss it will ...
UDF sitting on advice for strong anti-graft system,Deccan Chronicle,4 Jan 2014,http://www.deccanchronicle.com/140104/news-politics/article/udf-sitting-advice-strong-anti-graft-system,UDF sitting on advice for strong anti-graft system. DC | ARJUN RAGHUNATH. Published Jan 4  2014  8:17 pm IST. Updated Jan 20  2016  3:24 pm IST ...
Jailed J Jayalalithaa vs bailed Om Prakash Chautala,Economic Times,8 Oct 2014,http://articles.economictimes.indiatimes.com/2014-10-09/news/54827725_1_om-prakash-chautala-j-jayalalithaa-haryana,Sure  people in Haryana might look upon a graft prosecution more lightly than in Tamil Nadu  but that does not prove that institutional systems are weaker there ...
Nayar Agrawal LC question constitutional validity of ACB police ...,Legally India,17 Oct 2014,http://www.legallyindia.com/201410175203/Litigation/nayar-agarwal-law-chambers-act-on-murli-deora-rsquo-s-challenge-to-kejriwal-anti-corruption-fir,Nayar Agrawal LC question constitutional validity of ACB police powers in Murli Deora challenge to Kejriwal graft FIR · Email Facebook Tweet Linked-in ...
Gang sending people abroad illegally busted in Patiala,Daily News & Analysis,25 Jul 2014,http://www.dnaindia.com/india/report-gang-sending-people-abroad-illegally-busted-in-patiala-2005293,Sanjiv Kumar used to operate from his office Graft Consultancy near Namdev Chowk in Jalandhar and had also obtained mobile numbers using forged ID proofs ...
Graft case: CBI searches residence of Censor Board CEO,India Today,14 Aug 2014,http://indiatoday.intoday.in/story/cbi-rakesh-kumar-bribery-case-censor-board-ceo-shripati-mishra-mor-dauki-ke-bihav/1/377223.html,CBI is carrying out searches at the residence of Rakesh Kumar along with two other middlemen. Shripati Mishra has been demanding Rs 70 000 on behalf of ...
Haryana polls: INLD bets on sympathy for to-be-jailed Om Prakash ...,Economic Times,11 Oct 2014,http://articles.economictimes.indiatimes.com/2014-10-12/news/54928837_1_inld-mp-dushyant-chautala-haryana-polls,Modi directly attacked the INLD leader and charged him with graft and promoting dynastic politics. Chautala's son Abhay is holding the rallies that the former was ...
NTPC wary over Alstom graft probe,Livemint,7 May 2014,http://www.livemint.com/Companies/vqmwe6SffMJ8MBKMAKFbpK/NTPC-wary-over-Alstom-graft-probe.html,NTPC chairman Arup Roy Choudhury took up the matter with Alstom's chairman and CEO  Patrick Kron  on his visit to India in April. Photo: Bloomberg.
Suspended Syndicate Bank CMD SK Jain  others gets bail in bribery ...,Economic Times,1 Oct 2014,http://articles.economictimes.indiatimes.com/2014-10-01/news/54516736_1_puneet-godha-ltd-ved-prakash-agarwal-managing-director-neeraj-singal,They were apprehended in connection with two separate graft cases in which the CBI had booked them under the Prevention of Corruption Act and for the ...
A king among mangoes,The Hindu,23 May 2014,http://www.thehindu.com/features/metroplus/a-king-among-mangoes/article6040843.ece,“My uncle S.R.V. Thatham started the farm in 1945  and one of his friends brought the first graft of the Imam Pasand from Andhra Pradesh. We developed the ...
India reviews state hospitals to end widespread corruption,Reuters India,23 Aug 2014,http://in.reuters.com/article/india-health-corruption-idINKBN0GN0HO20140823,Prime Minister Narendra Modi's government has vowed to eradicate graft in India's $74 billion healthcare industry  where doctors receiving extra payments for ...
Entire gram panchayat of Chandrapada village in Naigaon may be ...,Times of India,6 Jul 2014,http://timesofindia.indiatimes.com/city/mumbai/Entire-gram-panchayat-of-Chandrapada-village-in-Naigaon-may-be-made-co-accused-in-graft-case/articleshow/37912254.cms,Entire gram panchayat of Chandrapada village in Naigaon may be made co-accused in graft case. Sandhya Nair. Committee members of entire gram panchayat ...
Back to Aam Aadmi. Arvind Kejriwal quits as Delhi Chief Minister,NDTV,14 Feb 2014,http://www.ndtv.com/india-news/back-to-aam-aadmi-arvind-kejriwal-quits-as-delhi-chief-minister-550818,Arvind Kejriwal's move to table the anti-graft Jan Lokpal Bill in the Delhi legislature was rejected. New Delhi: Less than two months after Arvind Kejriwal rode the ...
Setback to Virbhadra in money laundering case,The Hindu,6 Aug 2014,http://www.thehindu.com/news/national/other-states/prima-facie-case-appears-to-be-made-out-against-virbhadra-centre-to-hc/article6287421.ece,Octogenarian Himachal Pradesh Chief Minister Virbhadra Singh may soon face an FIR in the money laundering and disproportionate income case. Additional ...
BJP blocking six anti-corruption bills: Rahul Gandhi,Indian Express,15 Feb 2014,http://indianexpress.com/article/india/politics/bjp-blocking-six-anti-corruption-bills-rahul-gandhi/,Congress Vice President Rahul Gandhi on Saturday accused BJP of blocking passage of six anti-graft bills by Parliament  which form part of the government's ...
Arvind Kejriwal's Strike 2 against Sheila Dikshit based on ...,NDTV,6 Feb 2014,http://www.ndtv.com/delhi-news/arvind-kejriwals-strike-2-against-sheila-dikshit-based-on-commonwealth-games-549950,A panel appointed by the PM to investigate graft in the Games had faulted Ms Dikshit for over-spending on new street-lighting and signage mounted in the city ...
A short cut and a blind alley,Indian Express,6 Mar 2014,http://indianexpress.com/article/opinion/columns/a-short-cut-and-a-blind-alley/,This shelved the government's flagship anti-graft measures  which it thought would bring substantial electoral dividends.
Arvind Kejriwal government's journey through 48 days,Indian Express,15 Feb 2014,http://indianexpress.com/photos/picture-gallery-others/arvind-kejriwals-journey-through-48-days/,Arvind Kejriwal  who pledged to root out corruption after steering AAP to power in Delhi  was a man in a hurry and set a scorching pace to try to fulfill his anti-graft ...
Odisha Vigilance arrested OAS officer on graft charge,Orissadiary.com,28 Nov 2014,http://orissadiary.com/Mauyrbhanj/ShowDistrictNews.asp?id=55227,Baripada: The anti-corruption vigilance sleuths on Thursday arrested an Odisha Administrative Service (OAS) officer on graft charge. The officer identified as ...
ISL: Is Robert Pires the ideal midfielder for FC Goa?,Sportskeeda,30 Oct 2014,http://www.sportskeeda.com/football/isl-is-robert-pires-ideal-midfielder-fc-goa,Asking Pires to play such a role would be too tough on the 41-year-old  and given the loss in his speed and having been out of touch for a while  his graft has ...
Last UPA cabinet meet: Telangana  Rahul's anti-graft bills on cards?,Firstpost,27 Feb 2014,http://www.firstpost.com/politics/last-upa-cabinet-meet-telangana-rahuls-anti-graft-bills-on-cards-1412159.html,In what could well be the last cabinet meeting of UPA 2  the Manmohan Singh government is keen to clear key proposals  including anti-corruption legislation  ...
Minister fires graft salvo at officials,Calcutta Telegraph,16 Oct 2014,http://www.telegraphindia.com/1141017/jsp/frontpage/story_18934178.jsp,Patna  Oct. 16: Vinay Bihari  the state minister who has been regularly hurling allegations against the very government he is a part of  today fired yet another ...
Rajnikanth says 'glad' to see Jayalalithaa back in her residence,India.com,19 Oct 2014,http://www.india.com/news/india/rajnikanth-says-glad-to-see-jayalalithaa-back-in-her-residence-176378/,... “glad” to see AIADMK chief J Jayalalithaa back in her Poes Garden residence after being granted bail in a graft case and wished her good health and peace.
Akhilesh Yadav suspends Raebareli excise officer over graft charges,Economic Times,23 May 2014,http://articles.economictimes.indiatimes.com/2014-05-23/news/50054949_1_graft-charges-corruption-charges-raebareli,The officer  Nirankar Nath Pandey has been placed under suspension by the chief minister after corruption charges against him were prima facie found to be ...
Congress targets MoS Inderjit  cites graft allegations from UPA-I,Indian Express,30 May 2014,http://indianexpress.com/article/india/politics/congress-targets-mos-inderjit-cites-graft-allegations-from-upa-i/,Congress targets MoS Inderjit  cites graft allegations from UPA-I. Shashi Tharoor on Friday questioned how can it be that one is corrupt when in UPA and is ...
Delhi cops on VIP duty under scanner over criminal charges,India Today,28 Sep 2014,http://indiatoday.intoday.in/story/delhi-cops-on-vip-duty-under-scanner-over-criminal-charges/1/393230.html,... unit' deployed for VIP security cover are facing an inquiry from the force's vigilance department over various charges  including graft and sexual harassment.
Former Tamil Nadu CM Jayalalithaa gets bail in graft case,Reuters India,17 Oct 2014,http://in.reuters.com/article/india-politics-idINKCN0I60SP20141017,J. Jayalalithaa  former chief minister of Tamil Nadu and chief of Anna Dravida Munetra Khazhgam (AIADMK)  gestures from inside a vehicle after addressing her ...
GlaxoSmithKline Found Guilty of Bribery in China,Wall Street Journal (India),19 Sep 2014,http://www.wsj.com/articles/glaxosmithkline-found-guilty-of-bribery-in-china-1411114817,... bare a tale of intrigue involving a mysterious sex tape  whistleblowers  private investigators and a culture of bribery and graft in China's vast medical industry.
Narendra Modi gifts Maharshtra a new metro as CM boycotts events,India Today,21 Aug 2014,http://indiatoday.intoday.in/story/narendra-modi-gifts-maharshtra-new-metro-cm-boycotts-events/1/378296.html,... the state a clutch of infrastructure projects including a metro for Nagpur as he reaffirmed his government's commitment to development and rooting out graft.
Kerala govt chief whip sets up anti-graft outfit,India Today,15 Jul 2014,http://indiatoday.intoday.in/story/kerala-government-chief-whip--new-anti-graft-outfit/1/372474.html,Kerala government's chief whip P.C. George  who is vice-chairman of Kerala Congress (M)  is set to launch a new anti-graft outfit. The move to form the new outfit ...
Aam aadmi is against corruption  says Arvind Kejriwal before ...,NDTV,2 Jan 2014,http://www.ndtv.com/delhi-news/aam-aadmi-is-against-corruption-says-arvind-kejriwal-before-winning-trust-vote-546561,... We have to accept this country's politics is entrenched in graft; Water  electricity  roads are poor because of these politics; Two years ago  the aam Indian said ...
Left to kick off anti-graft movement,Deccan Chronicle,15 Oct 2014,http://www.deccanchronicle.com/141016/nation-politics/article/left-kick-anti-graft-movement,Left to kick off anti-graft movement. DC CORRESPONDENT. Published Oct 16  2014  10:22 am IST. Updated Jan 10  2016  8:38 am IST ...
`Ronaldo of knees`: surgeon saves football careers,Zee News,7 Apr 2014,http://zeenews.india.com/sports/football/-ronaldo-of-knees--surgeon-saves-football-careers_784402.html,With small  precise movements  Noronha removes a section of the patellar tendon  which lies over the knee cap  and uses it as a graft to repair the torn anterior ...
AAP announces nation-wide anti-graft campaign against Congress ...,Economic Times,15 Feb 2014,http://articles.economictimes.indiatimes.com/2014-02-15/news/47358995_1_arvind-kejriwal-manish-sisodia-aap,NEW DELHI: Supporting Arvind Kejriwal's decision to resign as Delhi Chief Minister  Aam Aadmi Party (AAP) on Saturday said that a national anti-corruption ...
Anti-graft body pulls up Karnataka MLAs for not declaring assets,India Today,26 Jan 2014,http://indiatoday.intoday.in/story/anti-graft-body-karnataka-congress-mlas-assets-and-liabilities-lokayukta/1/339989.html,The state anti-corruption body Lokayukta served notices to Congress MLAs R. Roshan Baig  Muniratna Naidu and B.A. Mohiuddin Bava for failing to declare ...
Mattu gulla can be grafted on to inferior varieties of brinjal,Bellevision,15 Mar 2014,http://www.bellevision.com/belle/index.php?action=topnews&type=8760,Udupi  15 Mar 2014: It is possible to graft an ordinary variety of brinjal with the famed ... Once the graft was successful  the plant would yield large  green  brinjals ...
Bollywood stars figure in CBFC graft case,Deccan Chronicle,19 Aug 2014,http://www.deccanchronicle.com/140820/nation-current-affairs/article/bollywood-stars-figure-cbfc-graft-case,New Delhi:The CBI  probing an alleged bribery case involving Rakesh Kumar  CEO of the Central Board of Film Certification  is also investigating allegations ...
Ex- AGM of Punjab & Sind Bank  Others Jailed in Graft Case,Outlook,8 Sep 2014,http://www.outlookindia.com/newswire/story/ex-agm-of-punjab-sind-bank-others-jailed-in-graft-case/858993,A Delhi court has awarded varying jail terms of 2 to 4 years to four persons including a former Assistant General Manager of Punjab and Sind Bank for ...
Rahul Gandhi saks if BJP is 'blind' to people like BS Yeddyurappa ...,Indian Express,29 Mar 2014,http://indianexpress.com/article/india/politics/is-bjp-blind-to-people-like-b-s-yeddyurappa-mining-mafia-rahul-gandhi/,Congress leader Rahul Gandhi on Saturday chose graft  BJP's main plank in the Lok Sabha polls  to attack the saffron party  saying “are they blind” to people ...
ACB books Versova inspector in Rs1.20 lakh graft case,Daily News & Analysis,18 Nov 2014,http://www.dnaindia.com/mumbai/report-acb-books-versova-inspector-in-rs120-lakh-graft-case-2036452,A police inspector attached to the Versova police station in Andheri (West) was on Tuesday booked by the Anti-Corruption Bureau (ACB) for allegedly ...
Politics: Changing equations,Livemint,2 Feb 2014,http://www.livemint.com/Specials/9NIqCaE2pNTrsWfowejUnI/Politics-Changing-Equations.html,Whether as an activist flanking the more high-profile Anna Hazare during the anti-graft protests or  more recently  as the newly crowned chief minister of Delhi  ...
Madras HC order seeking reason for RTI plea 'illegal'  say experts,Indian Express,21 Sep 2014,http://indianexpress.com/article/india/india-others/madras-hc-order-seeking-reason-for-rti-plea-illegal-say-experts/,... seeking reason for RTI plea 'illegal'  say experts. Sindhu Shivalingam  Chennai-based anti-graft activist  said such orders would make the RTI Act toothless.
RPSC full commission to decide on RAS exam,Times of India,27 Nov 2014,http://timesofindia.indiatimes.com/city/jaipur/RPSC-full-commission-to-decide-on-RAS-exam/articleshow/45303338.cms,RPSC is already facing the accusation of paper leak and the former chairman Habib Khan Gauran is facing graft charges. RPSC had already cancelled the ...
Exclusive: I am a mazdoor and I am used to hard work  says Modi,India Today,4 May 2014,http://indiatoday.intoday.in/story/narendra-modi-interview-exclusive-robert-wadra-black-money/1/358926.html,The BJP prime ministerial candidate described graft as a sin that has to be fought but made it clear he had not personified corruption. Sanjay Bragta & Amitabh ...
Graft case: Jagan Mohan Reddy appears in court,Deccan Chronicle,21 Jul 2014,http://www.deccanchronicle.com/140722/nation-current-affairs/article/graft-case-jagan-mohan-reddy-appears-court,Hyderabad: YSR Congress chief Y.S. Jagan Mohan Reddy and India Cements CMD Srinivasan appeared before the special court for CBI cases in Nampally on ...
What Prithvi Govt didn't say: how it sat on sanction requests in 76 ...,Indian Express,27 Oct 2014,http://indianexpress.com/article/india/india-others/what-prithvi-govt-didnt-say-how-it-sat-on-sanction-requests-in-76-corruption-cases/,At 26  the highest number of pending graft cases involve officials from the state revenue department. These include 11 tahsildars  eight nayib tahsildars  four ...
A day before retirement  an ACP booked on corruption charges,India Today,1 Aug 2014,http://indiatoday.intoday.in/story/acp-delhi-police-corruption-charges/1/375226.html,An ACP-rank police officer was booked on graft charges by the Delhi government's Anti- Corruption Branch on the eve of his retirement. Besides former Assistant ...
Bangladesh's former prime minister Khaleda Zia loses court battle ...,Times of India,14 Sep 2014,http://timesofindia.indiatimes.com/world/south-asia/Bangladeshs-former-prime-minister-Khaleda-Zia-loses-court-battle-on-corruption-charges/articleshow/42447556.cms,The national anti-graft agency started prosecution against the four by submitting a chargesheet against them in 2012. Proceedings in the cases were conducted ...
Ex-Bihar DGP  NIA chief in race for CBI top post,Indian Express,23 Nov 2014,http://indianexpress.com/article/india/india-others/ex-bihar-dgp-nia-chief-in-race-for-cbi-top-post/,Race for the coveted post of CBI director has heated up ahead of the Parliament's Winter Session  beginning Monday  when the government is slated to move a ...
Rs 100 crore common facility centre opened to enhance small ...,Times of India,23 Feb 2014,http://timesofindia.indiatimes.com/city/trichy/Rs-100-crore-common-facility-centre-opened-to-enhance-small-industries/articleshow/30922541.cms,TRICHY: The imminent announcement of dates for the elections to Lok Sabha has turned a blessing in disguise as long-pending projects are cleared hastily.
Report indicts 7 Mansa officials in food scam,Chandigarh Tribune,5 Dec 2014,http://www.tribuneindia.com/news/punjab/report-indicts-7-mansa-officials-in-food-scam/14778.html,The report has accused four food inspectors and two assistant food and supply officers (AFSO) and a district food and supply officer of graft. A team of AFSOs ...
Food Corporation of India in need of restructuring as corruption mars ...,Livemint,4 Nov 2014,http://www.livemint.com/Politics/vesoR5XxwEK0mrfSaeOVZI/Food-Corporation-of-India-pays-labourers-7250-a-month.html,... an agency at the heart of the world's largest public food distribution programme for the poor  as graft and waste leave 255 million people without enough to eat ...
Pawan Bansal's rise and fall from star salesman to wily rainmaker to ...,Economic Times,4 Aug 2014,http://economictimes.indiatimes.com/news/company/corporate-trends/pawan-bansals-rise-and-fall-from-star-salesman-to-wily-rainmaker-to-alleged-graft-middleman/articleshow/39648528.cms,Pawan Bansal's rise and fall from star salesman to wily rainmaker to alleged graft middleman. By Sugata Ghosh  ET Bureau | Updated: Aug 05  2014  10.38 AM ...
In Bihar  Narendra Modi attacks Congress on corruption issue,Livemint,27 Mar 2014,http://www.livemint.com/Politics/JDO9inDmru0bt8X2R1RmQO/Narendra-Modi-rakes-corruption-issue-to-attack-Congress.html,Political analysts following Modi's public speeches said he was speaking on graft in anticipation of the Aam Aadmi Party (AAP) chief Arvind Kejriwal bringing an ...
More Than PM Modi  Congress Helped Us Win  Says LK Advani,NDTV,15 Aug 2014,http://www.ndtv.com/india-news/more-than-pm-modi-congress-helped-us-win-says-lk-advani-649272,Then  like now  he had said the Congress' permissiveness of graft and poor governance enabled the BJP's winning result. Late last year  Mr Advani led a small ...
'Will Never Resign Again  Have Learnt My Lesson'  Arvind Kejriwal ...,NDTV,6 Nov 2014,http://www.ndtv.com/india-news/will-never-resign-again-have-learnt-my-lesson-arvind-kejriwal-tells-ndtv-689773,... I will never resign again " joked Mr Kejriwal  who controversially quit as Chief Minister in February after a 49-day term in office when his anti-graft proposal was ...
AAP's 50% waiver on power bills to Delhi defaulters on hold,NDTV,21 Feb 2014,http://www.ndtv.com/india-news/aaps-50-waiver-on-power-bills-to-delhi-defaulters-on-hold-551514,... two days before he and his cabinet resigned after the BJP and the Congress foiled their plans to introduce the anti-graft Jan Lokpal Bill in the Delhi Assembly.
20 BJP Leaders in Trouble With PM Narendra Modi for Skipping ...,NDTV,22 Dec 2014,http://www.ndtv.com/india-news/20-bjp-leaders-in-trouble-with-pm-narendra-modi-for-skipping-delhi-rallies-716971,Arvind Kejriwal of the Aam Admi Party then headed a minority government with support from the Congress  but quit after 49 days because an anti-graft proposal ...
BJP turns blind eye to corruption in Gujarat  Madhya Pradesh ...,Economic Times,7 Mar 2014,http://articles.economictimes.indiatimes.com/2014-03-07/news/48005679_1_youth-congress-anti-graft-bills-corruption-issue,NEW DELHI: Attacking BJP on corruption issue  Rahul Gandhi today accused it of blocking the passage of anti-graft bills in Parliament and turning a blind eye to ...
Two Howrah MMiCs face graft charges,Times of India,17 Aug 2014,http://timesofindia.indiatimes.com/city/kolkata/Two-Howrah-MMiCs-face-graft-charges/articleshow/40330162.cms,KOLKATA: Two persons have been removed from key posts in the Howrah Municipal Corporation after charges of irregularities were levelled against them.
Lokpal now a law as President Pranab Mukherjee gives his assent ...,NDTV,1 Jan 2014,http://www.ndtv.com/india-news/lokpal-now-a-law-as-president-pranab-mukherjee-gives-his-assent-to-the-anti-corruption-legislation-546447,New Delhi: The much-awaited Lokpal Bill today got the assent from President Pranab Mukherjee  providing for creation of an anti-graft watchdog which will bring ...
Arvind Kejriwal's Aam Aadmi Party moves Supreme Court against ...,NDTV,20 Feb 2014,http://www.ndtv.com/india-news/arvind-kejriwals-aam-aadmi-party-moves-supreme-court-against-presidents-rule-in-delhi-551428,... some 60 hours after Mr Kejriwal stepped down from Chief Minister's post after the BJP and the Congress foiled his plans to introduce the anti-graft Jan Lokpal ...
Winter Session of Parliament to resume on Feb 5 to pass 'Vote-on ...,NDTV,16 Jan 2014,http://www.ndtv.com/india-news/winter-session-of-parliament-to-resume-on-feb-5-to-pass-vote-on-account-budget-ahead-of-lok-sabha-po-548068,... passage of some anti-corruption legislations which have been identified by Congress Vice President Rahul Gandhi as the broader "framework" to fight graft.
You'll never forget the name Brendon McCullum again,Wisden India,18 Feb 2014,http://www.wisdenindia.com/cricket-article/forget-brendon-mccullum/99797,A batsman who has learnt to trust his defence  to play against his natural grain  to graft and graft if the situation so demands  but who  between the graft  also ...
Ukraine Names US National Natalia Jaresko as Finance Minister,NDTV,2 Dec 2014,http://www.ndtv.com/world-news/ukraine-names-us-national-natalia-jaresko-as-finance-minister-707494,... finance minister while handing the economy portfolio to Lithuanian investment banker Aivaras Abromavicius in a new government designed to sweep out graft ...
If Rahul is serious about corruption  then let the law of the land ...,Firstpost,21 Jan 2014,http://www.firstpost.com/politics/if-rahul-is-serious-about-corruption-then-let-the-law-of-the-land-investigate-vadra-1351449.html,In his speech Rahul Gandhi talked about giving "the country anti-graft bills which will transform the country ” and which will lead to "punish[ing] the corrupt and ...
Nashik Zilla Parishad CEO forms panel to probe graft charges,Times of India,17 Feb 2014,http://timesofindia.indiatimes.com/city/nashik/Nashik-Zilla-Parishad-CEO-forms-panel-to-probe-graft-charges/articleshow/30584383.cms,NASHIK: After a Nashik Zilla Parishad (ZP) member and an official traded charges of corruption in the meeting of the standing committee on Monday  the Chief ...
Israeli court sentences former premier Ehud Olmert to 6 yrs in jail,Indian Express,13 May 2014,http://indianexpress.com/article/world/asia/israeli-court-sentences-former-premier-olmert-to-6-yrs-in-jail/,The disgraced former premier  who had to resign after a series of allegations of graft started to come to light  was also fined USD 300 000 by a Tel Aviv court for ...
