Learn From Selfless Xi Jinping  Chinese TV Says In Graft ...,NDTV,19 Oct 2016,http://www.ndtv.com/world-news/learn-from-selfless-xi-jinping-chinese-tv-says-in-graft-documentary-1476419,Xi has waged a sweeping war on deep-seated graft since assuming power almost four years ago  vowing to go after powerful "tigers" as well as lowly "flies"  ...
Former party boss of China's Guangzhou jailed for life for graft,The Indian Express,29 Sep 2016,http://indianexpress.com/article/world/world-news/former-party-boss-of-chinas-guangzhou-jailed-for-life-for-graft-3057269/,Former party boss of China's Guangzhou jailed for life for graft. Wan Qingliang admitted his guilt and handed over evidence not previously discovered in the ...
Karnataka Lokayukta special public prosecutor quits  blames ...,The New Indian Express,3 Nov 2016,http://www.newindianexpress.com/states/karnataka/2016/nov/04/karnataka-lokayukta-special-public-prosecutor-quits-blames-government-and-graft-1534750.html,Dalwai's move came just hours after the court discharged three politicians  including former minister Katta Subramanya Naidu  in graft cases. Katta  whose name ...
China to prosecute former graft buster for suspected corruption,The Indian Express,13 Apr 2016,http://indianexpress.com/article/world/world-news/china-graft-officer-corruption/,A former senior Chinese provincial official overseeing graft busting efforts will himself be prosecuted for suspected corruption after an investigation found he took ...
Son  wife of China's former domestic security tsar jailed for graft,Daily News & Analysis,16 Jun 2016,http://www.dnaindia.com/world/report-son-wife-of-china-s-former-domestic-security-tsar-jailed-for-graft-2224439,Zhou Yongkang  Chinas former domestic security chief  stands between his police escorts as he listens to his sentence in a court in Tianjin  China  in this still ...
Consumer forum member held for graft,Times of India,8 Sep 2016,http://timesofindia.indiatimes.com/city/delhi/Consumer-forum-member-held-for-graft/articleshow/54201715.cms,According to ACB officials  Vinod Negi  who works as an executive officer at the Institute of Charted Accountants of India  had filed a graft complaint at the ACB ...
Ex-Chairman Chennai Port Trust Gets 2 Years In Prison For Graft,NDTV,30 Nov 2016,http://www.ndtv.com/chennai-news/ex-chairman-chennai-port-trust-gets-2-years-in-prison-for-graft-1632416,Chennai: Former Chairman of Chennai Port Trust K Suresh was sentenced to two years rigorous imprisonment by a CBI court in a graft case  a statement from ...
Graft accused cop amasses wealth 800% of legal income,Times of India,6 Nov 2016,http://timesofindia.indiatimes.com/city/surat/Graft-accused-cop-amasses-wealth-800-of-legal-income/articleshow/55280576.cms,Surat: Investigation into graft charges against suspended assistant sub-inspector (ASI) Prakash Patil  a millionaire cop  has revealed that he had accumulated ...
No  graft isn't good for growth,Livemint,28 Jun 2016,http://www.livemint.com/Opinion/GLCoIJFWrrVxz8MJjarOKK/No-graft-isnt-good-for-growth.html,Some critics dismiss Chinese President Xi Jinping's massive anti-graft campaign as a political witch-hunt directed at his enemies. Others have a different ...
Guatemala prosecutor says threat against her linked to graft ...,The Indian Express,19 Jul 2016,http://indianexpress.com/article/world/world-news/guatemala-prosecutor-says-threat-against-her-linked-to-graft-prosecution-2924871/,Guatemala prosecutor says threat against her linked to graft prosecution. Guatemala chief prosecutor Thelma Aldana said there are several theories about who ...
Graft case filed against Gotabaya Rajapaksa,The Hindu,31 Aug 2016,http://www.thehindu.com/news/international/graft-case-filed-against-gotabaya-rajapaksa/article9056392.ece,Gotabaya Rajapaksa  brother of Sri Lanka's former President Mahinda Rajapaksa  was among eight persons against whom the a graft commission filed a ...
Bangladesh Court Rejects Former PM Khaleda Zia's Plea In Graft ...,NDTV,17 Apr 2016,http://www.ndtv.com/world-news/bangladesh-court-rejects-former-pm-khaleda-zias-plea-in-graft-case-1396444,Dhaka: A court today rejected two petitions of Bangladesh's embattled former prime minister Khaleda Zia who appeared before it in a graft case which accuses ...
China: State television unveils graft secrets through tale of dead ...,The Indian Express,17 Oct 2016,http://indianexpress.com/article/world/world-news/china-state-television-unveils-graft-secrets-through-tale-of-dead-tortoise-3088978/,China: State television unveils graft secrets through tale of dead tortoise. Party officials are not supposed to practice religion and the charge of superstition is ...
Graft accused seeks deposition of seized cash in bank post,Business Standard,2 Dec 2016,http://www.business-standard.com/article/pti-stories/graft-accused-seeks-deposition-of-seized-cash-in-bank-post-116120201170_1.html,After the demonetisation of high-value notes  an accused in the graft case involving former Medical Council of India president Ketan Desai has moved a special ...
Delhi: Court asks accused businessman to join probe in graft case,The Indian Express,12 Aug 2016,http://indianexpress.com/article/india/india-news-india/delhi-court-asks-accused-businessman-to-join-probe-in-graft-case-2971411/,A Delhi court today directed a businessman  accused in a graft case involving Delhi Chief Minister's former principal secretary Rajendra Kumar  to join the ...
Centre accused academician of graft  Maharashtra promoted him,The Indian Express,27 Jul 2016,http://indianexpress.com/article/india/india-news-india/centre-accused-academician-jagannath-patil-of-graft-maharashtra-promoted-him2939595/,Days after the Central government shunted out a senior academician facing graft charges  the Maharashtra government offered him a plum posting. And despite ...
Can't probe Narendra Modi for graft  says SC,Times of India,25 Nov 2016,http://timesofindia.indiatimes.com/india/Cant-probe-Narendra-Modi-for-graft-says-SC/articleshow/55628827.cms,NEW DELHI: The Supreme Court refused to order a probe into alleged huge payoffs to politicians  including the then Gujarat CM Narendra Modi  purportedly by ...
Adarsh Building  Built On Graft  To Be Demolished  Says Bombay ...,NDTV,29 Apr 2016,http://www.ndtv.com/mumbai-news/adarsh-building-bulit-on-graft-to-be-demolished-says-bombay-high-court-1400823,The Adarsh Housing Society  an illegal apartment building in Mumbai that became a symbol of political corruption  must be demolished  the Bombay High Court ...
Central Council of Homeopathy chief Dr Ramjee Singh held for graft,Hindustan Times,22 Oct 2016,http://www.hindustantimes.com/india-news/central-council-of-homeopathy-chief-dr-ramjee-singh-held-for-graft/story-PZ9nVLQxxZSIr0NTSSZR8L.html,CBI sources say the arrests of Jha and Dr Singh could be the tip of the iceberg as the CBI suspects that Jha may have collected money for regulatory approval to ...
Demonetisation politics: How parties are coping with Modi ...,Firstpost,15 Nov 2016,http://www.firstpost.com/politics/demonetisation-politics-how-parties-are-coping-with-modi-governments-war-on-graft-3106422.html,A fallout of the Prime Minister's high-profile war on graft has been the emergence of moral fault lines around black money. Quite apart from the economics  his ...
Senior FDA official held for graft,The Hindu,14 Sep 2016,http://www.thehindu.com/news/cities/mumbai/senior-fda-official-held-for-graft/article9109633.ece,The Mumbai Unit of the Maharashtra Anti Corruption Bureau on Wednesday arrested an Assistant Commissioner with the Food and Drug Administration for ...
CBI plans 24x7 graft call centre,Times of India,16 Nov 2016,http://timesofindia.indiatimes.com/india/CBI-plans-24x7-graft-call-centre/articleshow/55466199.cms,The idea will be put before the anti-graft investigative agencies of states when their representatives gather in Delhi on Thursday for an annual conference.
Graft conviction pace worries HC,Times of India,22 Nov 2016,http://timesofindia.indiatimes.com/city/mumbai/Graft-conviction-pace-worries-HC/articleshow/55569881.cms,Mumbai: The Bombay high court on Tuesday expressed concern over the negligible conviction rate in corruption cases. "As per the data of National Crime ...
PM Modi to Opposition: Should the road to black money  graft be ...,Times of India,27 Nov 2016,http://timesofindia.indiatimes.com/india/Should-the-road-to-black-money-graft-be-blocked-or-should-there-be-a-Bharat-Bandh-PM-Modi/articleshow/55648903.cms,NEW DELHI: In a dig at the Opposition+   Prime Minister Narendra Modi on Sunday asked if the road to black money and graft should be blocked  or whether ...
3 agri officers held for graft in Bathinda,Chandigarh Tribune,22 Jul 2016,http://www.tribuneindia.com/news/punjab/3-agri-officers-held-for-graft-in-bathinda/269870.html,3 agri officers held for graft in Bathinda. 0. SHARES; facebook · twitter · goolge plus; Print This Page. Also in this section. No cash  Faridkot farmers lock bank ...
Brazilian aircraft manufacturer Embraer to pay $205 million in graft ...,Times of India,24 Oct 2016,http://timesofindia.indiatimes.com/business/international-business/Brazilian-aircraft-manufacturer-Embraer-to-pay-205-million-in-graft-settlement/articleshow/55041175.cms,NEW YORK/ NEW DELHI: Brazilian aircraft manufacturer Embraer has agreed to pay over $205 million to resolve charges of corruption and making bribe ...
US  Brazil probe graft in UPA's $208-million Embraer jet deal,Chandigarh Tribune,9 Sep 2016,http://www.tribuneindia.com/news/nation/us-brazil-probe-graft-in-upa-s-208-million-embraer-jet-deal/293172.html,A $208-million Embraer jet deal of the UPA era has come under the scanner of the US authorities over alleged kickbacks paid to secure the contract. The deal ...
CBI raids unearth major graft in FACT; case filed,The New Indian Express,22 Oct 2016,http://www.newindianexpress.com/states/kerala/2016/oct/23/cbi-raids-unearth-major-graft-in-fact-case-filed-1530871.html,According to the official  the vigilance wing of FACT had submitted a report before the Union Ministry of Fertilizers  after detecting the graft a few months ago  ...
CBI registers 502 graft cases against central government staff till Oct ...,Hindustan Times,25 Nov 2016,http://www.hindustantimes.com/india-news/cbi-registers-502-graft-cases-against-central-government-staff-till-oct-31/story-UyQ4xksLq79i0rcjhVo49N.html,In 2013  the agency had registered 596 graft cases. In 2014  607 cases were registered and in 2015  the agency had filed 576 cases under the Prevention of ...
Online system to check graft in central PSUs,Hindu Business Line,5 Sep 2016,http://www.thehindubusinessline.com/economy/policy/online-system-to-check-graft-in-central-psus/article9075219.ece,An online system to give vigilance status of top executives in central public sector enterprises (CPSEs) may soon be started by the Centre. The decision to start ...
AAP: Transport department indulging in graft,Times of India,17 Nov 2016,http://timesofindia.indiatimes.com/city/goa/AAP-Transport-dept-indulging-in-graft/articleshow/55484408.cms,Panaji: The Aam Aadmi Party (AAP) has charged the state transport department of corruption and alleged that transport minister Ramakrishna Dhavalikar alias ...
Co-accused can be tried after death of graft accused  says SC,The Hindu,10 Aug 2016,http://www.thehindu.com/news/national/coaccused-can-be-tried-after-death-of-graft-accused-says-sc/article8970017.ece,The death of a tainted public servant before trial begins in a corruption scam does not bar a special court from trying the fellow accused  who are private persons  ...
Finmeccanica's former boss jailed for graft in VVIP chopper deal with ...,The Indian Express,8 Apr 2016,http://indianexpress.com/article/india/india-news-india/finmeccanicas-former-boss-jailed-for-graft-in-vvip-chopper-deal-with-india-giuseppe-orsi-agustawestland/,Italian prosecutors had requested jail terms of six years and five years for Orsi and Spagnolini  respectively  news agency ANSA reported.
Water tanker 'scam': Report on graft 'by Sheila govt' sent to ACB ...,The Indian Express,16 Jun 2016,http://indianexpress.com/article/india/india-news-india/water-tanker-scam-report-on-graft-by-sheila-govt-sent-to-acb-says-mishra-2857938/,Meanwhile  BJP leader Vijender Gupta has written to LG Najeeb Jung and alleged the AAP sent the report in a “deceitful manner”  after having “slept over” it for ...
Vigilance Commission Plans First-Ever Public Perception Index On ...,NDTV,31 Oct 2016,http://www.ndtv.com/india-news/vigilance-commission-plans-first-ever-public-perception-index-on-graft-1587040,Vigilance Commission Plans First-Ever Public Perception Index On Graft ... measuring public perception about 25 government organisation in the matter of graft.
Khaleda to resume Zia Charitable Trust graft defence on Dec 15,Business News 24 BD,8 Dec 2016,http://businessnews24bd.com/khaleda-to-resume-zia-charitable-trust-graft-defence-on-dec-15/,Dhaka's Third Special Judges Court  set up on the Prison Directorate's grounds at Old Dhaka  is hearing the Zia Charitable Trust and Zia Orphanage Trust graft ...
Anti-corruption branch arrests revenue department personnel for graft,Hindustan Times,25 Aug 2016,http://www.hindustantimes.com/delhi/anti-corruption-branch-arrests-revenue-department-personnel-for-graft/story-2u60X87qAhSRr49q5o5wtK.html,Anti-corruption branch arrests revenue department personnel for graft. delhi Updated: Aug 26  2016 00:13 IST. Karn Pratap Singh Hindustan Times. Highlight ...
Graft is all-pervasive in Mumbai civic bureaucracy,Times of India,10 Sep 2016,http://timesofindia.indiatimes.com/city/mumbai/Graft-is-all-pervasive-in-Mumbai-civic-bureaucracy/articleshow/54266032.cms,But for the harried Mumbaikar  dealing with the civic bureaucracy can be a hair-tearing experience. Graft is all pervasive  and the common man has no recourse ...
Arvind Kejriwal Not Named In Graft FIR: Anti-Corruption Bureau Chief,NDTV,21 Sep 2016,http://www.ndtv.com/india-news/arvind-kejriwal-not-named-in-graft-fir-anti-corruption-bureau-chief-1464768,Arvind Kejriwal Not Named In Graft FIR: Anti-Corruption Bureau Chief. All India | Indo-Asian News Service | Updated: September 21  2016 19:37 IST. EMAIL.
BJP repeats Assam move in Nagaland  charges TR Zeliang govt ...,Firstpost,15 Nov 2016,http://www.firstpost.com/politics/bjp-repeats-assam-move-in-nagaland-charges-tr-zeliang-govt-with-graft-3106388.html,BJP repeats Assam move in Nagaland  charges TR Zeliang govt with graft. Nov 15  2016 15:33 IST. #Assam #BJP #ConnectTheDots #Corruption #DAN ...
AAP nominee accuses top leaders of graft  replaced,Chandigarh Tribune,24 Nov 2016,http://www.tribuneindia.com/news/punjab/aap-nominee-accuses-top-leaders-of-graft-replaced/328180.html,The Aam Aadmi Party (AAP) replaced its candidate from Bhoa Vinod Kumar late this evening  hours after he alleged that the party leadership had demanded Rs ...
Centre Suppressing Evidence Of Graft Against Sheila Dikshit ...,NDTV,4 Jul 2016,http://www.ndtv.com/india-news/centre-suppressing-evidence-of-graft-against-sheila-dikshit-alleges-delhi-minister-1427717,Centre Suppressing Evidence Of Graft Against Sheila Dikshit  Alleges Delhi minister. All India | Indo-Asian News Service | Updated: July 04  2016 12:43 IST.
Thane: MSEDCL engineer arrested for graft,The Indian Express,17 Oct 2016,http://indianexpress.com/article/india/india-news-india/thane-msedcl-engineer-arrested-for-graft-3089195/,Thane: MSEDCL engineer arrested for graft. The engineer was caught red-handed from his office after the ACB laid a trap when the aggrieved lodged a ...
Enable public raise graft issues: Pondy rights forum,Times of India,25 Oct 2016,http://timesofindia.indiatimes.com/city/puducherry/Enable-public-raise-graft-issues-Pondy-rights-forum/articleshow/55059597.cms,PUDUCHERRY: Civil rights forums have urged the Puducherry government to hold a series of public meetings during the vigilance week observance following ...
Aurangabad Airport Director Arrested For Graft,NDTV,31 Jul 2016,http://www.ndtv.com/india-news/aurangabad-airport-director-arrested-for-graft-1438508,Aurangabad Airport Director Arrested For Graft. All India | Press Trust of India | Updated: August 01  2016 09:50 IST. EMAIL. PRINT. COMMENTS. Aurangabad ...
Ex-Haryana speaker gets seven years for graft,Times of India,26 Aug 2016,http://timesofindia.indiatimes.com/city/delhi/Ex-Haryana-speaker-gets-seven-years-for-graft/articleshow/53883325.cms,NEW DELHI: Former Haryana assembly speaker Satbir Singh Kadian was sentenced to seven years' jail by a city court on Friday in a two-decade-old case for ...
Horticulture officer held for graft,Times of India,7 Aug 2016,http://timesofindia.indiatimes.com/city/ahmedabad/Horticulture-officer-held-for-graft/articleshow/53590993.cms,AHMEDABAD: A team of state Anti-Corruption Bureau (ACB) caught a horticulture officer and a middleman for accepting Rs 20 000 bribe to release government ...
Pakistan's Gen Raheel Sharif fires 6 top officers for graft,Times of India,21 Apr 2016,http://timesofindia.indiatimes.com/world/pakistan/Pakistans-Gen-Raheel-Sharif-fires-6-top-officers-for-graft/articleshow/51936604.cms,ISLAMABAD: In an unprecedented move  Pakistan's army chief  General Raheel Sharif   on Thursday sacked six top serving military officers over grave ...
CVC seeks rules for action against chiefs of regulatory bodies for graft,Economic Times,8 Aug 2016,http://economictimes.indiatimes.com/news/politics-and-nation/cvc-seeks-rules-for-action-against-chiefs-of-regulatory-bodies-for-graft/articleshow/53598686.cms,NEW DELHI: The Central Vigilance Commission (CVC) has sought a change in service rules so that punitive action can be taken against chiefs of regulatory ...
Graft case: Ex-deputy secretary of Arvind Kejriwal  Tarun Sharma ...,The Indian Express,2 Aug 2016,http://indianexpress.com/article/cities/delhi/graft-case-ex-deputy-secretary-of-arvind-kejriwal-tarun-sharma-granted-bail/,A special court on Tuesday  granted bail to former deputy secretary in Delhi Chief Minister's Office  Tarun Sharma  in a graft case involving CM Arvind Kejriwal's ...
Graft in India down  but not out: John G Rice  vice-chairman of GE,Economic Times,1 Feb 2016,http://economictimes.indiatimes.com/opinion/interviews/graft-in-india-down-but-not-out-john-g-rice-vice-chairman-of-ge/articleshow/50813247.cms,India is open for business but more work needs to be done  says John G Rice  vice-chairman of GE. In an interview to Sanjeev Choudhary  Sarita Singh and ...
Khadse's ouster a warning to BJP netas on graft,Times of India,4 Jun 2016,http://timesofindia.indiatimes.com/city/delhi/Khadses-ouster-a-warning-to-BJP-netas-on-graft/articleshow/52596573.cms,New Delhi: The resignation of Maharashtra revenue minister Eknath Khadse  though it took some time  is intended to signal a tough no-tolerance policy with ...
CBI explores possibility of 24x7 call centre on graft,Economic Times,16 Nov 2016,http://economictimes.indiatimes.com/news/politics-and-nation/cbi-explores-possibility-of-24x7-call-centre-on-graft/articleshow/55461284.cms,NEW DELHI: The possibility of one-stop call centre for reporting corruption in the country is being explored by CBI which will put the idea before anti-graft ...
Graft  the elephant in the room,The Hindu,4 Apr 2016,http://www.thehindu.com/elections/westbengal2016/west-bengal-graft-the-elephant-in-the-room/article8434115.ece,The collapse of an under-construction flyover here killing at least 27 people just three days before the elections has come as a major setback to the ruling ...
Assam forest officer arrested for graft  animals skins seized,The Hindu,14 Jun 2016,http://www.thehindu.com/news/national/other-states/assam-forest-officer-arrested-for-graft-animals-skins-seized/article8728036.ece,In a surprise move Bihar Chief Minister and Janata Dal (United) leader Nitish Kumar  an arch rival of Prime Minister Narendra Modi  has extended full support to ...
Two Swachh Bharat officials arrested for graft,Oneindia,31 May 2016,http://www.oneindia.com/india/two-swachh-bharat-officials-arrested-for-graft-2115124.html,Two Swachh Bharat officials arrested for graft. "Kumar and Sharma were found guilty of graft and have been arrested " Singh told IANS. The accused have been ...
Cognizant gags staff  steps up graft probe,Times of India,2 Oct 2016,http://timesofindia.indiatimes.com/business/india-business/Cognizant-gags-staff-steps-up-graft-probe/articleshow/54646587.cms,Chennai: With internal investigators digging into laptops and key documents of senior Indian executives of Cognizant  the company went into a huddle  imposing ...
BJP eyes 'Mission 265' in UP with slogans on 'goondaraj'  graft,Times of India,1 Nov 2016,http://timesofindia.indiatimes.com/india/BJP-eyes-Mission-265-in-UP-with-slogans-on-goondaraj-graft/articleshow/55196931.cms,NEW DELHI: BJP will launch its `Parivartan Yatra' from four places in Uttar Pradesh on November 5 to virtually kickstart the campaign for next year's assembly ...
Ex-bureaucrat  arrested for graft  commits suicide with son; wife ...,India Today,26 Sep 2016,http://indiatoday.intoday.in/story/bk-bansal-son-commit-suicide-delhi-residence/1/774125.html,Former bureaucrat BK Bansal  who was out on bail in a corruption case  today committed suicide along with his son  two months after his wife and daughter had ...
Service tax inspector gets 7 yrs for graft,Times of India,24 Sep 2016,http://timesofindia.indiatimes.com/city/dehradun/Service-tax-inspector-gets-7-yrs-for-graft/articleshow/54501252.cms,DEHRADUN: A special CBI court on Saturday sentenced an inspector of the service tax department to 7 years of rigorous imprisonment in connection with a ...
Corporation in the eye of graft storm,Times of India,29 Nov 2016,http://timesofindia.indiatimes.com/city/thiruvananthapuram/Corp-in-the-eye-of-graft-storm/articleshow/55693830.cms,THIRUVANANTHAPURAM: The city corporation  which witnessed a wave of corruption and the subsequent transfer of officials in the engineering wing last week ...
Two Civil Servants Accused Of Graft Cry Caste Discrimination In ...,NDTV,11 Jan 2016,http://www.ndtv.com/bhopal-news/two-civil-servants-accused-of-graft-cry-caste-discrimination-in-bhopal-1264639,He was arrested in 2002 in a graft case but later reinstated by the Supreme Court. His grouse is that the state government has given its approval to the ...
IT department's policy paper gives formula for graft,Times of India,23 Jun 2016,http://timesofindia.indiatimes.com/india/I-T-departments-policy-paper-gives-formula-for-graft/articleshow/52892845.cms,NEW DELHI: For the first time the income tax department  in a policy paper circulated among all top level I-T officials at a deliberation held in the capital recently  ...
IFS  ACB officers held for graft,The Hindu,25 Sep 2016,http://www.thehindu.com/news/cities/kolkata/ifs-acb-officers-held-for-graft/article9147930.ece,An Anti-Corruption Bureau officer and a Forest Department officer were arrested on bribery charges and sent to five days police custody by a court on Sunday.
Accountant held for graft,Chandigarh Tribune,7 Oct 2016,http://www.tribuneindia.com/news/chandigarh/accountant-held-for-graft/306513.html,Accountant held for graft. 0 ... arrested an accountant  Gurdeep Singh  posted at the office of the Accountant General  Punjab and UT  Sector 17  in a graft case.
China's graft watchdog head asks party members to give up ...,The Indian Express,1 Dec 2016,http://indianexpress.com/article/world/world-news/china-top-graft-buster-tells-party-members-to-give-up-believing-in-ghosts-supernatural-beings-4406244/,Party officials in officially atheist China are not supposed to practise religion and the charge of superstition is often levelled against the corrupt to further blacken ...
Brazil political drama deepens with graft plea deal,The Indian Express,1 Dec 2016,http://indianexpress.com/article/world/world-news/brazil-political-drama-deepens-with-graft-plea-deal-4406264/,Brazil political drama deepens with graft plea deal. Brazilian media said the plea deal could lead to 100 more suspects being dragged into the sprawling ...
Rajasthan Central varsity faculty accuses Vice-Chancellor of graft,The Indian Express,14 Jun 2016,http://indianexpress.com/article/india/india-news-india/rajasthan-central-varsity-faculty-accuses-vice-chancellor-of-graft-university-2853278/,Several faculty members of the Central University of Rajasthan have come out openly against the Vice-Chancellor and the university administration  alleging ...
Official held by CBI for graft  his wife  daughter commit suicide,The Indian Express,19 Jul 2016,http://indianexpress.com/article/india/india-news-india/dg-corporate-affairs-bribery-wife-daughter-commit-suicide-2924756/,MCA director-general Bal Kishan Bansal's wife Satyabala (58) and his daughter Neha (28) committed suicide on Tuesday afternoon at Neelkanth Apartments  ...
Congress stings AAP minister with graft clip,Times of India,9 Feb 2016,http://timesofindia.indiatimes.com/city/delhi/Congress-stings-AAP-minister-with-graft-clip/articleshow/50923008.cms,New Delhi: Triggering off a major drama  Congress on Tuesday made public purported conversations between what it called a personal staffer of minister Imran ...
India vs New Zealand  2nd Test: Black Caps show craft; India graft at ...,The Indian Express,30 Sep 2016,http://indianexpress.com/article/sports/cricket/india-vs-new-zealand-2nd-test-kolkata-black-caps-show-craft-india-graft-3058884/,New Zealand end the day on top  but India's plight could have been worse if not for the 141-run association between Cheteshwar Pujara and Ajinkya Rahane.
