No record of Adarsh  BEST plot amalgamation: BMC,Daily News & Analysis,1 Nov 2011,http://www.dnaindia.com/mumbai/report-no-record-of-adarsh-best-plot-amalgamation-bmc-1606215,The scam relates to the controversial residential building constructed on defence land in Colaba. Adarsh society was originally meant to be a six-storey building ...
Nehru wanted to create Lokpal: Krishnamurthy,Firstpost,21 Aug 2011,http://www.firstpost.com/fwire/nehru-wanted-to-create-lokpal-krishnamurthy-65551.html,Besides the Cycle scam of 1961  K D Malavya scam and Dharmateja Loan Scam  1960  happened during Nehru's tenure between 15 August 1947 and 27 May ...
2G case: A saga of twists and turns,Deccan Herald,12 Nov 2011,http://www.deccanherald.com/content/204432/2g-case-saga-twists-turns.html,Scam twist The special judge was not impressed even by Supreme Court view that the accused may seek bail. Janata Party president Subramaniam Swamy is ...
Indian engineering degrees may be recognized in 13 countries soon,Times of India,31 Mar 2011,http://timesofindia.indiatimes.com/india/Indian-engineering-degrees-may-be-recognized-in-13-countries-soon/articleshow/7835662.cms,But there was considerable delay as the All India Council for Technical Education  of which NBA was a part  was caught in a scam. Now NBA has become an ...
HC orders interim bail for Yadav,Chandigarh Tribune,19 Aug 2011,http://www.tribuneindia.com/2011/20110820/haryana.htm,In a faux pas that left the treasury benches in the Haryana Vidhan Sabha floundering for an explanation  the obituary resolutions on former Chief Minister Bhajan ...
Panoramic Universal  the company that made Moneylife change its ...,Moneylife Personal Finance site and magazine,22 Jul 2011,http://www.moneylife.in/article/panoramic-universal-the-company-that-made-moneylife-change-its-stock-picking-methodology/18293.html,... including former telecom minister A Raja  arrested for their alleged involvement in the second generation (2G) spectrum scam  in judicial custody itself  reports ...
कैसे हुआ 2जी घोटाले का पर्दाफाश,आज तक,10 Oct 2011,http://aajtak.intoday.in/story/dateline-of-2g-spectrum-scam--1-65601.html,22 नवं.  2007-वित्त सचिव ने 2001 की दरों पर लाइसेंस/2जी स्पेक्ट्रम आवंटन पर विरोध दर्ज कराया. 29 नवं.  2007-दूरसंचार विभाग ...
Mangalore: ABVP Holds Mega Rally in City Against UPA Government,Daijiworld.com,27 Jul 2011,http://www.daijiworld.com/news/news_disp.asp?n_id=109892,Addressing the gathering ABVP state president Dr B V Vasanth Kumar said that the 2G spectrum scam was the biggest in the world. "The scam has shaken the ...
2G case: RK Chandolia gets bail despite CBI objections,NDTV,1 Dec 2011,http://www.ndtv.com/india-news/2g-case-rk-chandolia-gets-bail-despite-cbi-objections-570297,The telecom scam was orchestrated  according to the CBI  by Mr Raja when he was telecom minister. He is accused of giving licenses and frequency for mobile ...
Delhi High Court rejects Kanimozhi's bail plea,The Hindu,8 Jun 2011,http://www.thehindu.com/news/national/delhi-high-court-rejects-kanimozhis-bail-plea/article2087082.ece,The Delhi High Court on Wednesday rejected the bail petitions of DMK MP Kanimozhi and Kalaignar TV director Sharad Kumar  accused in the 2G spectrum ...
Katta cleared 325-acre land in four days,Times of India,2 Oct 2011,http://timesofindia.indiatimes.com/city/bengaluru/Katta-cleared-325-acre-land-in-four-days/articleshow/10213173.cms,According to documents filed by Lokayukta police before the special court hearing the alleged land scam  the entire affair was orchestrated by Naidu and his son ...
MODI'S REVENGE ON GOOD COPS,HardNews Magazine,16 May 2011,http://www.hardnewsmedia.com/2011/05/3968,... ask Kuldeep not to take any action against the rioters. Pradeep Sharma is languishing in jail  apparently on cooked-up charges of involvement in a land scam.
For people of Kundapur  everything's in the name,Times of India,3 May 2011,http://timesofindia.indiatimes.com/city/mangaluru/For-people-of-Kundapur-everythings-in-the-name/articleshow/8154834.cms,MANGALORE: The `K' word has suddenly become fashionable and attracted a buzz -- thanks to Kundapur Vaman Kamath  non-executive chairman of ICICI ...
2G scam: Journalist close to Radia under ED scanner,TelecomTiger,3 May 2011,http://www.telecomtiger.com/PolicyNRegulation_fullstory.aspx?pagenum=1&storyid=11078&section=S174,Rai had sought an appointment with the official on the pretext of "furnishing some information" of use to the investigators probing the 2G scam   which refers to ...
Don't cross Lakshman Rekha  Centre tells court,The Hindu,22 Sep 2011,http://www.thehindu.com/news/national/dont-cross-lakshman-rekha-centre-tells-court/article2476730.ece,The Supreme Court should not cross the Lakshman Rekha and must act in accordance with law  senior counsel for the Centre P.P. Rao said on Thursday  ...
Fai's arrest exposes ISI-terror links: India,Chandigarh Tribune,23 Jul 2011,http://www.tribuneindia.com/2011/20110724/nation.htm,Reacting to the arrest of Kashmiri separatist Syed Ghulam Nabi Fai in Virginia  India today said this had clearly exposed the link between state agencies of ...
Reliance  Essar may hold key to Bahamas "export miracle",Firstpost,24 Oct 2011,http://www.firstpost.com/business/reliance-essar-may-hold-key-to-bahamas-export-miracle-115611.html,Mystery solved  proclaimed Business Standard. The "mystery" had been flagged off by a rival business publication  The Economic Times  on 21 October when it ...
3G roaming illegal: DoT,The Hindu,22 Dec 2011,http://www.thehindu.com/business/Industry/3g-roaming-illegal-dot/article2738604.ece,In a move that would hurt mobile operators providing 3G services  the Department of Telecommunications (DoT) has asked these operators to terminate their ...
Satyam fraud: Supreme Court agrees to hear bail pleas of accused,The Hindu,15 Sep 2011,http://www.thehindu.com/news/national/satyam-fraud-supreme-court-agrees-to-hear-bail-pleas-of-accused/article2458733.ece,The accused had sought bail on the grounds that the trial in the Satyam scam was not completed within the Supreme Court-stipulated deadline of July 31 and all ...
Odisha to assist CBI probe into MGNREGA scam says minister ...,Orissadiary.com,12 May 2011,http://orissadiary.com/CurrentNews.asp?id=26607,Bhubaneswar: The Odisha government on Thursday said that it would cooperate with the CBI to probe into the rural job guarantee scam under Mahatma Gandhi ...
Gujarat to go 4G in 18 months,Daily Bhaskar,4 Oct 2011,http://daily.bhaskar.com/news/GUJ-AHD-gujarat-to-go-4g-in-18-months-time-2480680.html,Ahmedabad: With the country currently embroiled in the 2G spectrum scam and telecom players struggling with 3G business  news of Tikona Digital Networks ...
Land denotification case: Yeddyurappa sent to jail till October 22,NDTV.com,15 Oct 2011,http://www.ndtv.com/india-news/land-denotification-case-yeddyurappa-sent-to-jail-till-october-22-565497,Bangalore: In a blow to the BJP  party strongman and former Karnataka Chief Minister BS Yeddyurappa has been sent to jail for seven days in a land case.
Private airlines may do well this summer on Air India's woes,Moneylife Personal Finance site and magazine,2 May 2011,http://www.moneylife.in/article/private-airlines-may-do-well-this-summer-on-air-indias-woes/16030.html,Snippet not available
BJP demands white paper on Mayawati's assets,Firstpost,6 Dec 2011,http://www.firstpost.com/politics/bjp-demands-white-paper-on-mayawatis-assets-149406.html,Snippet not available
Bellary trio's 14-day judicial custody gives breather to state BJP,Tehelka,5 Sep 2011,http://www.tehelka.com/story_main50.asp?filename=Ws050911Karnataka.asp,Snippet not available
People have given me rest: Karunanidhi,NDTV.com,13 May 2011,http://drop.ndtv.com/ndtv/articles/people-have-given-me-rest-karunanidhi-105511.html?pfrom=home-Top-Stories,Snippet not available
Yeddyurappa sent to jail on graft charges,Chandigarh Tribune,15 Oct 2011,http://www.tribuneindia.com/2011/20111016/main1.htm,Snippet not available
