2G: Anil Ambani's executives may turn approver  CBI tells SC,Chandigarh Tribune,29 Sep 2011,http://www.tribuneindia.com/2011/20110930/nation.htm,New Delhi: Unitech Managing Director Sanjay Chandra  arrested for his alleged role in the 2G scam  moved the Supreme Court on Thursday seeking interim ...
BJP accuses Mayawati's brother of money-laundering,Rediff,5 Dec 2011,http://www.rediff.com/news/report/bjp-accuses-mayawatis-brother-of-money-laundering/20111205.htm,Somaiya  who is also the chairman of BJP's national scam expose committee  alleged  "Mayawati's brother Anand Kumar has parked thousand crores of ...
CBI shielding Tatas  Balwa tells court,Rediff,18 May 2011,http://www.rediff.com/business/slide-show/slide-show-1-cbi-shielding-tatas-balwa-tells-court/20110519.htm,The "CBI's heart beats for the Tatas"  2G scam accused Shahid Usman Balwa alleged in court  questioning the agency's portrayal of the group as a "victim" of A ...
Raja names PM  Chidambaram in court,NDTV.com,25 Jul 2011,http://www.ndtv.com/india-news/raja-names-pm-chidambaram-in-court-462687,A spin-off from the alleged scam is that two of those companies - Unitech Wireless and DB Realty - then sold equity to foreign companies - Telenor in the case of ...
The story of Satyam's stunning turnaround,Rediff,20 Jan 2011,http://www.rediff.com/business/slide-show/slide-show-1-special-the-amazing-story-of-satyams-turnaround/20110121.htm,When Ramalinga Raju confessed his monumental fraud on January 7  2009  he not only brought Satyam Computer Services  India's fourth-largest information ...
Cash-for-votes case: BJP MP Ashok Argal chargesheeted,NDTV.com,3 Oct 2011,http://www.ndtv.com/india-news/cash-for-votes-case-bjp-mp-ashok-argal-chargesheeted-565214,New Delhi: BJP MP Ashok Argal was today chargesheeted by the Delhi police in the 2008 cash-for-vote scam in a court here which will decide on his ...
Bangarappa to Expose Eshwarappa Scam on June 20,Daijiworld.com,19 Jun 2011,http://www.daijiworld.com/news/news_disp.asp?n_id=106002,Bangalore  Jun 19: A new twist to the political scenario in Karnataka may soon be expected  with former chief minister of Karnataka  and current JD(S) leader ...
Orissa Government suspends IAS officer over Coal scam,Orissadiary.com,7 Feb 2011,http://orissadiary.com/CurrentNews.asp?id=24448,Bhubaneswar: As the Odisha government has initiated disciplinary action against three IAS officers in the wake of the much-talked-about dal scam in the state  ...
CBI looks into spectrum to Telecom companies in DTH business,The Hindu,9 Oct 2011,http://www.thehindu.com/news/national/cbi-looks-into-spectrum-to-telecom-companies-in-dth-business/article2523246.ece,Widening its probe in the 2G scam  the CBI has now turned to investigate spectrum allocation made to direct-to-home (DTH) broadcasters by seeking details of ...
UPA II: Beleaguered  depressed,Deccan Herald,5 Mar 2011,http://www.deccanherald.com/content/143455/upa-ii-beleaguered-depressed.html,... under UPA II grows  politicians  bureaucrats  corporates  media  the judiciary and senior armed forces officers have all been tainted in one or the other scam.
If credit rating agencies are indispensable  can they at least be ...,Moneylife Personal Finance site and magazine,13 Dec 2011,http://www.moneylife.in/article/if-credit-rating-agencies-are-indispensable-can-they-at-least-be-made-accountable-for-their-actions/22178.html,Two of them are cash-for-votes scam and cash-for-loans scam. It is time for us to take preventive steps to the extent possible to ensure that our country is free ...
Brahmani Steels a fake firm: CBI,Deccan Herald,20 Sep 2011,http://www.deccanherald.com/content/192390/brahmani-steels-fake-firm-cbi.html,The CBI investigations have unravelled the mystery behind the numerous benami companies in India and abroad floated by Janardhana Reddy as conduits to ...
City centre basement under 25 feet of water,Indian Express,24 Aug 2011,http://archive.indianexpress.com/news/city-centre-basement-under-25-feet-of-water/836643/,... water will be drained out from the basement or not because of the ongoing court case of the multi-crore city centre scam. The deep basement of the city centre ...
Two failed IPOs show that manipulators have withdrawn from the ...,Moneylife Personal Finance site and magazine,19 May 2011,http://www.moneylife.in/article/two-failed-ipos-show-that-manipulators-have-withdrawn-from-the-game-for-now/16571.html,Yes  the multiple applications scam is thriving  but has only got more sophisticated to evade detection. Our sources say that investment bankers are an integral ...
Marans intervened to restrict business environment for Siva Group ...,The Hindu,13 Oct 2011,http://www.thehindu.com/news/national/marans-intervened-to-restrict-business-environment-for-siva-group-says-cbi/article2535284.ece,The Central Bureau of Investigation's new FIR on the 2G spectrum scam has levelled serious allegations against the former Telecom Minister Dayanidhi Maran  ...
CBI arrests Janashree News owners in mining scam,Indiantelevision.com,5 Sep 2011,http://www.indiantelevision.com/headlines/y2k11/sep/sep25.php,BANGALORE: A CBI team from Hyderabad today arrested the co-owners of Kannada news channel Janashree News  Galli Janaradhana Reddy and his ...
Air India pilots' strike: BJP hits out at Prime Minister's Office,NDTV.com,1 May 2011,http://www.ndtv.com/india-news/air-india-pilots-strike-bjp-hits-out-at-prime-ministers-office-454393,New Delhi: Suspecting a "bigger scam" in Air India operations  BJP today demanded that Prime Minister Manmohan Singh pin responsibility for the alleged ...
How many Sukhois must crash for us to call it a scandal?,Firstpost,14 Dec 2011,http://www.firstpost.com/india/how-many-sukhois-must-crash-for-us-to-call-it-a-scandal-156066.html,When Mulayam Singh Yadav was defence minister in the HD Deve Gowda government in the late 1990s  he was  for all practical purposes  minister in absentia.
'Chidambaram a valued colleague  NDA trying to malign him',Rediff,9 Dec 2011,http://www.rediff.com/news/slide-show/slide-show-1-chidambaram-a-valued-colleague-nda-trying-to-malign-him/20111210.htm,... Kapil Sibal on Saturday attacked the Bharatiya Janata Party-led National Democratic Alliance of attempting to "foist" culpability on him in the 2G scam saying it ...
BJP to discuss Hegde report today,Chandigarh Tribune,27 Jul 2011,http://www.tribuneindia.com/2011/20110728/nation.htm,When asked about the statement of SP chief Mulayam Singh Yadav defending him in the cash-for-vote scam  Amar Singh said he had not heard about it.
NCC Patiala HQ indicts officers,Times of India,1 Feb 2011,http://timesofindia.indiatimes.com/india/NCC-Patiala-HQ-indicts-officers/articleshow/7408403.cms,After the Government Provident Fund (GPF) scam in Rapura office of the education department came to light  the Punjab government had directed all ...
BSP MP Arrested in Double Murder Case,Daijiworld.com,11 Dec 2011,http://www.daijiworld.com/news/news_disp.asp?n_id=124423,Dhananjay was again in news after the multi-crore National Rural Health Mission (NRHM) scheme scam in UP. The scam led to the murder of three health ...
Nanded education officer suspended  more heads may roll,Times of India,8 Oct 2011,http://timesofindia.indiatimes.com/city/mumbai/Nanded-education-officer-suspended-more-heads-may-roll/articleshow/10284120.cms,MUMBAI: The first head has already rolled in the bogus-student scam and the government is now pushing hard to identify more errant officials who refrained ...
High profits of ghost hotels,Tehelka,15 Jul 2011,http://archive.tehelka.com/story_main50.asp?filename=Ne230711COVERSTORY.asp,Despite a SC-monitored investigation into the 2G scam  none of the overseas countries has so far responded to Letters Rogatory (LR) sent from India seeking ...
Ex-private secretary to Foreign Minister held over graft charges,Tehelka,26 Nov 2011,http://www.tehelka.com/story_main51.asp?filename=Ws261111Corruption.asp,Dhanalakshmi's name has also surfaced in the alleged land scam in Tronica city project in Ghaziabad near Delhi where valuable land was allotted at throwaway ...
Price on former JPSC member,Calcutta Telegraph,26 Jun 2011,http://www.telegraphindia.com/1110627/jsp/frontpage/story_14164670.jsp,... Commission (JPSC) member Gopal Prasad Singh  who has been on the run for more than a year now after being implicated in the illegal appointments scam.
Minister upset with ex-babus joining private sector,Rediff,30 Sep 2011,http://www.rediff.com/business/slide-show/slide-show-1-minister-upset-with-ex-babus-joining-private-sector/20110930.htm,... controversy regarding a former telecom regulator joining a high-flying corporate lobbyist firm that allegedly had a big role to play in the 2G scam controversy.
Rediff.com » News » PM  Sonia producer and director of 'corruption ...,Rediff,27 Apr 2011,http://www.rediff.com/news/slide-show/slide-show-1-bjp-calls-sonia-and-pm-producer-and-director-of-corruption-movie/20110427.htm,The Delhi government under Sheila Dikshit was also involved in the CWG scam. It was the Cabinet Committee  Finance Ministry and the PMO which cleared the ...
In the market for votes  the best deal will triumph,Tehelka,13 May 2011,http://archive.tehelka.com/story_main49.asp?filename=Ne210511TAMIL_NADU.asp,The DMK government has won the hearts of the rural voters with its housing and insurance schemes. So  will they ditch the Kalaignar? wonders Sai Manish ...
EXCLUSIVE EXTRACTS: The Karnataka mining report,Rediff,28 Jul 2011,http://www.rediff.com/news/slide-show/slide-show-1-mining-report-by-karnataka-lokayukta-santosh-hegde/20110728.htm,While the report is voluminous  here are a few details of what the Lokayukta and his team have found while probing the illegal mining scam. In the report the ...
Sex-for-marks scandal: MP CM to send report,Times of India,18 May 2011,http://timesofindia.indiatimes.com/india/Sex-for-marks-scandal-MP-CM-to-send-report/articleshow/8431055.cms,Dutt said: "The scam was based on re-evaluation of examination papers. Girl students who failed the examinations were told to compromise sexually in order to ...
'It could be due to Centre's order or complacency',Rediff,5 Jun 2011,http://www.rediff.com/news/slide-show/slide-show-1-karunanidhi-blames-centre-for-kanimozhi-arrest/20110606.htm,Reflecting further strains in his party's ties with Congress  Dravida Munnetra Kazhagam chief Karunanidhi has blamed the Centre for the arrest of his daughter ...
NC worker's death JK's cash-for-vote scam: BJP,Indian Express,6 Oct 2011,http://archive.indianexpress.com/news/nc-workers-death-jks-cashforvote-scam-bjp/856616/,This is the cash-for-vote scam of Jammu and Kashmir " Hussain said. He maintained that there was suspicion about circumstances of Yousuf's death as he died ...
But that's not mine!,Calcutta Telegraph,27 Sep 2011,http://www.telegraphindia.com/1110928/jsp/opinion/story_14562807.jsp,One of the allegations against Kanhaiyalal Gidwani  a prime accused in Mumbai's Adarsh housing society scam  is that he owns three benami flats in the high ...
2G scam case: Pressure on Anil Ambani  Ratan Tata off,Rediff,23 Nov 2011,http://www.rediff.com/business/slide-show/slide-show-1-2g-scam-case-pressure-on-anil-ambani-ratan-tata-off/20111123.htm,The bail (on furnishing two sureties of Rs 5 lakh each) granted to the five executives will be a turning point in the on-going legal saga of the 2G scam  says a ...
IT dept probing Radia for tax evasion  SC told,Times of India,30 May 2011,http://timesofindia.indiatimes.com/india/I-T-dept-probing-Radia-for-tax-evasion-SC-told/articleshow/8655260.cms,The report to the SC said investigations in the case of telecom companies embroiled in the 2G scam were in an advanced stage and the findings were being ...
Lokayukta police file FIR against Yeddyurappa  kin,Deccan Herald,22 Aug 2011,http://www.deccanherald.com/content/185502/yeddyurappa-family-members-booked-lokayukta.html,... filed a first information report (FIR) against former chief minister B S Yeddyurappa and his kin in connection with their involvement in the illegal mining scam.
Are skywalks a blessing or a bane?,Moneylife Personal Finance site and magazine,25 Apr 2011,http://www.moneylife.in/article/are-skywalks-a-blessing-or-a-bane/15841.html,The poorly-conceived  poorly-designed  poorly-constructed  hurriedly-executed  'big-ticket' skywalks in Mumbai are a scam of sorts. Are we seeing a similar ...
Fake tax forms: leading ceramic units under lens,Indian Express,4 Apr 2011,http://archive.indianexpress.com/news/fake-tax-forms-leading-ceramic-units-under-lens/771695/,The statement of one of the three accused in the fake C form scam has brought 10 ceramic units in Morbi under the scanner of the police. Last year  the ceramic ...
Degrees on sale: Jaipur study centres offer bachelor degree to PhD ...,India Today,5 Oct 2011,http://indiatoday.intoday.in/story/degrees-on-sale-in-jaipur-phd-in-3-days/1/153852.html,Headlines Today investigated the degree scam thriving in the guise of study centres in Rajasthan capital and the adjoining areas. Headlines Today spy cameras ...
Advani's yatra plan is a farce: CPI-M,Rediff,16 Sep 2011,http://www.rediff.com/news/slide-show/slide-show-1-advanis-yatra-plan-is-a-farce-cpi-m/20110916.htm,Terming Bharatiya Janata Party leader L K Advani's proposed 'rath yatra' as a "farce"  the Communist Party of India-Marxist has said the country can ill-afford the ...
Sr Goenka  Balwa to guide DB Realty,Times of India,22 Apr 2011,http://timesofindia.indiatimes.com/business/india-business/Sr-Goenka-Balwa-to-guide-DB-Realty/articleshow/8061711.cms,A day after its managing director Vinod Goenka was arrested in the 2G spectrum scam case on Wednesday  the controversial Mumbai-based real estate ...
Tihar's high profile inmates get Rs 2k per week,Rediff,25 Apr 2011,http://www.rediff.com/business/slide-show/slide-show-1-tihars-high-profile-inmates-get-rs-2k-per-week/20110425.htm,It is the same for the other executives who were sent to judicial custody earlier this week over the 2G spectrum scam  along with Chandra. They are DB Realty's ...
No special privilege to Nirmal Yadav: HC,Chandigarh Tribune,14 Nov 2011,http://www.tribuneindia.com/2011/20111115/main5.htm,In the process  the high court also cleared way for her trial in the worst scam to have rocked the judiciary in this part of the region. Justice Yadav had invoked the ...
'Radia Tapes Weren't Authentic  They Were Manipulated',Outlook,29 Oct 2011,http://www.outlookindia.com/magazine/story/radia-tapes-werent-authentic-they-were-manipulated/278785,The tapes were leaked as a diversion  they suggested  to throw the media off the scent while those actually involved in the 2G scam used the time to clean up ...
CAG report slams Air India expansion,NDTV.com,8 Sep 2011,http://www.ndtv.com/india-news/cag-report-slams-air-india-expansion-467015,And it seems the Air India is again unfolding another major scam in the UPA for the country to witness." "Don't see ghosts where none exist " said Praful Patel  ...
Waqf Misuse  most systematically managed daylight robbery in India,ummid.com,20 Mar 2011,http://www.ummid.com/news/2011/march/20.03.2011/firoz_bakht_ahmed_on_wakf.htm,How waqf has become an institution deeply mired in corruption can be gauged from the land scam perpetrated by the Maharashtra Waqf Board. It sold a 4 535 ...
Stocks of controversial groups beaten down,Rediff,30 Dec 2011,http://www.rediff.com/business/slide-show/slide-show-1-perfin-stocks-of-controversial-groups-beaten-down/20111230.htm,For instance  Anil Dhirubhai Ambani Group companies  Sun TV  Unitech and Essar Group companies  all linked to the 2G telecom scam  and the Adani and ...
Lucknow: Death of Dr YS Sachan – CMO Arrested,Daijiworld.com,11 Jul 2011,http://www.daijiworld.com/news/news_disp.asp?n_id=107940,The fact that Sachan died a day earlier to his interrogation about Shukla's involvement in the said scam had made the police to suspect Shukla's hand in ...
Some examples of everyday fraud and what you can do about them,Moneylife Personal Finance site and magazine,31 Aug 2011,http://www.moneylife.in/article/some-examples-of-everyday-fraud-and-what-you-can-do-about-them/19373.html,Your article is a real Eye opener particularly Scam of Cheques. I can't even dream that this could happen too. About CFOs & Call centre Cabs issues   they look ...
Mangalore: CPI (M) Youth  Women Workers Picketing DC Office ...,Daijiworld.com,19 Apr 2011,http://www.daijiworld.com/news/news_disp.asp?n_id=99736,2G spectrum  CWG scam  Adarsh House scam in the centre and land scam  nepotism in the state have affected the common people badly. Both the governments ...
SBI breaches RBI norms on loans to Reliance,Rediff,10 Jun 2011,http://www.rediff.com/business/slide-show/slide-show-1-sbi-breaches-rbi-norms-on-loans-to-reliance/20110610.htm,The public sector lender  which also has significant exposures to troubled Air India besides certain telecom firms being probed in relation to the 2G scam  has ...
The Bullet Bites You,Outlook,12 Aug 2011,http://www.outlookindia.com/magazine/story/the-bullet-bites-you/278019,When we sent our crew to London to follow up on a scam that ran into a few hundred thousand pounds  we weren't even sure if a company called AM Car and ...
Rediff.com » Business » Putting money in an IPO? Just be very careful,Rediff,15 Dec 2011,http://www.rediff.com/business/slide-show/slide-show-1-special-putting-money-in-an-ipo-just-be-very-careful/20111215.htm,Ashok Kumar probes how operators and promoters relieve themselves on the heads of gullible and greedy retail investors. A few months ago  an ex-student of ...
Gold Sukh scam: Company ran 5 cos to evade tax  'invest' money,Daily Bhaskar,4 Dec 2011,http://daily.bhaskar.com/news/RAJ-JPR-gold-sukh-scam-company-ran-5-cos-to-evade-tax-invest-money-2615794.html,goldsukh_288 Jaipur: The owners of Gold Sukh Trade India Ltd were running five more companies which were registered separately to dupe its investors and ...
Yeddy & co take kids for a ride,Tehelka,1 Apr 2011,http://www.tehelka.com/story_main49.asp?filename=Ne090411YEDDY.asp,All this goes to show  says Ugrappa  that the real beneficiaries of the scam were being protected. More damningly  “They have also not taken into account the ...
South Indian food for Tihar jail inmates now,Deccan Herald,12 Jun 2011,http://www.deccanherald.com/content/168260/south-indian-food-tihar-jail.html,When news of Tamil Nadu chief minister M Karunanidhi's daughter Kanimozhi's name appeared in the 2G spectrum scam  female inmates of jail number six  ...
The Art Of Living,Outlook,25 Feb 2011,http://www.outlookindia.com/magazine/story/the-art-of-living/270628,Last month  AIADMK cadres in Salem distributed play money in notes of Rs 500 and Rs 1 000  bearing rubber-stamped text saying it was 2G scam money.
Post-2G  courts increasingly hanging up on bail pleas,The Hindu,13 Oct 2011,http://www.thehindu.com/opinion/op-ed/post2g-courts-increasingly-hanging-up-on-bail-pleas/article2535127.ece,When Union Law Minister Salman Khursheed expressed concern over businessmen being kept behind bars and said this might affect investment  he might not ...
Rebuilding past  single biggest driver: Mahindra Satyam,Business Standard,3 Mar 2011,http://www.business-standard.com/article/companies/rebuilding-past-single-biggest-driver-mahindra-satyam-111030300210_1.html,Mahindra Satyam  which has been focussing on strategies to rebuild itself post the scam in 2009 involving founder B Ramalinga Raju  today said it was the story ...
India's low-cost BPO tag helps draw global investors: E&Y,Hindu Business Line,6 Jun 2011,http://www.thehindubusinessline.com/info-tech/indias-lowcost-bpo-tag-helps-draw-global-investors-ey/article2082418.ece,What could have also triggered the dip is the 2G spectrum scam that is making foreign investors increasingly uncomfortable. (The 2G spectrum scam involved ...
PAC chair MM Joshi defends report in 2G scam,Tehelka,4 May 2011,http://archive.tehelka.com/story_main49.asp?filename=Ws0405112G_SCAM.asp,After creating a storm with a report on the 2G scam that severely criticises Prime Minister Manmohan Singh and former Finance Minister P Chidambaram  ...
I was not the only judge to be allotted house site  says Karnataka ...,The Hindu,17 Sep 2011,http://www.thehindu.com/news/national/karnataka/i-was-not-the-only-judge-to-be-allotted-house-site-says-karnataka-lokayukta/article2462804.ece,Barely a month after being appointed Karnataka's anti-corruption ombudsman  Lokayukta Shivaraj V. Patil finds himself embroiled in allegations of impropriety in ...
Amma and Didi make it big,Hindu Business Line,13 May 2011,http://www.thehindubusinessline.com/opinion/columns/rasheeda-bhagat/amma-and-didi-make-it-big/article2016234.ece,In Tamil Nadu  the simmering anger over rampant corruption and brazen promotion of Mr M. Karunanidhi's family for five years crystallised around the 2G scam.
Scamsters offer $7.5 lakh and iPad2 in a lottery on the Tata Motors ...,Moneylife Personal Finance site and magazine,15 Mar 2011,http://www.moneylife.in/article/scamsters-offer-75-lakh-and-ipad2-in-a-lottery-on-the-tata-motors-name/14767.html,This time they have used the name of Tata Motors to offer a lottery of $7.5 lakh and an Apple iPad2  similar to the BMW lottery scam last year
KHB officials thrashed for fraud in site allotment,Deccan Herald,17 Nov 2011,http://www.deccanherald.com/content/205513/khb-officials-thrashed-fraud-site.html,Now  Mandya on land scam map. One more land scam has surfaced in the State and this time it is in Mandya. Five people  including three MLAs  have been ...
'Most corrupt men bribe whoever is in power',Rediff,3 Jan 2011,http://www.rediff.com/news/interview/interview-corruption-indian-business-politics/20110103.htm,The 2G spectrum scam is slowly seeping into public conscience thanks to the CAG-estimated loss of Rs 176 000 crore. What kind of figures are we talking about ...
13 Indians charged in biggest credit card fraud in US,Firstpost,8 Oct 2011,http://www.firstpost.com/business/economy/13-indians-charged-in-biggest-credit-card-fraud-in-us-102571.html,New York: In the biggest identity theft scam in the US history  111 people  including at least 13 of Indian origin  have been charged by federal authorities for ...
ET Now interview with Kumar Mangalam Birla,India Infoline.com,18 Mar 2011,http://www.indiainfoline.com/article/news/et-now-interview-with-kumar-mangalam-birla-5108065809_1.html,But how do you look at this whole 2G spectrum allocations  the subsequent scams which have come to light and Idea Spice itself has embroiled in a controversy ...
Sahara India FinCorp extends pre-mature payment date by three ...,Moneylife Personal Finance site and magazine,31 Dec 2011,http://www.moneylife.in/article/sahara-india-fincorp-extends-pre-mature-payment-date-by-three-months/22628.html,Sahara India Financial Corp Ltd (SIFCL) has issued an advertisement in newspapers  on Saturday  extending the premature payment to its depositors' to 31 ...
Indian students in US radio-tagged; angry govt says remove it,Times of India,29 Jan 2011,http://timesofindia.indiatimes.com/world/us/Indian-students-in-US-radio-tagged-angry-govt-says-remove-it/articleshow/7386322.cms,Scores of Indian students  mostly from Andhra Pradesh  are caught up in a scam in which the dubious university allegedly helped foreign nationals illegally ...
MHA expressed concern on Shahid Balwa's link with Dawood: Swamy,Indian Express,3 Dec 2011,http://archive.indianexpress.com/news/mha-expressed-concern-on-shahid-balwas-link-with-dawood-swamy/883664/,Swamy said following the 2G scam  Etisalat was stopped from buying stakes in a Chennai-based company due to objection by the Home Ministry. As per the ...
Riddhi Siddhi shareholders in the dark on sale of starch biz to ...,Moneylife Personal Finance Magazine,21 Jan 2011,http://www.moneylife.in/article/riddhi-siddhi-shareholders-in-the-dark-on-sale-of-starch-biz-to-french-firm/13336.html,When  or rather  why does a winner quit? Shareholders of starch and starch derivatives giant Riddhi Siddhi Gluco Biols Limited are pondering over this question.
Standard Chartered appoints Sandeep Das as managing director ...,Moneylife Personal Finance site and magazine,20 Jun 2011,http://www.moneylife.in/article/standard-chartered-appoints-sandeep-das-as-managing-director-and-head-private-banking-india/17438.html,... meltdown of 1997  the Kargil conflict of 1999  the Harshad Mehta stock scam of 1992  and ensuring liquidity during the India Millennium Bond maturity of 2000.
It's Season Of Scams In Jaipur In Connivance With Police,indiatvnews.com,1 Dec 2011,http://www.indiatvnews.com/news/india/it-039-s-season-of-scams-in-jaipur-in-connivance-with-police-12509.html,In the Gold Sukh scam  over 1.75 lakh investors were duped of Rs 200 crores  and all the four directors of the firm have fled abroad  siphoning off money through ...
Yeddyurappa will remain in jail today,NDTV.com,3 Nov 2011,http://www.ndtv.com/india-news/yeddyurappa-will-remain-in-jail-today-565978,He was arrested on October 15 for his alleged involvement in a scam that saw his family members getting prize land at throwaway prices while he was chief ...
Two fertiliser firms in subsidy mess,Chandigarh Tribune,21 Aug 2011,http://www.tribuneindia.com/2011/20110822/main2.htm,Several Members of Parliament have written to the Prime Minister's office  alerting it about the “fertiliser subsidy scam”' and the nexus among importing agencies ...
Former adviser offered two booths  house to whistleblower: Probe ...,Indian Express,2 Mar 2011,http://archive.indianexpress.com/news/former-adviser-offered-two-booths-house-to-whistleblower-probe-report/756974/,A former senior bureaucrat who served in Chandigarh on a top post  too  is in the dock as the scathing inquiry report on the alleged booth-mafia accuses the ...
